cid,text,time,author,channel,votes,photo,heart
UgyaDzw64s2u4RHNolN4AaABAg,Thank you America and Thank you NATO,3 minutes ago,Prabhakaran M,UC-gh7I-5pFYtZ-MqgUWerhA,0,https://yt3.ggpht.com/ytc/AKedOLTvFjo15CNdgBgPmamuuj5mhNa0kvKe-zJix_WS8A=s176-c-k-c0x00ffffff-no-rj,0.0
UgyrY4ItXzxsTGTWwex4AaABAg,"In times of war,  the right thing for any nation to do is denied,  denied.",5 minutes ago,Tshav Feng Vang,UC_2E5-VKRj75W0pg41tgBNg,0,https://yt3.ggpht.com/ytc/AKedOLRV4RXPHnkNCRJ9zsxFokBSIT-AuV_C2IAQAEjZ1g=s176-c-k-c0x00ffffff-no-rj,0.0
Ugy9MReLQVR_e4k1OR94AaABAg,You should point out that Ukraine has been making a graveyard in Donetsk region for 8 years. Your news is not accurate and one sided.,8 minutes ago,Larysa Golubovych,UCzrEw1SyGTMY7QpH6Rnd-8w,1,https://yt3.ggpht.com/ytc/AKedOLRia8uDR5wXsvNpOd-sqmiSfoBu5msYnY19JQ=s176-c-k-c0x00ffffff-no-rj,0.0
Ugz0FLwbVRZfN_3Bb9N4AaABAg,Only shitty comedian is responsible,11 minutes ago,mohit gupta,UCbjimBSW17GzDigm2KI9VGA,0,https://yt3.ggpht.com/ytc/AKedOLTUziBctqOyCxKDKFYcrTDCkH6LJGJp0d1HrY9ypA=s176-c-k-c0x00ffffff-no-rj,0.0
UgxCDbjbuBACniNAEjt4AaABAg,"As an Indian I am ashamed that Indian channel Wion is behaving like any other western channel by not showing Russian perspective on Donbass. Hundreds of Russian speaking civillians have been killed by Ukraininan neo Nazi military. See Patrick Lancaster videos and ground reporting. Where is the unbiased journalism of wion gone...? 

Has Wion surrendered to whims and wishes of YouTube after they got banned...?",17 minutes ago,Ashgarn Gorfel,UCYEOpiQYV1v6el-csCuHTdA,0,https://yt3.ggpht.com/ytc/AKedOLQgESnUUKGtla-3fVUbbHmY2CCNFyiL6_W2tdx7Z2RBNv2sriix7nbs-Sf8vpZM=s176-c-k-c0x00ffffff-no-rj,0.0
Ugzlt-nTm3Fdj845hCd4AaABAg,We are in new world now so understanding  these things will help because racism and war will only push the west away because of their history and experience of world domination,21 minutes ago,patrick dayton,UCF5FhR4yjGChdwzGfZsTnhg,0,https://yt3.ggpht.com/ytc/AKedOLRnB-os-yB9VHrUG3T821SxvoNDxSIA2KlR6w=s176-c-k-c0x00ffffff-no-rj,0.0
Ugx6C3F-RsAq_tp3o4V4AaABAg,So sad for Ukraine but I pray that they will win this war against Russia,22 minutes ago,David Sunday,UCc90yK6U_hzsd41R8Xy0kgg,1,https://yt3.ggpht.com/ytc/AKedOLQCtimCVEb78j_uO2H2o3Jmnq-jPT-WwZ1F4Q=s176-c-k-c0x00ffffff-no-rj,0.0
Ugx0gQ5lPAyWUgJA_A14AaABAg,My advice to the west is that your ideology and principles of Government has not been the best and isn't the best for others. You can have peaceful competition of the system and ideology on equal footing and level plan field,23 minutes ago,patrick dayton,UCF5FhR4yjGChdwzGfZsTnhg,0,https://yt3.ggpht.com/ytc/AKedOLRnB-os-yB9VHrUG3T821SxvoNDxSIA2KlR6w=s176-c-k-c0x00ffffff-no-rj,0.0
UgzQmZfDl01ImtjCNxp4AaABAg,Russia is not about establishing world domination but about world equivalent and Peace because we don't need a world of humanity were one group of humanity think and feel that it is the super human and better that all other of the humans races of God because we are all human matter the skin color and places of origin. Until the western world can accept these fact the world of humanity will be in war status for ever,25 minutes ago,patrick dayton,UCF5FhR4yjGChdwzGfZsTnhg,0,https://yt3.ggpht.com/ytc/AKedOLRnB-os-yB9VHrUG3T821SxvoNDxSIA2KlR6w=s176-c-k-c0x00ffffff-no-rj,0.0
UgxuWCf3SQqUKUdKPRh4AaABAg,Russia is ruled by a war mongering madman. And his military turned out to be an undisciplined mob suited only to raping girls and killing old ladies,29 minutes ago,Raven Moon,UCGi15MyYD6jp4z0VhNyE3Jg,0,https://yt3.ggpht.com/32CZMzOjQniPei8VYmL5AEQ6GnmMCr8_27HA2RqWqDJvi9lLBZAZoQqhzPlThOFFe9MhCgiIIkc=s176-c-k-c0x00ffffff-no-rj,0.0
UgyhliPRhxhaD_3N7oF4AaABAg,Ukraine deserves it 👍,29 minutes ago,Rahulk Naina,UCIP0ckAsb2GsNHMbn5sJaGg,3,https://yt3.ggpht.com/ytc/AKedOLTWfCzpc-TglV6Bp33A3XrC1XjvtxjW0EQcqw=s176-c-k-c0x00ffffff-no-rj,0.0
UgyNB5toTzeGj4dp2c54AaABAg,"im glad the other indian anchor took a break, she letting emotions dictate the news..not palki she's awesome.. but she's was being biased and breaking the sacred rule to your brand that so many came to love..just report news hows that so hard..and stop the \\ well america did this and india that... thats not news omg biden he shook air....really thats what shows up in my feed we are busy ppl also or  try to limit towards the end some of us just wanna hearr the news not hear an opinion that got you emotional ,if i did ill just watch cnn or fox..",30 minutes ago (edited),SavingDark SaviorVii,UCcl_X5lKrx-FoZC0ukxhkDw,0,https://yt3.ggpht.com/ytc/AKedOLQTn22qR08KVdrVaxYID6-gtpI6ADEy1miJCJzA=s176-c-k-c0x00ffffff-no-rj,0.0
UgwJwVzhypAO4N4uAn14AaABAg,wion is standing in same line as the western media. No neutrality only biased reporting. because they are affraid of getting banned again.,31 minutes ago,shubham chauhan,UC2GrJvJN0JcUgx0SZhs1UjQ,0,https://yt3.ggpht.com/ytc/AKedOLSVCMKzdsj_kRdF1_DEUokzLZZqwMUdXJENMhxpAA=s176-c-k-c0x00ffffff-no-rj,0.0
Ugxwb9O394YkF0HFo694AaABAg,Heart breaking 😭 😭😭,38 minutes ago,Niojila Yimchunger,UCDuXi-5FhKHy6EqnNtZMIGA,0,https://yt3.ggpht.com/ytc/AKedOLTvi_iColwNGBvg1utAzWoZZ7DBDXkBn_ClfAvUn31xat-31So5-j4E3x7ywwht=s176-c-k-c0x00ffffff-no-rj,0.0
UgwfnY0o9EBB7_DJ6HF4AaABAg,"People, remember before it's too late! Russia did not attack Ukraine! Russia helps the Ukrainian people get rid of the Nazis, fascists and mercenaries. The bandits captured the whole of Ukraine, intimidated people. All the atrocities and rapes are done by the Nazis in Ukraine! And the media tells you that the Russians did it. Russians are never capable of this in their lives! Are you so stupid? The same is being done specifically against Russia. Information war. Now it is Russia that is fighting fascism in Ukraine, alone. God see everything.",39 minutes ago,Светлана,UC9VmM3nHHqJ6tNjwljqmsIQ,0,https://yt3.ggpht.com/ytc/AKedOLTqTZndmBBspOsLvELVkiCKJQvgwiUy9txpUBG11MyhydGRlsUt64Co2C18iwjn_w=s176-c-k-c0x00ffffff-no-rj,0.0
UgyeHV2g5FPxz99NNjt4AaABAg,Will happen if you arm civilians,44 minutes ago,nithaam moses,UCkZ0KrnLg0k59EJirnm2IEQ,1,https://yt3.ggpht.com/ytc/AKedOLSIc7SF-KxbnnVph6REwv8tRUblCiG5yJG5b_YwDfQ9uOHsO1W2049PXuZ-QqVr=s176-c-k-c0x00ffffff-no-rj,0.0
UgxeB8R_CpC33asgaNJ4AaABAg,"What is being done to force the truth about the invasion into Russia? We live in a technological age, it shouldn't be that difficult to fight the disinformation within Russia  from the outside. People in Russia should be flooded with material and people accounts of what is happening. The Ukrainians speak Russian, it should be easy to convey the message. Wake more Russians up and Putin's reign will crumble.",48 minutes ago (edited),kal,UCFTwpmSO_tK3ocZCbVHac2w,0,https://yt3.ggpht.com/ytc/AKedOLRUia5aiINxQYNdLpm88LodeQFdT-JVav8Mgxf74NdC9DOJH4jf-zVswMO_AdI0=s176-c-k-c0x00ffffff-no-rj,0.0
UgygiLAym55F2SvBgMx4AaABAg,"It is called the Russian meat grinder.
They advance slowly but what is left is what you see.
Welcome to Libya, Irak, Syria, Gaza, Afgansitan....
It looks as if the chickens came home to roost....
Chinese proverb.
Mind your fxcking business...",48 minutes ago,Robert S Williamson,UC9Pgl09vschPoeBhds6LPvA,1,https://yt3.ggpht.com/ytc/AKedOLSIQIw19-hdEXA_8uftcDGxYYOPHCNKZgfmkkciT9m96GQgUIy4ao5Sqfpvby_K=s176-c-k-c0x00ffffff-no-rj,0.0
Ugx7e2Etckax4bZ3ret4AaABAg,"Show people the truth about what is going on in Mariupol and Donbass. Since 2014, Ukraine has killed 14,000 people. And now even more. Why have you been silent all these years? The Azov criminal battalion has been killing people in the Donbas for 8 years... Not only ethnic Russians live there, but also Ukrainians, Greeks and many more. Mercenaries and Nazis don't care who they kill. NATO did everything to make this war happen.",51 minutes ago,Светлана,UC9VmM3nHHqJ6tNjwljqmsIQ,0,https://yt3.ggpht.com/ytc/AKedOLTqTZndmBBspOsLvELVkiCKJQvgwiUy9txpUBG11MyhydGRlsUt64Co2C18iwjn_w=s176-c-k-c0x00ffffff-no-rj,0.0
Ugx6C3F-RsAq_tp3o4V4AaABAg.9_tSGx_Jswm9_tTmEvgi1F,Your prayers will not be listen,9 minutes ago,Maxus,UCw2VExRsR2sKjKHt3hhNfJg,0,https://yt3.ggpht.com/ytc/AKedOLT9l_geOC68-tWeWJvGZJQkvsSJD0yOAEGgYOzqHA=s176-c-k-c0x00ffffff-no-rj,0.0
UgyBy2aQYbeGUHiqX7J4AaABAg,Instant conscription of civilians to soldiers is a deadly Metamorphosis. No thanks to the comedian.,54 minutes ago,magnacarta1215,UCCqYAJBIEnU2vmE_KnhPLkw,4,https://yt3.ggpht.com/7WqLV-zurRwxhdgDk0M4iXyyHL3cMaiz4ypCsQ55wc7hU4Gju9_PVHamrzMolL6dGmWDDJVE7Q=s176-c-k-c0x00ffffff-no-rj,0.0
UgziJ-NjJEH9aU1HKwJ4AaABAg,"Russian armies atrocities have enraged the Ukrainians and the world.
Also has led to many countries wanting to join NATO.",55 minutes ago,John R,UCM_lW_DN7dk0xKsjAegxC8A,1,https://yt3.ggpht.com/ytc/AKedOLSzX_h2vi0AKvTJYypYxmMNftrUxHWERyeyRQ=s176-c-k-c0x00ffffff-no-rj,0.0
Ugw-yCgjPFEqgGCibW94AaABAg,"🎺ᴛʜᴇꜱᴇ ᴀʀᴇ ᴛʜᴇ ꜰɪɴᴀʟ ᴅᴀʏꜱ  ʙᴇꜰᴏʀᴇ ᴛʜᴇ ᴇɴᴅ ᴏꜰ ᴛʜᴇ ᴡᴏʀʟᴅ. .  ☁JESUS IS COMING ☁

𝓙𝓮𝓼𝓾𝓼 𝓲𝓼 𝓽𝓱𝓮 𝓸𝓷𝓵𝔂 𝔀𝓪𝔂 𝓽𝓸 𝓗𝓮𝓪𝓿𝓮𝓷.    𝓡𝓮𝓬𝓮𝓲𝓿𝓮 𝓽𝓱𝓮 𝓰𝓲𝓯𝓽 𝓸𝓯 𝓢𝓪𝓵𝓿𝓪𝓽𝓲𝓸𝓷 𝓽𝓸𝓭𝓪𝔂!

 ✝  By this gospel of Good News you are saved (by grace alone through faith alone) if you hold firmly to the word I preached to you. Otherwise, you have believed in vain  3 For what I received I passed on to you as of first importance:  that Christ died for our sins according to the Scriptures, 4 that He was buried, and that He rose again on the third day, according to the Scriptures  (1 Co 15:2-4) (Eph 2:8-9)
✝ For God so greatly lდved and dearly prized the world, that He gave His One and only begotten Son, so that  whoever 𝙗𝙚𝙡𝙞𝙚𝙫𝙚𝙨 in Him shall not perish (hell)  but have Eternal life (Heaven).    For God did not send his Son into the world to condemn the world, but to save the world through Him.  (John 3:16-17) 

👑ᴊᴇꜱᴜꜱ ɪꜱ ᴄᴏᴍɪɴɢ ᴛᴏ ʀ̾ᴀ̾ᴘ̾ᴛ̾ᴜ̾ʀ̾ᴇ̾ ᴄʜʀɪꜱᴛɪᴀɴꜱ ᴜᴘ ᴛᴏ ʜᴇᴀᴠᴇɴ ᴡɪᴛʜ ʜɪᴍ ɪꜱ ɪᴍᴍɪɴᴇɴᴛ; ᴀɴʏ ᴍɪɴᴜᴛᴇ   ~ ""𝓽𝓱𝓮 𝓑𝓵𝓮𝓼𝓼𝓮𝓭 𝓗𝓸𝓹𝓮"" ꜰᴏʀ ᴀʟʟ 𝙗𝙚𝙡𝙞𝙚𝙫𝙚𝙧𝙨",56 minutes ago,Arneth Productions,UC8CRDfNGg9I5XHsTRmSX2ag,0,https://yt3.ggpht.com/XdUg51IqmHe2B53lBf_7v8-XflwA-2eBlqjAk9JvFFeOh3Pmxn_eut5sK_cmI34qTCpaw-1ZiA=s176-c-k-c0x00ffffff-no-rj,0.0
UgyO4bNVOnRG94rWHEp4AaABAg,God bless Zelensky and Biden,56 minutes ago,jozef goethals,UClJQOLew0r-bZX_h640x3-Q,1,https://yt3.ggpht.com/ytc/AKedOLRM93pNGzKcgqskS8GtWTCq-d48rgMz_FdZHw=s176-c-k-c0x00ffffff-no-rj,0.0
UgziOaidOC_Rc6SRb7l4AaABAg,"20,000 Russian bodies??? where are the bodies???",56 minutes ago,Daniel B.,UC225NN7saNYJpIlgO6cKqew,2,https://yt3.ggpht.com/ytc/AKedOLS3THQIGuzaYN2xpBSGo0WN30d47448sxYyKBGk2g=s176-c-k-c0x00ffffff-no-rj,0.0
UgyOzWGvIDyLhdPKyql4AaABAg,Stop the war,57 minutes ago,Wayne Munro,UCQWh9UP7ylG_QhQeFxk12pw,2,https://yt3.ggpht.com/ytc/AKedOLQ2zW__vF1oM3M3P7So8acOmRGMl9e042NZLDzt24LPuSDJsQu3i-0dUOAnNZCA=s176-c-k-c0x00ffffff-no-rj,0.0
Ugyk4oqnJM9j3D7DX2t4AaABAg,"Following a phone call from a vigilant citizen on the night of 22nd September 1999, police found bags containing 200kg of explosives in the basement of a residential building in Ryazan. As the job of disposing of the bags was left to the local police, de-activating the explosives was carried out by Ryazan police’s engineering department. Their detectors showed that the bags contained hexogen.
      The detonating fuse was made with an electric clock set to set off at 5.30am and contained a shell from a shotgun filled with gunpowder. That same day, local FSB officers created and published composite pictures of the suspects and soon identified and arrested them. But those who planted the bombs turned out to be... Moscow FSB officers!",58 minutes ago,vinm300,UC6lD2NFMaWFc0hNmkkrWCbw,1,https://yt3.ggpht.com/ytc/AKedOLQeAQD2VtNU61y8tKL-10Phv6tBuePyHKAfdA=s176-c-k-c0x00ffffff-no-rj,0.0
UgwNyX6Cy5-AldcjejN4AaABAg,why these Ukrainian have Italian accents,59 minutes ago,Maliheh Saraj,UCixEXii40VJMAlNUGKRehMg,0,https://yt3.ggpht.com/ytc/AKedOLT6kcuFbxQRsyDm5LFVcvxj4zxFe1fsyzsRtQ=s176-c-k-c0x00ffffff-no-rj,0.0
UgyNKqjq723krE6nmBV4AaABAg,Human shield,59 minutes ago,Jackson Ghia,UCH6BkXGah41pkVvicvcR_qg,3,https://yt3.ggpht.com/ytc/AKedOLQ5e_hG7bS3zqp-iiBhwsJS7iTK6ccfSiYMb20JJw=s176-c-k-c0x00ffffff-no-rj,0.0
UgwDdoxXdPmLmdz1Smd4AaABAg,So as per Ukraine forces they have killed cumulatively 1 lakh soldiers from the start of war until now but still Ukraine is getting pounded and destroyed. Atleast some of the facts should be believable.,1 hour ago,Ravi,UChQksDJlvhQysCD6W2m0jJw,0,https://yt3.ggpht.com/j4-n23PjtiIW97w8S--SqG2bGO9xCX-TQmgBqzXQZisKjABCY0w9asN8gS2zy_r-cb9of1Eg=s176-c-k-c0x00ffffff-no-rj,0.0
UgxdlTSGfsPNWFL20x14AaABAg,"This is what you get when you choose Clown as your country's President, more destruction yet to come,or should i say next Seriya in making. Islamic Jihadis and Ukraine have one similarity both fighting for revange at the end they get death.",1 hour ago,Tumbler,UCVhxFxAVA3demIPnCiPtP6w,0,https://yt3.ggpht.com/w7JfJlSt2zGiwmJnmxJ-4LrsoM1-KjSEGfQY_3NgVn1CyA3E_uqxVPFs2OZdHYNSOwoCNp_Njkw=s176-c-k-c0x00ffffff-no-rj,0.0
Ugx3yEgTaADpeLNJfM54AaABAg,The pain of these people is palpable.  My heart goes out to them.,1 hour ago,William Price King,UCLlvS0NXcrh33xXdaJuRWvw,8,https://yt3.ggpht.com/ytc/AKedOLSsd8hnwiB4i5HsunyYR0fmp9O1ZiDlr4eqNuTg7w=s176-c-k-c0x00ffffff-no-rj,0.0
UgxbOIU5d9UGgmQSDdd4AaABAg,"The Russian way of war is barbaric, intentionally targeting civilians, raping, looting, and killing them. Putin himself didn't commit all these war crimes. The Russian people have much to answer for as well. They should try to fix their own country before trying to invade and occupy their neighbors. It's going to take generations to get their reputation back, similar to the Germans and Japanese after WW2.",1 hour ago,Russell Laverty,UCr9sqaWls5lLlTUQWVufNKA,1,https://yt3.ggpht.com/ytc/AKedOLR1sf19_aV-Jd8RRFl8mPL_rIE2QIn9RfaWbF3g3Q=s176-c-k-c0x00ffffff-no-rj,0.0
UgyQfA-Ze2ofHrMY8Qp4AaABAg,"God Bless President Putin and The Russian Federation 🇷🇺
....",1 hour ago,A G,UCYHY3BzCXkKvdEG4RxeiqQQ,17,https://yt3.ggpht.com/ytc/AKedOLQOrOE4DqXWO-qy3qvn-FN4xHXFywhbczH5tw=s176-c-k-c0x00ffffff-no-rj,0.0
Ugz4cCnhu8jG4RN5wOd4AaABAg,"Oil prices in india are already more  than that of USA .
And USA per capita gdp is above 60k dollars ..i guess and for india it's around 2k dollars",1 hour ago,Maxus,UCw2VExRsR2sKjKHt3hhNfJg,2,https://yt3.ggpht.com/ytc/AKedOLT9l_geOC68-tWeWJvGZJQkvsSJD0yOAEGgYOzqHA=s176-c-k-c0x00ffffff-no-rj,0.0
UgwHjEeiKgUTqj_0ZHR4AaABAg,"America supported Iraq in Iraq's war with Iran for years and then turned on Iraq when they were no longer a useful puppet. Same with Ukraine, America will use their willing puppet Zelinski to do their fighting & dying for America until Ukraine is no longer useful and then will abandon them as well. Look no further than past history - Vietnam, Afghanistan. Kruds of Iraq etc.",1 hour ago,Scat 392,UC_COCs1RIokuaVAptaOF9Xw,2,https://yt3.ggpht.com/ytc/AKedOLTIRoviNkXXhU19vdwWGGfQkZHWPzFwVhipFqfutA=s176-c-k-c0x00ffffff-no-rj,0.0
UgyEqv2WapmTqlAB4A54AaABAg,What happen to wion?,1 hour ago,dapp store,UCEyjOCUZDL95N_0G9OoQmvQ,2,https://yt3.ggpht.com/ytc/AKedOLQu-hSEkO7LPUzBg2BN9kAxa90J7OV_UtRHuJPSv5x3lxJpcZj8MAFxcacOTzqC=s176-c-k-c0x00ffffff-no-rj,0.0
UgwAz5ZdFWUX3QaJ0bV4AaABAg,WION bias news is clear,1 hour ago,truman dibaratun,UCBJoZRXKgU1PagNZaa4VnuQ,0,https://yt3.ggpht.com/ytc/AKedOLTV1-XnKQM8T67napyT2cm4HwbgT7CQ3-kyLg=s176-c-k-c0x00ffffff-no-rj,0.0
UgwnhcEvKoyvAWDVLJR4AaABAg,How can the Russians and their leadership sleep we with the conscience? Knowing all these evil they are pepertrating to their brothers and sisters,1 hour ago,Timba,UC3O6FuAi2x5jrV1A5KyI3ZQ,1,https://yt3.ggpht.com/ytc/AKedOLSJKCtMZVPUP72L3prvIGCo9V-BPi5XNBJ8LcrF9QBDIimoYsDfCk6txTiskIty=s176-c-k-c0x00ffffff-no-rj,0.0
Ugz3s_77i0J_lT7evod4AaABAg,"Tell NATO that the more weapons, the more deaths. NATO is fighting to the last Ukrainian🔥🔥🔥🔥🔥🔥🔥🔥",1 hour ago,Lisa,UCSuaCggyqzy5CWMNcE-zOsg,0,https://yt3.ggpht.com/ytc/AKedOLR9EKxzSd86xLlNz-gWw83WHop5kC-1UP8a8Q=s176-c-k-c0x00ffffff-no-rj,0.0
UgyBy2aQYbeGUHiqX7J4AaABAg.9_tObuqSgd89_tPZ14vZTB,"Very wise comment.
Many forgot that Zelensky gave weapons freely to all citizens.
As a Russian soldier all civilians are now freedom fighter.
Thus no inocent civilians...
Bravo for remembering...",46 minutes ago,Robert S Williamson,UC9Pgl09vschPoeBhds6LPvA,1,https://yt3.ggpht.com/ytc/AKedOLSIQIw19-hdEXA_8uftcDGxYYOPHCNKZgfmkkciT9m96GQgUIy4ao5Sqfpvby_K=s176-c-k-c0x00ffffff-no-rj,0.0
UgziJ-NjJEH9aU1HKwJ4AaABAg.9_tOSVBkdFc9_tOzl2A739,Which world?😳,51 minutes ago,magnacarta1215,UCCqYAJBIEnU2vmE_KnhPLkw,0,https://yt3.ggpht.com/7WqLV-zurRwxhdgDk0M4iXyyHL3cMaiz4ypCsQ55wc7hU4Gju9_PVHamrzMolL6dGmWDDJVE7Q=s176-c-k-c0x00ffffff-no-rj,0.0
UgziJ-NjJEH9aU1HKwJ4AaABAg.9_tOSVBkdFc9_tS1Ngk761,Not entire world kiddo,24 minutes ago,Manoranjan Raj,UC8w_ni0kvtaga7nLI8sl8Zg,0,https://yt3.ggpht.com/ytc/AKedOLQhye6HW9GqK2rDKsZnPjP-t7nuXeDtiLVFSw=s176-c-k-c0x00ffffff-no-rj,0.0
UgyO4bNVOnRG94rWHEp4AaABAg.9_tOMtlcmfd9_tRI8GWD-P,No.,30 minutes ago,Raymond XL,UCJAFaiFiHE_-SZv5U9Z8jXQ,0,https://yt3.ggpht.com/ytc/AKedOLRh5uZC5QYqpGtEZ2fDOOfLQXddRZaCFRmYvMLE8g=s176-c-k-c0x00ffffff-no-rj,0.0
UgziOaidOC_Rc6SRb7l4AaABAg.9_tOLBX1IUK9_tOewC1_IM,Supporting both the sides death is also a sin. don't support anyone you only pray for solution,53 minutes ago,no-one,UCIjf-xQxV6hewwk_3EtY8uA,0,https://yt3.ggpht.com/NfdER-y9tJnDNSYMiKhG4F4sMIE6eygbhAe0E1EcJ5iQlluv39O72BlEWYo0ojiDB2TYu60i=s176-c-k-c0x00ffffff-no-rj,0.0
Ugx3yEgTaADpeLNJfM54AaABAg.9_tNGB4z3EZ9_tQFAhp2Qa,My heart goes out to Iraqi and Afghanistan woman and children which America murdered. May God bless them and all other countries who are still suffering today because of America's hostile brutal savage murderers,40 minutes ago,Jerome,UCZJRFK1a83td9lALfipMigA,1,https://yt3.ggpht.com/ytc/AKedOLSH_dDxUJUCDOFisgVLwUbRpIuFwCHhugGnakvs=s176-c-k-c0x00ffffff-no-rj,0.0
UgyQfA-Ze2ofHrMY8Qp4AaABAg.9_tMvCZBH7P9_tSVgcdMth,India 🇮🇳 supports Russia 🇷🇺,20 minutes ago,Ashgarn Gorfel,UCYEOpiQYV1v6el-csCuHTdA,1,https://yt3.ggpht.com/ytc/AKedOLQgESnUUKGtla-3fVUbbHmY2CCNFyiL6_W2tdx7Z2RBNv2sriix7nbs-Sf8vpZM=s176-c-k-c0x00ffffff-no-rj,0.0
UgyQfA-Ze2ofHrMY8Qp4AaABAg.9_tMvCZBH7P9_tTNFVvE_f, @Ashgarn Gorfel  Thanks!,12 minutes ago,Maxus,UCw2VExRsR2sKjKHt3hhNfJg,0,https://yt3.ggpht.com/ytc/AKedOLT9l_geOC68-tWeWJvGZJQkvsSJD0yOAEGgYOzqHA=s176-c-k-c0x00ffffff-no-rj,0.0
Ugz4cCnhu8jG4RN5wOd4AaABAg.9_tMjO-mKP29_tOQXHrIiZ,AMERICA has 22 trillion$ debt but india has 600 BILLION$ ONLY,56 minutes ago,Tt,UCCxddN6IXjZqlbNTHQcdlVw,3,https://yt3.ggpht.com/_KgMZlsYKkjQrKu6Q7QvEP6SbH2xpU_L4nYhRwbtgeypRFLsqZZQq4c5VggBHwAa__k6kA1Evg=s176-c-k-c0x00ffffff-no-rj,0.0
Ugz4cCnhu8jG4RN5wOd4AaABAg.9_tMjO-mKP29_tTUM6y_EE,Not true plus they have there own oil get some knowledge,11 minutes ago,Abhinav Choudhury,UCar46LrnJAVQLJ1bUte49wQ,1,https://yt3.ggpht.com/ytc/AKedOLQ4xs0msFSncE5W3IPduTy6-hIBQ0wxKPwhxvFrAw=s176-c-k-c0x00ffffff-no-rj,0.0
UgwHjEeiKgUTqj_0ZHR4AaABAg.9_tMerqthG99_tMwIbV8eb,Libya too 🇱🇾,1 hour ago,Roberto Mota,UCAmUjuDX0aIsQBQPjkw--JQ,2,https://yt3.ggpht.com/ytc/AKedOLSGtnco6eEW1dMhoSz973s2HnOmplkCIz7uWQ=s176-c-k-c0x00ffffff-no-rj,0.0
UgwnhcEvKoyvAWDVLJR4AaABAg.9_tMS2odOtz9_tNlqqxLiK,The same as the American company who was guilty for the Bhopal,1 hour ago,Maxus,UCw2VExRsR2sKjKHt3hhNfJg,1,https://yt3.ggpht.com/ytc/AKedOLT9l_geOC68-tWeWJvGZJQkvsSJD0yOAEGgYOzqHA=s176-c-k-c0x00ffffff-no-rj,0.0
UgzDllb8j3UIf7usZFt4AaABAg,The war crimes that Putin has committed in Ukraine would make most Gestapo and SS officers blush with shame!,1 hour ago,David Getling,UClGzOWXuB85UWxCtlTOboWQ,4,https://yt3.ggpht.com/ytc/AKedOLTifV6p_WaTTEuKjNFJhhMgYKv39lPMeowErgi4=s176-c-k-c0x00ffffff-no-rj,0.0
UgzV0oQ1WAnvjFBrcpt4AaABAg,Wion said 20k Russian Dead 😂🎉,1 hour ago,Outer space,UCCxJatWfBI_B0tXaltAz22Q,1,https://yt3.ggpht.com/DOWrdejPFHWcxqnbTxMqWAVs0I4MBCtxl-czGpj0_FwOMMG8pD_KMlaE8s5TukcUw8SiCgNtfw=s176-c-k-c0x00ffffff-no-rj,0.0
Ugw5l9FlqazoLitLkTN4AaABAg,"Its very difficult to recognise a russian tank, with its turret still intact. haha",1 hour ago,ab369,UC9JdaZCSo98JeXWoAb4Dw7w,5,https://yt3.ggpht.com/ytc/AKedOLRelBh5xR_Kg9fXdTacS3qnVXvwRJwb74Gsdg=s176-c-k-c0x00ffffff-no-rj,0.0
Ugz3G6iijik_XHZxa6R4AaABAg,Why didn't you show the funeral of Donbass residents? Ukraine has been killing them for 8 years and is killing them now!🤬,1 hour ago,Lisa,UCSuaCggyqzy5CWMNcE-zOsg,27,https://yt3.ggpht.com/ytc/AKedOLR9EKxzSd86xLlNz-gWw83WHop5kC-1UP8a8Q=s176-c-k-c0x00ffffff-no-rj,0.0
UgxrQ0M6jRlMJVK7CGh4AaABAg,I  know it might be wrong but this all looks act to me.,1 hour ago,Dr. Mushfiq,UCZ1ZMbgJzDkhVRwxhxX-0rQ,3,https://yt3.ggpht.com/ytc/AKedOLRSBxWhejTV3upnscqU_xCGXuDsUZzw-I_qK6jrig=s176-c-k-c0x00ffffff-no-rj,0.0
UgxuE7IswSIOBjp34jR4AaABAg,"Mass murdering of civilians, many with their hands tied up. Tortures, rapes, etc.",1 hour ago,Putin must end up like Gaddafi,UCB6gcogOro_KdTxVcXLOarQ,0,https://yt3.ggpht.com/BySlZ9458zE-b7DxwBFgdJBcsDCmHlbFo1v1QxiFMKrlD8-n2Upo6qyqKr3HAw_UZLZmWtcs=s176-c-k-c0x00ffffff-no-rj,0.0
UgwG2DRpqQzQ-FfCs2x4AaABAg,where is the coverage of Pakistan invading Afghanistan,1 hour ago,Prem Ramman,UCiM03FmK4ikwcyXiVzAzAxA,4,https://yt3.ggpht.com/ytc/AKedOLSkVYeYJxujGRsWJd8h4gT7Xb1wrflodY26Iw=s176-c-k-c0x00ffffff-no-rj,0.0
UgyfHP7FoKpEUizHx2V4AaABAg,NATO SHOULD GIVE GUARANTEE THAT UKRAINE WILL NOT BE ACCEPTED BY NATO . JUST SIMPLE AS THAT AND THEY WILL NOT EXPAND EASTWARDS SIMPLE!,1 hour ago,Tt,UCCxddN6IXjZqlbNTHQcdlVw,0,https://yt3.ggpht.com/_KgMZlsYKkjQrKu6Q7QvEP6SbH2xpU_L4nYhRwbtgeypRFLsqZZQq4c5VggBHwAa__k6kA1Evg=s176-c-k-c0x00ffffff-no-rj,0.0
UgwBjChGt2sRuPqxQa14AaABAg,Ukraine started war by joining NATO,1 hour ago,Prashant,UCrtYRASPtf4fXq1jcDhcMoA,1,https://yt3.ggpht.com/ytc/AKedOLSwbCv-A7OwHDuUsryFz6wg5G1t1vsuLBy7Sx9qLg=s176-c-k-c0x00ffffff-no-rj,0.0
UgwQBeIrzuBdT0Jw92Z4AaABAg,More is coming and can be worst!!!,1 hour ago,Mike Jadulan,UC2nnUajGagn6yrxu01qxwNg,2,https://yt3.ggpht.com/ytc/AKedOLR5PtVQ7FX5_NJFNafj0kxdJYrraEMex3pbPQ=s176-c-k-c0x00ffffff-no-rj,0.0
UgzNhhOY98ye7W-wgXl4AaABAg,But I thought Ukraine was winning this war.....,1 hour ago,Bravo31AA,UCiFkXHWAOq_GN7dH1usz1_Q,7,https://yt3.ggpht.com/ytc/AKedOLQQqscDEIYt9hB2dIkXngDnlz5pK_3PZ7SVAmSl4jDgqzIs3z37AxcYski8LzED=s176-c-k-c0x00ffffff-no-rj,0.0
Ugz8Ae-bvYuoslTyruB4AaABAg,May God of the biblical Passover cause this horrific time and troubles Passover Ukraine now 🙌🙌🙌🙏,1 hour ago,arthur lyampensha,UC2wUDF_9v86i7kTZGerhe5A,1,https://yt3.ggpht.com/ytc/AKedOLR0qtAcu9UwSgYtVZs3ZFO8rWmdZTZaRmP-gQ=s176-c-k-c0x00ffffff-no-rj,0.0
Ugzfe3BLn5xkkpxNfVx4AaABAg,It's all because US led NATO military expansion which is against Minsk treaty although Russia has warned numerous times,1 hour ago,Mamacry Right,UCJnSE74qOolMMFpSZgDfTOg,3,https://yt3.ggpht.com/ytc/AKedOLRWpFFU-H0z2cQ6Cx8CLc7SWEqGEiPGHDPhe2eKOpHO3qPRDg26t1c-v_of2Eys=s176-c-k-c0x00ffffff-no-rj,0.0
UgyYRq-nZPuWGor_8Zl4AaABAg,🇷🇺INDIA♥️RUSSIAN🇮🇳,1 hour ago (edited),Capriz,UCYNwRWzvcsW7C57BeEh7tXA,10,https://yt3.ggpht.com/ytc/AKedOLQW1neUk3P-eh3XPM3YmD4Q-zIdYelAkGSNKg=s176-c-k-c0x00ffffff-no-rj,0.0
UgxVWOvWKNUWM28q28Z4AaABAg,"No coverage like this when Iraq, Libya, Yemen was pummelled.",1 hour ago,Grace Tang,UCexaAalmdT1mOgK1DbnjJsA,10,https://yt3.ggpht.com/ytc/AKedOLQ0GZhNrtv1LAlt1j1wSpEd4voDXp7ioCKGRQ=s176-c-k-c0x00ffffff-no-rj,0.0
UgzPO6F0Z93L-n2Bpr14AaABAg,Russia is a terrible country especially Putin,1 hour ago,Banger,UC0W9M1BkbyQLHPhSMWfoSAA,0,https://yt3.ggpht.com/ytc/AKedOLTbY1WFvo_Ff5IBV7vfjIDyVEZU-3WbssMyAcFvOw=s176-c-k-c0x00ffffff-no-rj,0.0
UgwLY7gDZ8nT4PPVn-d4AaABAg,Biden's fault.,1 hour ago,J C,UC4HoquoXJFoxtK-LV9biR1Q,1,https://yt3.ggpht.com/ytc/AKedOLQeefco9mzA7aQ0bYg_BzwNZx-K4sinPIRbjA=s176-c-k-c0x00ffffff-no-rj,0.0
Ugx5EmAJkbSt_J0_ESR4AaABAg,all could've stopped only if Ukraine had not joined NATO.,1 hour ago,Amit Jambhale,UCtKLV9CQR1MeLFforHOIDUQ,7,https://yt3.ggpht.com/fGZ0MfhFUofj2J45c5KRwCU6FNPtx9EBpkCpzandUQCkSbP2mfD7YrvxvmNJo5HV2hTPLEO8=s176-c-k-c0x00ffffff-no-rj,0.0
UgzCkc4MzBOlOg2xa8V4AaABAg,I feel sorry for the Ukrainian people. They've got nothing to go back to!,1 hour ago,Hairy John,UCaWtW3_pS085W3p8yFJCkwg,0,https://yt3.ggpht.com/ytc/AKedOLQwxtwtWmy9kcEq-A5ljExlkeA1tWCHtRXO_S4-=s176-c-k-c0x00ffffff-no-rj,0.0
UgzDllb8j3UIf7usZFt4AaABAg.9_tMFljvsgC9_tNRbzVl0J,What about me,1 hour ago,USA:Syria Japan Iraq war criminal,UCYaEpk73K3TGddAEbMH2Edw,3,https://yt3.ggpht.com/ytc/AKedOLSs2QQR69yD0wtjVnbAqYokYYvFriaPAp9vrAw8_g=s176-c-k-c0x00ffffff-no-rj,0.0
UgzDllb8j3UIf7usZFt4AaABAg.9_tMFljvsgC9_tNxznpOPc,"😂who armed the Civilians and who hide in public buildings and attacking from them.
They deserve this",1 hour ago,Shivam Soni,UCDd7ZbPdXWs21U9J2BOp9MA,4,https://yt3.ggpht.com/ytc/AKedOLSEbkcCgJxR9054wF-V7fD1MTeskIkZWW6ggg=s176-c-k-c0x00ffffff-no-rj,0.0
UgzV0oQ1WAnvjFBrcpt4AaABAg.9_tMFC-fmcQ9_tMnohBu8l,As per Ukraine,1 hour ago,Ranveer Rana,UCL2n2wnpXE8Qxv_5gZ9DI_g,0,https://yt3.ggpht.com/ytc/AKedOLScIODV2uldhD7KnI1xZzljLblKP-OMrGUiXw=s176-c-k-c0x00ffffff-no-rj,0.0
Ugw5l9FlqazoLitLkTN4AaABAg.9_tMCxCRUC29_tQ2r8sIkP,Oke bot,41 minutes ago,Mr Pepe,UC70oBr_UC0I89HfmhQGFWiQ,0,https://yt3.ggpht.com/ytc/AKedOLSOj96sMdoYlc1qN0aNQjAyxGLuxf9yZgjTOA=s176-c-k-c0x00ffffff-no-rj,0.0
Ugz3G6iijik_XHZxa6R4AaABAg.9_tM7RxI7rl9_tOuyt9-OY,It was a civil war. People died on both sides.,51 minutes ago,Peter Carson,UCmLsFeeRKU0fv13aJwFb6oA,1,https://yt3.ggpht.com/ytc/AKedOLQ3HWAN3yHJ-3av9rc4nZls4SP00owIlcCZ4w=s176-c-k-c0x00ffffff-no-rj,0.0
