cid,text,time,author,channel,votes,photo,heart
Ugx84o3DjyYf2bM0qsx4AaABAg,Don't politicize Harry visiting his grandmother.,1 hour ago,Witek Michno,UCm4nlmlEsxbCgrTUuO95yJQ,0,https://yt3.ggpht.com/ytc/AKedOLRtZc1xzLCCVSpqtIVdV8Uh41UQIqx5ctWpbw=s176-c-k-c0x00ffffff-no-rj,0.0
UgycF44xKRq6V355lFd4AaABAg,"As Forest Gump's mother said, ""Stupid is as stupid does.""",1 hour ago,J C,UC4HoquoXJFoxtK-LV9biR1Q,1,https://yt3.ggpht.com/ytc/AKedOLQeefco9mzA7aQ0bYg_BzwNZx-K4sinPIRbjA=s176-c-k-c0x00ffffff-no-rj,0.0
UgwluGo9F_keRTKyCdt4AaABAg,Suits !✨,1 hour ago,Krishnapal Mori,UCyyAlxKSgFQNp5NY9AsyycQ,1,https://yt3.ggpht.com/ytc/AKedOLQgXXCyXE3gr4TZVv_r8OzRTClkVjB3jstelzRmSQ=s176-c-k-c0x00ffffff-no-rj,0.0
UgyoPywxS8AbZ5mWIvB4AaABAg,What a lie he is he wants his money for showing up at the Invictus games. He dose not give one damn about these people. Btw he was only a toy soldier. Y after he Betrayed his country that he should even be allowed to show.,1 hour ago,Sherry Dykes,UC1yL2m61X4PUsN4XnfIAC-w,2,https://yt3.ggpht.com/ytc/AKedOLS9wnAI3wKf8FDhr87IrlhPwQOJl0y1RF3LL9hJzW0Hfr1rDooLleKTx7PlwQSR=s176-c-k-c0x00ffffff-no-rj,0.0
UgwmOlhuKAhEmUpYFOV4AaABAg,Why even report on these two idiots.,1 hour ago,martytube821,UC8cuBSCHjs5hqSd8oot3oOw,0,https://yt3.ggpht.com/ytc/AKedOLSdnV8ryKCdLe-i8O5AznmSdd8qUYCiIieEpQ=s176-c-k-c0x00ffffff-no-rj,0.0
UgxQVMr9AOlZW6Mhrq54AaABAg,Always great to see our fav Royals. ❤❤❤,2 hours ago,Cher Del,UC9180jXP8mNtmAhbegGPrxg,2,https://yt3.ggpht.com/ytc/AKedOLStytOruIh_6vn4H5i0KLjvwjnv535utXe4r4NR2g=s176-c-k-c0x00ffffff-no-rj,0.0
UgzpXrEaGBP0AmrELBN4AaABAg,Good to see the couple in public appearance...again..💖💖,2 hours ago,The Mother's Hand,UCn8sV89a8zhhkG4JtpIf_RA,7,https://yt3.ggpht.com/ytc/AKedOLQjENfpBvLA-JHDQsN3EfqRG-nbzM9hI68Kn0jG=s176-c-k-c0x00ffffff-no-rj,0.0
UgwdPGwLDjXieEANmrR4AaABAg,Calling him Prince harry when he left his royal title already is funny. He should be called Harry since that's his name and he is no different than any common man.,3 hours ago,Just Some Guy with a Mustache,UCHEKimK0xiJjcZW62gjlJ_g,5,https://yt3.ggpht.com/vVq2ZuRJe4WCPwEBnAsA_Gn9SKTjiFTEV9wLBBf-3z3HfQs3d1Q-dm8GFQds-0I1aGQB10bDRg=s176-c-k-c0x00ffffff-no-rj,0.0
UgxcTmV4iaV35l1bD6d4AaABAg,They haven't been missed.  They are vile the way they treat their families!,3 hours ago,Sparkle,UCGjMFzX9w_fqmJ1z-fAUytQ,0,https://yt3.ggpht.com/ytc/AKedOLSpZKhG6M5Cc_izMlq_6WJvy5h_bCVMgQrcOrRQBw=s176-c-k-c0x00ffffff-no-rj,0.0
UgyG4fLHZoIRbjZRu1Z4AaABAg,"If you dont care about this games-INVICTUS GAMES, started by Prince Harry for wounded service men and women, then you dont appreciate the military men who sacrificed for your freedoms which includes freedom of expression.. and so you are to be pitied",3 hours ago,Iheoma Nwakpadolu,UC8djrlgH8b2qhm4e8CHMqkA,5,https://yt3.ggpht.com/ytc/AKedOLQQSD1nfT0K9UxVWGb0T_RJ5A2mqzkFznaupA=s176-c-k-c0x00ffffff-no-rj,0.0
Ugy4ZFnhG_0Nxw1Q82N4AaABAg,Who is Harry and Meghan ?,4 hours ago,kaleen bhaiya,UC3R24zjWdki-lI6tlTtmzzA,7,https://yt3.ggpht.com/ytc/AKedOLTPCOSjbyXG_pwlf2zhG7H-6VqqAXIa2J-8Am7Z5Q=s176-c-k-c0x00ffffff-no-rj,0.0
UgwOaZTxZ-7klv9TgWd4AaABAg,The grifters trying to gain relevance by visiting grandma before attending an event that will fill their personal bank account. You could have talked about the veterans instead. 👀,4 hours ago (edited),Carolina Hill,UCbdBcGyDHdE3QKsGz9S0Jbg,9,https://yt3.ggpht.com/ytc/AKedOLRCU2QYVl7lKgbGnSAnIoJLB2j2LwoIRxwYxiSmkw=s176-c-k-c0x00ffffff-no-rj,0.0
UgwlLr_IrQ-vqRWHZTF4AaABAg,White are racist will be,4 hours ago,fetri,UC-1qcItKdRl6vV6uI5IAuYw,0,https://yt3.ggpht.com/7Z_G--JZ8VZtqS4lDb4iazSVYRXw9rvHc-ICc86IpF5L9ozOLpSU3ArljoJ82T7Ne1v_kjJd8-o=s176-c-k-c0x00ffffff-no-rj,0.0
UgyHyk7mlRB7kldLPZV4AaABAg,"Of course they will decline to comment..
The most leaks come from them...
This time, they were totally taken by surprise too..
Kudos Harry and Meghan!!",4 hours ago,Hephziba H,UCu3O1DEq3dQ7b7ypMqcHdwQ,7,https://yt3.ggpht.com/ytc/AKedOLRX4Avk2GQ94znANJbRfDwLGPfygtNDo8bBUw=s176-c-k-c0x00ffffff-no-rj,0.0
Ugztu--VPjQWkmen68h4AaABAg,Who cares there no bodies now. You can't have it both ways. Get on lone and buy a ticket like Iike everyone else.,4 hours ago,Robert Sullivan,UCccz8ax-T0VkZOG6LZETRtg,3,https://yt3.ggpht.com/ytc/AKedOLRKX5L5bZMjRvBRzfdT84Mez5BdbN_DWC4OIQ=s176-c-k-c0x00ffffff-no-rj,0.0
Ugxdh-9i4SYHCOiy3Dh4AaABAg,anyone wondering who owns wion ?,4 hours ago,BonSang,UCbc50tOT_Dmmj90nMOb07rA,7,https://yt3.ggpht.com/ytc/AKedOLRCP2Oq9OjW7qCJaRKLWYwO5UNWBHKQVw8geUEoaXQxCgfrFLVdVdoHsWl9gQ0X=s176-c-k-c0x00ffffff-no-rj,0.0
UgwI1YTKRVwxZTSo1IF4AaABAg,"lizards   you know  they are when harry grows his bald patch like a pedo elite,  thats the sign of the beast",4 hours ago,covid my arse,UCxEaPtkb6JqTgl334hCUpkg,0,https://yt3.ggpht.com/hX9N37IguQPx6I77o1dK86U2lfieSYzpCIetRjX0GTZ_Lsb31ePeF0HZHxDqzFwgWfw_hc8Oi18=s176-c-k-c0x00ffffff-no-rj,0.0
UgzR51VyhL0GK2LujzF4AaABAg,Just go outside and feel the weather. It is more comforting.,4 hours ago,Orlando Necesito,UCTleTWHFbg95dBOnuz0yLZg,4,https://yt3.ggpht.com/ytc/AKedOLTuhalB7LyaG6xHsSmxstHBpB3GDD_Ve5Lw=s176-c-k-c0x00ffffff-no-rj,0.0
UgybBrVz64tstzvZKJt4AaABAg,Disappointed by this news 😑 There are many important topics that you can cover 😒,4 hours ago,MS Suskar,UC-FOTen8kgizyIDpZwbS6aQ,12,https://yt3.ggpht.com/ytc/AKedOLTX0D7j3EgQN5P9prKiKXutU-ocvsT6qhcowZsj=s176-c-k-c0x00ffffff-no-rj,0.0
UgwdPGwLDjXieEANmrR4AaABAg.9_t7IBz24QT9_tD-hOO_m8,Do not forget that he is born a Prince like it or not he is Prince Harry from the day he was born and he will die a Prince.,2 hours ago,Ester Shiweda,UCgWDttuYCz-8YVnpXsGdZbQ,1,https://yt3.ggpht.com/ytc/AKedOLSa_tcbwcGLqAdTaI5hEcg_CmYS-aHg3YBkQg=s176-c-k-c0x00ffffff-no-rj,0.0
Ugy4ZFnhG_0Nxw1Q82N4AaABAg.9_t2LKXFYZ79_tG_soZo2Z,You obviously can't get enough of them......thus your attention seeking question.,2 hours ago,Cher Del,UC9180jXP8mNtmAhbegGPrxg,0,https://yt3.ggpht.com/ytc/AKedOLStytOruIh_6vn4H5i0KLjvwjnv535utXe4r4NR2g=s176-c-k-c0x00ffffff-no-rj,0.0
UgwJ8W4d7W3iS_JhyhJ4AaABAg,Żegnam bydło masonów,4 hours ago,Papi,UCnD8itvNdSXLeaKPf-oZL7Q,0,https://yt3.ggpht.com/Y2JPb6Z37Ds3brYZuL8C0PFOvwxceJPniU4yuHS7ge8gq8bkP7QBDQx7Jpx1OTqWxYTqkbOUn9k=s176-c-k-c0x00ffffff-no-rj,0.0
UgyJa76vTgf_E99lPcl4AaABAg,Hit that dislike button....give Megain and her poodle their privacy,5 hours ago,Catania Momma Italia,UCu1l-bTKHG73rxUt_fseutA,7,https://yt3.ggpht.com/ytc/AKedOLQ_m6FbvJz57CaIDizZdARwntMNkka1JENKNYV9Nw=s176-c-k-c0x00ffffff-no-rj,0.0
UgwunJlWUTGU2ZniSbZ4AaABAg,❤❤❤❤❤We miss harry and megan thats why I look at the royals.😊😊😊😊,5 hours ago,bb love,UCkSY2v6PcK8i1pqQgBBcscg,6,https://yt3.ggpht.com/ytc/AKedOLQyOEWuxAG2tfo8sQU37jwszsON37e9cs4BOk8oXYjN4F3swqp9qzMYv2AE6v9h=s176-c-k-c0x00ffffff-no-rj,0.0
Ugx7YtDGmlEORIwIZdJ4AaABAg,Who invited the cameras? They want their privacy and shit ....,5 hours ago,Catania Momma Italia,UCu1l-bTKHG73rxUt_fseutA,13,https://yt3.ggpht.com/ytc/AKedOLQ_m6FbvJz57CaIDizZdARwntMNkka1JENKNYV9Nw=s176-c-k-c0x00ffffff-no-rj,0.0
Ugz1wehQlD7cqVDJbKd4AaABAg,Disgusting couple,5 hours ago,Patricia McClanahan,UCgT7L92MiICYkmFJjIGjpBQ,0,https://yt3.ggpht.com/ytc/AKedOLSEhk4yiaSM7lrM5SU2KW1NOzn4eqhOB1LEYw=s176-c-k-c0x00ffffff-no-rj,0.0
Ugyi51t3h5SJyWzzJVl4AaABAg,This couple is yesterday's news.,5 hours ago,Kam Lady,UCU_1YHUS2Xj-3k-z3jOuevQ,22,https://yt3.ggpht.com/ytc/AKedOLTsRQTClFRhNCink5le7cvflj7rOqbx_WPNPg=s176-c-k-c0x00ffffff-no-rj,0.0
UgyiNgeO30w3W3GWWgd4AaABAg,"How utterly ridiculous that here we are in the 21st-century, and we still have people celebrating other people as being ""royalty"". Hey, you dummies, these ""royal"" people have to pee and poop every day, just like you do.",5 hours ago,Oscar Windham,UCe1-CuygZQux6UceZ4h-C2Q,0,https://yt3.ggpht.com/ytc/AKedOLTxs9viV6j5hk-oKsa40p_YE8k4dE1g_kbormeAAE17hkn8WsGzB0Dsd3-767F4=s176-c-k-c0x00ffffff-no-rj,0.0
UgzDoM-JMRxeE3z8ry14AaABAg,"The smear campaign against this industrious, compassionate couple is not working with decent people.",5 hours ago,mary mann,UC3eAshnIez0G7l2Up95vw9w,0,https://yt3.ggpht.com/ytc/AKedOLScpTHT4y73_9c3epTzl5rdVRehONw0MYqvrV2Wyg=s176-c-k-c0x00ffffff-no-rj,0.0
Ugw216CQsbL0hMuZKs54AaABAg,"This is the man living with principles doing the right things. Being the children and family members of the English types of monarch that is responsible for plenty horrible things all over the world including committing crimes against humanity such as 300 years long African slavery, wiping out the natives in the Americans, Australia and New Zealand, Colonization, the spread of racism,  Apartheid in South Africa, handing over Palestine to the Rothschild and all the wars going on since WWII till today have been done in the name of Queen and kings of England. Despite US is taking over England's crimes since WWII, both are working together till today including in Ukraine against Russia and everything going on in the world.  

Harry distancing himself from this kind criminal establishment makes him the man of principle standing for the truth, right and humanity in general. God bless both Harry and Megan with their children.  The world respects them million times than the criminal English monarchy establishment and its active members that are living lavishly with excess because of their birth right which is not the case for the rest of the population.",5 hours ago,Badma Wededu,UCh6RxAnqDpEzs0e2ig_rtog,0,https://yt3.ggpht.com/ytc/AKedOLQ5gyBCY02UVLMH2JBAYe1LxpmwcDvGUVJQUg=s176-c-k-c0x00ffffff-no-rj,0.0
UgxmbcHdipENZGn7jGR4AaABAg,Lovely couple with great hearts,5 hours ago,Sophy Jemba,UC68JlFD8xTVe06exW_AbwnQ,12,https://yt3.ggpht.com/ytc/AKedOLS-JkS_feZXypHhczJOKUxE3CMCLC_vwaKux-crfSToTVTST9-FUY3kCVSeFEZ0=s176-c-k-c0x00ffffff-no-rj,0.0
Ugy4WT35PSercQKO0YJ4AaABAg,Vile  liars hated in england,5 hours ago,Ged Huffadine,UCr0ZrGLWoxofe1EyRyOjxAg,0,https://yt3.ggpht.com/ytc/AKedOLTT0DfGJ9aQ3nYASwW_VxSS3aul2MdMDJS48g=s176-c-k-c0x00ffffff-no-rj,0.0
UgzXNiZA2JhgwgXf80J4AaABAg,It’s not my cup of tea.  Sorry.,5 hours ago,William Price King,UCLlvS0NXcrh33xXdaJuRWvw,13,https://yt3.ggpht.com/ytc/AKedOLSsd8hnwiB4i5HsunyYR0fmp9O1ZiDlr4eqNuTg7w=s176-c-k-c0x00ffffff-no-rj,0.0
Ugx3RFppyL1PaLdFbKl4AaABAg,"Cuando va a morir la reina? Eso sería Interesante, más show mediático,",5 hours ago,swami. kt,UCTAYO0JtzRKKCjzDGPqIDfw,7,https://yt3.ggpht.com/e1jvnRc9jpGU_s49TBmTawiSX6TXA4lHPa0_fc5nWMcogORE7XwdwPZrvs0b-kOp0m2HHyHkFw=s176-c-k-c0x00ffffff-no-rj,0.0
Ugz_HPfqpRqqc6rHZm94AaABAg,The days of kings and queens and monarchy are over. We are all equal and must earn own bread.,5 hours ago,Singh Always King,UCzns_qkQgxwsIK8RTxCGPjQ,38,https://yt3.ggpht.com/ytc/AKedOLTOo4Pgnh_IOchE96rv3Kayqrp6ZMTsLWMOeOpq=s176-c-k-c0x00ffffff-no-rj,0.0
UgwmQvoMg5EXxWjBzI94AaABAg,More breaking news. I decided not to go into work today. I might go meet my cat’s girlfriend (who is also a cat) later today.,5 hours ago,iknownothingman,UC1OyKaAgsI8xQKanCVa-CGw,11,https://yt3.ggpht.com/c3Bg29v_CTP-TK26-nxv8vCi0ACnOnme1fTUVAN43vtxDS4WiRDweAYQmgqzU33Q2X_ZgDT4mGY=s176-c-k-c0x00ffffff-no-rj,0.0
Ugz7nh3fFX0eUl1gT5J4AaABAg,a day without open defecation is a day wasted - pajeet Patel 👌🏻😂😂😂😂😂😂😂,5 hours ago,HAI I’m PAJEET PATEL 2,UCWzwvsxEaQDXQSMOoSYKlUw,0,https://yt3.ggpht.com/6Xu7WNWfsihKWx6mEoI-FaFYlMomXaQXzgiSkBUijhjkB3xrP1cCbOgUecYv9zIRvLD-h_oUVw=s176-c-k-c0x00ffffff-no-rj,0.0
Ugy_d4VY22zE_16kKFd4AaABAg,Who cares about these freeloaders?,6 hours ago,MOTOGOD,UCjEBI6URGsrqgEItCtzqt8Q,1,https://yt3.ggpht.com/QAEM9hKY7drsycp_GtTLjwVYttdXIDoQQoHY8wDPKH-ZBiFtwN5hAtPceaW4qC4QClFkGUix=s176-c-k-c0x00ffffff-no-rj,0.0
UgxMYPAU6dFHNJHvKQF4AaABAg,Nobody cares,6 hours ago,SuspiciousOmniVan,UCDfhvn7rKDeGX-lJJF_UJVA,28,https://yt3.ggpht.com/amMRALG7dfXzQqtxY-myUWA1Q5y-KdfnVtDGYFo4YzzttFBxo9PEuvb6rCH8GqVgOhwrEjldBw=s176-c-k-c0x00ffffff-no-rj,0.0
UgyJa76vTgf_E99lPcl4AaABAg.9_sx_axpeCl9_t2kgVwRGn,"Harry is the founder of the Invictus games, they have their privacy, and there were no leaks when they went to visit his Grandmother 🤭. What does privacy mean in your life? To share what you want, right? Privacy NOT seclusion 😏",4 hours ago,Queen Sha'asia Beautiful Earth,UCXdKifUF8ZvHGP3rSL62g1w,3,https://yt3.ggpht.com/QczdjyiIDXcogtJJodvKBE2khazVjdAlpm6npVvAhr659h7F8G563XVb4fdypD95YffIJYMJKg=s176-c-k-c0x00ffffff-no-rj,0.0
UgyJa76vTgf_E99lPcl4AaABAg.9_sx_axpeCl9_t2oCTojtb,Ignorance at an all-time high,4 hours ago,Queen Sha'asia Beautiful Earth,UCXdKifUF8ZvHGP3rSL62g1w,2,https://yt3.ggpht.com/QczdjyiIDXcogtJJodvKBE2khazVjdAlpm6npVvAhr659h7F8G563XVb4fdypD95YffIJYMJKg=s176-c-k-c0x00ffffff-no-rj,0.0
Ugx7YtDGmlEORIwIZdJ4AaABAg.9_sxMLtL8zH9_t0cY4zAaw,Isn't this the Invictus games?,4 hours ago,Queen Sha'asia Beautiful Earth,UCXdKifUF8ZvHGP3rSL62g1w,3,https://yt3.ggpht.com/QczdjyiIDXcogtJJodvKBE2khazVjdAlpm6npVvAhr659h7F8G563XVb4fdypD95YffIJYMJKg=s176-c-k-c0x00ffffff-no-rj,0.0
Ugyi51t3h5SJyWzzJVl4AaABAg.9_svtHc-Yry9_t0YMQECIS,This couple keeps the RF NEWS 🤭,4 hours ago,Queen Sha'asia Beautiful Earth,UCXdKifUF8ZvHGP3rSL62g1w,4,https://yt3.ggpht.com/QczdjyiIDXcogtJJodvKBE2khazVjdAlpm6npVvAhr659h7F8G563XVb4fdypD95YffIJYMJKg=s176-c-k-c0x00ffffff-no-rj,0.0
Ugyi51t3h5SJyWzzJVl4AaABAg.9_svtHc-Yry9_tGOwEzdzM,So why are you watching?,2 hours ago,Cher Del,UC9180jXP8mNtmAhbegGPrxg,1,https://yt3.ggpht.com/ytc/AKedOLStytOruIh_6vn4H5i0KLjvwjnv535utXe4r4NR2g=s176-c-k-c0x00ffffff-no-rj,0.0
UgxmbcHdipENZGn7jGR4AaABAg.9_stz8QLVZK9_sxNjXrees,Liar,5 hours ago,Catania Momma Italia,UCu1l-bTKHG73rxUt_fseutA,8,https://yt3.ggpht.com/ytc/AKedOLQ_m6FbvJz57CaIDizZdARwntMNkka1JENKNYV9Nw=s176-c-k-c0x00ffffff-no-rj,0.0
UgxmbcHdipENZGn7jGR4AaABAg.9_stz8QLVZK9_szW1gxE61,Nah,4 hours ago,Shatakshi,UClNsWZYN07Ifi0J4Kcwyi9g,5,https://yt3.ggpht.com/ytc/AKedOLR4EDyNFy9-0ck1g0dDlN_axie8fo-GZxEnNmBnwY1SCzpEbfAgkFG0gMI5eC_C=s176-c-k-c0x00ffffff-no-rj,0.0
UgxmbcHdipENZGn7jGR4AaABAg.9_stz8QLVZK9_szzwJOND1,More like look at me look at me .....,4 hours ago,Senidu Teklu,UCK-1o-WIw8U7PPmGZAgA7_g,6,https://yt3.ggpht.com/ytc/AKedOLSpDP6Xx56qWW6n5Pf2bVQbQlR_E96deK1pjnXltg=s176-c-k-c0x00ffffff-no-rj,0.0
UgxmbcHdipENZGn7jGR4AaABAg.9_stz8QLVZK9_t0TTtwP2R,Own money earners Harry and Meghan 🥰,4 hours ago,Queen Sha'asia Beautiful Earth,UCXdKifUF8ZvHGP3rSL62g1w,0,https://yt3.ggpht.com/QczdjyiIDXcogtJJodvKBE2khazVjdAlpm6npVvAhr659h7F8G563XVb4fdypD95YffIJYMJKg=s176-c-k-c0x00ffffff-no-rj,0.0
UgxmbcHdipENZGn7jGR4AaABAg.9_stz8QLVZK9_t0drFh7TR,"They are in deed a lovely couple, I wish them all the best.",4 hours ago,p burn,UCF2zEadpvUI0XishRe5VR7w,1,https://yt3.ggpht.com/ytc/AKedOLT9ivEj1wvYliR19yHmBdFQgVUerTjEyBKMHQ=s176-c-k-c0x00ffffff-no-rj,0.0
UgzXNiZA2JhgwgXf80J4AaABAg.9_stJbbsfQL9_t33BoxspR,While you're sipping you here 🤭,4 hours ago,Queen Sha'asia Beautiful Earth,UCXdKifUF8ZvHGP3rSL62g1w,2,https://yt3.ggpht.com/QczdjyiIDXcogtJJodvKBE2khazVjdAlpm6npVvAhr659h7F8G563XVb4fdypD95YffIJYMJKg=s176-c-k-c0x00ffffff-no-rj,0.0
UgzXNiZA2JhgwgXf80J4AaABAg.9_stJbbsfQL9_tGeTA3mBx, @Queen Sha'asia Beautiful Earth  my thoughts exactly!!!😂😂😂,2 hours ago,Cher Del,UC9180jXP8mNtmAhbegGPrxg,0,https://yt3.ggpht.com/ytc/AKedOLStytOruIh_6vn4H5i0KLjvwjnv535utXe4r4NR2g=s176-c-k-c0x00ffffff-no-rj,0.0
Ugx3RFppyL1PaLdFbKl4AaABAg.9_ssq2NIvVO9_stx2-bU-K,That's a spiteful hateful remark!,5 hours ago,Ged Huffadine,UCr0ZrGLWoxofe1EyRyOjxAg,2,https://yt3.ggpht.com/ytc/AKedOLTT0DfGJ9aQ3nYASwW_VxSS3aul2MdMDJS48g=s176-c-k-c0x00ffffff-no-rj,0.0
Ugz_HPfqpRqqc6rHZm94AaABAg.9_ssgn2HeUt9_tL2oE4VQv,correct,1 hour ago,J C,UC4HoquoXJFoxtK-LV9biR1Q,0,https://yt3.ggpht.com/ytc/AKedOLQeefco9mzA7aQ0bYg_BzwNZx-K4sinPIRbjA=s176-c-k-c0x00ffffff-no-rj,0.0
Ugz_HPfqpRqqc6rHZm94AaABAg.9_ssgn2HeUt9_tPs4Lys8u,"Excellent bro, why these medias giving hype for these people, we dont want to hear these bullshits..",44 minutes ago,Fazil Shajahan,UCI4XBMwfuVrdpA9zXEdbWSA,0,https://yt3.ggpht.com/ytc/AKedOLTydo07DAZnwF2dfdkpNQlFSgxGB1V_cHpOCjxZPw=s176-c-k-c0x00ffffff-no-rj,0.0
UgxMYPAU6dFHNJHvKQF4AaABAg.9_sp5nIyYZN9_spRmlJ9LN,Wrong. We do,6 hours ago,Cathy Carty,UCVDb8gIhtWWnkkS-33OL4TA,11,https://yt3.ggpht.com/ytc/AKedOLQl8q3CQ_Jw0aqqXxm5pkeIAuV5Abdnk1I6=s176-c-k-c0x00ffffff-no-rj,0.0
UgxMYPAU6dFHNJHvKQF4AaABAg.9_sp5nIyYZN9_spmjQz3t_,We care and you care because you would not have wasted time commenting and watching it.,6 hours ago,Avery J*,UCrs0zUigZvYex0Qzl5yI16g,13,https://yt3.ggpht.com/ytc/AKedOLRfCipXCFIR2EuoqHU7Hs3hME9XhMXz3qkcdw=s176-c-k-c0x00ffffff-no-rj,0.0
UgxMYPAU6dFHNJHvKQF4AaABAg.9_sp5nIyYZN9_ssMB86m9Y,You are here early for someone who doesn't care.,5 hours ago,Sandra Brown,UCPdKf_if3uQCbWaaKH-nokg,4,https://yt3.ggpht.com/ytc/AKedOLSevZNPSH7QELfOs5Zyh8DDyFQw_nW5NMKrPgxM-iEq4wU0axjsgZRhf36Wj-ml=s176-c-k-c0x00ffffff-no-rj,0.0
UgxMYPAU6dFHNJHvKQF4AaABAg.9_sp5nIyYZN9_t16aJuagp,You are here🙄,4 hours ago,Queen Sha'asia Beautiful Earth,UCXdKifUF8ZvHGP3rSL62g1w,2,https://yt3.ggpht.com/QczdjyiIDXcogtJJodvKBE2khazVjdAlpm6npVvAhr659h7F8G563XVb4fdypD95YffIJYMJKg=s176-c-k-c0x00ffffff-no-rj,0.0
UgxMYPAU6dFHNJHvKQF4AaABAg.9_sp5nIyYZN9_tGktrhdab, @Queen Sha'asia Beautiful Earth  you're killing me.....🤣🤣🤣,2 hours ago,Cher Del,UC9180jXP8mNtmAhbegGPrxg,0,https://yt3.ggpht.com/ytc/AKedOLStytOruIh_6vn4H5i0KLjvwjnv535utXe4r4NR2g=s176-c-k-c0x00ffffff-no-rj,0.0
