cid,text,time,author,channel,votes,photo,heart
Ugx4Z6HdLtMiVgdLpER4AaABAg,Like chicken 🐓 in cages they treats people,9 hours ago,Marie Cameau,UCg8TdVE6JDI8epjnk9bhGhg,0,https://yt3.ggpht.com/ytc/AKedOLTGxTeXt2Et3vkvLGOgvCvwoNxzJELeNq9PvPMgajnRW12kq_snjqV7PqUxZE7p=s176-c-k-c0x00ffffff-no-rj,0.0
UgzHE4ilbCMNsy3LM4l4AaABAg,"I feel very pity for the Chinese people, thats against the human rights  !!!",9 hours ago,brigitte soleil,UCPqRmhaQcw6seChhajQ01UQ,0,https://yt3.ggpht.com/ytc/AKedOLSEVZDscVNztw4xuIeCqfL4nGYCnGQDKRRYoA=s176-c-k-c0x00ffffff-no-rj,0.0
UgwtYx-gaemXqlDYerd4AaABAg,"It’s impossible to reach zero Covid situations! Once you reach zero cancer, zero diabetes, zero tuberculosis, etc, that’s when you can reach zero anything else. Shanghai is INSANE",9 hours ago,vidfreak727,UCZp4mUsoFix0oIg0XsjBKuw,1,https://yt3.ggpht.com/ytc/AKedOLTVKXq2jUXzwVy8TAGYN847b2Q3mYTPfvfB1tvw=s176-c-k-c0x00ffffff-no-rj,0.0
UgwEVH_jY0jl6DXtMuB4AaABAg,"Your English is not clear and blurr.
Hope other newscaster can replace her.",10 hours ago,Benny Chua,UCPF098ckPlGWp3sMl9OPZ7Q,0,https://yt3.ggpht.com/ytc/AKedOLR5RwN_O_3ZFDJz9GtQRXU3Jr_Pj8-rJhWy3Tq77fSSlQLBNQDwpozp0kGyKAzq=s176-c-k-c0x00ffffff-no-rj,0.0
Ugz5drD5phUkeCsTJiB4AaABAg,"These events are the Kazarian Calabala,  who have been planning this for years. Thier plan is to break down all countries,  forces a credit system on those people who survive,  kill most of. All leaders of every country are involved in the distructsion of the people.  Ur distructsion is thier goal. Less human beings,better to manage the rest.wake up.",11 hours ago,Sue Roy,UConzlo62ZMIxuDcfeCFMFyw,0,https://yt3.ggpht.com/ytc/AKedOLSI7zEA5tWdsK2qeJdBxtNnDaWZr6Hr-if2kA=s176-c-k-c0x00ffffff-no-rj,0.0
UgwpgIPNuAQsJ139dKd4AaABAg,"It seems Sinovac does not work, which is the favorite of WHO",12 hours ago,prak syxre,UCp2MG7lafN_8vQevAG_wE7Q,1,https://yt3.ggpht.com/ytc/AKedOLSqEqF-pS6azGgDcERce6AtGEEdqFOxrv5iwA=s176-c-k-c0x00ffffff-no-rj,0.0
UgwK-e5UprKB-oKGMkN4AaABAg,"All below (open secret) statements are from demons. Have you ever heard?

# Ignorant people think they worship GOD, instead they worship us as gods. We are demonic gods on the world.   
- Elizabeth

# Ultimate psychopathic, evil & demonic power & control are our ultimate goals. All we need is the right major crisis ( must be artificial & evil) and the nations will accept the New World Order (Ultimate Satanism).
- Rockefeller

# HELLO THERE, MY NAME IS JACOB ROTHSCHILD. MY FAMILY IS WORTH 500 TRILLION DOLLARS. WE OWN NEARLY EVERY CENTRAL BANK IN THE WORLD. WE FINANCED BOTH SIDES OF EVERY WAR SINCE NAPOLEON. WE OWN YOUR NEWS, THE MEDIA, YOUR OIL, AND YOUR GOVERNMENT.
- Rothschild

# At least 4 Billion ""useless eaters"" shall be eliminated by the year 2050 by means of limited wars, organized epidemics of fatal rapid acting-acting diseases and starvation. Energy, food and watershal be kept at subsistence levels for the non-elite, starting with the White populations of Western Europe and North America and then spreading to other races. The population of Canada, Western Europe and the United States will be decimated more rapidly than on other continents, until the worlds population reaches a manageable level of billion, of which which 500 million wil consist of Chinese and Japanese races, selected because they are people who have been regimented for centuries and who are accustomed to obeying authority without question. From the time there shall be artificially contrived food and water shortages and medical care to remind the masses that their very existence depends on the goodwill of the Committee of 300.
- Klaus Schwab

# It's our ultimate plan & goal to convert this world as the most devilish place.
- George Soros

# 99% people in the world are useless eaters. So 1% rulers & controllers of the world must take effective steps to kill & control 99% people.
- Henry kissinger

# With my innocent face & smile we are going to kill billions of people in the world by the most poisonous (slow poison) vaccines one by one based on false hypocritical dramas. We hope you will enjoy.
- Bill Gates 

# We must do anything for increasing our demonic money, assets & power. So we must obey our demonic gods. If they say to kill all humans & humanity then we must do that without any kind of hesitance.
- All billionaires

# Universal Truth about all politicians & governments:

 ""We know they are lying. They know they are lying, They know that we know they are lying. We know that they know that we know they are lying. And still they continue to lie.""

More than 99% politicians and governments are big liars hypocrites frauds evils psychopaths inhumans. They are agents of demons. They can do anything against humanity, if their demonic gods say them to do. They focus only on evil selfishness. But people still support them.",13 hours ago,Anti Satanism Intelligence,UCJL831KF216NnX_NkMj4Nvg,0,https://yt3.ggpht.com/0fCLggikkIg1MdJX-E7E8jxMxR1mYYBV1VzX26cz1BUFAMcrc98ov3ZjdRp1npyeBuc4cof7D2o=s176-c-k-c0x00ffffff-no-rj,0.0
UgxgDaKrTPjn-ioaCEN4AaABAg,all Indians have are the big mouths and all they can do is BS whole day and cannot make anything haha :) a nation totally useless.,15 hours ago (edited),红火树 RedFireTree,UClbGhAPTLkfJZ7eK70SImFA,0,https://yt3.ggpht.com/ytc/AKedOLRsRourR8ve03v9c8oMlRHMXG6qC7AV4FIdJz-SS3o=s176-c-k-c0x00ffffff-no-rj,0.0
UgybEe-KrTxrSnrOckt4AaABAg,This due to confusion caused by the switch from one-child to three-child policy. Many Chinese misunderstood it as a three father policy which resulted in comical and confusing results. Now the whole of Shanghai has to be locked down so paternity tests can be conducted on everyone to help CCP members determine who their real fathers are.,15 hours ago,Clockwork Orange,UCPebSZ1WmriDRJLH6YmWEMg,0,https://yt3.ggpht.com/ytc/AKedOLR14Itmp-xvs2sBADtT-YnkfmOfn4hQ7Usi8w=s176-c-k-c0x00ffffff-no-rj,0.0
Ugz-ieFv5EaYxji0Zzp4AaABAg,"China's 3 astronauts returned back to earth safely after spend 6 months in China's space station, India cannot send a single man into space.",15 hours ago,红火树 RedFireTree,UClbGhAPTLkfJZ7eK70SImFA,4,https://yt3.ggpht.com/ytc/AKedOLRsRourR8ve03v9c8oMlRHMXG6qC7AV4FIdJz-SS3o=s176-c-k-c0x00ffffff-no-rj,0.0
UgyM6NtzqCOzTeGmnyp4AaABAg,China should be held accountable for releasing covid on the world.,15 hours ago,melvinISmischievous,UCFSJTRA76A-CEMrwTstqa0Q,0,https://yt3.ggpht.com/ytc/AKedOLQwbWYm73woT9Shs14JXKQxljzSocdtBWt2VwHB=s176-c-k-c0x00ffffff-no-rj,0.0
UgzzR0TKp7dWVmWceR54AaABAg,It doesn't matter WW3 has started the end of everything is near.,16 hours ago,Harley Center,UCGjA76D4cOV3loQv7D8CamA,0,https://yt3.ggpht.com/GsQxs6y2nCe_fxJb9SYm4IgJ_-5TZV9IR8pHa2T-VHYl6MKgs9UxP7zIdhf5jxGPvSQkQ6BNKVI=s176-c-k-c0x00ffffff-no-rj,0.0
UgwEo_u24is-U1DIzpl4AaABAg,North Korea SUFFERING AND SMILING!,18 hours ago,BIAFRA first,UCcQJ05RqH2ZV8NTnL544Vwg,0,https://yt3.ggpht.com/ytc/AKedOLSPzPD0_c72O23dAlHRCmuYHCDUXNOz27fJEJ18=s176-c-k-c0x00ffffff-no-rj,0.0
Ugz67qV6Wgn8VKadSEV4AaABAg,China swallowed their iniquities,18 hours ago,Rhodora Policarpio,UC5NiGAhs-Sv6Lvj6XEOREcQ,0,https://yt3.ggpht.com/ytc/AKedOLQKavgnw5z1_4G2VR--eP9ZgasEEJnKl1mCEw=s176-c-k-c0x00ffffff-no-rj,0.0
Ugz7YfI8d5GJKUM2VWB4AaABAg,China has swallowed their iniquities,18 hours ago,Rhodora Policarpio,UC5NiGAhs-Sv6Lvj6XEOREcQ,0,https://yt3.ggpht.com/ytc/AKedOLQKavgnw5z1_4G2VR--eP9ZgasEEJnKl1mCEw=s176-c-k-c0x00ffffff-no-rj,0.0
UgxygIr7lqkmb_9Yi9N4AaABAg,Why is Xi treating Han Chinese like Uyghurs? They are supposed to be special!,19 hours ago,Clockwork Orange,UCPebSZ1WmriDRJLH6YmWEMg,0,https://yt3.ggpht.com/ytc/AKedOLR14Itmp-xvs2sBADtT-YnkfmOfn4hQ7Usi8w=s176-c-k-c0x00ffffff-no-rj,0.0
UgwOQ3HVGhgw5XVOS4F4AaABAg,I love this channel. More Americans should watch it.,19 hours ago,sherry snyder,UCnwbfdkl7lQXrZPYbe0K3eg,15,https://yt3.ggpht.com/ytc/AKedOLR9ok8ykJcKZOGpDNl6PvsaDgNeTBXls0akxtnc=s176-c-k-c0x00ffffff-no-rj,0.0
UgznRs3lo-m7peMtyFl4AaABAg,"Those loans, destroy countries",19 hours ago,sherry snyder,UCnwbfdkl7lQXrZPYbe0K3eg,0,https://yt3.ggpht.com/ytc/AKedOLR9ok8ykJcKZOGpDNl6PvsaDgNeTBXls0akxtnc=s176-c-k-c0x00ffffff-no-rj,0.0
UgyLXGqx6UmZfY-Ipf54AaABAg,There is something seriously wrong on this planet and it's not COVID.  Feel for these poor Chinese people.,19 hours ago,Michele Misiewicz,UCy0QiBV2wexDDyiqyNscn5Q,1,https://yt3.ggpht.com/ytc/AKedOLRG49qFd-3NVrwU9ddbFddK9C4677UYDM6Nl96M-9Cv5JbmJvIM4mIxgittx3B9=s176-c-k-c0x00ffffff-no-rj,0.0
UgzAUx3xe6u5gp_Jjbd4AaABAg,i get real terrorist false flag vibes from this guy.,19 hours ago,Agent Double o 7,UCksaEq80YiTdnp0S6BPXdsg,0,https://yt3.ggpht.com/ytc/AKedOLQ6RteqDLXaCKpnu-8nFVLrHtYJOi6dNmurCgK-8ZLaTT2AyinewyHqtC_ei4G0=s176-c-k-c0x00ffffff-no-rj,0.0
UgwEVH_jY0jl6DXtMuB4AaABAg.9_sLFhkUvd_9_sRmzkrW9t,Thats not true  she speaks very good English  !!!,9 hours ago,brigitte soleil,UCPqRmhaQcw6seChhajQ01UQ,0,https://yt3.ggpht.com/ytc/AKedOLSEVZDscVNztw4xuIeCqfL4nGYCnGQDKRRYoA=s176-c-k-c0x00ffffff-no-rj,0.0
Ugz-ieFv5EaYxji0Zzp4AaABAg.9_rolXY6vvd9_rwLdEAizx,I can clearly see how happy Chinese people are in 9:52,14 hours ago,Nikhil prince,UCr1BhojjKEjl_EB1ZTLSZ2A,1,https://yt3.ggpht.com/ytc/AKedOLRaVRfFNhTVcROXFSUHz9So75hb8ahy6wglXFyHeg=s176-c-k-c0x00ffffff-no-rj,0.0
Ugz-ieFv5EaYxji0Zzp4AaABAg.9_rolXY6vvd9_sMzfGBqIt,Sending people to space but fighting  for food and groceries! What a shame!,10 hours ago,Krishna A,UCshtVlfKPTHkbwz8UcogHoA,5,https://yt3.ggpht.com/ytc/AKedOLQg1o5XBc8qRKKzA7k2NovzxcNzB2ioUVpxzEXOIA=s176-c-k-c0x00ffffff-no-rj,0.0
UgwOQ3HVGhgw5XVOS4F4AaABAg.9_rPH-KFeZT9_rgZVcf_fM,Watching in Canada,16 hours ago,Lydia V,UCUENWKtKoRUM3upNuD6EUww,3,https://yt3.ggpht.com/ytc/AKedOLT8hSnYpltySDyP_0AXbmaTCKdh5UPZ9qRJWs3Vuhg=s176-c-k-c0x00ffffff-no-rj,0.0
UgwOQ3HVGhgw5XVOS4F4AaABAg.9_rPH-KFeZT9_tElaga6fp,More Americans are… greetings from FL,2 hours ago,Gokus flipflops,UCc_o73ETLknLkRWJAjk_G0w,1,https://yt3.ggpht.com/ytc/AKedOLRGKU632INXotfEzsjb6fshZ-6EcjQO9wEYTjBFDGI=s176-c-k-c0x00ffffff-no-rj,0.0
UgwOQ3HVGhgw5XVOS4F4AaABAg.9_rPH-KFeZT9_tG6YAak5l," @Gokus flipflops  I live in Florida, I’m not from Florida",2 hours ago,sherry snyder,UCnwbfdkl7lQXrZPYbe0K3eg,0,https://yt3.ggpht.com/ytc/AKedOLR9ok8ykJcKZOGpDNl6PvsaDgNeTBXls0akxtnc=s176-c-k-c0x00ffffff-no-rj,0.0
UgyLXGqx6UmZfY-Ipf54AaABAg.9_rMqwMRpqB9_ra9kVR0T0,"It shouldn't surprise me that this will come to the USA , a different shape and form  !!🤔 / Future watch!!",17 hours ago (edited),FERNANDO SCRENCI,UCA0uS8soTIJi6Yv8F3nZjGA,1,https://yt3.ggpht.com/ytc/AKedOLTrOk-Q9E1Tp8Arcajfyf2BbJbBrRnUp6OWP7hO=s176-c-k-c0x00ffffff-no-rj,0.0
UgwxGyOAOcYyFCU7QSl4AaABAg,It's ozone. Ozone isn't contagious,20 hours ago,You Can Still Come Home,UC2fVOEkfsZWWLOtob2zfO9w,0,https://yt3.ggpht.com/1VVyZ6yUmRyA_GuBwnZ0H4MytYqUP4V-GnuPRjQV8UScQoyxkwoFXTJgODbvxhjo-rDyg6m_DaM=s176-c-k-c0x00ffffff-no-rj,0.0
Ugwm21kAkMkjvqa5XHZ4AaABAg,"wion - "" there is no slums or shit holes , as worst as shanghai  """,20 hours ago,Chopper Ghost Bipin,UCPieCHBuSfkvP8iT8-zdjqg,1,https://yt3.ggpht.com/ytc/AKedOLT9IYRR7w9xIsVWU6lm2cduCMOAdhEsC9VLUdf5dbRwqSbPquDozmOResxgcKBd=s176-c-k-c0x00ffffff-no-rj,0.0
UgyIMMdlc5wirBtVlZ94AaABAg,"wion - "" china ought to be ashamed of their olympics result , pandemic not an excuse  """,20 hours ago,Chopper Ghost Bipin,UCPieCHBuSfkvP8iT8-zdjqg,0,https://yt3.ggpht.com/ytc/AKedOLT9IYRR7w9xIsVWU6lm2cduCMOAdhEsC9VLUdf5dbRwqSbPquDozmOResxgcKBd=s176-c-k-c0x00ffffff-no-rj,0.0
Ugz6YcGfqpXvGk3kys54AaABAg,"wion - "" china has a lot to learn from india , on saving more lives in the midst of pandemic """,20 hours ago,Chopper Ghost Bipin,UCPieCHBuSfkvP8iT8-zdjqg,2,https://yt3.ggpht.com/ytc/AKedOLT9IYRR7w9xIsVWU6lm2cduCMOAdhEsC9VLUdf5dbRwqSbPquDozmOResxgcKBd=s176-c-k-c0x00ffffff-no-rj,0.0
UgxFkZHvejWsXuSJ9XN4AaABAg,"The mushroom from soil has the cure in china, and they do not study it. 

A great loss for all.",21 hours ago,Sir Derty ♦,UCNlJtQ-jGRinT9geRGslvDw,0,https://yt3.ggpht.com/j8ocXda9QymzzNy9n4bAOyJIWn340Mq2byjE6DkCQMZAHayQkvOcXF0nTJU1HiWIMkIeYh73rQ=s176-c-k-c0x00ffffff-no-rj,0.0
Ugy__yHs6_vMQrvV_ll4AaABAg,"Yes it does.

Ironic since mushroom is eastern chinese medicine and yet they are not using it which clearly shows evidence.",21 hours ago,Sir Derty ♦,UCNlJtQ-jGRinT9geRGslvDw,1,https://yt3.ggpht.com/j8ocXda9QymzzNy9n4bAOyJIWn340Mq2byjE6DkCQMZAHayQkvOcXF0nTJU1HiWIMkIeYh73rQ=s176-c-k-c0x00ffffff-no-rj,0.0
Ugx1RcL7Qn7TZfoTGzR4AaABAg,i truly like wion coverage but having difficulty understanding their english accent...help..well not all  news anchor..but i would say almost all only few people actually have little to zero accent when speaking english,21 hours ago (edited),Yummy Mellon,UCz8aYNMshuG4BTY8wMCCFhA,2,https://yt3.ggpht.com/ytc/AKedOLTgrxBTPl_suGLh2B917Z9k2QkGh59A-8aXtGdt=s176-c-k-c0x00ffffff-no-rj,0.0
UgxtoUdrY6uBOnDDXOx4AaABAg,"Is this humanity  sending Asylum  to Uganda,  Prime minister of UK is second Putin",21 hours ago,paul dpd,UCLN7wA3DjJUEybO-7kq64nA,1,https://yt3.ggpht.com/ytc/AKedOLR9-JXgyYU7NjGuyzzlA814az-8qYOMAFyo2eDMXA=s176-c-k-c0x00ffffff-no-rj,0.0
Ugy1_ITqk2C52HnZfo14AaABAg,I thought this about china,21 hours ago,Angie Bervinkle,UCIFEnIEMhTtdFXvUdt9tlLQ,1,https://yt3.ggpht.com/ytc/AKedOLT9WIxv1EJq-RtSVP64QYNSOyukcC_RNfm4-A=s176-c-k-c0x00ffffff-no-rj,0.0
Ugz2cBBMPaVxSjt9TY14AaABAg,well if a bunch of ppl leave over it there goes thier money,21 hours ago,Angie Bervinkle,UCIFEnIEMhTtdFXvUdt9tlLQ,0,https://yt3.ggpht.com/ytc/AKedOLT9WIxv1EJq-RtSVP64QYNSOyukcC_RNfm4-A=s176-c-k-c0x00ffffff-no-rj,0.0
UgwkIyTdKg2lgIwSDCp4AaABAg,"Hey, don't blame CCP for treating their Chinese slaves like slaves.",21 hours ago (edited),Clockwork Orange,UCPebSZ1WmriDRJLH6YmWEMg,3,https://yt3.ggpht.com/ytc/AKedOLR14Itmp-xvs2sBADtT-YnkfmOfn4hQ7Usi8w=s176-c-k-c0x00ffffff-no-rj,0.0
UgwQHlmLTws5Dl_FZL94AaABAg,"ITIP OF TODAY!!!! Watch YT channel “ Hugo Talks” uploaded today “ Zelensjky digital presence in UK. Antichrist rising fast.. fourth Reich Nazi smart phone digital ID ready to be up and running in UKRAINE, CHINA, RUSSIA, CANADA, USA, AUSTRALIA, ALL EU COUNTRIES, NEW ZEALAND, BALTIC STATES, many others. COMPLY or … DIE. Which I will Gladly DO!!! WARRIOR OF LOVE, JESUS SAVES YOUR SOUL!!! And… OBVIOUSLY.. the virus produced by Satanic Cabal Elites is NOR in Shanghai ONLY with NO cases elsewhere in China. DUH. It’s NOT about Co id19, which is less than .05 out of 1000 that die and those are 99.9
Percent very old with 6 or more comorbidities.( dying already obviously and in all likelihood READY for RELIEF from their Suffering. DEATH is NOT always the Grim Reaper , black hooded beckoning with outstretched bony finger.. for some, DEATH is an ANGEL with SOFT WIDE WINGS",21 hours ago,Brenda Hines,UCdEt5HMKWps2Oh6veDdrk2g,1,https://yt3.ggpht.com/ytc/AKedOLTloOs-ytptgkg6RZjPmpuUwzD8azdu3yVOaxZG=s176-c-k-c0x00ffffff-no-rj,0.0
Ugznw6lahSp2k08fB-V4AaABAg,Winnie is trying to kill more Chinese than Mao and cement his place as the greatest commie leader. Long live Xi Dingding!,21 hours ago,Clockwork Orange,UCPebSZ1WmriDRJLH6YmWEMg,0,https://yt3.ggpht.com/ytc/AKedOLR14Itmp-xvs2sBADtT-YnkfmOfn4hQ7Usi8w=s176-c-k-c0x00ffffff-no-rj,0.0
UgzOTtoNsHAMCuAyvMx4AaABAg,If Winnie doesn't watch out he might get deposed by a rival faction and then he'll be hanged for corruption. Poor Xi Pingping!,21 hours ago,Clockwork Orange,UCPebSZ1WmriDRJLH6YmWEMg,1,https://yt3.ggpht.com/ytc/AKedOLR14Itmp-xvs2sBADtT-YnkfmOfn4hQ7Usi8w=s176-c-k-c0x00ffffff-no-rj,0.0
Ugys2q3Tn2_bvRR-ckd4AaABAg,Correct corona is not reason now to one year's lockdown possible,21 hours ago,Madhumita roy,UC9uv7ilzdph1zuj4r6poHLQ,0,https://yt3.ggpht.com/ytc/AKedOLQdYHY_9b8ZShHvPt8eLML43THQYz19qmfBIw=s176-c-k-c0x00ffffff-no-rj,0.0
UgzML45TlF1bTRHO7hV4AaABAg,Ìu⁸ùìķ,21 hours ago,RABI SANKAR PANDIA,UCOKOpErWDut6pG1ktBhKJuw,0,https://yt3.ggpht.com/lbawBOSyTMIzDw7ewR5UeNH327rxcf5RDo1pYoK-lM1fOYpnLcMJDvGgZKns17zK7jylnLOEgC4=s176-c-k-c0x00ffffff-no-rj,0.0
Ugwm21kAkMkjvqa5XHZ4AaABAg.9_rJpHerksM9_rKx7DB4hF,"Look Inside 
You Can Still Come Home
4 seconds ago
It's ozone. Ozone isn't contagious",20 hours ago,You Can Still Come Home,UC2fVOEkfsZWWLOtob2zfO9w,0,https://yt3.ggpht.com/1VVyZ6yUmRyA_GuBwnZ0H4MytYqUP4V-GnuPRjQV8UScQoyxkwoFXTJgODbvxhjo-rDyg6m_DaM=s176-c-k-c0x00ffffff-no-rj,0.0
UgyIMMdlc5wirBtVlZ94AaABAg.9_rJjRFky4h9_rL0xp1U6m,"You Can Still Come Home
4 seconds ago
It's ozone. Ozone isn't contagious",20 hours ago,You Can Still Come Home,UC2fVOEkfsZWWLOtob2zfO9w,0,https://yt3.ggpht.com/1VVyZ6yUmRyA_GuBwnZ0H4MytYqUP4V-GnuPRjQV8UScQoyxkwoFXTJgODbvxhjo-rDyg6m_DaM=s176-c-k-c0x00ffffff-no-rj,0.0
UgxFkZHvejWsXuSJ9XN4AaABAg.9_rE6LsRDCY9_rL3xmwtii,"You Can Still Come Home
4 seconds ago
It's ozone. Ozone isn't contagious",20 hours ago,You Can Still Come Home,UC2fVOEkfsZWWLOtob2zfO9w,0,https://yt3.ggpht.com/1VVyZ6yUmRyA_GuBwnZ0H4MytYqUP4V-GnuPRjQV8UScQoyxkwoFXTJgODbvxhjo-rDyg6m_DaM=s176-c-k-c0x00ffffff-no-rj,0.0
Ugx1RcL7Qn7TZfoTGzR4AaABAg.9_rDuwHJ8No9_rKuuEtCyX,The chocolate guy has a perfect accent I agree the others is difficult to understand.,20 hours ago,Glopy mystique,UCrowCYBnQG_pvP4q28brDwQ,2,https://yt3.ggpht.com/uuYKbO4sSZS2sRWBaCFiwjdaR9dIec0TLSifiYjX9jLw6VnhlNrcP22Am8bPirseXOOuDsl9WA=s176-c-k-c0x00ffffff-no-rj,0.0
Ugx1RcL7Qn7TZfoTGzR4AaABAg.9_rDuwHJ8No9_rQY4nvSJq," @Glopy mystique  that nigerian speaks so heavy,like copycatting posh brit. palki needs to give cast eng classes.",19 hours ago,Kaiser Gidorah,UCD7z2qWLtW_xkzDgYTrZc8A,0,https://yt3.ggpht.com/ytc/AKedOLRU4TSHvy9Gn7GNwuNkZ5b8-rLNZ8aKG9AI0CvjiA=s176-c-k-c0x00ffffff-no-rj,0.0
Ugx1RcL7Qn7TZfoTGzR4AaABAg.9_rDuwHJ8No9_rR7OLT2ZM, @Kaiser Gidorah  forienge speakers will never sound like and English born speaker we've been speaking it out whole life from birth,19 hours ago,Big Homie,UC2GxbpXlIvIiUjB7vrjCd_w,0,https://yt3.ggpht.com/ytc/AKedOLRjh9UpC5qd1sC8LomSzhTSFa8nTwqPipqc1e_ROUd3h6kAX8UYN-hTx_Cz-yfG=s176-c-k-c0x00ffffff-no-rj,0.0
Ugx1RcL7Qn7TZfoTGzR4AaABAg.9_rDuwHJ8No9_rcdIioIfY," @Big Homie  viewers got right to critique cause thats what any broadcaster asks for bare minimum. dun go ad hominem on me,indians may know eng but they're the worst accents!",17 hours ago,Kaiser Gidorah,UCD7z2qWLtW_xkzDgYTrZc8A,0,https://yt3.ggpht.com/ytc/AKedOLRU4TSHvy9Gn7GNwuNkZ5b8-rLNZ8aKG9AI0CvjiA=s176-c-k-c0x00ffffff-no-rj,0.0
Ugx1RcL7Qn7TZfoTGzR4AaABAg.9_rDuwHJ8No9_s-Zaozx8K, @Kaiser Gidorah  may be our accent is worst  but you guys need to understand it's not our language atleast we can speak it and that's enough I think !! if you will speak our language you will sound more funnier 😜😝,13 hours ago,Omnivores,UCbHYgaPt_uJ8SURgtk6UHFg,0,https://yt3.ggpht.com/ytc/AKedOLSsGLvgGL1V2yScml4wEHNB-yAJml4qR_IxuVTaMA48HCLkh9U4yu_Y_GXJ7VkD=s176-c-k-c0x00ffffff-no-rj,0.0
Ugx1RcL7Qn7TZfoTGzR4AaABAg.9_rDuwHJ8No9_s11O81nLw, @Omnivores  more funny is redundant,13 hours ago,Kaiser Gidorah,UCD7z2qWLtW_xkzDgYTrZc8A,0,https://yt3.ggpht.com/ytc/AKedOLRU4TSHvy9Gn7GNwuNkZ5b8-rLNZ8aKG9AI0CvjiA=s176-c-k-c0x00ffffff-no-rj,0.0
Ugy1_ITqk2C52HnZfo14AaABAg.9_rByXjDZlw9_rRGC9iW89,Watch it you'll seen them speaking on China about 45 minutes in,19 hours ago,Big Homie,UC2GxbpXlIvIiUjB7vrjCd_w,0,https://yt3.ggpht.com/ytc/AKedOLRjh9UpC5qd1sC8LomSzhTSFa8nTwqPipqc1e_ROUd3h6kAX8UYN-hTx_Cz-yfG=s176-c-k-c0x00ffffff-no-rj,0.0
Ugy1_ITqk2C52HnZfo14AaABAg.9_rByXjDZlw9_rRJiB9S7l,50 minutes*,19 hours ago,Big Homie,UC2GxbpXlIvIiUjB7vrjCd_w,0,https://yt3.ggpht.com/ytc/AKedOLRjh9UpC5qd1sC8LomSzhTSFa8nTwqPipqc1e_ROUd3h6kAX8UYN-hTx_Cz-yfG=s176-c-k-c0x00ffffff-no-rj,0.0
UgwkIyTdKg2lgIwSDCp4AaABAg.9_rBK1uvaxM9_rLB6crtWx,It's ozone. Ozone isn't contagious,20 hours ago,You Can Still Come Home,UC2fVOEkfsZWWLOtob2zfO9w,0,https://yt3.ggpht.com/1VVyZ6yUmRyA_GuBwnZ0H4MytYqUP4V-GnuPRjQV8UScQoyxkwoFXTJgODbvxhjo-rDyg6m_DaM=s176-c-k-c0x00ffffff-no-rj,0.0
UgwkIyTdKg2lgIwSDCp4AaABAg.9_rBK1uvaxM9_ralJOvV78,With a country like China this would happened !!✍🏻🤨📡📸⏱,17 hours ago,FERNANDO SCRENCI,UCA0uS8soTIJi6Yv8F3nZjGA,1,https://yt3.ggpht.com/ytc/AKedOLTrOk-Q9E1Tp8Arcajfyf2BbJbBrRnUp6OWP7hO=s176-c-k-c0x00ffffff-no-rj,0.0
UgyECBd-T9BjB_8LcCN4AaABAg,another revolution is due,21 hours ago,tommy chook,UCZSOQrhyYeap6e5H7LinSfA,1,https://yt3.ggpht.com/ytc/AKedOLRQtQe8qTHkLG1ZF7uKXoZbmJbRX472qSuGioY4=s176-c-k-c0x00ffffff-no-rj,0.0
UgwNZTJjfc3pt97F-7R4AaABAg,Please post video about open defecation in mumbai.,21 hours ago,Indian Street Shitter,UCPt-ffdgl2YrKEzTGRTK5Cg,0,https://yt3.ggpht.com/psfiBYehpo4H7KRC8mFyf97Mbf90RqDOACq_0T44b0tVdJn3hdUZnEprlYRqePl7-brP4zcqfA=s176-c-k-c0x00ffffff-no-rj,0.0
UgyCkx4Av3Qkta6ofeJ4AaABAg,With Biden hell I don't know if I'm coming or going half the time either.,21 hours ago,Sophie Belvedere,UCSw_8ZFvd07D5-5FGQkoOeA,0,https://yt3.ggpht.com/ytc/AKedOLSmRlE83pIpPQLUbnxuQ2jVDay0olKPP6NlJhJ-uQ=s176-c-k-c0x00ffffff-no-rj,0.0
Ugw4wYrEeGp7nP0KVT94AaABAg,"Hi, algae petrol seemed promising enough. It just have a slightly lower octane. No big deal for the ease of production. Tho... It's biomass. Plankton dies in the process. I assume plankton produces gases like methane that could be extracted without killing it while it's alive and that some natural processes could differentiate living plankton from dead plankton so to procedurally produce gasoline only out of dead plankton and letting the alive part of it be. Petrol is biomass too so that's not a huge difference if you take a moment and think about it.",21 hours ago,Matthieu Simard,UCRlakb6VeEyoLTOXU8firUg,1,https://yt3.ggpht.com/ytc/AKedOLRd_XP_PtilDkHdJrptqSKRRjRFZvV0WeGcVL9Aiw=s176-c-k-c0x00ffffff-no-rj,0.0
UgwsPpC5mg6_8ic1GZB4AaABAg,Way too long! China story at 56:20.,21 hours ago,A Remedy Project,UC50oJSrh9DrFGykuzxncF7w,24,https://yt3.ggpht.com/tbxCqNtU5n1VMQRS9iQXfEwxJ8H8HiO0jK81OwU3vCEhziE2u3notP4JiViMu4TfiFsUoOJ62w=s176-c-k-c0x00ffffff-no-rj,0.0
Ugw0EfoWJ4ksqEVQSe54AaABAg,You did not speak uponthe crisis of Sri Lanka that what is the reason of this economic crihdvr thrvui hu 7i,21 hours ago,Nirmal Sharma,UC-d8e5lLE52GTHwQGlyb4zw,1,https://yt3.ggpht.com/ytc/AKedOLTrs0763NTrkNu46FXKz9mCsUI66VlZ7nT6QA=s176-c-k-c0x00ffffff-no-rj,0.0
UgxMs9cxkUsE6X1m-c14AaABAg,omg! These narcissistic sociopath so called leaders need to be gone. Hang these Evil minions. know that when these evil evil horrible ugly leaders will be turned into roaches. These UK leaders are horrible as well! Who the hell do they think they are? Disgusting! Stop calling Humanitarian anything that is doing this to these people,21 hours ago,Court me,UC04-MfuZvls7CiX8TkrMzbA,1,https://yt3.ggpht.com/ytc/AKedOLQv-YJs6bd0T-OXsXwVDK0FjyUQ7LgcQdCOVTt_ggc=s176-c-k-c0x00ffffff-no-rj,0.0
UgxoNz5ydtTpaeBYOlp4AaABAg,Too many subjects to watch all the way to the end. Sorry 🧐✨🙏💓,21 hours ago,Mikki Mikki,UCpcfbIAfo5xi4LBBZEIEnag,1,https://yt3.ggpht.com/ytc/AKedOLQ2fLKKI831Sp3Usr2GSsrFzHSE84fzqUcKSSMa=s176-c-k-c0x00ffffff-no-rj,0.0
UgyRUYpCbmSsC0AJ9ft4AaABAg,🤡 world,21 hours ago,Maria V,UCbaWOLrBK7hk5plJWRR2HRA,2,https://yt3.ggpht.com/ytc/AKedOLSO3OKaiHGHcfaJ7qZ5JE8DMj_nZQEIjK7aA4YnVg=s176-c-k-c0x00ffffff-no-rj,0.0
UgwpkAckThUGqGI3rmd4AaABAg,Pipipi leaders lol,22 hours ago,Les Fussilez,UC23QVpmuvns7Y9rSqEbdYEA,1,https://yt3.ggpht.com/m7l8b9jyes2vPVDmGwFhMfIkeQ97497ud1-ppfooaHT_VDAUi2SjvpHnOpIJONpYXREsLqNvPGQ=s176-c-k-c0x00ffffff-no-rj,0.0
UgwsPpC5mg6_8ic1GZB4AaABAg.9_r97zO3nJW9_rKhuvpYgb,Thanks for the info.,20 hours ago,Glopy mystique,UCrowCYBnQG_pvP4q28brDwQ,2,https://yt3.ggpht.com/uuYKbO4sSZS2sRWBaCFiwjdaR9dIec0TLSifiYjX9jLw6VnhlNrcP22Am8bPirseXOOuDsl9WA=s176-c-k-c0x00ffffff-no-rj,0.0
UgwsPpC5mg6_8ic1GZB4AaABAg.9_r97zO3nJW9_rVIsaUA0t,Thank you 😊,18 hours ago,zahra Abdul,UC5V_aJulaur7ftQW_2qUE5A,0,https://yt3.ggpht.com/ytc/AKedOLQMTJ3Pp_xcF_bNdpb___IVgzaL6BhJ2Z1JQkJFKLTgd8uezZusq__S74cWmDRB=s176-c-k-c0x00ffffff-no-rj,0.0
