cid,text,time,author,channel,votes,photo,heart
UgyDGCKXClc8evAQXcp4AaABAg,LMFAO..... Who really cares...... Death to Putin!,32 seconds ago,Not Listed,UCbHM50zzEDnAxvoVlpFRZag,0,https://yt3.ggpht.com/ytc/AKedOLR_jKZPjnEtCMYZsBDdB00d6hRhikMr5t6Ta0F32xhbq-G5rFKq_ZTFdIFM5sTk=s176-c-k-c0x00ffffff-no-rj,0.0
UgyTNlyuIQFrsApSfFR4AaABAg,Bet you never seen a supersonic weather storm ….,13 minutes ago,Patrick Fordyce,UCCFQc0WOhENSZ1U62kuqzkQ,0,https://yt3.ggpht.com/ytc/AKedOLSQP6ZtBqVKRmn6bs3mMF8T-kpmtJGjIA5BFPpJvSlfBd7frRcNS3h3NeUH_PvT=s176-c-k-c0x00ffffff-no-rj,0.0
Ugw8S4ZwPrutcB-iaSZ4AaABAg,Puttin welcome to a real time war !!!,13 minutes ago,Patrick Fordyce,UCCFQc0WOhENSZ1U62kuqzkQ,0,https://yt3.ggpht.com/ytc/AKedOLSQP6ZtBqVKRmn6bs3mMF8T-kpmtJGjIA5BFPpJvSlfBd7frRcNS3h3NeUH_PvT=s176-c-k-c0x00ffffff-no-rj,0.0
Ugy6htoLUSnRHzqEhOp4AaABAg,America bring some extra supersonic missiles to the NATO countries for we need to compare them to Puttin’s hypersonic missiles!!!! Puttin wants to escalate so we got to bring in the bigger gun period !!!!,14 minutes ago,Patrick Fordyce,UCCFQc0WOhENSZ1U62kuqzkQ,0,https://yt3.ggpht.com/ytc/AKedOLSQP6ZtBqVKRmn6bs3mMF8T-kpmtJGjIA5BFPpJvSlfBd7frRcNS3h3NeUH_PvT=s176-c-k-c0x00ffffff-no-rj,0.0
Ugyx9nUuJnwWA2nNri94AaABAg,Dont trust America,20 minutes ago,Amoya Tochhawng,UCz-YFuubkdEAaaKHP2Wm9Ww,0,https://yt3.ggpht.com/vahPDYayLbYi072Udn3KSHv1zziwMC_k612SUNSm0yFkyt50i8gCo98ggOfUGSORt8DZ0Yn51Q=s176-c-k-c0x00ffffff-no-rj,0.0
Ugz3a1kLeNj4FHiJdkF4AaABAg,now I know why Putin must destroy NATO ....,22 minutes ago,Nicola methods,UCZLYfUSnMoSVrnQWyjtMDFQ,0,https://yt3.ggpht.com/ytc/AKedOLRE5ALJesHWsdO51AuUX240tJEinbJjANXro2bfZ-KisLKWWWBvxmvM9HrVrJ4l=s176-c-k-c0x00ffffff-no-rj,0.0
UgxWk9OvdyfYJe8dYmZ4AaABAg,"imagine if Putin can threaten Finland now with his troops busy in Ukraine.  If Finland wait til Ukraine fall,  what will Putin do to the Finland?  likely attack and annex her",24 minutes ago,michel Le havre,UCoGz71khTxl2n_eg1VhwEdA,0,https://yt3.ggpht.com/ytc/AKedOLQlFHnYpYrOQKLC389QeSwkCZgQD3fLxJoymg=s176-c-k-c0x00ffffff-no-rj,0.0
UgyLv9OjKA3lA3Nvert4AaABAg,NATO Is a defensive alliance only in the eyes of a fool.,32 minutes ago,Eslomu Zihute,UCKvG0stFMNN8MUK9mpNCoxA,0,https://yt3.ggpht.com/ytc/AKedOLQ3JKgxvEjWxmwkK2AvxztyLv3nYbT_IVwRna0tygU=s176-c-k-c0x00ffffff-no-rj,0.0
Ugz98bRr0RCddzHkPil4AaABAg,did russia touched anybody till now? no. So why this rush into the hell?,33 minutes ago,fromika,UCZMHAV8Dqm4GqPZqAQM-EsQ,0,https://yt3.ggpht.com/ytc/AKedOLRJTJCx-95Gab8QD_LodGgviIMd6ieTbiXZcA=s176-c-k-c0x00ffffff-no-rj,0.0
UgzrVxWFCU-u2aD2M_l4AaABAg,Nato is agresor can every one see or every body is blind,34 minutes ago,Grasko Gtaudio,UC63D2Iu4buPQkggY0ICITWA,0,https://yt3.ggpht.com/ytc/AKedOLSi4s-0w-6jfyfMALr11OZrH0x4CkNC4kI9LQ=s176-c-k-c0x00ffffff-no-rj,0.0
UgzIFTiOGwKtKkIprW14AaABAg,"Sounds like they want armageddon, and Russia does not.",39 minutes ago,Jandolin Marks,UCXOhV4MycZmryd3dZNXhRHw,0,https://yt3.ggpht.com/ytc/AKedOLTUbJSZ0QXTRj4mc2aZBez3kqgA3K9Lj0zsn-IOgA=s176-c-k-c0x00ffffff-no-rj,0.0
Ugy8VWTIBdIlVpdcIIJ4AaABAg,So Putin wants to contaminate his potential oil fields in the Black Sea and permanently destroy the bread basket of Europe....not!,50 minutes ago,rick fidler,UCNolU0TVWKW89bfSaHmJBYQ,0,https://yt3.ggpht.com/ytc/AKedOLTV8-rncF5q-Dyjir94yQyWS7P_ehzoCnII4RPtOQ=s176-c-k-c0x00ffffff-no-rj,0.0
Ugyy2MkJQBvXukbq9ix4AaABAg,"Live it up while you can, Some lunatic in charge is going to ruin it for everyone,  AGAIN!",55 minutes ago,Rick Easley,UCDgjzk8hbWyH4ld6r1jdiMw,0,https://yt3.ggpht.com/ytc/AKedOLQgvfVDcpaiFqQ7slnuTo2Nxcvlv9uXWeACLw=s176-c-k-c0x00ffffff-no-rj,0.0
UgwjGVJLr41MaQ0iYvx4AaABAg,pUNK president kills one more grandma . or child all hell is going to explode,57 minutes ago,Stan M,UCAyp7RSMf_UCr5TFq5lYscA,0,https://yt3.ggpht.com/ytc/AKedOLRYvwengjIX3k9RvEN5TPai5bu_RVqS8Rlosg=s176-c-k-c0x00ffffff-no-rj,0.0
UgxkJ2noYy9dA8Geg1h4AaABAg,"Putin wouldn't have to threaten the EU with nukes. All he has to do is redirect his oil from the EU to China, India, Iran, etc etc. Europe gets 40% of their oil from Russia.",1 hour ago,GRAPEntine,UCi9mxbxaoz2gbYklMRsyQuA,0,https://yt3.ggpht.com/F2EaQn8uaj7lcXFIXS9HsePJnu20TE6OdGPG7rp5SOE1Y0ePrNPD9HVV3mzH90h9cVSxjECoGw=s176-c-k-c0x00ffffff-no-rj,0.0
UgxTyC81fVWVCbD5cEF4AaABAg,"Korea is closely watching this development the moment a nuke is thrown to Europe, Korea will surely nuke US, them kaboom WW3",1 hour ago,Ommy Azzy,UCOCZgn7-8ylQDeSShQNSD2g,0,https://yt3.ggpht.com/ytc/AKedOLSWvbP661DLsEYc9gD2qprdkKNY3mkNJ7qNWw=s176-c-k-c0x00ffffff-no-rj,0.0
UgwqijJ7IaxLtJc8sxR4AaABAg,The bully has his back to the wall. Ukraine keeps kicking Putin between the legs. His followers are fleeing and those that dont have been arrested. Any nuclear fallout will get blown over Russia by the Trade winds. Why haven't we blown up their gas pipes under the Baltic?,1 hour ago,Colin Osborne,UCHQ4vVs8P7Rc6SgH_DLuX6Q,0,https://yt3.ggpht.com/ytc/AKedOLT28ee4DIU-N5HkU_KE4gmI7eld4WnWgChExw=s176-c-k-c0x00ffffff-no-rj,0.0
UgxxQq4vWPO4ZdYc2El4AaABAg,"If NATO is defensive, surely the nukes and hyper-sonic missiles could be defensive too right? Problem solved.",1 hour ago,Andy Gee,UCsrxOS4xnlLtG6YnmbwcLoA,0,https://yt3.ggpht.com/ytc/AKedOLSOwHbKQ1dGuwf89G2cWIZR8-rGzSa47jGkvf37PFo=s176-c-k-c0x00ffffff-no-rj,0.0
UgzOvfr1oWRGAxp0Mtp4AaABAg,Nato is a defensive alliance with offensive weapons 😉,1 hour ago,Undrod,UCOEzp_OwI85AQuf6QowF24A,0,https://yt3.ggpht.com/ytc/AKedOLShAiwQpCpKoGIdwHoGJ8LzNcOqsY59T9d52EvzZA=s176-c-k-c0x00ffffff-no-rj,0.0
UgxZT8li7weaCnFAJC94AaABAg,Liar.,1 hour ago,Rita CL Yong,UCE8_zWTVMsP4AovCYqPSTJw,0,https://yt3.ggpht.com/ytc/AKedOLTNOyAUfxMvwBbTgGHFo8IeVBLBQsrotYVXtg=s176-c-k-c0x00ffffff-no-rj,0.0
UgyNi5abB-AZ4M0JSQh4AaABAg,Defensive alliance? You mean like when NATO bombed Serbia? The US is rotten to the core.,1 hour ago,bigbreadstick,UCkH0Wyx0Z0tFTlwi6aMlr1A,0,https://yt3.ggpht.com/ytc/AKedOLQR0b4KuCw5cuj9X6lFUCHgjysBGiJH1Gnyqw=s176-c-k-c0x00ffffff-no-rj,0.0
UgwTcoq6R66sb4We7MN4AaABAg,"Even the V2 missile in ww2 was 'hypersonic' so nothing new.  NATO means North Atlantic, how does that include Russia's neighbours ?  Above all the world leaders all drink champagne together behind the scenes toward a one world government; why do u think they all locked the world down ?",1 hour ago,R L,UCdX2Lld2uKn0Um3IaUkTK5A,0,https://yt3.ggpht.com/ytc/AKedOLQMNs_rKFrbqWefNpgn2RC2fGesyaeaU3FnPw=s176-c-k-c0x00ffffff-no-rj,0.0
UgweiPWmBjegklDbwqx4AaABAg,"You are not God to test others that they will not retaliate, not all missiles are accurate, and someone at the space is watching all  systems where monitored, you cant fired it they want to save the earth, their final frontier is here, use your best interpretations, they will breaks the continent in many pieces, just wait and watchful",2 hours ago,Dolly Tome,UCFr64nxRunVm2If6SDHOpfw,0,https://yt3.ggpht.com/ytc/AKedOLSUqYNlOjrogux8Ymxo0tTYA5osuWAaL5wufQ=s176-c-k-c0x00ffffff-no-rj,0.0
UgzbD272iOz-smIjEUt4AaABAg,"There is no point in Asia, Europe or the Americas that does not already have an eminent and direct threat of Russia’s nuclear weapons.",2 hours ago,Fodor,UC3ktenkelUXeC0kXOUtr-Jw,1,https://yt3.ggpht.com/ytc/AKedOLSEiZOvsu2VNS4fQNmtJldl4MI-wRYLeMw47ECToQ=s176-c-k-c0x00ffffff-no-rj,0.0
UgwX2jo3BrCskMyJmH54AaABAg,"Nato, U.S. and  ukrine President  responsible for provocation  of war, all planned  made years ago, putin wanted peace bot nobody listened, may god walk with  mr PUTIN",2 hours ago (edited),Philomena Higgins,UCKMb7RHnwf1meLp-3rLt0EA,0,https://yt3.ggpht.com/ytc/AKedOLTJ5B_gZCEd4K7pfGjDRcSnr62lHZWRKEgazw=s176-c-k-c0x00ffffff-no-rj,0.0
UgxYz8XEAOs2Wfjyd6F4AaABAg,Finland and Sweden joining NATO? that would be interesting to see how Russia would respond …,2 hours ago,Abdul Rani Ahmad,UCaVOFHCwiuUb-8jdV3lYnDw,0,https://yt3.ggpht.com/ytc/AKedOLRMYrUUdjL-FHqFB4232zlQ16sPqjJCDEDbgObsoQ=s176-c-k-c0x00ffffff-no-rj,0.0
UgzaUCFkyb_0ulmAMfF4AaABAg,Why U.S this is Europe.,2 hours ago,Robert Mugisha.K,UCzipZoITKk0OdrMvgB5P9xg,0,https://yt3.ggpht.com/ytc/AKedOLTT1LuCkKhg2mnYOwhMLcY-FsTZjlNe8l5NNw=s176-c-k-c0x00ffffff-no-rj,0.0
UgwarEoO7dnNp6YPGGR4AaABAg,Putin is really getting paranoid....of being attacked......I wonder why?,2 hours ago,William Jones,UCGqvCKRIZOmOlIIJeOjFgyQ,0,https://yt3.ggpht.com/ytc/AKedOLRUcHDVp0GhvoNfKHM-yKh3Az2YVCzx-SkdHiZ2=s176-c-k-c0x00ffffff-no-rj,0.0
UgwNfs1jRJcuAB4dX254AaABAg,Western faced with Putin while Asia faced with greedy and crazy China and North Korea,2 hours ago,sarah twinkle201,UCffRLGgjCrIIdNucesZGxKQ,0,https://yt3.ggpht.com/ytc/AKedOLRsEa6g71dju6af9Yhsdw0B3GoKPTkqSuoSIw=s176-c-k-c0x00ffffff-no-rj,0.0
UgxgR-u6L5lFRB2rIf54AaABAg,"The difference is that Russia will attack all adjacent NATO countries and alliance countries like Finland and Sweden. WW3 has already started that will lead to direct attacks on the   United States in the near future. Our feeble and indecisive government under the leadership of president Biden and Harris will cost million upon millions of American lives. Cities like New York, Washington, Chicago, San Francisco, Dallas will be completely destroyed in a necular holocaust. This will be the result of super stupid leaders in all NATO countries and by Russia.",2 hours ago,BILL LOHRKE,UCwD3MnDv1OgQvxzB9Oq_bgw,0,https://yt3.ggpht.com/ytc/AKedOLQUWkHLIxS52Qdq4fxPS8LTk0e-zt5Otb99LurA=s176-c-k-c0x00ffffff-no-rj,0.0
UgwA-64_b_zNXfXZLxV4AaABAg,Why does anybody talk to Ned Price?  You can get more truth from a sponge,2 hours ago,maccon1,UC9lRYL7D47utBp92ruy9KSQ,0,https://yt3.ggpht.com/ytc/AKedOLSEtnwGyFelTtr6rZQPf2TJgsDmB2j_eEoNcA=s176-c-k-c0x00ffffff-no-rj,0.0
Ugxdwfyk3Qs9BT2D5MR4AaABAg,'You can't always trust what they say'.  Understatement of the year.,3 hours ago,Ian Kelly,UCzp1r-SeCkM9T821yLw2hxg,1,https://yt3.ggpht.com/ytc/AKedOLQhRH1V0bM2nveEvvv2-mkbVa8LcZgrHToJMA=s176-c-k-c0x00ffffff-no-rj,0.0
Ugwd4ngMYRoHafOadLJ4AaABAg,"The Indian Govt, Indian people and WION support Putin 💯🇮🇳🇱🇺🇮🇳🇱🇺",3 hours ago,Mike Camacho,UC6trfstvPtkkRPzCYWxmPbA,0,https://yt3.ggpht.com/ytc/AKedOLQS-d-dO7E-Jq3E8_KHxp78DrN_C-QlWRJeCeXYRkAswWWKzHGaWFlqsIVY22b5=s176-c-k-c0x00ffffff-no-rj,0.0
UgzqyP-mDBgAFUOfZoh4AaABAg,Nato brings wars...,3 hours ago,F M,UC933iIQofjFar_KCAwf31jA,0,https://yt3.ggpht.com/ytc/AKedOLQwReJGkL8Nhyed8D2GTxY_FDXEvr2v4yw4Bw=s176-c-k-c0x00ffffff-no-rj,0.0
Ugxjc7x4mopZ1OjFLkF4AaABAg,"Mr Putin, for over the past 50 days you have wrecked havoc on Ukraine! You are a disgrace to the Russian people whom you claim to lead. Your soldiers are butchers who you have cut loose on innocent people. History is full of tyrants like you, including Nebuchadnezzar's son Belshazzar, who treated the Jews abominably. You may remember that he threw a riotous party where a hand appeared writing on a wall. If you turn around you will also see a hand writing on your wall, written in the blood of Ukrainian people - mene, mene, tekel, upharsin.  Any person from outside your tightly controlled kingdom will tell you that your days are numbered!  You have been weighed by humanity and found wanting.",3 hours ago,Edward Sianski,UCrW5WJheqn22XrNbwqrqFSA,0,https://yt3.ggpht.com/ytc/AKedOLTstzZovlOJngDaBU3b1HkZpi8I8sN1BEswyQ=s176-c-k-c0x00ffffff-no-rj,0.0
Ugy0vcWCD5RaWrxhIjF4AaABAg,With the reliability of Russian vehicles and probably lack of maintenance putin will be taken out by the time they even get them running never mind get them in position they would probably go off like a damp firework anyway,3 hours ago,Martin Freeman,UCqriq8J0EQKFtiF8X-t0rtA,0,https://yt3.ggpht.com/ytc/AKedOLTrsXMnkte6UO6LOcUs1rBtaYOFYCH9zkrP6Q=s176-c-k-c0x00ffffff-no-rj,0.0
UgwUtXM-yJRMB9OFlZh4AaABAg,Russia's nukes are useless and decrepit. Like it's army.,3 hours ago (edited),Machen SS 666,UCBcErCQenUg2murDLyn660Q,0,https://yt3.ggpht.com/ytc/AKedOLQQ-5dCYDkfTX_kLprAg2QGn11uPcYeKzWOBp2zcKcxbXJyIEDDMA6tA_3n9iR3=s176-c-k-c0x00ffffff-no-rj,0.0
Ugwnxfo8Yidmu82_uEp4AaABAg,"Of course Putin will threaten with nuclear weapons.  He cannot be humiliated with a defeat so he may just launch nuclear weapons just to save face.  (Unless someone assassinates him 1st)  In doing so, he may just have signed the death sentence for Russia.",3 hours ago,Din Bee,UCXJGSYrbweq6f0rYS9aUf3w,0,https://yt3.ggpht.com/ytc/AKedOLQwO6dqCdzePAZLiE4UIkFwC3j-hDUrqgTmRyo9fQ=s176-c-k-c0x00ffffff-no-rj,0.0
UgwTxKI8igbKIHxGVc14AaABAg,"Ned Price, that shameless unscrupulous warmongering neocon. He and his cohorts beginning with the malevolent Victoria Nuland are the source of instability in Europe and throughout the world.",3 hours ago,Enriquillo Bribiesca,UCiwY5XHnuJGrelUBhopS01Q,0,https://yt3.ggpht.com/ytc/AKedOLRV0QXCKyTEe9twth7cirMYaHcq62iR32q4rg=s176-c-k-c0x00ffffff-no-rj,0.0
UgxoLwwK84tYx6b6iLN4AaABAg,US encouraged the military problems in Europe and is backing off after all. It was encouraging Ukraine to fight and eurpean countries to suport a war but without US comitment. This is exactly US - British way of causing the problem far away from the US and Britain. US had biotech LABS in Ukraine and CIA agents doing dirty job as usually.,3 hours ago,marek szczesny,UCB9o8yjrDneEn3giNIT9_Wg,0,https://yt3.ggpht.com/ytc/AKedOLQDmmxEIS9WXH6CxdhUCZ-XJ8rYxJtLgV8PUA=s176-c-k-c0x00ffffff-no-rj,0.0
UgysFU-DeP_5hjVR7mZ4AaABAg,Russian armed forces are good for nothing. It's all hype and no substance. Let him place whatever he wants to... Russian will lose terribly.,3 hours ago,Raja reddy,UCIlIuLdp5lHgVmLUyX1Y2Sg,0,https://yt3.ggpht.com/ytc/AKedOLQ0wGM3oJ9mE8b-70NXhXO0IPkYPUFGAb8FbQ=s176-c-k-c0x00ffffff-no-rj,0.0
Ugw7cB5B9CgAOmuKwn94AaABAg,No need Russia... You have plenty spares already sitting on the bottom of the sea compliments of Ukraine... Save all ya can but dry all ya save!,3 hours ago (edited),G Keefer,UCkArvw4AkqMv24-TzXI4ESg,0,https://yt3.ggpht.com/ytc/AKedOLRY6ZVVzVH68PigFxrC97E16gNnyUBGmf04EZy4RA=s176-c-k-c0x00ffffff-no-rj,0.0
UgylIClV_gQZRju2t_B4AaABAg,One thing is for sure THE KING IS COMING SOON AND VERY SOON!,3 hours ago (edited),RELAX NOW,UCt5q3vDcLjpH7BaVsd2wNkg,0,https://yt3.ggpht.com/ytc/AKedOLRR8znIcBNYHyvzwBoQwfu_hQ6BIVaZOeREcQ=s176-c-k-c0x00ffffff-no-rj,0.0
UgyqJwAdEk9Hha31MYJ4AaABAg,"My red line, your redline. My country, your country. My planet, your planet….",3 hours ago,elzo stubbe,UC7377BSUwQCuzLYTmCtNRPA,0,https://yt3.ggpht.com/ytc/AKedOLSeLwQJwvpqKf7Ng7EPi28OlKj1_aZflSCK1FMkig=s176-c-k-c0x00ffffff-no-rj,0.0
UgziQD8_ZPEjHjp5gh14AaABAg,"Is it putin that crazy, can defend by his own, and use nuecler weapon 
LOOK AT OTHER SIDE THE WORLD 
 THINK TWICE BEFORE GOING TO WAR, A HERO CANNOT BE HERO ALWAYS. (PUTIN THINK TWICE)",3 hours ago,Satha Sivam,UCGwgNrFTOXK-EeqFFS5kRcA,0,https://yt3.ggpht.com/ytc/AKedOLSWyJpLLBLoZ-1nvwhPUVXMELgtDubcK0VK2btq_bzj4KpmpLIoFUWIkaU9eD0b=s176-c-k-c0x00ffffff-no-rj,0.0
Ugy5gxZmOJb7B5rgN_d4AaABAg,Don’t look up,3 hours ago,Ares Marte,UCW-4iNnUy-chMHWlYhk2BdA,0,https://yt3.ggpht.com/ytc/AKedOLTkEvpcR1Kp-prEdVo714pYkt0ncHY3cvFIqg=s176-c-k-c0x00ffffff-no-rj,0.0
UgyWrnqplOMsxWC8Io14AaABAg,Ukraine is cheated by NATO and US it's leads to whole Ukraine destruction,3 hours ago,anil nelli,UCiD57Gt2KiDV4ZZyjAG9B-Q,0,https://yt3.ggpht.com/ytc/AKedOLTY-FQurYgHg0ZRVOnWJydXAemLN05xN6ajuYanIJ1K8w8x0vOitPOJDXtvABrA=s176-c-k-c0x00ffffff-no-rj,0.0
UgybWQIxK4QonrZv5tR4AaABAg,Russia invade Ukraine for this same reason and Finland and Sweden is doing the same thing why is it so hard for people to learn from the past,4 hours ago,OnlyOnEarth,UC5WVeF-yvigudkJrcEAjLhg,1,https://yt3.ggpht.com/zzr_Hllnit_lkumZKXgBRXjxq_Y6_nDaRouLsK5ptJN4eEGK-0TCXMIQi6b_qxw7Qrc_rjrVeA=s176-c-k-c0x00ffffff-no-rj,0.0
UgzX9a4JR_jd34lcp9p4AaABAg,As a swede i don't think making a rushed application for NATO membership together with Finland in current situation is a good idea. It would only provoke Mr. Putin further. But what does one know?! The West (the masonic moronic New World Order people) wants a major war with East. I also think that use of tactical (smaller nukes) is a possible move from Putin in a not to far future. What consequences that would have i don't even want to think of.,4 hours ago,Stefan Westerberg,UC2mj12nBQaE_3_8zxF-Vi5w,0,https://yt3.ggpht.com/ytc/AKedOLQAweQA2Hb8XDlnOy8pbJFpeaJxFInX0EiT2w=s176-c-k-c0x00ffffff-no-rj,0.0
UgxOdbf8PBuF5fHUxxV4AaABAg,"I wonder if this current conflict is the one that renders this planet a large radioactive grave marker. Anyway, hating America, or Putin, or Zelensky or Ukraine or China seems to be the best argument so far and remains the most toxic poison we can shove down the throats of our children. Should we not reexamine what it is to be a ""civilized"" species ?",4 hours ago,Marc Goudreau,UCSTYF23BoT2uslWsPhlPrlQ,0,https://yt3.ggpht.com/ytc/AKedOLSgUrWScTuL45NCCHicXe38DDKXwAfViVfBKbA9=s176-c-k-c0x00ffffff-no-rj,0.0
UgzfglD8lAsNAXTiUah4AaABAg,"LOL my question is this, Whats india gonna do when russia falls and china attacks them and they have no friends left because they refused to help them ?",4 hours ago,Ruele TheFirst,UC0Tx9Z6YcCqkfRkyOFHbgtA,0,https://yt3.ggpht.com/ytc/AKedOLTxSdvb6ABBTeg0LokHQFHw1JbtOAirF057_A=s176-c-k-c0x00ffffff-no-rj,0.0
Ugxw4WrFaI-h2rAZI6F4AaABAg,"The West has to come out and say if you nuke we nuke, if you hit one of the baltics Moscow comes up missing. You got a man up to this monster this guy is just an animal.",4 hours ago,Glidescube,UC1k_kiv9rk_y0l4cWfU5fBw,0,https://yt3.ggpht.com/ytc/AKedOLRVbhe0KZTde8_qslJKghVeR7tAQ8FcWBdxAA=s176-c-k-c0x00ffffff-no-rj,0.0
Ugw7OJ2vKNvhc28cw7p4AaABAg,"War mongers create wars and conflicts to exploit the situation to steal oil and gas for free. Maiming, killing and filling graves for profit",4 hours ago,Jerome Devotta,UCz5E0m6VMjLDOewFpbfY-bQ,0,https://yt3.ggpht.com/ytc/AKedOLTlQnzR8N8H28NjUT89Q6cGcosgriSC6TgT9Q=s176-c-k-c0x00ffffff-no-rj,0.0
UgylJVSCZkrsKjZ6PFV4AaABAg,"putin is the one who disistabilize  europe , ,if he did not  invaded  ukraine  these two nation will not make a plan to join nato , ,, thats my opinion.",4 hours ago,ETO ANG TOTOO TUNAY ANG ETO,UCkp9aA6_7GOnXPKPEWSlr5Q,0,https://yt3.ggpht.com/ytc/AKedOLRl3KdV5PIYzvGAfc_S_1O06TxxjsocWThSfPEvyw=s176-c-k-c0x00ffffff-no-rj,0.0
UgxjNEQPK0xF7hnFJ5Z4AaABAg,Put is one man How is just one man allowed to do this just don't understand,4 hours ago,Dennis Cartter,UC4gqb9J3HxMy8_0fBHObUcw,0,https://yt3.ggpht.com/ytc/AKedOLQgJWUJnqXIVXelSeJNG1E56vgnK1M2ZglY4Q=s176-c-k-c0x00ffffff-no-rj,0.0
UgwAjX9KdshDKC7tWpt4AaABAg,The weapon of Putin is mentioning nuclear word to Biden and he so fearful he don't know what to do,4 hours ago,Roger Delarmente,UCb3pmpb89Pf2D20qy9RMXug,0,https://yt3.ggpht.com/ytc/AKedOLQXkhFl9iquLI3zjLRPnQDQbOX314AKCAr2dQ=s176-c-k-c0x00ffffff-no-rj,0.0
UgxXm73Vwf8DCvHjdHB4AaABAg,As if Russia is the only country that have Nukes..,4 hours ago,Tiger Uppercut,UCamMMBtEZH3orCwNR-fcCDQ,0,https://yt3.ggpht.com/ytc/AKedOLRwci_jIyRjuLBGPWzre8xG9b77GzqjYMrTlKLu=s176-c-k-c0x00ffffff-no-rj,0.0
UgwIWFld4qAZi6YRCLx4AaABAg,Putin is like childish,4 hours ago,Eduardo Manalili,UCEXWDRoqSznv3_q-jkw9sBQ,0,https://yt3.ggpht.com/ytc/AKedOLQ1k1oQOctH9SMFMCKPKtxPBJxgTKtznsXQyg=s176-c-k-c0x00ffffff-no-rj,0.0
UgxDsKibIWko5HTOu0R4AaABAg,please stop using english . we can't understand sh*t,4 hours ago,Simon Sheriff,UCR9RsNRJhxJIbBP5JtoajoQ,0,https://yt3.ggpht.com/ytc/AKedOLSA8MMGny733cUHgP52w2N3WoFmmc24D-_RNtXT=s176-c-k-c0x00ffffff-no-rj,0.0
UgyXqxKFauPm3Hxi--d4AaABAg,thinking like this should be planned well how to be stop but america and the west has their own sins too,4 hours ago,Ranillo Ballais,UCVFcSboS8eB6aq_DKchJ_GQ,0,https://yt3.ggpht.com/ytc/AKedOLQUjI7Kky8CMENthkKn_JDQWzz0E296LsiI_w=s176-c-k-c0x00ffffff-no-rj,0.0
UgzKIINfZ2OYkPidbKZ4AaABAg,Even in Somalia we must develop Nuclear Facilities very soon so as to Confront these bullies called  NATO who want to.enslave the world again.British slave traders and the Yankees sold Africans across the Atlantic but this time its we who are going to sell them to Russia  India  and China and to Kim Un Jung   the Rocket boy     ..........somalia,4 hours ago,Abdulqadir Mohamed Ali,UCa1ual6Th0pbiMCdr6_ns9w,0,https://yt3.ggpht.com/ytc/AKedOLTfyr_t-bT5F8OLwyPw6r7VP4ErH9VgJkG39g=s176-c-k-c0x00ffffff-no-rj,0.0
Ugx8WcCVJL33XIdFrjp4AaABAg,Russians are so entertaining 🤣,4 hours ago,Lito Recio,UCz-exjxDX4Ay9InK9FlsLyQ,0,https://yt3.ggpht.com/ytc/AKedOLRJYj5aUexJHc2uWtDJ4NoH6lD0z-2KUgMndA=s176-c-k-c0x00ffffff-no-rj,0.0
UgwFcQvP0SYLzaagYpF4AaABAg,lol trying to join Nato was the very reason Russia invaded Ukraine. So Finlands bright idea is to do the same LOL. Far out government officials are clueless.,4 hours ago,ValheruStinger,UCQ50H3KsavTXz6Z3ou5ooIA,0,https://yt3.ggpht.com/ytc/AKedOLSnhVR-JXInpQ0sQR-u4PPzbkuNWwT6Yq9Znw=s176-c-k-c0x00ffffff-no-rj,0.0
UgwhT6jcVxyKz2RgZid4AaABAg,"if threatened with nukes, that means they are hit seriously",4 hours ago,Tony Jose,UCs5HdHtf9GxE3XGvgeSzwTA,0,https://yt3.ggpht.com/ytc/AKedOLR-4P2O4rHn-HsT9oKRUKBr_3XFJYQ86A9jF6s0=s176-c-k-c0x00ffffff-no-rj,0.0
UgxStpUNEpEuPmKMIqJ4AaABAg,"deploy nukes to Russia, quite simple! Next!",4 hours ago (edited),holmofrur,UChzcm_r8xK2CFwHZFnfHL6A,0,https://yt3.ggpht.com/_LSD8ocsFkFAtaZZUBytbpnGvMgmVNrRrg-HP4QHwNREII6cebv19GvlPu3ZDUhX-1VamJ7BOZk=s176-c-k-c0x00ffffff-no-rj,0.0
Ugz2jQmswZ9k27pVaL94AaABAg,"poootin throwing stones on  other peoples house, without knowing  his house is also made of glass.",4 hours ago,Garuda Purana,UCZ8RTzuxj7oHjeR8uXiBpQQ,0,https://yt3.ggpht.com/ytc/AKedOLSdS_vLbyJ_frrTlpZaAxzQTJw5VD688U544Toe_A=s176-c-k-c0x00ffffff-no-rj,0.0
UgwZQgqsuccCexfysGR4AaABAg,puny putini hides in a bunker while he rattles his saber and sends russians to feed the soil in ukraine.,4 hours ago,paladro,UCLX9VyuMyWGY-t1APV3ngZg,0,https://yt3.ggpht.com/ytc/AKedOLS0ohBaCfdydXeiJ4ch2kd45bsFTctsfWFi9CfX=s176-c-k-c0x00ffffff-no-rj,0.0
Ugx4ylc0fwwBzf-Qa1V4AaABAg,That will be the biggest  Mistake he makes.,4 hours ago,Henry Parent,UCfu1eJRP31LEc3xt_tUT7mw,0,https://yt3.ggpht.com/ytc/AKedOLSZvFE7EOGUWmhW9OOtrRiZamEfbxyYfCEEyQ=s176-c-k-c0x00ffffff-no-rj,0.0
UgzbuIoqXPXIX6zENhR4AaABAg,"This Yankee hood is just playing with fire.    NATO is destroying the whole world.They are invoking war but they cannot fight they are cowards who cannot even fight in Ukrain
.Now they are inciting the grates Nuclear war.   .What is the benefit of Finland and Sweden joining this devilish NATO   useless  NATO were defeated badly by the Taliban of Afghanistan    that left their shoes in Kabul   ...Mogadishu  somalia",4 hours ago,Abdulqadir Mohamed Ali,UCa1ual6Th0pbiMCdr6_ns9w,0,https://yt3.ggpht.com/ytc/AKedOLTfyr_t-bT5F8OLwyPw6r7VP4ErH9VgJkG39g=s176-c-k-c0x00ffffff-no-rj,0.0
UgxKMv_oeAiwbqcH3494AaABAg,"Tell Iraqis, Afghans, Syrians and Libyans about how NATO is a ""DEfEnSivE aLlIaNcE"". It would appear as though the West is doing everything it can to escalate the situation - everything short of direct confrontation. One reason the invasion surprised so many of us was that we all underestimated how threatened Russia felt about NATO expansion eastward. Whether or not NATO actually pose a threat is a completely different story but it is also completely irrelevant. What matters is that they do believe NATO is an existential threat -- and if someone feels like their very existence is at stake, they will lash out - because the only other alternative is to ""die"" without putting up a fight. This is why the threat of crippling sanctions did not deter Russia. 

Sweden and Finland will NOT join NATO anytime soon. Blinken said it, without actually saying it when he said membership will depend on the agreement of other NATO countries at 0:32. Russia has very clearly demonstrated they are willing to risk it all for their survival and I am willing to bet that at least a few NATO countries will have second thoughts about allowing Ukraine, Sweden or Finland to join. What's the point of a defensive alliance if letting some nations join will drag you into a war? At least, I hope they are smart enough to deny them membership. Western leadership have amply demonstrated their stupidity in recent years so who knows.",4 hours ago (edited),Groud Frank,UCIkbONa0a_92ZfDGpI22Tew,10,https://yt3.ggpht.com/ytc/AKedOLSk8zECNr34GvM0zM7m6rUf81xqVBX5s6rYKT1BG5c=s176-c-k-c0x00ffffff-no-rj,0.0
UgxuMtdAe1gE_CcDPqt4AaABAg,"Russia making threats? Isn't he forgetting, he lost the right to claim any higher moral ground whatsoever when he raped Ukraine and took Crimea as his own so back off Adolf Putler!",4 hours ago,Sheza Jewell,UCZKXhMT_kWl5ESWhktGsIdQ,0,https://yt3.ggpht.com/ytc/AKedOLRiTtiVMXAVcuaEnkGQfYF7CDyqNJ9Q14Ku20b4mQ=s176-c-k-c0x00ffffff-no-rj,0.0
UgzjB1ts4tuLR58eu5J4AaABAg,Fool Putin wants all people die except him by india tamilan vaiko,4 hours ago,Siva Subramaniyan,UCiULNtRrqDRQkr5DJhpd7aw,0,https://yt3.ggpht.com/ytc/AKedOLRg4SK5W8urPne0YlOHCLNhw8jHzOXH7Rp8jSBVSYfUOjWSNDUBQDKzcXkl2eaD=s176-c-k-c0x00ffffff-no-rj,0.0
UgxdCSJRBsShs5npUaR4AaABAg,"Threat threat threat blah blah blah!🤣🤣🤣🤣🤣 This where russia excels the most! Aside from raping, looting and killing kids!",4 hours ago,Rex Isaac Manuel,UC3T3g1PUyxiUXdpmKQCY72A,0,https://yt3.ggpht.com/ytc/AKedOLRQKgDqMNIpdTIZWlI-X-uMjxlrEHuvK6jaLnah=s176-c-k-c0x00ffffff-no-rj,0.0
Ugw9ak_QcniSCLnl9xF4AaABAg,Dumb putin bullying and threatening nuclear war do Russia be3 the only country having a nuclear weapons. He should start the war and see what he is looking for.,4 hours ago,Charleswastaken,UCs-9re9noDbzBjEZwt7kkig,0,https://yt3.ggpht.com/ytc/AKedOLSdzbf-fqT1QoeVO_SFdNAWYQuyqs66BzZIFSmT6A=s176-c-k-c0x00ffffff-no-rj,0.0
Ugwyoi342Ckhl6Jsv814AaABAg,"Would someone please throw a bucket of cold water over Ned Price. He has got to be the most dislikeable man alive.
Oops! I almost forgot about Elon Musk, Geoff Bezos and Mark Zuckerberg.",4 hours ago,Ivan Walker,UCRMRSlLdKsoOM7tHxbgUvwQ,0,https://yt3.ggpht.com/ytc/AKedOLTvWOkAUjmjxjDOG1mCAH3SAcZZs4XNuwnd4Q=s176-c-k-c0x00ffffff-no-rj,0.0
