cid,text,time,author,channel,votes,photo,heart
Ugz3G6iijik_XHZxa6R4AaABAg.9_tM7RxI7rl9_tTT92vmrL," @Peter Carson  So,it was ok",12 minutes ago,Maxus,UCw2VExRsR2sKjKHt3hhNfJg,0,https://yt3.ggpht.com/ytc/AKedOLT9l_geOC68-tWeWJvGZJQkvsSJD0yOAEGgYOzqHA=s176-c-k-c0x00ffffff-no-rj,0.0
Ugz3G6iijik_XHZxa6R4AaABAg.9_tM7RxI7rl9_tUotrT1Bc,"this conflict was started by russians
Who are those so called ""separatists"" in Donetsk and Luhansk? According to Igor Girkin - the former military chief commander of these ""separatists"" - they are the regular russian armed forces in disguise, very similar to the ""little green men"" in Crimea. Igor Girkin said this on several occasions in interviews with the newspaper ""Frankfurter Allgemeine Zeitung"" (2017) and the weekly news magazine ""Der SPIEGEL"" (2018). He lost his job as their military chief commander several years ago. Since then he occasionally talks about his time in Donetsk and Luhansk with foreign media.

There is also a significant number of russian POWs and killed russian soldiers from the regular russian armed forces who have documents which prove that they have been deployed to the Donbass since 2014. This is further backed with medals and awards which they have for their service in the Donbass since 2014. So we have the statements of Igor Girkin - the former military chief commander of those ""separatists"" - and personal belongings of russian POWs and killed russian soldiers which further back what Igor Girkin told several foreign newspapers.

So what does it mean? It means that the regular russian armed forces occupy the Donbass since 2014. That the ukrainian military tries to push them back out of Ukraine is the bare minimum of what everybody would expect from a country which has sovereignty and dignity. These regular russian armed forces which pretend to be ""separatists"" use the civilian population of the Donbass as human shields and are therefore solely responsible for their suffering. At the same time Putin denies that it's his own armed forces which fight against Ukraine in the Donbass and has the audacity to accuse Ukraine of breaking the Minsk agreement.

Yeah sorry, this whole Minsk agreement is an entire farce in the first place when Russia pretends to be a mediator between Ukraine and so called ""separatists"" while at the same time these ""separatists"" are regular russian armed forces who pull of a pathetic mascerade.

Within the russian military there is even an official term for this kind of warfare: Maskirovka (маскировка). I would like to quote the opening sentence of the Wikipedia article about ""Maskirovka"":

""Russian military deception, sometimes known as maskirovka (Russian: маскировка, lit. 'disguise'), is a military doctrine developed from the start of the 20th century. The doctrine covers a broad range of measures for military deception, from camouflage to denial and deception""

Russia's covert warfare in the Donbass since 2014 - in which its soldiers mascerade as ""separatists"" and ""militias"" - is the perfect example of ""Maskirovka""",13 seconds ago,dayooo2306,UCYIJ0AABhFS-R1a5BvPZNDw,0,https://yt3.ggpht.com/ytc/AKedOLT_GI5SVYXSTZmbnlYkmalMAuaI4D3OLV2-ZQ=s176-c-k-c0x00ffffff-no-rj,0.0
UgxrQ0M6jRlMJVK7CGh4AaABAg.9_tLs9AHW7k9_tMYYEelBW,Its all an act but real people are getting hurt and killed because of stupid rich people who want power,1 hour ago,MissMeWithYourBullshit,UCu7QEQPjc6gEqAinlyV4LmQ,0,https://yt3.ggpht.com/AhskhGY7oZKzcGKyhUWYVVqZuNxPs88NV53JF4YdLVfHoiZ1p7VJti8mKXdFOTu26czrWyK4=s176-c-k-c0x00ffffff-no-rj,0.0
UgwG2DRpqQzQ-FfCs2x4AaABAg.9_tLf_RYokH9_tOX_HuTgb,Yeah they also killed 41 civilians,55 minutes ago,Tt,UCCxddN6IXjZqlbNTHQcdlVw,0,https://yt3.ggpht.com/_KgMZlsYKkjQrKu6Q7QvEP6SbH2xpU_L4nYhRwbtgeypRFLsqZZQq4c5VggBHwAa__k6kA1Evg=s176-c-k-c0x00ffffff-no-rj,0.0
UgwG2DRpqQzQ-FfCs2x4AaABAg.9_tLf_RYokH9_tQmBXfPT7,After what Americans and Russians experienced in Afghanistan I do not believe Pakistan is so stupid to invade. But you never know.,35 minutes ago,r& g,UC0yvwqMcGGIL7bcvaY1iRxQ,0,https://yt3.ggpht.com/ytc/AKedOLTIZ9iuai295Rq34pYTM8gUDKPz33U7uzrAwdPoYzwsWgp7eMjbzo93PS6VMsh6=s176-c-k-c0x00ffffff-no-rj,0.0
UgyfHP7FoKpEUizHx2V4AaABAg.9_tLWnlN97i9_tOFhVi6NM, @itsJacob72  I DOUBT IT WHY THEY HAVEN'T EVEN TRIED BEFORE DOUBT IT.,57 minutes ago,Tt,UCCxddN6IXjZqlbNTHQcdlVw,0,https://yt3.ggpht.com/_KgMZlsYKkjQrKu6Q7QvEP6SbH2xpU_L4nYhRwbtgeypRFLsqZZQq4c5VggBHwAa__k6kA1Evg=s176-c-k-c0x00ffffff-no-rj,0.0
UgyYRq-nZPuWGor_8Zl4AaABAg.9_tL7UgyqP89_tLabRR2Vw,R u indian,1 hour ago,Tt,UCCxddN6IXjZqlbNTHQcdlVw,0,https://yt3.ggpht.com/_KgMZlsYKkjQrKu6Q7QvEP6SbH2xpU_L4nYhRwbtgeypRFLsqZZQq4c5VggBHwAa__k6kA1Evg=s176-c-k-c0x00ffffff-no-rj,0.0
UgxVWOvWKNUWM28q28Z4AaABAg.9_tL1gYXlXi9_tLfO7Wugc,Exactly,1 hour ago,Rock Wood,UCQp8YqjNN5aI1WXnMy2_loA,1,https://yt3.ggpht.com/FHW0Y8QJ7SmzgJFS9HC94d-gHSQHnXjzzylF5U_Zrcp40l_0ZobvH7Cdxg9fIjqSXAFJxrPRcA=s176-c-k-c0x00ffffff-no-rj,0.0
UgxVWOvWKNUWM28q28Z4AaABAg.9_tL1gYXlXi9_tN7AmjpbP,"Western media literally named it ""shock and awe tactics""",1 hour ago,Luke Murray,UCN_MISB8Nl5pU7Av3uxGTkA,1,https://yt3.ggpht.com/ytc/AKedOLS0IptJq4HEM4sqiBYjed-MPsjf1i_u9qeuvKR8bdQrH5UUcRUKJU0NyMF2lFIn=s176-c-k-c0x00ffffff-no-rj,0.0
UgxVWOvWKNUWM28q28Z4AaABAg.9_tL1gYXlXi9_tPk5czK8P,Yeah! I don’t understand why Indian media wasn’t interested in that.,44 minutes ago,Peter Carson,UCmLsFeeRKU0fv13aJwFb6oA,0,https://yt3.ggpht.com/ytc/AKedOLQ3HWAN3yHJ-3av9rc4nZls4SP00owIlcCZ4w=s176-c-k-c0x00ffffff-no-rj,0.0
UgxVWOvWKNUWM28q28Z4AaABAg.9_tL1gYXlXi9_tUGB0AZMA," @Peter Carson  are you fool 
 wion is a new global  news channel.
hindi channels was  reporting that time",5 minutes ago,DevRawat Show,UCOAoyLdxwhJJN02SG9hrY2g,0,https://yt3.ggpht.com/RlmlkmoakIcQg-SgnopwqZSlPSXtVQDhCTOzpQNoOGc2ohrjsHIWlv5bgCDnM1wyT65utyVpIQ=s176-c-k-c0x00ffffff-no-rj,0.0
UgzPO6F0Z93L-n2Bpr14AaABAg.9_tL0Qw2Im-9_tLcAqCDYv,"I think you must correct it instead of Russia and Putin, America and bush holds good for your sentence",1 hour ago,Manoranjan Raj,UC8w_ni0kvtaga7nLI8sl8Zg,1,https://yt3.ggpht.com/ytc/AKedOLQhye6HW9GqK2rDKsZnPjP-t7nuXeDtiLVFSw=s176-c-k-c0x00ffffff-no-rj,0.0
Ugx5EmAJkbSt_J0_ESR4AaABAg.9_tKm1LZhx79_tL95Tzp9Z,Ukraine isn't part of nato you dink. Nato has refused Ukrainian membership many times.,1 hour ago (edited),Dui Hui,UCNRfudRp0jd6fxGSmZnWQ-Q,3,https://yt3.ggpht.com/ytc/AKedOLTpodo5XW7Ign6DpPs238Lf_Pgn8UM4vhUNhg=s176-c-k-c0x00ffffff-no-rj,0.0
Ugx5EmAJkbSt_J0_ESR4AaABAg.9_tKm1LZhx79_tLaUNf9tC, @Dui Hui  dont mind his english :),1 hour ago,Dr. Mushfiq,UCZ1ZMbgJzDkhVRwxhxX-0rQ,0,https://yt3.ggpht.com/ytc/AKedOLRSBxWhejTV3upnscqU_xCGXuDsUZzw-I_qK6jrig=s176-c-k-c0x00ffffff-no-rj,0.0
Ugx5EmAJkbSt_J0_ESR4AaABAg.9_tKm1LZhx79_tN4UgPfGS, @Dui Hui  except Nato was building bases in Ukraine and Pentagon financing biological weapons.,1 hour ago,kk,UCekHjtZ6ptM11NSdT1gr0TA,0,https://yt3.ggpht.com/ytc/AKedOLTrsGRbRFNS62AlnO9i-IczlqbFykkMptL5TQ_LIEkJ9f_1rrew-2NFqWuPuFynCA=s176-c-k-c0x00ffffff-no-rj,0.0
Ugxp20YgSHrRW9F_fy94AaABAg,"Soon it will be India turning into a graveyard 🪦. You have totally neglected reporting about the dying people in Yemen, Afghanistan, Nigeria, Somalia, Libya, etc ..",1 hour ago,Gerald Musoke,UCO99uYJ4R6ZPIwZCXCbcvKA,7,https://yt3.ggpht.com/IHeQGUzrV_4X9RBA2kPwrvJkxw6UGSuwnEygbA_SizLDNeSYh7YWzTKfa7WiXoVqeUduZO36Ez4=s176-c-k-c0x00ffffff-no-rj,0.0
Ugz-F18ty7NPY78JsQt4AaABAg,LMFAO if the USA and Canada and the rest of the world didn't get their dirty little hands in where they don't belong this war would have been done by now so there to blame did anyone go after the USA for all the people they killed in the middle east? so what when it's them it's okay to kill said people but when it's someone else bigger than them there to blame till the USA is held accountable for the deaths in the middle east this shit on Russia means shit. Russia needs to use hyper sonic missiles on all country that is supporting the nazis as the people that live in said countries need to force their governments to stop supporting the nazis and if not then they deserve everything they get on them from Russia,1 hour ago,Wake Up Canadians,UC9e-LyTdQ3q1Euz0zaO9E9w,0,https://yt3.ggpht.com/HHxevKbama4ulxZGDGZSrBj7Re59WrtcolzqJVULOoQZqJGEPvf2W-y-3J65PUPV4EYgHux3ag=s176-c-k-c0x00ffffff-no-rj,0.0
Ugw2fK8Vkzi6cGB2l3J4AaABAg,No peace for weaked one,1 hour ago,Aminu Muhammad Danjuma,UC6A2IwvZz4dDPWoFl11PMKA,2,https://yt3.ggpht.com/ytc/AKedOLSKqdgb5pITlxy2Z7TEmtBFKLTeya68_jt_2g=s176-c-k-c0x00ffffff-no-rj,0.0
UgwhennIn47jPvucZBF4AaABAg,"Russia is indeed causing crises, but more the Ukrainian people killing their own people, see videos from PatrikLankaster, he makes constant reports by asking locals",1 hour ago,Lena Maniork,UCLWUxJZtJr9GLeXKWvrCp7A,0,https://yt3.ggpht.com/ytc/AKedOLS2IMis4G0jWe3_A6XFrTS9SbYdePSI1Z9byQ=s176-c-k-c0x00ffffff-no-rj,0.0
UgyuiLlpX2sfTTyJMaJ4AaABAg,"Russian invasion? Careful Wion, you'll upset the Russian trolls.",1 hour ago,Robert Bones,UC1BPgRXS5GSGhvJ1POpW_0g,11,https://yt3.ggpht.com/ytc/AKedOLTGC0oevp03CLo13VKFB7TbLy5k_3kVp20tMHT3=s176-c-k-c0x00ffffff-no-rj,0.0
UgyoF8ELssmF2r-AqYV4AaABAg,"Romans 6:23,,,,,,,, 
 For the wages of sin is death, but the gift of God is eternal life in Christ Jesus our Lord",1 hour ago,Light of God,UCj3MLzuHyUvSaBW-rKDQCFw,1,https://yt3.ggpht.com/m6VeAGeQeO4CHPHEqGrm1h2Fe607ZGee5fpJC5cvSO7u5CO3kI2kj5mWnJy-3uFLT1OfkERq4g=s176-c-k-c0x00ffffff-no-rj,0.0
Ugx3l6B_g57cyvPgy7t4AaABAg,Ukraine will need decades to rebuild and India could help 🇺🇦🇮🇳,1 hour ago,Discover China探索中国,UC4wMcnVXz0EG1mDV7uGaUrw,12,https://yt3.ggpht.com/ytc/AKedOLQkNbQVyAfZsCoLxRsmHmJXjZ6jCGNtDWBegQ=s176-c-k-c0x00ffffff-no-rj,0.0
UgzaRWQmJyOtPkTYNqt4AaABAg,"Zelensky made worst decisions of his life When he considered Biden Is an Ally, Even After Afghanistan Fiasco 🤣
Finland is gonna Next Ukraine soon.",1 hour ago,USA:Syria Japan Iraq war criminal,UCYaEpk73K3TGddAEbMH2Edw,14,https://yt3.ggpht.com/ytc/AKedOLSs2QQR69yD0wtjVnbAqYokYYvFriaPAp9vrAw8_g=s176-c-k-c0x00ffffff-no-rj,0.0
UgztZoIzlaRO7c8QR-x4AaABAg,Cuba 🇨🇺  should have RUSSIAN military base for self defense,1 hour ago,USA:Syria Japan Iraq war criminal,UCYaEpk73K3TGddAEbMH2Edw,15,https://yt3.ggpht.com/ytc/AKedOLSs2QQR69yD0wtjVnbAqYokYYvFriaPAp9vrAw8_g=s176-c-k-c0x00ffffff-no-rj,0.0
Ugw51OfHNDxrQgmSKAN4AaABAg,Ura Russia 🇷🇺 🤝🇮🇳,1 hour ago,USA:Syria Japan Iraq war criminal,UCYaEpk73K3TGddAEbMH2Edw,9,https://yt3.ggpht.com/ytc/AKedOLSs2QQR69yD0wtjVnbAqYokYYvFriaPAp9vrAw8_g=s176-c-k-c0x00ffffff-no-rj,0.0
