cid,text,time,author,channel,votes,photo,heart
UgxNYbgGzPP03dyCZi14AaABAg,Ok I like her. She’s cool. They just need to give her more camera time and she’ll be a favorite. Palki will be back guys. She still does gravitas plus on the weekends which I love cause I learn so much from those small segments palki does,50 minutes ago (edited),Wavveytae,UCnGjN86dY5bgeD7C8xC8lfw,1,https://yt3.ggpht.com/Sk7Eqzr65Mw3ZEq-WFwTVMQtyAEHShaSEkcmhjQgr6qSQ-RGl6uJx2nV4PsqNrpX3wnmdNYcew=s176-c-k-c0x00ffffff-no-rj,0.0
UgzfpT5uEOuPqNtlKQx4AaABAg,Where is palki,2 hours ago,Isaac Omondi,UC0qlm-ZqukDSL-gnucox3Sw,0,https://yt3.ggpht.com/ytc/AKedOLTg48AmAGfCMtdeZZBo0LSf5OEykQXnS9zg5snOq6NS5O3mpVCkRZcj9ijR0toK=s176-c-k-c0x00ffffff-no-rj,0.0
Ugx5nHdYqreH1ghI14V4AaABAg,How the hell does anas Malik manages to be everywhere at once,4 hours ago,Panzer of the lake,UCaX1On0K93DF0jTKIqnwo_w,0,https://yt3.ggpht.com/ytc/AKedOLRVh0j6RHLXlcnCv3xv906a5r0Dac1Yp4lptSbQ=s176-c-k-c0x00ffffff-no-rj,0.0
UgxXKGhHOEZuAsmlalN4AaABAg,Every Defect Indians seeing on USA . America learned it from India,5 hours ago,F Piedade,UCNBlLXX5nJ2VhgiZaiTea8g,0,https://yt3.ggpht.com/ytc/AKedOLSNYSk81MvjSff_J_-2-Ow97T1peZxAoDm8OfVJU7bQttGiGM2ceoBFysQ8v2B6=s176-c-k-c0x00ffffff-no-rj,0.0
UgzejM0mAcSBFbm-Yrh4AaABAg,Keep up the good reporting on Biden and Camellia Harris,7 hours ago,Michael Maxfield,UCvmq9TQfO8-wqOBJGSq_HOw,0,https://yt3.ggpht.com/ytc/AKedOLSmjMBPuPlJTM7DxAAtw_vJaoVcjDBFq_4YnA=s176-c-k-c0x00ffffff-no-rj,0.0
UgwLDE5I1GWcOlMCTAR4AaABAg,That's not what's causing inflation. Inflation is caused by these governments printing money. The United States is put 3 trillion dollars in into circulation. We gave away money to businesses to everybody and now there's spending that money causing inflation. The United States keeps putting off the pain of a depression-era time. We need to let our system balance itself out and not bail anybody out. If we let it collapse it could be over in 7 to 8 years but now we keep kicking the can down the road and it's going to just be worse when it happens. The only way we can reset the world's monetary system is by going back to a gold standard are silver standard our wheat standard where our money is backed by something other than Fiat currencies,7 hours ago,Michael Maxfield,UCvmq9TQfO8-wqOBJGSq_HOw,0,https://yt3.ggpht.com/ytc/AKedOLSmjMBPuPlJTM7DxAAtw_vJaoVcjDBFq_4YnA=s176-c-k-c0x00ffffff-no-rj,0.0
Ugw79D8FkO57IuV9qch4AaABAg,I'm wrong Rwanda is a Christian country,7 hours ago,Michael Maxfield,UCvmq9TQfO8-wqOBJGSq_HOw,0,https://yt3.ggpht.com/ytc/AKedOLSmjMBPuPlJTM7DxAAtw_vJaoVcjDBFq_4YnA=s176-c-k-c0x00ffffff-no-rj,0.0
Ugx9OfrmnpaPc6Nzs1x4AaABAg,Don't you think the migrants from Muslim countries would be more comfortable in Muslim countries? The UK's a Christian country Rwanda is a Muslim country if I remember right,7 hours ago,Michael Maxfield,UCvmq9TQfO8-wqOBJGSq_HOw,0,https://yt3.ggpht.com/ytc/AKedOLSmjMBPuPlJTM7DxAAtw_vJaoVcjDBFq_4YnA=s176-c-k-c0x00ffffff-no-rj,0.0
UgzLgbVO-dOQZtEX_W94AaABAg,We have a big problem with that in the United States. People illegally crossing the borders and coming to the United States looking for a change from the country they're leaving. The big problem is they get here and they wanted change this country to be like the countries are leaving. They have tried to turn the Minneapolis-Saint Paul area into little Somalia they've turned Miami-Dade into little Cuba it's crazy. The Border region with Mexico they've turned into a drug field gang area. MS-13 out of El Salvador has destroyed the inner cities in our country. We now have so many people that refuse to work living on the sidewalks up and down the West Coast waiting for handouts right next to help wanted sign. We have the lowest unemployment we've had in decades and yet we still have people living on the sidewalk because they expect the government to give them something this is something that was imported into our country from a belief system of people that think the government should take care of them. I do not Blaine do United Kingdom for trying to get rid of this disease out of their country. I know that seems rough but the last time I remember in our country that we Face tyranny the American people took up arms and drove them back out that's what these Asylum Seekers need to do. You overthrow your country if the country's not the way you want it. We need to arm the Asylum Seekers and send them back to their country to get rid of their dictators,7 hours ago,Michael Maxfield,UCvmq9TQfO8-wqOBJGSq_HOw,0,https://yt3.ggpht.com/ytc/AKedOLSmjMBPuPlJTM7DxAAtw_vJaoVcjDBFq_4YnA=s176-c-k-c0x00ffffff-no-rj,0.0
UgyOfHXO0CyW3dNrY8d4AaABAg,Where is palki sharmal I miss her,8 hours ago,Jahziel Serrano,UCFWT_uGcdIHInGyBtTDsSdw,0,https://yt3.ggpht.com/ytc/AKedOLRiNTvzjFhgK-SZROw0PvtVHkXDoMtgWAVLEkSfCo5AwCrVQqCE5JyEi6MF60X6=s176-c-k-c0x00ffffff-no-rj,0.0
UgykqzQv85NvjnK-qrJ4AaABAg,And WHO will recommend same methods?,8 hours ago,Fidel Thaddeus Borja,UC4aD4ZlqAiUa9qFMEpCTVpg,0,https://yt3.ggpht.com/ytc/AKedOLSVNC2oBPj1nTqgJTekcIk4QIpR47g04b41GQ=s176-c-k-c0x00ffffff-no-rj,0.0
Ugz7BAZQy8jzA65UH3Z4AaABAg,Molly is trying to be Politically correct in her approach whereas Palki is bold.,9 hours ago,A O C,UCVkGt1Woh0WloABrRWtQgew,0,https://yt3.ggpht.com/ytc/AKedOLQXeC6SwkRvHEl2nS-v6j6y6t993FDcEAEtbA=s176-c-k-c0x00ffffff-no-rj,0.0
UgwVonjRhkPnYokVQZp4AaABAg,Somalia has a parliament?!,9 hours ago,Rajagopal PS,UCi4cBNeZF3pWjFrsM3sKRMg,0,https://yt3.ggpht.com/ytc/AKedOLSMmw8WZb1smYTSRuGYLW5s_nwRr7SU-14yxg=s176-c-k-c0x00ffffff-no-rj,0.0
UgxRhMPwy49SWDDfG2d4AaABAg,"Palki is not present, sorry wion, gonna unsubscribe",10 hours ago,Commôn Mànñ,UChJuDqMtEgkps4oc-JgNKlw,0,https://yt3.ggpht.com/ytc/AKedOLRszSm-x1lCG5CxFZLgM4WpQ_fzXF1tNLJMr21a=s176-c-k-c0x00ffffff-no-rj,0.0
UgwMsHQJzKy5W-r1uc14AaABAg,"Guys don't be too judgemental and like kinder kids. Wion channel presenting ethical journalism.  Palki, Molly and Sharma all doing great.  Just watch and listen to the content rather crying like babies I want P or M or S. Grow up guys.",11 hours ago (edited),Sae Eng,UCaA6BdcS7zLFAlQCRt54AKw,0,https://yt3.ggpht.com/ytc/AKedOLTZ-LXwBUOkuyy4MCgcFdm7HnlhlvjLvUNH1kSU=s176-c-k-c0x00ffffff-no-rj,0.0
UgyIeEgInfIxYQQdV554AaABAg,I'm sorry. I couldn't help but notice her pronunciation of Rwanda.,13 hours ago,sctonio,UC8VLyp_8UMMndRYMdWYTsdA,0,https://yt3.ggpht.com/ytc/AKedOLRFn-uBiUUvwcrIh9XLefMrskS2-QZM2lgVkJPhKeD-yUPACdcBWX2a_2nEomqa=s176-c-k-c0x00ffffff-no-rj,0.0
Ugz8KnKeFrsMEKh3tuF4AaABAg,Palki mam🙏,14 hours ago,Ankit Jakhar,UCKgRXjZVu1YT8rxV14g6MRg,0,https://yt3.ggpht.com/ytc/AKedOLQ8jmdPz6wTHSV6mrHt82xUCaFPb_tV-sb_CuMs=s176-c-k-c0x00ffffff-no-rj,0.0
Ugx0xJ3wDBDOwFayFd94AaABAg,"I believe Army will take over. Expect BAJWA to take over or another General will depose BAJWA and take over. Politicians can never rule in Pakistan, so a Musharraf-type coup is expected, with China taking over Pakistan's real estate.",14 hours ago,Faith94,UCxpYhT2Qp2xASgWbx-8F1eA,0,https://yt3.ggpht.com/ytc/AKedOLQXFfiuEv7cKxC4Ucg6Bn-L8iCESLkFBh_QM3mx0w=s176-c-k-c0x00ffffff-no-rj,0.0
Ugxu8B5IxPriQcOJ2zV4AaABAg,What! You guys did not see the person Biden was shacking hands with? I did! You guys can't see!,15 hours ago,Keith Johnson,UCRtOkvha5_emZUudL7Z0Hvg,0,https://yt3.ggpht.com/ytc/AKedOLQp4oCMTlWqa4vYblLIaxXcKrJHdzycVfyr_yT95Q=s176-c-k-c0x00ffffff-no-rj,0.0
UgzhQbFbHvFdm0qoX054AaABAg,And you know who is the blame for all of this high coast spending right?   PUTIN!,15 hours ago,Keith Johnson,UCRtOkvha5_emZUudL7Z0Hvg,0,https://yt3.ggpht.com/ytc/AKedOLQp4oCMTlWqa4vYblLIaxXcKrJHdzycVfyr_yT95Q=s176-c-k-c0x00ffffff-no-rj,0.0
UgxMp2S5iYtJkk0i-UB4AaABAg,palki upadhyay miss u for this show,15 hours ago,wAy tO chAngE,UC9O9EONLyBnVOJ0rWZwoqqg,0,https://yt3.ggpht.com/1kCfetg_ZV7n8juaOh6GxD58asLTvz2xTsH__rxVxw7bextHvkGWZohfa8JTWsBlPdOrz2tR=s176-c-k-c0x00ffffff-no-rj,0.0
UgwnF26BLMNLLWprPXd4AaABAg,Education authority recognized full naming of all war coalition dominance  against each other rather than in getting against being as two apposing  groups against  militate A proposing plans .,15 hours ago,Richard Mckenzie,UC8A8vLKcwEwEdcojnJEZfCQ,0,https://yt3.ggpht.com/G1ffKPwIFYCElvLRa3GV1CZZY9mte88tz-W5Ek2hXeDNYJ0E0ysDg8p6jXqc8a6NmlkjWaMxTa8=s176-c-k-c0x00ffffff-no-rj,0.0
Ugygn6GVVbd1JeJxnZN4AaABAg,"disgusting kicking people out of their home, you certainly wont see any government official giving up their homes!",16 hours ago,Leslie Spiers,UChaSA7u-ACFfQFV4Zl_6eDw,1,https://yt3.ggpht.com/ytc/AKedOLRFbu9jcitMjY7owJUluZWhfmWBNXCwP8H_sm3sgg=s176-c-k-c0x00ffffff-no-rj,0.0
UgyPEFO5Xv2HGaXZ-wh4AaABAg,Why relocating illegal migrants to Rwanda???,16 hours ago,Fatai-Ayoade Yusuph A.,UC7fJ24iPqKITXRI0wTRRYgg,0,https://yt3.ggpht.com/ytc/AKedOLSz5OZROZb7bLYMGYxh3qNEC4VoLroZKeV7utrk=s176-c-k-c0x00ffffff-no-rj,0.0
Ugxfza5R5_6PWEoMHtt4AaABAg,Who is the real racist? Who is the real Human Rights Violators. Furious World is Watching.,16 hours ago,Orlando Necesito,UCTleTWHFbg95dBOnuz0yLZg,0,https://yt3.ggpht.com/ytc/AKedOLTuhalB7LyaG6xHsSmxstHBpB3GDD_Ve5Lw=s176-c-k-c0x00ffffff-no-rj,0.0
Ugx7idfMO9Ojbyj1C9Z4AaABAg,She is also good but I miss palki mam please bring her back 😭,16 hours ago,The glimpse of our history,UC9xjiJhXlSKX2biWAZEmXLA,0,https://yt3.ggpht.com/Dw5EyU3Od-69bSzKU3tl_eUiTv65eP-98NBMlLzmn3N6cGb3zLWtJJ6_xv7ZhLMYefgMZpbHOw=s176-c-k-c0x00ffffff-no-rj,0.0
UgyFzBlhfrrtp6oED4B4AaABAg,"I don't understand this! If the Army Chief is more in charge then the PM, then let the Chief be the PM! I always thought the head of the military's is under the PM and Presidents in a Country!",16 hours ago,Keith Johnson,UCRtOkvha5_emZUudL7Z0Hvg,0,https://yt3.ggpht.com/ytc/AKedOLQp4oCMTlWqa4vYblLIaxXcKrJHdzycVfyr_yT95Q=s176-c-k-c0x00ffffff-no-rj,0.0
Ugxws57OKLV9HuFNTOZ4AaABAg,"any country that think what Britain is doing with immigrants/refuges, illegal immigrants, is wrong , THEN let them step up-& them take them to their counties then.(problem solved)",16 hours ago,Leslie Spiers,UChaSA7u-ACFfQFV4Zl_6eDw,1,https://yt3.ggpht.com/ytc/AKedOLRFbu9jcitMjY7owJUluZWhfmWBNXCwP8H_sm3sgg=s176-c-k-c0x00ffffff-no-rj,0.0
UgzJeqxZdOku8kVQiyJ4AaABAg,"Columbo must take the money out of the politicians' accounts. As well as take over their lands and goods, at home and abroad 🙏",16 hours ago,Angel Dust,UCdlMZCuvByC3_pXl-qeJEGg,0,https://yt3.ggpht.com/ytc/AKedOLQgESnUUKGtla-3fVUbbHmY2CCNFyiL6_W2tdx7Z2RBNv2sriix7nbs-Sf8vpZM=s176-c-k-c0x00ffffff-no-rj,0.0
UgxPtiB7t8F7D_NEQJJ4AaABAg,"No offense, but where's palki? It's been 2 days!",16 hours ago,kartikey pandey,UCkQ81cBDl9CvlRRWYVm7Bzg,0,https://yt3.ggpht.com/ytc/AKedOLQCI9mmCg3w9-ZJz275g4OTvNg9QNpFr3Z02Giaow=s176-c-k-c0x00ffffff-no-rj,0.0
Ugy_nMjuKk5TypccYhF4AaABAg,No more aid to the Terrorist Nation. Or irresponsible nations!,17 hours ago (edited),Angel Dust,UCdlMZCuvByC3_pXl-qeJEGg,0,https://yt3.ggpht.com/ytc/AKedOLQgESnUUKGtla-3fVUbbHmY2CCNFyiL6_W2tdx7Z2RBNv2sriix7nbs-Sf8vpZM=s176-c-k-c0x00ffffff-no-rj,0.0
UgxehgfN2v8pX-iYB2d4AaABAg,Pakistan is an AUTOCRAT system of government being ruled by ARMY...,17 hours ago,sky larks,UCQMAbsUDqRQeJ0rTvOyZZDw,0,https://yt3.ggpht.com/v3G5isIp3QGNB8WBWLYB87z3PSluRV_A6IZtLDi-9GCutrHnT8W1XXisuDUd7GRW-4sGSoBHqe4=s176-c-k-c0x00ffffff-no-rj,0.0
UgzJ9s4n2Iw9C0MT2HB4AaABAg,"Stay the HELL AWAY FROM THE WORLD BANK? Ten million dollars... that's nothing you can get that from one rich businessman from India, Pakistan, China, Russia... anywhere but the west.",17 hours ago,Sparrow Paras,UCt5ncZ6WDLi_usFI6ICKy0A,0,https://yt3.ggpht.com/ytc/AKedOLRLwg7UKF99zRgs5rU9l95Wl3ikCNDZrxbyLg=s176-c-k-c0x00ffffff-no-rj,0.0
UgwIOn7z4CDtJrjXBp14AaABAg,"Nothing about Ukraine, congrats 👏India along with China, North Korea, and Erritrea must be the only countries in the world who have not publicly condemn Putin's invasion 🤢You phucking warmongers commies 🤮",17 hours ago,Cata kta,UCdr8p_3Qw8_9k9JwsVz2CVA,0,https://yt3.ggpht.com/ytc/AKedOLRnRGDvoHu4qQzZZoyzGowqXRIqBKgHZYbOnyG9=s176-c-k-c0x00ffffff-no-rj,0.0
UgyibeqRV9m8ukf_Dcd4AaABAg,"I miss Palki Sharma Upadhyay... I hope she is coming back soon. I am under impression that she has gone to cover a big news, i hope i am right. Also hope she is safe and well!",17 hours ago,sagar jain,UC_S5usrhNt4PP-j_bBYOdqA,0,https://yt3.ggpht.com/ytc/AKedOLSXNQbdnEGt3SeV_CHese9WUh3pZTxfH2pp_r0Svg=s176-c-k-c0x00ffffff-no-rj,0.0
UgyA7WSDVR-7_UkMQmB4AaABAg,Excellent job 👏,17 hours ago,pankaj kanyan,UCe1pKGRGHg4CGTAEYQSk5Sw,0,https://yt3.ggpht.com/ytc/AKedOLQleAE1YkRDGHCKnUYP4bNsl9uvAEbADwiemG3c-w=s176-c-k-c0x00ffffff-no-rj,0.0
UgzTCxj_q7IURuJQkjR4AaABAg,"We miss Palki. Love and support from Edmonton, Canada 🍁 🇨🇦",17 hours ago (edited),Sai Niranjan,UCMyMNbkeljt-0mQ2aghxuvA,1,https://yt3.ggpht.com/ytc/AKedOLQ-uQE00NQdYcd86CyZowiz6Ag-DN6ChTYsqMiHfA=s176-c-k-c0x00ffffff-no-rj,0.0
Ugw4sfydwD7ePakeyUN4AaABAg,"Hoje e Sexta-feira da Paixão.

Ouçam no YouTube a voz de uma brasileira, Maria Bethânia. O título é ""Meu coração não aprendeu nada"" | Maria Bethânia | Fernando Pessoa.

Vocês ganharam por mérito muitas responsabilidades, reconhecimento e ativos e tem condições em traduzir.
Traduzem.",18 hours ago (edited),Marcos Jesus,UCGq1_dSpGkztaFbVwEar_yw,0,https://yt3.ggpht.com/ytc/AKedOLTnGTXSN169OF2aByEDRqRac8CgNkAJH4bw9FO8_w=s176-c-k-c0x00ffffff-no-rj,0.0
Ugy-NHWgCBj2e3xnXhV4AaABAg,At india matter all pakistani are same 💪🇵🇰💪🇵🇰💪🇵🇰💪🇵🇰💪🇵🇰💪💪🇵🇰💪,18 hours ago,Sports Highlights,UCtSex92mtaXcBlz6kQza_hw,0,https://yt3.ggpht.com/adt5K_XGjmTVKxqxBUBqQ_VmBrtHsS4hZEyt-Oiy6DXqq0C_GFWl2hyqTTDT6rjU33WA42uEyg=s176-c-k-c0x00ffffff-no-rj,0.0
UgzuPLcK0tLNjIjD7DN4AaABAg,A wish young lady this where is Palki,19 hours ago (edited),Kevin Wesley,UCam7aLRTa71elukCr6YEpGw,0,https://yt3.ggpht.com/ytc/AKedOLRhfFxmlN73Z8XKLJ4a_HXK7swWRqwB9KVj4A=s176-c-k-c0x00ffffff-no-rj,0.0
UgyDfoRWCOajKZZLTl54AaABAg,Thank you India for your help with the Food Supplies good job. Now if you could talk to the Beast and have him stop killing children that would be a blessing. You know he's killing them as we speak and he has been for some time now.,19 hours ago (edited),Edward Daniels The Artisan,UCSUPqDHb6X3YtJ82_4HTOCQ,0,https://yt3.ggpht.com/ytc/AKedOLSe2Jz_0bQcwECHnFAsEn_HLhM5ICAkh5a9Nwh4=s176-c-k-c0x00ffffff-no-rj,0.0
UgynHugrBjTzEtNuH614AaABAg,Where's Ms.Palki we hope she's okay. The new anchor is doing good so far. Thanks Wion but we miss Ms.Palki to bits.,19 hours ago,Al-hesam Tadile  Ebrahim,UCvOj6UMb2cqovC3K6VzdEtw,3,https://yt3.ggpht.com/5cKplSmHUjkq7m1Zq3OIguhvAmKcqegE6TtIC-U0tEmWbnAMWIC2qUtqEN-_x1dcPSJtdPNo=s176-c-k-c0x00ffffff-no-rj,0.0
Ugy9knGTek9R-_tTyAt4AaABAg,I started watching this channel for Palki and really looking forward to see her in this segment. She just holds it❤️,20 hours ago,Uma Mishra,UC3gKFGXLvLaY5SL5nbwbKIQ,9,https://yt3.ggpht.com/ytc/AKedOLRIQ2ueamPnC2eCabDDyyEBry0kLWwtVv-8VJjgBAw=s176-c-k-c0x00ffffff-no-rj,0.0
UgzFYB_HOFww03HzUtZ4AaABAg,China bet failed for Sri Lanka,21 hours ago,Sushant Rathor,UC872NFkKW8Bfm9bMvQON1KQ,0,https://yt3.ggpht.com/ytc/AKedOLTWYDFIbVvvnNyCOGoVwejb43HzDnXYBuot8Q=s176-c-k-c0x00ffffff-no-rj,0.0
Ugw8eYeyZ8U8hlRAjd54AaABAg,The state is imploding,21 hours ago,Sushant Rathor,UC872NFkKW8Bfm9bMvQON1KQ,0,https://yt3.ggpht.com/ytc/AKedOLTWYDFIbVvvnNyCOGoVwejb43HzDnXYBuot8Q=s176-c-k-c0x00ffffff-no-rj,0.0
Ugz2VWkpt7lDnj8DRox4AaABAg,Molly ma’am is also good..congratulations to her,22 hours ago,Renu Bhutani,UC8o8LhGnOYk2sNpUrF-bUtg,0,https://yt3.ggpht.com/ytc/AKedOLQoy7d1OZ5HFUGjICQjUkIgtJLSLpE1nEZ_zQ=s176-c-k-c0x00ffffff-no-rj,0.0
Ugyq6Unarq-X8v9Sg9R4AaABAg,WION  Please respect us Viewers by giving the date of Broadcasts.   Also please be careful  Using VoA  content  Some of us americans think VoA is the voice of the CIA  and I don't like the fact that they think they should be conducting US foreign and not the president or congress.,22 hours ago (edited),SurferNorm,UCDIc8ohPT6hPIQkcUbJFCew,0,https://yt3.ggpht.com/ytc/AKedOLRiy9FWmaaZG7hGDh_Ti8fYnQ6z_nwFuthlYUA2=s176-c-k-c0x00ffffff-no-rj,0.0
UgxS5EkoSEBdCNQJR594AaABAg,where is palki ma’am,22 hours ago,Renu Bhutani,UC8o8LhGnOYk2sNpUrF-bUtg,0,https://yt3.ggpht.com/ytc/AKedOLQoy7d1OZ5HFUGjICQjUkIgtJLSLpE1nEZ_zQ=s176-c-k-c0x00ffffff-no-rj,0.0
UgypkE8FZ9kYLjr_8Ch4AaABAg,Where ? Where ? Where? Where? Where? Where ? Where are youuuuuuuuuuu...........,22 hours ago,Manu Krsna,UCMijzTQ8t7Mnvwo6EC7uo8A,0,https://yt3.ggpht.com/ytc/AKedOLQEAOWZ-h9OQcFkmGrC-tFck6l_vtZc4gsS_xUS=s176-c-k-c0x00ffffff-no-rj,0.0
UgyyPxYwhFBtH_lrZnx4AaABAg,As usual report given by wion is great....News reader is also nice:),22 hours ago,Aditya Das,UCFAoyex-zDhiFgfE1JOyBUw,1,https://yt3.ggpht.com/ytc/AKedOLSELu-2kwKlZplNlKrTkGzwiDz6k_zzHZbKGEbotw=s176-c-k-c0x00ffffff-no-rj,0.0
Ugx0k9Y_oMORgimvPC14AaABAg,Pope should have washed hands of people whose ancestors are killed by church because they did not convert to His intolerant cult. There are millions of such people across world who faced brutal death for refusing to convert to his intolerant cult. Also he can consider the parents of those kids who are molested by pedophiles in church who are protected by Vatican for decades.,22 hours ago,Vidyasagarbb,UCRX4IYkDdRSFHr9xcYstSCQ,1,https://yt3.ggpht.com/ytc/AKedOLRSPDeP6as20a0bWGx2j_677AjrLtN5SoHPuQ=s176-c-k-c0x00ffffff-no-rj,0.0
Ugy7jMKcfxbjGvBTzv54AaABAg,The world have seen nothing yet.,22 hours ago,Emmanuel Guobadia,UCc9qsBsSFzoTODm5Pgovxhg,0,https://yt3.ggpht.com/ytc/AKedOLSAPFzwxgTBZb7rW-Dp0W12rezPE6pr1MVGgg=s176-c-k-c0x00ffffff-no-rj,0.0
Ugx6c5eVtZrF3iPMWhl4AaABAg,where is palki?,22 hours ago,DJ,UC6g_LP1UG8JgcfkvBGZBWzA,0,https://yt3.ggpht.com/ytc/AKedOLQGh-8JNhO2uUtoGrVoPbGLzgC7ON4H9s72MCebEQ=s176-c-k-c0x00ffffff-no-rj,0.0
UgyWCLd5xGSrDfuw5Rp4AaABAg,Omg What is happening in America this is all the about losse power of lable  of world  power😂😂😂😂,23 hours ago,Koshti Ankit,UCW08L7BKJR7iJd3rN5dfgkQ,0,https://yt3.ggpht.com/ytc/AKedOLTEJnaunHSrRjffca9INOfynBJhsLuuC08Maw=s176-c-k-c0x00ffffff-no-rj,0.0
UgxEwsuyBnsywsAnTbV4AaABAg,"almighty God justice is slow but sure,let this gov kno this.",23 hours ago,mike singh,UCyiJo1X19GWteBRuSY7dgkg,0,https://yt3.ggpht.com/ytc/AKedOLQWPjp1uE2eCFgQ_Q0PdmqV4giYbn4QT3Ik7Q=s176-c-k-c0x00ffffff-no-rj,0.0
UgyHqAaRpG8OmLZndKF4AaABAg,Where is Palki?,23 hours ago,spacemarine00,UC1R4nEF0T19XlQvGc57f_1g,1,https://yt3.ggpht.com/ytc/AKedOLSkKAi3DfmN12DhWJZItAo64XGKaT-Ndv-H1g=s176-c-k-c0x00ffffff-no-rj,0.0
UgwYo9rw2I_pL__AVVB4AaABAg,22:27 an Indian stooge for Boris’ dirty laundry,23 hours ago,primetime0104,UCdlQ5JPHAyrmEquHYapPLmw,0,https://yt3.ggpht.com/ytc/AKedOLSrSrGjo_Cq46-E-eEiTcLcbLTyeCn3ZABY3A=s176-c-k-c0x00ffffff-no-rj,0.0
UgyxDrAYEfATizlU6154AaABAg,"Could it be that Musk WANTS Tweeter To Fail to Show Up Social TRUTH To Be The Next Social Media out There, That you Spend Money To Crush Your Competitor, Eventually Uses The  Same Methods, I think it's Called Cooperate TAKE OVER, In A way To CONTROL FREE Speech, As Long it's In There Favor. Elon Musk Made His Bulk of Money During The Former President Reign, And Hardly ever Said A Negatives of The Former President, Even though He Have Said OVER 70 Should Not Run For The Highest Office In America, And If The Former President Serves Musk Purpose Then He Have ENOUGH Money Where He Can Afford To Gamble Knowing That He Will Recoup On His Investments. It's All About Making MONEY. Musk Is A Risk Taker And Very Shroud Business Man. Let's Not Forget, He Was Born In Pretoria, S A. That Country Has A Negatives Past History, And That Past History Exists With The Former President Base. ☮️.  
He May Try the Same With Facebook  
But Zuckerberg have Just As Much MONEY To Fight Him Off. It's A Vicious Society Out There There Controls By Just A Few.",23 hours ago (edited),Elred Lenny,UCv9sMrxjGxyUVUzM-CDtJ3A,0,https://yt3.ggpht.com/ytc/AKedOLTGX0nNtR1Pvgv14s6vLRl1wxO7SZrpfT2H5g=s176-c-k-c0x00ffffff-no-rj,0.0
Ugy9knGTek9R-_tTyAt4AaABAg.9_rHJpUfcvk9_sZUR2mKUN,"Palki is addictive!!!
Everyone likes her",8 hours ago,No Name,UCQ7_q5uloN1TJo6UEaMyTig,2,https://yt3.ggpht.com/ytc/AKedOLSdU_y0Au7y3Q6oU-CZP2n-n3DxF_m4yBLySv5wYg=s176-c-k-c0x00ffffff-no-rj,0.0
Ugy9knGTek9R-_tTyAt4AaABAg.9_rHJpUfcvk9_t9j_bRMUi,She must b busy... Will come bk soon...,3 hours ago,Aarya R,UC9WyaIHLkzIS0yA5uwy2S9g,0,https://yt3.ggpht.com/ytc/AKedOLRt4kmjdbtLMas1feROYEfq_hDLCmfe3ABBHLeTcdP0toH8A0MH7bXTCcUCdx_s=s176-c-k-c0x00ffffff-no-rj,0.0
UgxypD-5FqDlRq8VDHh4AaABAg,Molly mam is also very best but we are more connected with palki mam and missing her from 2 days,23 hours ago,Gratifying R2H...,UCltbReSaflADIzGiDV4Zt7g,0,https://yt3.ggpht.com/AVv_6BzWfo7bcKeHZUjRRNYycNYtsIJAWlmKNOWfod2mTNTqtFG9DJlr4oQzPcYC_7oYwyixyeU=s176-c-k-c0x00ffffff-no-rj,0.0
UgyyWAv6w3VA1xGvd5F4AaABAg,"Really like your presenter here, She's growing into her 'Palki-ness'!!!",23 hours ago,personkid21,UCwoZMjZwugEdtbUGQLpV-Vg,6,https://yt3.ggpht.com/ytc/AKedOLS8CR6FF6GpgW2KdoP22ffkwLiolZh9RUSuQ_p0=s176-c-k-c0x00ffffff-no-rj,0.0
UgxZRNQfovrlVOWrxpN4AaABAg,Molly does a g8 job. Thanks for the news maam,23 hours ago,Kvm,UCa1LW3dIdNFwN0s1gIFa8xg,0,https://yt3.ggpht.com/ytc/AKedOLRwYT2mJgp-qnxV-W1XdOvAqkKUp5NKTgzF7DzCaOpRPPDeE7heVVDOq-YBMdLj=s176-c-k-c0x00ffffff-no-rj,0.0
UgwSGqhqbb8-6lSR1uh4AaABAg,We want Pulki Sharma Back on show !!,23 hours ago,Sandip Muthkarwar,UCfz2cUEoUabBVE0N9ijtD6Q,2,https://yt3.ggpht.com/ytc/AKedOLQj48U_2YmopF4DuPbEkC0rqrpbRNA3EZBtDw=s176-c-k-c0x00ffffff-no-rj,0.0
Ugx6_TZbavjMLzQG6GF4AaABAg,That's truly to slauther those refuges .This new English law it's a criminal manoeuvre.   SINCERELY Amen.,1 day ago (edited),Alcidio Emanuel Cardoso Ramos,UCk0TUR5QRQkajbTpMKDHv7Q,0,https://yt3.ggpht.com/ytc/AKedOLT-eRq7yt2wj0nxRNXrzoLvNykbhPWm0Xu2Sg=s176-c-k-c0x00ffffff-no-rj,0.0
UgwcenkCJKk3N4-1XhR4AaABAg,"looking at thing from Imran Khan point of view, their actions leads to reconfirm thing or rather gave a reason of suspicion...",1 day ago,Muah muah,UCSlJdSMEswr9VTCVQwoWLyQ,0,https://yt3.ggpht.com/ytc/AKedOLQdNnwwWZWmLQN-6gwnpzZ0_eMEdPy3j1R8sBAetA=s176-c-k-c0x00ffffff-no-rj,0.0
UgxxudCefM7FodEW1pl4AaABAg,"You should refresh your search engines and look beyond what you're being told...never believe what circulate on these western Medias reason why I started watching WION news turns out you're not different from the others, You just act on a given agenda shame to this platform.",1 day ago,Mushambo Ally,UCT3BCjkp7ni5OZ4STMylCIg,0,https://yt3.ggpht.com/ytc/AKedOLQ8msjuIUhRqe0dXGbQsihT0z359x0EreHXbNFy7A=s176-c-k-c0x00ffffff-no-rj,0.0
Ugyr4R-Ggf8jwUQC_1V4AaABAg,"MEDICINE IN S.LANKA missing yet the "" Pharmaceutical industry "" does not do nothing about he van so They got lots of Medicine in stock  it, ain't about helping People the "" Pharma Industry "" drive   it's all about another buck .  So people will die in relation of the lack of Medicine in Pharmacys & Hospitals, yet the Pharma Ind. Does not do a thing .  Sad but thrue.",1 day ago,Alcidio Emanuel Cardoso Ramos,UCk0TUR5QRQkajbTpMKDHv7Q,0,https://yt3.ggpht.com/ytc/AKedOLT-eRq7yt2wj0nxRNXrzoLvNykbhPWm0Xu2Sg=s176-c-k-c0x00ffffff-no-rj,0.0
UgwtNjF3a7uDbIlVrZZ4AaABAg,Miss you Palki,1 day ago,Berry Chase,UCPgQCkPTwNMr10S_UT3PIxA,1,https://yt3.ggpht.com/ytc/AKedOLSV21zfxOPxiKV0snXdC3vkU7QcH3D9jqHSO5jN4w=s176-c-k-c0x00ffffff-no-rj,0.0
UgyoiAm_lAaVWVz-h714AaABAg,MG,1 day ago,mishra chabra,UCXp979fmZwsAHtO2nz80cJg,1,https://yt3.ggpht.com/ytc/AKedOLQioHpIse7hjoKb1jATO_youwc_VClbqUiPNg=s176-c-k-c0x00ffffff-no-rj,0.0
UgzJ8FCJH496bI4CcSp4AaABAg,"Lanka was founded by Kuber, the guardian of celestial wealth himself. Once it was literally made up of gold. Yet, today the same place is going through perhaps it's toughest times financially. How the time has turned up. Ironic, isn't it?",1 day ago (edited),Thunderboiz op,UCwf-6zCWNGhSg_jyvXV78Zg,8,https://yt3.ggpht.com/JpeB4zreDV6X9W5_U4MNgxyHp_DpXn-kak0FFWGmffnyU1SXYC2GeohR-NYng4Ayx-98GvigyHI=s176-c-k-c0x00ffffff-no-rj,0.0
Ugy2qZxD4p9BhKKqAj94AaABAg,"I have seen an earlier TV report that Srilanka has fined RS. 13 Cr. for a few “ Fishing community “ crossed the boundary ! If the “ Fishing community were to have so much money , they would have left “ fishing “ which is so hard & their life at risk for all the time “! Now srilanka wants India to help them ( already supplied food grains , medicines & Huge ( 2 B $ credit line )). All illegal migrants to India are placed in an recognised area with min. Humanitarian needs provided . Will srilanka show the courtesy  to send all “ fishing community without troubling them further & giving min. Human needs in their area till they are handed over “ Indian “ security . Jai Hind 🇮🇳",1 day ago,Satish Kygonahalli,UCz_q_Q2FHlEBTapjBbQ5TQA,2,https://yt3.ggpht.com/ytc/AKedOLTgqudm9qnCVgRjcx7LGM2cXxXK5yTJd02p9jUHHg=s176-c-k-c0x00ffffff-no-rj,0.0
UgyNWAvUnLnrmcWPda54AaABAg,yaaaaaaaaaar where is palki?,1 day ago,Anushka Maurya,UCC6jYR83YLNrlTBCsfNtygg,0,https://yt3.ggpht.com/ytc/AKedOLQaYAnLKk5fcbmXJppxQomBRS9dNE7g7JMsnJ10eQ=s176-c-k-c0x00ffffff-no-rj,0.0
Ugx_-O3AMfiQ_zSl2rl4AaABAg,Molly you are doing great..,1 day ago,K Soujanya,UC9wTlAXWzVGy_u-9sSq4GyQ,0,https://yt3.ggpht.com/ytc/AKedOLTYl4FUqLCRY-2FDSl9QtMHHRhdVklc2rnW448MWw=s176-c-k-c0x00ffffff-no-rj,0.0
UgxmAosLpjcw8tFOI5F4AaABAg,"Our Only Hope is in Yeshua Hamashiac/Jesus Christ the Messiah He has warned us of all of this read/study the King James Verison painstakingly translated and brought to us by the blood of many martyrs the Bible of Truth, and coupled with the Hebrew Translations is pure Golden Truth...it's all we need to live by.",1 day ago,Eileen Meltzer,UCwIjvb7t_xeF08hu1nwPt8Q,1,https://yt3.ggpht.com/ytc/AKedOLRIN8bKqbjrwzODWlZoyn09B-gC_XLZ36bIXg=s176-c-k-c0x00ffffff-no-rj,0.0
