cid,text,time,author,channel,votes,photo,heart
UgzOQS1CDIN9MiNMb1d4AaABAg,I'm pulling for the Lady to win...,1 hour ago,Dan H.,UCLzb6m_5HY_JISISzjsEPxA,0,https://yt3.ggpht.com/ytc/AKedOLQa634ABY84BS9IxNkcnmh9qa8XqB3t9Gtid7EH=s176-c-k-c0x00ffffff-no-rj,0.0
UgyzQnHN8tSVNfcZU8N4AaABAg,Rubbish report ...Macron has had more hate for being biased towards certain groups ...Even threats .,2 hours ago,immortal Dio,UCKyHZ5z8hpvVDA0qWiIDXLA,0,https://yt3.ggpht.com/ytc/AKedOLT8Ko77IEb6ndcH5DuqXzYaIAokDwmHildQS6HmtA=s176-c-k-c0x00ffffff-no-rj,0.0
Ugx5-ViSeU60qMPrjxJ4AaABAg,Macron is accusing Le Pen of what he is himself. An authoritarian vaccine mandate dictator graduate student of NWO  Klaus Schwab.,2 hours ago,Joe Beef,UC6fActPjjmBbqnWYzS5_ayw,0,https://yt3.ggpht.com/ytc/AKedOLTQ64x_X_mAV1EgShgmqi2tyG3HTHce8XDN8Nvl=s176-c-k-c0x00ffffff-no-rj,0.0
UgwiURJkS6S0JKm8Dm54AaABAg,I hope French voters give Marine Le Pen a chance! I'm am praying for Le Pen. Long Live Le Pen!,2 hours ago,Martin Lopez,UCqNxbApC8YaDBckw3E5Xc9g,0,https://yt3.ggpht.com/ytc/AKedOLS0vR63cuTsvtKl1IwsWokuyU-w5kOpuH0SloOhWsL9DEVhcO66Qb9KOLk9P35F=s176-c-k-c0x00ffffff-no-rj,0.0
UgwhtC3gX81ogw_Ueg14AaABAg,"Prey that le pen wins and she can start reducing the stain of Islam in their country.
The French shouldn't have to worry about walking through their cities and being attacked by some backwards foreign regimes trying to infiltrate their democracy.
Deport all foreign criminals",3 hours ago,Bobby Bastable,UCDg-IGJoVi1AgkjNP8thSkw,0,https://yt3.ggpht.com/ytc/AKedOLTVpMmHCCx7SNsGmDktzKU3V0Y_KpVPBHHCvg=s176-c-k-c0x00ffffff-no-rj,0.0
UgxlGyAKILwg8riM5FJ4AaABAg,"There's no way Germany will allow Pen to win, vote rigging at its finest!",8 hours ago,Ex animo,UCfrRZPduvfh-AlSzKrwp0LA,0,https://yt3.ggpht.com/ytc/AKedOLRV9K4_-g2yGe0xPXfBwyseQUI79IvO6fHwLrRw=s176-c-k-c0x00ffffff-no-rj,0.0
UgzpMFMbmYTKffGGxAV4AaABAg,Follow on 🔥🤣🌎🇬🇭❤️,10 hours ago,K.o.j.o_ID,UCzo7IMlmwV2Ho_6Uly8Tu6w,0,https://yt3.ggpht.com/IadN5hWK6QvjsNK7-vEevHSusutjsymjy18HAUlSwe-bHtKbe6MA9q_Sm-ytd9-j53svyghY=s176-c-k-c0x00ffffff-no-rj,0.0
Ugxpo1KhiT11bNDLsDp4AaABAg,Le Pen!,14 hours ago,Kenny Lam,UCZjkp8U3NM-AG4lSUK5X1Ag,0,https://yt3.ggpht.com/ytc/AKedOLRWlXKuGysLl2r8YRvKPO-CEM5XZoogLxmVa2pVzfw0nkNK7C-JFyQW5GcEfKta=s176-c-k-c0x00ffffff-no-rj,0.0
UgzYU6-zyXmvUGjFeYZ4AaABAg,Mélenchon ✊ Macron and Lepen 👎👎👎,15 hours ago,El Passeur,UC8dsdyBjVRlwqxWN-FsU6zg,0,https://yt3.ggpht.com/U_5u4_xdGgl8D2kgRvhxVzmz7R7dLmg811cjOK8uT93N6oLYmZ_2UCvbVcfoCyl6_ImQCvgMSg=s176-c-k-c0x00ffffff-no-rj,0.0
UgxsSH2fd64nqt536EJ4AaABAg,"Macron and his government are puppets of the World Economic Forum. Their Founder, Klaus Schwab said so himself.",16 hours ago,Libertas,UC9wnNsH9ebVugn2UovP3SQA,1,https://yt3.ggpht.com/ytc/AKedOLS0_psxAXisEAR8NgUUohAxu7TyNcY4v5Xelg=s176-c-k-c0x00ffffff-no-rj,0.0
UgzX39AK0e6AK5qtpcl4AaABAg,Pen is a terrorist !!,18 hours ago,Heartless Love,UCTyIFjo8Nsur1Wm9IGw7I7g,0,https://yt3.ggpht.com/ytc/AKedOLQBPXumFbv_wQJL_pQXYNMdohWwH3ixmXKPELER1w=s176-c-k-c0x00ffffff-no-rj,0.0
UgzHqfWf3qpfX721zBx4AaABAg,Same problem as america. Address the little cheating issues and le pen will win.,21 hours ago,Frank Fucwit,UCI-bScCZMzh0JjeoTP4VZyg,0,https://yt3.ggpht.com/ytc/AKedOLQoVEYXgSdZle4zvxzdVztHA-0miv928YTa1fkl6ZlDI8HrbmsqXti3bBb_Mw0L=s176-c-k-c0x00ffffff-no-rj,0.0
Ugz_Am3W0kASAUFMI654AaABAg,Macaroni scumbag Le Pen winner!!!!!,1 day ago,Rollo Kline,UCcWG3HxhcbljMgggQ2gkSZg,0,https://yt3.ggpht.com/lmTsbxtGAUa2ymV3H71KQntV6ccBrkzJYoi34KQnN3_q215CVmYttl-PNKrYF2gB7X9tCX4bgA=s176-c-k-c0x00ffffff-no-rj,0.0
Ugzi9JBzXUh4zwiw-pB4AaABAg,how to lose   an election by marie le pen  i intend to take france out of nato !!!,1 day ago,David Collins,UCRs2r2uVb0b4XNK8IhXRfQg,0,https://yt3.ggpht.com/ytc/AKedOLTqBVlrHkiFA0A9Q6P3fNPnG5ktzB-TNVdTzd0HvSrcdNOljqa4ESkVawfuFHi2=s176-c-k-c0x00ffffff-no-rj,0.0
Ugz44-wmLe3j6S2WdHJ4AaABAg,Macron will just scrape thru and win another term,1 day ago,Ganesh ram,UC6EeXD44_xRJQcBtekrmw0g,0,https://yt3.ggpht.com/ytc/AKedOLQHB6ypEJ_y5mL0nu7K1d0ciooJgl43Ao5INakNOg=s176-c-k-c0x00ffffff-no-rj,0.0
Ugxr90J_3Vm0dVgyXGB4AaABAg,How can she have extremist views if almost half the people vote for her ????,1 day ago,AP,UCWaUV0eVKroobp8WCVPH-5A,0,https://yt3.ggpht.com/ctn0_G8CpfvnYfqjB_pADI-WSfL6UttbZYL_hyDA1DZMBTodjqqUxvq6ZNXRBpnKL3-roBCNgw=s176-c-k-c0x00ffffff-no-rj,0.0
UgyamtlZ0p4a3BbNebp4AaABAg,Seems covid is gone for now as they are not wearing masks. I hope they won't start locking everywhere down when covid re-emerges,1 day ago,Samuel Oluwagbenga,UC1yTJeK7rCWSABOyUgyCL7Q,0,https://yt3.ggpht.com/ytc/AKedOLSarGw0B3I_K3wtWcuC6kR3fCxPXwoROPmrgA1l=s176-c-k-c0x00ffffff-no-rj,0.0
UgxPuLwgq3ME3qNLKex4AaABAg,Manny Pacquiao for President,1 day ago,Kursk Wunderkammer,UCP18lLiqNqRo5HpTIsVRCDw,0,https://yt3.ggpht.com/ytc/AKedOLQFZBpChN7tTi20UKuK1XTajMA86v94xgrHCA=s176-c-k-c0x00ffffff-no-rj,0.0
Ugy1U3zBOU1fGWxMKxF4AaABAg,MARINE LE PEN the new france president 101%,1 day ago,john cruz,UCcxwJnHTbl3YSv-ST5eZd0Q,3,https://yt3.ggpht.com/ytc/AKedOLSmAXPHp7nfD29cZRc59RYS3jM-xGTYd1HuCti6OCm8focTi_AdqrXoZWQ7rLyD=s176-c-k-c0x00ffffff-no-rj,0.0
UgyvJb54fqJlaC0dhw94AaABAg,Marine to win. She must beat that globalist macron.,1 day ago,Tom Higgins,UCz_fuSyphPmoXcKf2c6Ih_A,0,https://yt3.ggpht.com/ytc/AKedOLTgqp3OjnhLvnr2HaRyAJwji8YP7oCNS2XJnQ=s176-c-k-c0x00ffffff-no-rj,0.0
UgwWAebVAW8rmDiwCzZ4AaABAg,"She's fighting an uphill battle.
The French don't want a woman as President. Even political enemies will unite to try and stop her from getting the vote.
They're misled misogynists who will unite for selfish reasons.
Its time the Elysée got a brave woman to tell them to shove it.",1 day ago,John Davies,UCVAbDwDvtWLOhJ-PziofOVw,0,https://yt3.ggpht.com/ytc/AKedOLRnb_3CYUo6HacdEPjaDL7_sbppKBc-qA8LQg=s176-c-k-c0x00ffffff-no-rj,0.0
UgyqDAXxv2qo7pDdoN14AaABAg,After leaving NATO France could implement its foreign policy which is solely based on the geopolitical interest of France and not based on USA's,1 day ago,USA:Syria Japan Iraq war criminal,UCYaEpk73K3TGddAEbMH2Edw,8,https://yt3.ggpht.com/ytc/AKedOLSs2QQR69yD0wtjVnbAqYokYYvFriaPAp9vrAw8_g=s176-c-k-c0x00ffffff-no-rj,0.0
Ugz9OyvgIYl4JoXLKiB4AaABAg,Le pen 👍,1 day ago,Nobita Nobi,UCfTQiUquZMMvqK5fzqTAkYw,3,https://yt3.ggpht.com/5c8-1UUgcLnkaPBhfCcGpzkRiM0P2MFPDCggzh4BAFMFJicBm8a5y5uwK164Xmluv-JrvC2w=s176-c-k-c0x00ffffff-no-rj,0.0
Ugw0rmxTA7iQGEQuw954AaABAg,MARINE for the top job!,1 day ago,Paul Faigl,UCAnEvakSamsDLqDkaWnXfGw,1,https://yt3.ggpht.com/ytc/AKedOLQ9KchvSVDs0Bqw6mhZJ8muksGAVuOgH9_w4FrW=s176-c-k-c0x00ffffff-no-rj,0.0
UgzLrmIpy1QTUMIetaV4AaABAg,My vote go for macron,1 day ago,Zoe Zoe,UCFyX6rF3geg0SwhPthcCOnQ,0,https://yt3.ggpht.com/Gnzvok5pqrDkwDZSSpqu3OILjzuEVU1_lBx0wTkAMO1-KSBtwzpLxbWIbTfV4doXWt1tYuUS9A=s176-c-k-c0x00ffffff-no-rj,0.0
UgxszwLvGstQeKwJMTp4AaABAg,The weekend debate will decide the winner.Both are now into ending Nato domination and against Isolating Russia.,1 day ago,Aron Aronite,UC0n3GYJHsRqfnmhP1AkHwgQ,1,https://yt3.ggpht.com/ytc/AKedOLTh1vHMMGstXyTlTK2hupxZnlHvfjsJ4zLmxSrF9Q=s176-c-k-c0x00ffffff-no-rj,0.0
UgwD4z3YXPM1DjasFBp4AaABAg,They won't allow Le Pen to be president,1 day ago,Artus,UCkD7p9nswaQWByADNwFL2fQ,0,https://yt3.ggpht.com/yjXF1fixY5HgEi-qTqdcEK1XsP7cOfXzPkQyPkkMPGW0efFfpoya0kO5pQVrVZKKoFt4-giO=s176-c-k-c0x00ffffff-no-rj,0.0
Ugznrq3s9c0jXsmZBCt4AaABAg,Free EU from Nato 💪,1 day ago,mie AR,UC77OzZcOeG4eewmJBxZ4QkA,1,https://yt3.ggpht.com/ytc/AKedOLQUPY37Hh1QurAydN_cdbItehaO1TPpfzd45ZJsvQ=s176-c-k-c0x00ffffff-no-rj,0.0
UgxnvlvhnH96g0_bhQZ4AaABAg,Pen keep it up.,1 day ago,Thomas Tan,UCACSL-1yjxx8o8sxTbHhdig,0,https://yt3.ggpht.com/ytc/AKedOLRuaiAUsO1pTylwzG-BVZtplqaSjJMUtLGCNK8LSQ=s176-c-k-c0x00ffffff-no-rj,0.0
UgwX2IdfNcTw9Dm7ah94AaABAg,"What we would like to know is why French women are now abused denigrated by men from their own country,by black women and by people all around the world! Any answers!!!?",1 day ago,Laetitia Perrot,UCitLd4XziFY1BSW4xInaSLA,0,https://yt3.ggpht.com/ytc/AKedOLTMQ7-HjvNkiIacJ6TC8dRfr5KR2_bqyQSJwA=s176-c-k-c0x00ffffff-no-rj,0.0
Ugy_XM1tcYeV28sZk8l4AaABAg,"Momentum is on Le Pen......she will win, if she promises to get out of NATO...

Le Pen   vs.    Le Fool",1 day ago,Ramon Ng,UC7r1huBn1w-iZ95s-fD9P2g,6,https://yt3.ggpht.com/ytc/AKedOLRFmE352PEmgugx7yjxbdtYZhMLPle4Oa-R_sYxqRB2W6vxfXfI2CUjCxteY-Wb=s176-c-k-c0x00ffffff-no-rj,0.0
Ugxq5WVXblq0WXrEhbJ4AaABAg,Mr Frc during any idea capital group of OILS AND INDUSTRY  ACCOUNT OF  IS  DA MAN IS  CANADA HOME VVIP  TO LIVE TO  FRC  YOUR  YA,1 day ago,Prabakran Kathirvel,UCnLfnRqcEPTg1i_pkgXVIlg,0,https://yt3.ggpht.com/ytc/AKedOLSg0q712gJX67tr07r3C2Oze4PWmUQ7_nSXt77G1Jw_HTFIIjRQRmF-qpHbhQ0w=s176-c-k-c0x00ffffff-no-rj,0.0
UgwdpnNxDILF0n488mZ4AaABAg,"Some French people like to think of themselves as progressive but France is really the only major power of Western Europe that hasn't had a female president. Of course, the gender of the candidate isn't a priority but I think before the French judge and criticize other countries on issues of women's rights, they should look in the mirror and practice what they preach.",1 day ago,Ernest Avocado,UCAIyxnmYfjvdGaIQDgwEOXQ,5,https://yt3.ggpht.com/ytc/AKedOLRugRC_KpHKo5HP37wTYxCbg7502dLqaydkEWTe=s176-c-k-c0x00ffffff-no-rj,0.0
Ugzehjm2hCRvooainzh4AaABAg,They gonna use those vote rigging machines like in 2020,1 day ago,minititan,UCNReIqlC2l0REfx0hzOp_FQ,0,https://yt3.ggpht.com/ytc/AKedOLQ59mwW0QfVWDkTVHvHUCIwcH984RQ_ktsUjA=s176-c-k-c0x00ffffff-no-rj,0.0
UgzQSxy_kzwkb09H2-h4AaABAg,I hope La PEN wins!,1 day ago,Barbara Seidel,UCstZZn9LydrXjUvMe4rtJGA,6,https://yt3.ggpht.com/ytc/AKedOLSMTNafC3GGyBLkVz3igpaexTjgM-9WQlK_OEJTHeeIxmLBntDMmHXONqd6K2rA=s176-c-k-c0x00ffffff-no-rj,0.0
UgyYhaXoEI7jYOK2hCJ4AaABAg,"Where is Palki, this  newchick sucks, she always sounds like she is whining, Palki's voice is faaaaaaaaaaaaaaaaaaaaaaaaaaaaaaar better",1 day ago (edited),ramboram03,UCXAW20skZsv5Ag1J6y20RpQ,0,https://yt3.ggpht.com/ytc/AKedOLThv_QrvkkVLuROfxNO3OX0P2jbDjb1kSxMJY-d=s176-c-k-c0x00ffffff-no-rj,0.0
UgyzRmz8M1BDo0Qifkx4AaABAg,Student “dreams of being a politician” 🤣🤣. Clearly a very low bar.,1 day ago,g a,UCEtqAauyiGPLmKs7byeoUQg,1,https://yt3.ggpht.com/ytc/AKedOLQU8Rw-ZZRC3c_VU3wD3ImQpEHmpNSiJHR7CA=s176-c-k-c0x00ffffff-no-rj,0.0
UgzILwNwjHxFpQc5xat4AaABAg,MLP💙💙💙😘😘😘,1 day ago,KingMaker,UCfY3auTVNoRvNJB883w7fSA,2,https://yt3.ggpht.com/ytc/AKedOLShJFXg-QNRitc-9qHyZwwQ7HauvDGtRIdemr6p3A=s176-c-k-c0x00ffffff-no-rj,0.0
UgzboF7HmLGZFBTTRqJ4AaABAg,First women president in the history of France,1 day ago,KingMaker,UCfY3auTVNoRvNJB883w7fSA,1,https://yt3.ggpht.com/ytc/AKedOLShJFXg-QNRitc-9qHyZwwQ7HauvDGtRIdemr6p3A=s176-c-k-c0x00ffffff-no-rj,0.0
UgyqDAXxv2qo7pDdoN14AaABAg.9_puPe3aP-T9_sEt9OBWg6,Usa is only country to use nuclear weapons not once but twice,11 hours ago,Aslam Pervez,UCOzRU_EQHoz3qXRJtmM_uIw,0,https://yt3.ggpht.com/ytc/AKedOLSf1SaChmKd0twC7AuRD0k1MzRkJVAv_KwzfQO2EEjHMCQXknLPhYCTQcfTaVOx=s176-c-k-c0x00ffffff-no-rj,0.0
UgwdpnNxDILF0n488mZ4AaABAg.9_phsEyPJIK9_poptlHmVl,If you believe gender doesn’t matter for candidates…. Why bring it up?  🤷‍♂️,1 day ago,Christopher Manabat,UCIfFo61iBSD6foByW538d-w,0,https://yt3.ggpht.com/ytc/AKedOLQOp7dfwo18yUUhWnDEg0vDk9gG2AMxEusFhb8ILg=s176-c-k-c0x00ffffff-no-rj,0.0
UgxXnyIQpx52scbr5Vh4AaABAg,"Marine le pen
Iron lady
Patriot
Queen
Phoenix",1 day ago,KingMaker,UCfY3auTVNoRvNJB883w7fSA,4,https://yt3.ggpht.com/ytc/AKedOLShJFXg-QNRitc-9qHyZwwQ7HauvDGtRIdemr6p3A=s176-c-k-c0x00ffffff-no-rj,0.0
Ugw62DbS9empvCPYgLF4AaABAg,Vote for Macron a political catastrophe and global threat,1 day ago,KingMaker,UCfY3auTVNoRvNJB883w7fSA,1,https://yt3.ggpht.com/ytc/AKedOLShJFXg-QNRitc-9qHyZwwQ7HauvDGtRIdemr6p3A=s176-c-k-c0x00ffffff-no-rj,0.0
UgzR8bfHsHmqRw6RA5N4AaABAg,Macron disaster performance,1 day ago,KingMaker,UCfY3auTVNoRvNJB883w7fSA,0,https://yt3.ggpht.com/ytc/AKedOLShJFXg-QNRitc-9qHyZwwQ7HauvDGtRIdemr6p3A=s176-c-k-c0x00ffffff-no-rj,0.0
UgzoUwoFieKSnERSRWl4AaABAg,Le Pen for Extremely Express is called: LUDICROUS SPEED!,1 day ago,Sun Vulcan Sun Vulcan,UC8mSXjRhVkvVoKVf1auTrLw,4,https://yt3.ggpht.com/ytc/AKedOLTn02gOQBvxLjINlRYehIosXZlxzZwp0aUA26nM=s176-c-k-c0x00ffffff-no-rj,0.0
UgxyP09autqwdiw7wap4AaABAg,"Vive Presidente Le PEN
Vive la France!
YG",1 day ago,George Omaha,UCBNvljcvW6e14gmrODtXP3A,7,https://yt3.ggpht.com/ytc/AKedOLTNmraHGOTsJ_vSpoXKJMln-x_SwB6nS2L_lA=s176-c-k-c0x00ffffff-no-rj,0.0
Ugz8EMm09ABq2yYghdJ4AaABAg,"did they say yet she is ""threat to democracy""? 🤡 Vive Le Pen!!!",1 day ago,Peter M,UCN3-KEiMZSQz-EQ4DhOSjOw,1,https://yt3.ggpht.com/ytc/AKedOLTQwCX8k56wxJOX9yaFoKEml2tSu-AUwsi2nNpYqw=s176-c-k-c0x00ffffff-no-rj,0.0
Ugx-XwH5eeKk5WuQDPh4AaABAg,Who has the final word!,1 day ago,Raju podiyan,UCgE2UQpz-fgNEQr7zE5NARA,0,https://yt3.ggpht.com/ytc/AKedOLT9ZIKk_9wMm0X_GZD8d6y5QBDvXCYyu0-AWQ=s176-c-k-c0x00ffffff-no-rj,0.0
UgxzSbJBQnL_2_azgUt4AaABAg,ABAJO LOS MANDATOS MACRONIANOS ABUSIVOS,1 day ago,Cjvkck Uhlgugoj,UCzPp26iQXeMRzczoSbYfsEA,0,https://yt3.ggpht.com/ytc/AKedOLTsXN-D_5D4m2D21CWMiKER0hLMilmsIaxLlA=s176-c-k-c0x00ffffff-no-rj,0.0
UgzNUAxZnbg3NE5vXYx4AaABAg,"History
What cause world war 3
Expansion of NATO led by US 👍",1 day ago,Ronal Mongz,UC5Sf845t_YYDJYHDiSGmBgw,0,https://yt3.ggpht.com/ytc/AKedOLT9c-vqdzKeFHGhTAJFPSLSjg1vC4z-mkmTIMfE6yKFFZWLU3dc_Y06FpLeHDGg=s176-c-k-c0x00ffffff-no-rj,0.0
UgzZAEsa0etJgZER-ah4AaABAg,Yes NATO should be Banned 👍✌️,1 day ago,Ronal Mongz,UC5Sf845t_YYDJYHDiSGmBgw,5,https://yt3.ggpht.com/ytc/AKedOLT9c-vqdzKeFHGhTAJFPSLSjg1vC4z-mkmTIMfE6yKFFZWLU3dc_Y06FpLeHDGg=s176-c-k-c0x00ffffff-no-rj,0.0
Ugw9UnEcg049pWZXUVZ4AaABAg,Le pen still wait for three decades to win,1 day ago,Sonam Lama,UCRE1UqDd8UFePFwYe6P4iAQ,0,https://yt3.ggpht.com/ytc/AKedOLScFth9F74pclMd25yuSJhEGPo9VJQSaOqElQ=s176-c-k-c0x00ffffff-no-rj,0.0
UgxxzNL2KXuZZpevich4AaABAg,Who will win? French people or migrants and LSBTQ?,1 day ago,Anatoly Alperovich,UCOC-iGX5YLAjj2PjnlhFsPQ,3,https://yt3.ggpht.com/ytc/AKedOLQ7YtkvWhTGTDdcT5JMX4XMSgZjQaszpr7dbAVE4A=s176-c-k-c0x00ffffff-no-rj,0.0
UgxDyFx88nQ7StBKu-14AaABAg,"Palki Sharma we love you!
Be safe!!",1 day ago,productionsbyo,UC2w5NibZTSmdH6KWFkzu_Uw,1,https://yt3.ggpht.com/ytc/AKedOLS54Ezc0N-GdXsVOxLyz6VFpPGKAeNz3AnqHhdMUh8TWlUM53BKs-m4U6pfngze=s176-c-k-c0x00ffffff-no-rj,0.0
UgzOaT-KPOfH6QG0Ocx4AaABAg,Marin will win..,1 day ago,tatjana simic,UCitFubPgrOU_MfXAEddM_3w,6,https://yt3.ggpht.com/ytc/AKedOLSz7PZmujPeah4w9OQNI1B4fjV-2yggeT_C_w=s176-c-k-c0x00ffffff-no-rj,0.0
UgzzfknqKwJpSHTGS094AaABAg,Where is palki sharma?,1 day ago,productionsbyo,UC2w5NibZTSmdH6KWFkzu_Uw,0,https://yt3.ggpht.com/ytc/AKedOLS54Ezc0N-GdXsVOxLyz6VFpPGKAeNz3AnqHhdMUh8TWlUM53BKs-m4U6pfngze=s176-c-k-c0x00ffffff-no-rj,0.0
UgxYYi5r7NL4lhnCJTx4AaABAg,Snails and smelly cheese😂,1 day ago,Explore London,UCcgdfmZ6FzXU0tEVPBzzCkA,0,https://yt3.ggpht.com/ytc/AKedOLQ19B_u2kOsr3OTwqSk9cWPu2AeyRAymOiUbA=s176-c-k-c0x00ffffff-no-rj,0.0
Ugyu_We2qo70unIel1l4AaABAg,Le pen ✊✊✊✊,1 day ago,में,UCuJ7hhgQeWhKP4HjRt9QoyA,16,https://yt3.ggpht.com/_7EtFAQ6OVZ22ysnrxDGyxfV3p-vtUO6wAjZKLSJBXybUeHfDnRpiXTW0VoEM_dIcreL3YJJ=s176-c-k-c0x00ffffff-no-rj,0.0
UgwHpg-Lxz-F8uA-EXJ4AaABAg,Le Pen bcuz she opens the door for NATO-free Europe and also for her tendency to make peace between Russia and Ukraine.,1 day ago,Rounak Shaw,UC2onPh3Xdh-bgjiW7AVBb9A,29,https://yt3.ggpht.com/ytc/AKedOLQb0PVFz5oDVnb3QDclMQeHSNcIn2F3mNCSIl64=s176-c-k-c0x00ffffff-no-rj,0.0
UgxtUb4GE4uPWCOUTuF4AaABAg,LE PEN LE PEN LE PEN !!!,1 day ago,NalaLin,UCS7OgS3khAjWlL8de05sU0A,9,https://yt3.ggpht.com/ytc/AKedOLSBXmP2hjx2dPcrusaZMA5mj5xmT4iKl71qW_2M=s176-c-k-c0x00ffffff-no-rj,0.0
UgwHpg-Lxz-F8uA-EXJ4AaABAg.9_pRCcUACah9_t6iKr2y3I,So where is democracy.  People wants to be free.,3 hours ago,Suzy Girl,UCXkg-3LbmmOdGsi_zTMK69g,0,https://yt3.ggpht.com/ytc/AKedOLSKNWnpawqrwGF_agwHS_zaoVdbDo5CTYgagA=s176-c-k-c0x00ffffff-no-rj,0.0
UgxtUb4GE4uPWCOUTuF4AaABAg.9_pRC79jn5J9_q-86FXJcW,In Hindi language you r selling pen 😂😂,1 day ago,Warlock,UCDbKS_xPmF8gXNPJCi8mbnA,1,https://yt3.ggpht.com/qLTVS3bqG-5If-ZfW2nQlwdWPH14MWekhP04AU8k-yoJqidpt_awro60ZPL1y_MWmIFRq_Jy=s176-c-k-c0x00ffffff-no-rj,0.0
UgxtUb4GE4uPWCOUTuF4AaABAg.9_pRC79jn5J9_sKNO4HjOh, @Warlock  ahahaha amazing!!!,10 hours ago,NalaLin,UCS7OgS3khAjWlL8de05sU0A,1,https://yt3.ggpht.com/ytc/AKedOLSBXmP2hjx2dPcrusaZMA5mj5xmT4iKl71qW_2M=s176-c-k-c0x00ffffff-no-rj,0.0
Ugz7frnTmBn6OZebK5V4AaABAg,"Putin makes Mariupol an Aleppo.  Also drops chemical weapons, thus Sub has to explain this to the Russian Ship Moskva.  Soon all NATO Subs have to Explain everything to Putin. Le Pen is an IDIOT!",1 day ago (edited),Elvis King,UCLTLuY7jnAnVnwreQYRxDeg,0,https://yt3.ggpht.com/ytc/AKedOLRQFaigP6HK0CD_WumkrWmBbrGMfKO4IVo6Hg=s176-c-k-c0x00ffffff-no-rj,0.0
UgyBiWilXhZiTMnbbQ94AaABAg,Le Pen is a false dream,1 day ago,John Reed ,UCDxj4qZT6DHqpOeeEyQCvyQ,1,https://yt3.ggpht.com/5k2drJd9hXXKhf423YFL01uXiEAC1sWRd_jAvzBN4NgcX6Y_Z0AZsxIFbq0DNCKFeGMV6RJI4yM=s176-c-k-c0x00ffffff-no-rj,0.0
Ugxg3XLJ1dtMlWmzkZF4AaABAg,Letts goooo l3 pen,1 day ago,Sesharatnam Venigalla,UC_-7Q-ay8BzcyJOMpqPilMA,5,https://yt3.ggpht.com/ytc/AKedOLS-JkS_feZXypHhczJOKUxE3CMCLC_vwaKux-crfSToTVTST9-FUY3kCVSeFEZ0=s176-c-k-c0x00ffffff-no-rj,0.0
Ugy7BVGR1hU7Opv7gGd4AaABAg,France saw Macron's 5 years and the nation was bullied by US and Australia. France needs a new leader. Marine is the person who can lead for the great nation forward. NATO is an outdated and bully club and should be dismantled. France should leave NATO and EU. There is no value by in these clubs. Best wishes Marine Le Pen.,1 day ago,Lion Victor99,UCH_4yhyPiPIBCrnEAJ5H-FQ,0,https://yt3.ggpht.com/ytc/AKedOLTuM0oW1eSjzGZjZgcPy0K-gvvW7EZtXClqT7u5Xg=s176-c-k-c0x00ffffff-no-rj,0.0
UgySZ38pCa4qEFpypod4AaABAg,"Le pen will be a disaster. 
Not my concern tho. Just sayin'.🥱",1 day ago,Mahiya Hassen,UCF_CpMCDJ45YjUIq7229t0g,1,https://yt3.ggpht.com/ytc/AKedOLTEjgI0J3-rNS5tQN8-wiSfbH_9vF9Iy5iqGMdO=s176-c-k-c0x00ffffff-no-rj,0.0
UgxWEA9GfsA0cvzqCB94AaABAg,I like Marine ♥️,1 day ago,Nick Pope,UCFpAWleEtqk3QI8oHHW29eg,19,https://yt3.ggpht.com/24PeLCdI5IxU4IxaXapWF9_fg2cF6We1bZ-PTnsCpeUXXOq0tm_D4b3PE_JaEWsWf-vVJ2Qd=s176-c-k-c0x00ffffff-no-rj,0.0
UgyTT8xX2rvQn71fRvt4AaABAg,"Yes LePen!!!
Not far right or extreme",1 day ago,Annetta Jensen,UCWBSpKOvbxbewoA7ZvjGYcg,16,https://yt3.ggpht.com/ytc/AKedOLSYge_DhEuG3FMVMVDb-NAUIIy8wdGWc2STkEfn=s176-c-k-c0x00ffffff-no-rj,0.0
UgyBnS2gZMm6XFcB8jB4AaABAg,"Go Le pen. Macron, while criticking Biden, is in, on nato plan to expand Ukraine war to include NATO. Le pen may just save Europe from a war that devastates it but not US",1 day ago,Fidel Thaddeus Borja,UC4aD4ZlqAiUa9qFMEpCTVpg,0,https://yt3.ggpht.com/ytc/AKedOLSVNC2oBPj1nTqgJTekcIk4QIpR47g04b41GQ=s176-c-k-c0x00ffffff-no-rj,0.0
UgzBrDQ7Q6AvQlFWPwx4AaABAg,"Fox News mentionne que les catastrophes sous les démocrates américains atteignent des niveaux bibliques : cela donne à chacun la possibilité d'être factuel sur les liens entre la spiritualité, les religions, l'utilisation authentique de la science et la politique. Cela ne signifie pas qu'il ne devrait y avoir aucune distinction entre l'État. et religions sur le terrain, cela signifie simplement que cela ne devrait être fait qu'à un niveau analytique. Les sciences nous aident avec des abstractions qui peuvent servir à d'autres fins que la manipulation des gens. La Spiritualité Laïque n'est attachée à aucune Religion spécifique mais peut être utilisée comme un bouclier protecteur pour des expressions et des Cultes libres et respectueux. La science, l'argent et les armes sont des outils qui n'ont ni esprit ni âme !",1 day ago,Patrice Lauverjon,UCLqFzX8R6QxJ0K3iIKhQHqw,0,https://yt3.ggpht.com/ytc/AKedOLTFi3DAAW_IvVynb-x1VH3G9Yih_r0EiR4ZwDfxbEYxDg7J3oyM_Rukzk0BXMlZ=s176-c-k-c0x00ffffff-no-rj,0.0
UgyNdVBym82PnoRaXeR4AaABAg,Don’t believe polls,1 day ago,Gerald Croft,UCkyxqaVTe5gsNTZJ7OyhOVw,0,https://yt3.ggpht.com/ytc/AKedOLTyjsz94B9RIJ7uNH-Ruk8a1CAt41BsqDRVuA=s176-c-k-c0x00ffffff-no-rj,0.0
UgzFN2Wz3Nl4uBXSNBV4AaABAg,The only way to save France is by macabron losing!,1 day ago,T0NI x M0NSTER,UC9y1JVg7COKeTrHpiUW1kHw,0,https://yt3.ggpht.com/fLFhkuSGY5u7PXOcqb4KYdVXsPSS0UjHr_YP2q8IHpj2EVffexnSBKCJ-E-3QLitpL1XqADj=s176-c-k-c0x00ffffff-no-rj,0.0
UgynRhFYPJoICiYY2Ox4AaABAg,😃,1 day ago,Melchor Bangaoil,UC6jAl1kCYMbeTWkT5xb8_Uw,0,https://yt3.ggpht.com/ytc/AKedOLTovYuKvrViTgm0Am3J_7QgOFSlMT6o9X7QAlP-U86BKI5cvkRVjO0nWxLDRquu=s176-c-k-c0x00ffffff-no-rj,0.0
UgxiL4CnZDL6H5WUg_Z4AaABAg,Le Pen,1 day ago,Gerald Croft,UCkyxqaVTe5gsNTZJ7OyhOVw,18,https://yt3.ggpht.com/ytc/AKedOLTyjsz94B9RIJ7uNH-Ruk8a1CAt41BsqDRVuA=s176-c-k-c0x00ffffff-no-rj,0.0
Ugwo7T8LuxGnopAHvOV4AaABAg,Le pen should win,1 day ago,Legacy rider,UCJQzDh0RehFlIexGAhRKcVw,15,https://yt3.ggpht.com/ytc/AKedOLQQBr0psk2dqSSwirUFhy1Xui7hULFVWo-FE6T46A=s176-c-k-c0x00ffffff-no-rj,0.0
Ugz4K9Io2-L1JjKYD1h4AaABAg,Lets go Le Pen! Show the globalists WHO IS BOSS,1 day ago,PapaBetadine,UCgKj2ZVN6rKTAlTxUjo42Og,25,https://yt3.ggpht.com/2nU-B6yZd51_pfTsDrsVPspbGduOJkV4eW8EYLdew0Q15zCWpbjtwt8sUJIqUQp8AULvcCDhHg=s176-c-k-c0x00ffffff-no-rj,0.0
UgziPd8omhPNLWMjl0B4AaABAg,Mélenchon ✊ !!!!,1 day ago,El Passeur,UC8dsdyBjVRlwqxWN-FsU6zg,2,https://yt3.ggpht.com/U_5u4_xdGgl8D2kgRvhxVzmz7R7dLmg811cjOK8uT93N6oLYmZ_2UCvbVcfoCyl6_ImQCvgMSg=s176-c-k-c0x00ffffff-no-rj,0.0
Ugx6ouQHYysZ7aT1nvh4AaABAg,"The woman is far right Putin lover! She is dangerous as Putin, Hitler. Stop all run all over the world!",1 day ago,K Butler,UCYgBCFonNmsE38Fbgw3rBCQ,0,https://yt3.ggpht.com/ytc/AKedOLTblVBrp-cf9ENngzOFhYWEfYMyUxE-q_-WVV0OWg=s176-c-k-c0x00ffffff-no-rj,0.0
Ugxe7b-FOXo5s5fS56d4AaABAg,Russia will win againts NATO aggression....,1 day ago,Dante Mejos,UC_XqHSNrVZuW684ubV9gF7g,0,https://yt3.ggpht.com/ytc/AKedOLROMAgHdsgKYX2vVz4YH-KGy_U6FriQ07g-DQ=s176-c-k-c0x00ffffff-no-rj,0.0
UgzU6czmEWHYHhoYSEh4AaABAg,"Joseph ""Joe"" Ira Dassin still is the legendary martyred president of France 🇫🇷 🙌",1 day ago,Yariel Rivas,UCjM804Mdf9ddOyjTHKX4AXQ,3,https://yt3.ggpht.com/Nue4R3SgT1FRQT2PFDDL4cbTb8cwVRNatihMF8fBI87hyuYQiAqXI3jowDpK_MCJmjpvpTH4Jfs=s176-c-k-c0x00ffffff-no-rj,0.0
Ugzz7iSua7wQbLcP_4l4AaABAg,Come on France.  This is your opportunity to START CHANGE..,1 day ago,Peter,UCkElO4ilS73yHQDMzQpz3Ng,15,https://yt3.ggpht.com/ytc/AKedOLQekggVfxRM9F3fGfIXO6KKt9j49kgaJT3nJ_AnxB1ZxPHQaHZm_vb9L3BOILcE=s176-c-k-c0x00ffffff-no-rj,0.0
Ugy7BVGR1hU7Opv7gGd4AaABAg.9_pOU_-ga-T9_pQvWnYRZc,But he had sell hundreds of Rafale fighters to many countries that had not happened earlier.,1 day ago,Harshit Garg,UCOsmdgY1mm70rHGc2M3fggw,0,https://yt3.ggpht.com/ytc/AKedOLTAQ7COpcIQaKR0TSOPwp8TKXRnEzFE-g50Ow=s176-c-k-c0x00ffffff-no-rj,0.0
UgzBrDQ7Q6AvQlFWPwx4AaABAg.9_pLzgOlV-O9_pP5ttUb9m,La science rend la vie plus supportable et comfortable,1 day ago,Seeman Prabhakaran,UCf5X-ohKn0aD_GZT-f5vxuQ,0,https://yt3.ggpht.com/ytc/AKedOLQvRrf0OqzwImUr8NT18yiaUQCzC3wKV1m1nbENL6JdkGoLjJ6RsQEsBX7ljWZz=s176-c-k-c0x00ffffff-no-rj,0.0
UgzBrDQ7Q6AvQlFWPwx4AaABAg.9_pLzgOlV-O9_pRri6wkF5,"firstly, I don't understand french, but I translated your comment in English to get your views. What you commented is absolutely right and eye-catching. 

premièrement, je ne comprends pas le français, mais j'ai traduit votre commentaire en anglais pour avoir votre avis. Ce que vous avez commenté est tout à fait juste et accrocheur.",1 day ago,Rounak Shaw,UC2onPh3Xdh-bgjiW7AVBb9A,1,https://yt3.ggpht.com/ytc/AKedOLQb0PVFz5oDVnb3QDclMQeHSNcIn2F3mNCSIl64=s176-c-k-c0x00ffffff-no-rj,0.0
UgzBrDQ7Q6AvQlFWPwx4AaABAg.9_pLzgOlV-O9_pSlKo7S4R," @Rounak Shaw  Thank you so much for going through the effort of translating! I share my latest  oomment in English for you:
The word Psychology cannot be as scary when we realise we live it day after day, as it is present even when we think we leave it behind. Quiet moments and busy moments have all psy contents.

Starting from here makes it easier to climb up the hierarchy of needs of Maslow with confidence. Indeed confidence and gratitude are the keys helping through despair and expanding positive moments. Universal Values tell us is that storms and cyclones are events that do not destroy the overall balance, so they are backed up by an unreachable infinite system. Trying hard to penetrate the absolute can be harmful while going along with what is accessible, using knowledge and feelings, is a much easier path towards being ourselves. I looked for God and never found him or her, I looked for myself and enjoyed going along with Universal Values. As a reminder: Nature is the earthen language of the Universe. Recycling is not about science it is about working at our own image in win win terms",1 day ago,Patrice Lauverjon,UCLqFzX8R6QxJ0K3iIKhQHqw,1,https://yt3.ggpht.com/ytc/AKedOLTFi3DAAW_IvVynb-x1VH3G9Yih_r0EiR4ZwDfxbEYxDg7J3oyM_Rukzk0BXMlZ=s176-c-k-c0x00ffffff-no-rj,0.0
Ugzz7iSua7wQbLcP_4l4AaABAg.9_pJVqoVcHe9_pRB3rlhgy,LE PEN LE PEN LE PEN!!,1 day ago,NalaLin,UCS7OgS3khAjWlL8de05sU0A,2,https://yt3.ggpht.com/ytc/AKedOLSBXmP2hjx2dPcrusaZMA5mj5xmT4iKl71qW_2M=s176-c-k-c0x00ffffff-no-rj,0.0
Ugzc2UhhXSkQDlCUoM94AaABAg,"Remember people it doesn't matter who votes, who matters is who counts the votes.",1 day ago,I'm Retarded,UCdTuVHY3FV7hiiKa3cjS69w,20,https://yt3.ggpht.com/ytc/AKedOLQUUgVqDqR5LGrMrw3bku_c0TyzcdNCmCystg=s176-c-k-c0x00ffffff-no-rj,0.0
Ugzb3iQKqGiUZ8s4gsJ4AaABAg,Macron still the best and he will win for sure,1 day ago,D. S. M,UCZ2-XGrvCqvnIssJ_nIbCCA,6,https://yt3.ggpht.com/CEgqEbQseemZ7fEsyJWiDERrjep-LKBt78qGmTxbcXICdCqmegKomN0kn__TgSSjRvXNp7vo=s176-c-k-c0x00ffffff-no-rj,0.0
