cid,text,time,author,channel,votes,photo,heart
UgwQdDwOTCMhh48N_uN4AaABAg,"►For personalized classes on stock market, please check [Last few seats left for March Batch]:
https://wisdomhatch.com/",1 month ago,Akshat Shrivastava,UCqW8jxh4tH1Z1sWPbkGWL4g,1,https://yt3.ggpht.com/VI0OvMwpPQPFGoHAQOHsvtEcFWg-_YzFBhoeohr2CRz1T21Ja4unTGte1Gz6TnDUgVX9wcOG=s176-c-k-c0x00ffffff-no-rj,0.0
UgwAVC5nIEkdZGAhmRB4AaABAg,Correction: The British Money Laundering Expert’s name is Oliver Bollough not Oliver Burro. He is a legend.,4 weeks ago,Sajan Sybell,UCzvaDPh8cR_r6nrzjdLzvqg,0,https://yt3.ggpht.com/ytc/AKedOLR9xMUhvmmqVR0e7mWqQyJbP8_sjB44RbZ7q-S71K0=s176-c-k-c0x00ffffff-no-rj,0.0
UgwqOXR56RQtTd4wmVd4AaABAg,There are richer politicians in India also it is just that their money is not accounted or counted (lol),1 month ago,Rahul SR,UCFWkGOfu8t4jP7Pq8mm2-Rg,0,https://yt3.ggpht.com/ytc/AKedOLR_r-87M4F6m4JXjEnRkpsfH8x-owpEQPLZQwxRVw=s176-c-k-c0x00ffffff-no-rj,0.0
Ugwjqs57frDfRrfQJp94AaABAg,Chor hai sala,1 month ago,Jainam Mehta,UChtJBWgDEmhDS_ZkPz398Gw,0,https://yt3.ggpht.com/ytc/AKedOLQhctzuTTVdtwuBIxq8CdEFUBD125aw8nhNcEBySA=s176-c-k-c0x00ffffff-no-rj,0.0
UgxFmDI-8a45TMqt6cN4AaABAg,You forgot Rahul Gandhi.. the great .. the king of corruption,1 month ago,Bandi gowtham,UCCHyiamJ5kn5UaNFeEOX_cg,1,https://yt3.ggpht.com/q1TXF_y1LpI-aRxt4rE7mtrQ6aJoFvJrK2IfK3FfUkV7OmKmkvMtEa6aa0eIoeZF0T_7CKfz0A=s176-c-k-c0x00ffffff-no-rj,0.0
Ugz6Ol9huvAscR687HR4AaABAg,KGB FSB BOSS FIR HOW LING...PROTECTION MONEY KICKBACKS 50 TO 75% FIR PSU SELL OFFS LIKE AIR INDIA TO RAWTAN TATA FOR ~FREE.,1 month ago,MON€¥ TALKIES: CRYPTOE!,UCeR6iyPA9TDei6q5rBbU_IA,0,https://yt3.ggpht.com/Xc6TDVlsrta3Nm9JKXm3hZivPUeECcxxj0waLSgVuqy2apV8YCEVn5WITxj1-KjuyJfEJpe0=s176-c-k-c0x00ffffff-no-rj,0.0
UgxAoBTf80DH5uSpEsh4AaABAg,pretty sure the queen has over a trillion,1 month ago,Saurav Banerjee,UCbTbOOxDkWSgs_lsM6QSI-w,0,https://yt3.ggpht.com/ytc/AKedOLQTrI9aXlU3BcauObUmFZ2jW4-4ImtBJGZiBSdW=s176-c-k-c0x00ffffff-no-rj,0.0
UgwZWgkCvYIF4LaHeTt4AaABAg,Kumarswamy and D K shivakumar from Karnataka have much more than that.. Many indian politicians are much richer than that,1 month ago,Jeevitha Jagadish,UCbd_sEWFYrXzVy3rrVUgNmw,1,https://yt3.ggpht.com/ytc/AKedOLQ-9jXsKPRdwFxM9SRFLiuHmsDWdpdtyG8VeGE6Eg=s176-c-k-c0x00ffffff-no-rj,0.0
UgwQDaHoduRvDNwlFtF4AaABAg,Ye bahut bada pagla hai isko kuch nahi pata sirf chutiye dekhte hai iska video,1 month ago,Value Investing Cash,UCHTa1pm_zBzKMydPr6-4FlA,0,https://yt3.ggpht.com/ytc/AKedOLQe51Wqsp_OvlSkXU_AY3ajMca0LjkvcInu1Tng_vAH0iwZmLundtsJ1m2se9nG=s176-c-k-c0x00ffffff-no-rj,0.0
UgyDY6m-rZYHn_tnQix4AaABAg,He is continuing with the war despite economic impact on Russia. Also all oligarchs have been affected. They are crying now. It is clear that he is the face of old guard or nationalists. Rest is just western propaganda,1 month ago,Krishna Prasad,UC9zCoZ6GXT-roAkUmx6nYqw,0,https://yt3.ggpht.com/ytc/AKedOLTYBskkeiyG8PabFkiYI1oedHwvDqgJOcdqCb-IVTU=s176-c-k-c0x00ffffff-no-rj,0.0
Ugyg-3NpNklcrWYI7aJ4AaABAg,"His net worth is literally inconsequential compared to the power and the resources available to him, he has been the president since before I was born for christ sake, money amd not went matter to a person in that position",1 month ago,prashanth koundinya,UC0SONiVC4pqJtbqUbwSs3xg,1,https://yt3.ggpht.com/ytc/AKedOLTgsKbv12ansTNOOXJm4ATVPcJH4V5MTeOzMw=s176-c-k-c0x00ffffff-no-rj,0.0
Ugzfoth9DZFfqIG1NsV4AaABAg,Most curropt politician,1 month ago,Abhishek Gaba,UCfMq7banOKfBdDXqgNSgS5g,0,https://yt3.ggpht.com/fD6ScDwm_SZjwiYgL5utn5muTs-PHnvOwMMPCXoJ8Sqmn-9kSr5j5M7pVGmTj8dI6vwM4SC4Huk=s176-c-k-c0x00ffffff-no-rj,0.0
UgwGiznxJU3UY9BiOot4AaABAg,"If Britishers are telling he is a theaf.
Then it must be serious because they have a expertise in it.
Look earlier EIC,now they are hosting maliya,nirav, russia fraudsters, america,etc.",1 month ago,Mr Bean Bag,UCKxvJHxMehPM3ge2CD7EeiA,0,https://yt3.ggpht.com/ytc/AKedOLRxlVqZAjOGYSgABk5Azuw6RuFKcc7oubWX7_c3cPOWiABqFTppwFyyysmZUsW9=s176-c-k-c0x00ffffff-no-rj,0.0
Ugz01tYA_zAUBhHze3x4AaABAg,"Politicians don't make money, they steal money.",1 month ago,Prashant Rai,UCnNfDsUPitQB0v2htOq6-9w,0,https://yt3.ggpht.com/ytc/AKedOLQQIg9H1OUriF4OLjLMCjihKNMM7tGVS8m6tJlx3A=s176-c-k-c0x00ffffff-no-rj,0.0
Ugyq5r7fRbLt3a9ikgl4AaABAg,"DMK kaliger karunanithi and family group.

Richest politician in the world
Richest politician in the india
Richest politician in tamilnadu
Richest politician in Asia

DMK paid per vote to 2000 to 10000 rupees.",1 month ago (edited),Prabu S,UCoazRQQ07EPJMjMi7tk_12g,3,https://yt3.ggpht.com/hnRFes4ep1OfhBGOXyFSpo2PqaEG1TpHC_ixxesH5k3Aqki8YBCeM8TJOAo_kJPmdeuLtdadMA=s176-c-k-c0x00ffffff-no-rj,0.0
Ugy0o69q3xtBuLoz3lN4AaABAg,SO WHAT ?,1 month ago,Jsm Kumar,UC_xBX72Dl73jFeW4cYwITIA,0,https://yt3.ggpht.com/ytc/AKedOLSIpSXrD46_gkj6uq8B3qlmW62aixtciSUFEPRnAA=s176-c-k-c0x00ffffff-no-rj,0.0
Ugy3FMhjtBxuN-5YA_V4AaABAg,What about Sharad pawar?,1 month ago,Xcsczlsb 5558bnm,UCQIvlxgiBlT3OEQh46JuBBQ,7,https://yt3.ggpht.com/ytc/AKedOLS1Su0GvqixN84Vx_Db-pg4S6w4ihswVpED_cYMvXvefa1PZKab8949l2dcLwIE=s176-c-k-c0x00ffffff-no-rj,0.0
UgxmAHe9ndEFhFdsjCB4AaABAg,Why do Youtube shorts have a 30 second ads 🤔 ?,1 month ago,Sandipan Aich,UCjiIoElOEbJFQ7m8eR1z2gQ,1,https://yt3.ggpht.com/ytc/AKedOLRFxvDd1N-__1vqdsOP71wPVa8iau59Di6eHyCe8Q=s176-c-k-c0x00ffffff-no-rj,0.0
UgwK0UCaTLUTU_e5DhV4AaABAg,dhruv rathi se churaya. copy cat.,1 month ago,Prabhakar Thakur,UCEuaG-8MygRr0y3mBit-drA,0,https://yt3.ggpht.com/ytc/AKedOLRb1Z5R_uTRqXWw5zqPRBiMDjYjisTDERxb7XwfVw=s176-c-k-c0x00ffffff-no-rj,0.0
Ugyc4e7zM4wFcrNfFQl4AaABAg,click here for relaxing your mind - https://youtu.be/-vBXri7-hQU,1 month ago,Relaxing Time,UCXqFPmwHUuAZLni5ahCHFUQ,0,https://yt3.ggpht.com/GorBMnb07RNhHyX-b45MsdKtnZyvB89DcfgjSwMJrtohnAne1G553Z3Tv2BDe4frGVxq7ZU5Eg=s176-c-k-c0x00ffffff-no-rj,0.0
UgwQdDwOTCMhh48N_uN4AaABAg.9ZGw8iQBzYY9ZH1T271JMm,"Hi i want to work with you, can u give me a work?",1 month ago,Saurav Pandey,UCdmur96a62TBe5NsZjb2dtw,0,https://yt3.ggpht.com/ytc/AKedOLTYJ9T2VuB7TWB6q6zo4qrKqupNujgWM8T0Qg=s176-c-k-c0x00ffffff-no-rj,0.0
UgwAVC5nIEkdZGAhmRB4AaABAg.9Zkb_EkDlB89_ukbRCrdG_,"Appreciate your comment ☝️whasap the number above for more tips and guidance on profitable investment....
You can join our VIP offers",17 minutes ago,Akshat s十①⑤⑦⑤④⑧⑨④⑥②③,UCVs3Ip0WcDIB9ACyVQmSZUA,0,https://yt3.ggpht.com/XX6l36agaNPRREuldJVL-7QSDAHTYDtSK37cQP8NfcnpM155dyUsBYzXjWOU0hHNryN1Vs_c=s176-c-k-c0x00ffffff-no-rj,0.0
UgwqOXR56RQtTd4wmVd4AaABAg.9Za0p6huxh69_ukfSA_Osu,"Appreciate your comment ☝️whasap the number above for more tips and guidance on profitable investment....
You can join our VIP offers",16 minutes ago,Akshat s十①⑤⑦⑤④⑧⑨④⑥②③,UCVs3Ip0WcDIB9ACyVQmSZUA,0,https://yt3.ggpht.com/XX6l36agaNPRREuldJVL-7QSDAHTYDtSK37cQP8NfcnpM155dyUsBYzXjWOU0hHNryN1Vs_c=s176-c-k-c0x00ffffff-no-rj,0.0
UgxFmDI-8a45TMqt6cN4AaABAg.9ZZ96iVwt0a9_ukdPtiyuD,"Appreciate your comment ☝️whasap the number above for more tips and guidance on profitable investment....
You can join our VIP offers",16 minutes ago,Akshat s十①⑤⑦⑤④⑧⑨④⑥②③,UCVs3Ip0WcDIB9ACyVQmSZUA,0,https://yt3.ggpht.com/XX6l36agaNPRREuldJVL-7QSDAHTYDtSK37cQP8NfcnpM155dyUsBYzXjWOU0hHNryN1Vs_c=s176-c-k-c0x00ffffff-no-rj,0.0
UgxAoBTf80DH5uSpEsh4AaABAg.9ZSxRDe_UFk9_ukeQqv-ti,"Appreciate your comment ☝️whasap the number above for more tips and guidance on profitable investment....
You can join our VIP offers",16 minutes ago,Akshat s十①⑤⑦⑤④⑧⑨④⑥②③,UCVs3Ip0WcDIB9ACyVQmSZUA,0,https://yt3.ggpht.com/XX6l36agaNPRREuldJVL-7QSDAHTYDtSK37cQP8NfcnpM155dyUsBYzXjWOU0hHNryN1Vs_c=s176-c-k-c0x00ffffff-no-rj,0.0
UgwZWgkCvYIF4LaHeTt4AaABAg.9ZQcU59Hf3s9_uki8HFLac,"Appreciate your comment ☝️whasap the number above for more tips and guidance on profitable investment....
You can join our VIP offers",16 minutes ago,Akshat s十①⑤⑦⑤④⑧⑨④⑥②③,UCVs3Ip0WcDIB9ACyVQmSZUA,0,https://yt3.ggpht.com/XX6l36agaNPRREuldJVL-7QSDAHTYDtSK37cQP8NfcnpM155dyUsBYzXjWOU0hHNryN1Vs_c=s176-c-k-c0x00ffffff-no-rj,0.0
UgyDY6m-rZYHn_tnQix4AaABAg.9ZOAO2dI58z9ZONMvaGCY6,"Thanks for your comment...
Contact the What'sapp line above for more information and consultation on investment, also participate in the ongoing march investment plan…",1 month ago,Akshat.S ±①②⑥⑦⑥④⑦⑦⓪③②,UCuUHG83SEdtjE3EM7Q9RxXQ,0,https://yt3.ggpht.com/K_rCcYYvtgDE97vj5yCcn9KXZ9g0iYfWGIwS5N1eMQ1LJMg5fC63UYtW70ekrMn5ZuPD3LFZ=s176-c-k-c0x00ffffff-no-rj,0.0
Ugyg-3NpNklcrWYI7aJ4AaABAg.9ZMcLQm3xC-9ZONO62rqM-,"Thanks for your comment...
Contact the What'sapp line above for more information and consultation on investment, also participate in the ongoing march investment plan…",1 month ago,Akshat.S ±①②⑥⑦⑥④⑦⑦⓪③②,UCuUHG83SEdtjE3EM7Q9RxXQ,0,https://yt3.ggpht.com/K_rCcYYvtgDE97vj5yCcn9KXZ9g0iYfWGIwS5N1eMQ1LJMg5fC63UYtW70ekrMn5ZuPD3LFZ=s176-c-k-c0x00ffffff-no-rj,0.0
Ugzfoth9DZFfqIG1NsV4AaABAg.9ZLQr45O_fR9_ukhA5OzqJ,"Appreciate your comment ☝️whasap the number above for more tips and guidance on profitable investment....
You can join our VIP offers",16 minutes ago,Akshat s十①⑤⑦⑤④⑧⑨④⑥②③,UCVs3Ip0WcDIB9ACyVQmSZUA,0,https://yt3.ggpht.com/XX6l36agaNPRREuldJVL-7QSDAHTYDtSK37cQP8NfcnpM155dyUsBYzXjWOU0hHNryN1Vs_c=s176-c-k-c0x00ffffff-no-rj,0.0
Ugy3FMhjtBxuN-5YA_V4AaABAg.9ZIUWMPbj9z9_uk_YYgYRk,"Appreciate your comment ☝️whasap the number above for more tips and guidance on profitable investment....
You can join our VIP offers",17 minutes ago,Akshat s十①⑤⑦⑤④⑧⑨④⑥②③,UCVs3Ip0WcDIB9ACyVQmSZUA,0,https://yt3.ggpht.com/XX6l36agaNPRREuldJVL-7QSDAHTYDtSK37cQP8NfcnpM155dyUsBYzXjWOU0hHNryN1Vs_c=s176-c-k-c0x00ffffff-no-rj,0.0
UgxmAHe9ndEFhFdsjCB4AaABAg.9ZINUKtJcp29ZOZX5ZcXf_,"Thanks for your comment...
Contact the What'sapp line above for more information and consultation on investment, also participate in the ongoing march investment plan…….",1 month ago,Akshat.S ±①②⑥⑦⑥④⑦⑦⓪③②,UCuUHG83SEdtjE3EM7Q9RxXQ,0,https://yt3.ggpht.com/K_rCcYYvtgDE97vj5yCcn9KXZ9g0iYfWGIwS5N1eMQ1LJMg5fC63UYtW70ekrMn5ZuPD3LFZ=s176-c-k-c0x00ffffff-no-rj,0.0
UgwK0UCaTLUTU_e5DhV4AaABAg.9ZIM0jhqb-l9ZONR1tE3Oo,"Thanks for your comment...
Contact the What'sapp line above for more information and consultation on investment, also participate in the ongoing march investment plan…",1 month ago,Akshat.S ±①②⑥⑦⑥④⑦⑦⓪③②,UCuUHG83SEdtjE3EM7Q9RxXQ,0,https://yt3.ggpht.com/K_rCcYYvtgDE97vj5yCcn9KXZ9g0iYfWGIwS5N1eMQ1LJMg5fC63UYtW70ekrMn5ZuPD3LFZ=s176-c-k-c0x00ffffff-no-rj,0.0
UgxDN72jyc9a_2ADhVt4AaABAg,"Let's  find out net worth of Antonio maino,  ex bar dancer.",1 month ago,Sushila Rawat,UCwjcP3hoINSZZuUQ6kTD-Cg,10,https://yt3.ggpht.com/ytc/AKedOLRistiTX50mGysUwc78O9WvB4sBzUWarzSY_A=s176-c-k-c0x00ffffff-no-rj,0.0
UgxbeVjyash6ZLXLJTl4AaABAg,Yes. Putin's networth is around $200billion. Makes him the richest. This info was confirmed in Panama and Pandora papers leak.#AkshatShrivastava,1 month ago (edited),Benhur D'souza,UCAze-ZsWrgHlDGCCuhq_5Wg,0,https://yt3.ggpht.com/ytc/AKedOLTRIbCUFQdkbtuZ_WTp7c9Q4Fv8Fn-LIf1U2tfvqdFoU7A_uPcT1IDc8Cq9jOuy=s176-c-k-c0x00ffffff-no-rj,0.0
UgzMonIXyPrk9tns5LV4AaABAg,Hey Akshat.. We need to know more about Crypto market and how it behaves so atleast we can gain confidence. Also more about NFTs please..,1 month ago,Debarshi Basak,UCTKHpWpnh7tvhDObNWzwZ3g,0,https://yt3.ggpht.com/ytc/AKedOLTduwBCqeYKF0szWaV0Z74QT7pYKZF3iyU2jM-M2w=s176-c-k-c0x00ffffff-no-rj,0.0
UgypkD_G-2PIrP_O8jR4AaABAg,I am sure DMK karunanidhi's family's wealth is more that that,1 month ago,vignesh sekar,UCNKU2NB1NBQHR5te0hhWyWg,22,https://yt3.ggpht.com/ytc/AKedOLQ-5d4miWjnlFJ_n4AaiP-tDGiZ50Lsgrlmgg=s176-c-k-c0x00ffffff-no-rj,0.0
UgyUmTKnZ_lJeB5iiUR4AaABAg,Let me introduce you to damadji sasu maa saala ji and betiya.,1 month ago,Indian,UCxE39I0Ou5eJeLkoKZfaw9Q,1,https://yt3.ggpht.com/ytc/AKedOLST9LA9MZTD00ybHxjFlGa5Gv1_jvtE9KI7Pg=s176-c-k-c0x00ffffff-no-rj,0.0
Ugybo4RwlTUjaby9kPp4AaABAg,One more fake news spreading by Western countries to show him as villain and finding reason to kill him.,1 month ago,Komal Kumar,UC8z4faWas2QPt2b1KAwlPAA,0,https://yt3.ggpht.com/ytc/AKedOLSbGmkQINXEjmZgJGGzwTUKh5HOkV9m4xO6Mv-e8Q=s176-c-k-c0x00ffffff-no-rj,0.0
UgwUHXzhfCnJp6LMHQt4AaABAg,Allow me to introduce Sharad Pawar,1 month ago,shantanu selokar,UC9bXWG0CcAkny-Y0SQXshag,46,https://yt3.ggpht.com/ytc/AKedOLQonyPc29Vg_FGRPWFCxY8gSELkjzt48E4Nm8bAXQ=s176-c-k-c0x00ffffff-no-rj,0.0
UgwD1XN6rS6mIuTQkNd4AaABAg,Kya karu mai iska,1 month ago,Evil Hunter,UCS3EGq8rGYele1zwpeOKkXQ,5,https://yt3.ggpht.com/ytc/AKedOLTtTLuCfhUH30CuO3WioyJTAIECUXe5J1roIELlaQ=s176-c-k-c0x00ffffff-no-rj,0.0
UgzOP1bybwkAm04rM1d4AaABAg,When your viewers have no more money left to average their stocks.  Hope to see more videos like this 😉,1 month ago,Vivek Pandey,UCBdIMJK1eeBmoudclpYceIw,27,https://yt3.ggpht.com/ytc/AKedOLTTQ87OAtsLXzHFOI4PSEbrnjlzAZ1lURfBSL-mnw=s176-c-k-c0x00ffffff-no-rj,0.0
UgzaLZxz59h7DyNA7LZ4AaABAg,make videos about the stock market. Nobody cares about the Western Narrative that you are trying to shill,1 month ago,Devanshu Vasishth,UCJ7xt-Gc8QKv_cCh65NXiNw,10,https://yt3.ggpht.com/ytc/AKedOLQtOYKjoRce2CrpW9YprB9GkUepmQ5XM3_VsA=s176-c-k-c0x00ffffff-no-rj,0.0
UgyRhxVHox570TEAgMF4AaABAg,"to be honest he has saved russia from the mismanagement of gorbachev and boris yeltsin.

He deserves it !

let's be honest!


it's the only way he doesn't get swayed by lobbyists",1 month ago,Terminator,UCWzBZWSc7fp4YoOClNxlBKw,43,https://yt3.ggpht.com/kls3FHKj_ODiI_eaIqNIZO-2lCSxVUM6WVITL_AOZnR_KpttRKySi1YBnFE73uMKL8OcmVUHcQ=s176-c-k-c0x00ffffff-no-rj,0.0
Ugx4jLshUkVEt6MVDwB4AaABAg,DMK,1 month ago,karthi mahi,UCzyZtPw6nMi_3fob1YVTUfA,12,https://yt3.ggpht.com/ytc/AKedOLR42imeT0dk83THSKRy9HdWSkoCBZauQBkkY08D=s176-c-k-c0x00ffffff-no-rj,0.0
UgwK0_adRDbK0QVkZq54AaABAg,Dhruv rathee shorts,1 month ago (edited),AKSHAT,UCmXukS52HHUmL8niAY2BYqw,6,https://yt3.ggpht.com/ytc/AKedOLSCtz6DGtkcokGuH23UfEMS4dkstf0jIvkpOoCYCw=s176-c-k-c0x00ffffff-no-rj,0.0
Ugyl5f_zVl7ECJK_Sat4AaABAg,Jagan anna,1 month ago,Bhanu Sudheer,UCYA4mDqw7_qySbi_LKM4Ulw,4,https://yt3.ggpht.com/ytc/AKedOLTACook8h1PhCGrFEqyFy4nMCs2dOzV4wo8ng=s176-c-k-c0x00ffffff-no-rj,0.0
Ugx2fmwUjWAJ8khBsKx4AaABAg,"Never trust all news about Putin by Western Media. Western Medias are biased & spread fake news, remember NYT doing news against Iraq's Saddam Hussain having piles of Weapons of Mass Destruction, also same Western Media NYT, BBC etc do hate news against Indians. Journalists are biased & have agenda, truth is hidden. Propaganda is information war.",1 month ago,Rks,UCp7fXCiQEp9gz38U63NEq1Q,2,https://yt3.ggpht.com/ytc/AKedOLT1xXScOqPQt18uwIsBxtfU4uqYaj7ryk4CzMcrW5XgM_qYjImXAPqaaJIKNKzU=s176-c-k-c0x00ffffff-no-rj,0.0
UgzMonIXyPrk9tns5LV4AaABAg.9ZHGz0GGspF9_ukcY_z_eY,"Appreciate your comment ☝️whasap the number above for more tips and guidance on profitable investment....
You can join our VIP offers",17 minutes ago,Akshat s十①⑤⑦⑤④⑧⑨④⑥②③,UCVs3Ip0WcDIB9ACyVQmSZUA,0,https://yt3.ggpht.com/XX6l36agaNPRREuldJVL-7QSDAHTYDtSK37cQP8NfcnpM155dyUsBYzXjWOU0hHNryN1Vs_c=s176-c-k-c0x00ffffff-no-rj,0.0
UgypkD_G-2PIrP_O8jR4AaABAg.9ZHCRMC2UKK9ZIwZ1YKIU0,Great bro..,1 month ago,Prabu S,UCoazRQQ07EPJMjMi7tk_12g,0,https://yt3.ggpht.com/hnRFes4ep1OfhBGOXyFSpo2PqaEG1TpHC_ixxesH5k3Aqki8YBCeM8TJOAo_kJPmdeuLtdadMA=s176-c-k-c0x00ffffff-no-rj,0.0
UgwUHXzhfCnJp6LMHQt4AaABAg.9ZH1b8Ambq19ZHASoPK-eU,who is he?,1 month ago,Jeevan Rajagopal,UCpNLARKp8fCZe0sWc33UdLw,0,https://yt3.ggpht.com/FcvfsvLrPE0RJrJpnMsOP9tP_cASmXMG-CxcEDSh-J1mhBfnZtGlEuWbLQIPHIN5YVSwUvJa0k0=s176-c-k-c0x00ffffff-no-rj,0.0
UgwUHXzhfCnJp6LMHQt4AaABAg.9ZH1b8Ambq19ZIMzR-o7nA,"i have seen that many people who follow personal finance channels have problem with corrupt politicians but are fine with corrupt crony capitalists. crony is the key word here before anyone says that i am anti capitalism. Does anyone believe that general public knows the real wealth of Ambani? Also, tell me one hotel in India that the new BJP headquarter in Delhi can’t compete with. Corruption not there at central minister level, but getting billions of rupees in party fund from anonymous sources is great?",1 month ago,Prabhakar Thakur,UCEuaG-8MygRr0y3mBit-drA,4,https://yt3.ggpht.com/ytc/AKedOLRb1Z5R_uTRqXWw5zqPRBiMDjYjisTDERxb7XwfVw=s176-c-k-c0x00ffffff-no-rj,0.0
UgwUHXzhfCnJp6LMHQt4AaABAg.9ZH1b8Ambq19ZIkw2FEfVS, @Jeevan Rajagopal  The guy who lied about mumbai bombings,1 month ago,Sanyukta,UC5rif8TQMPVy9aZsZMtPNpg,2,https://yt3.ggpht.com/ytc/AKedOLS-WTP_xlMPwkN-M8JJxYMaFnRZU1Hp_iXJ19dDeg=s176-c-k-c0x00ffffff-no-rj,0.0
UgwD1XN6rS6mIuTQkNd4AaABAg.9ZH0yxNJZrD9ZH4Ar1enIH,😂😂,1 month ago,devesh tewari,UCCNqewAS9Qs6yo8mHWf41Jw,1,https://yt3.ggpht.com/ytc/AKedOLSTGQKfYxBYWo-DVcL5c8Q_CMx57Tm_edBkKQ=s176-c-k-c0x00ffffff-no-rj,0.0
UgzOP1bybwkAm04rM1d4AaABAg.9ZH0k1WKCfZ9ZH6Jzw4HB7, @Admin  i will only pay in euros in cash at Mars,1 month ago,AKSHAT,UCmXukS52HHUmL8niAY2BYqw,1,https://yt3.ggpht.com/ytc/AKedOLSCtz6DGtkcokGuH23UfEMS4dkstf0jIvkpOoCYCw=s176-c-k-c0x00ffffff-no-rj,0.0
UgzaLZxz59h7DyNA7LZ4AaABAg.9ZH03AqGNHl9ZxsH4AkoYe,Great Atleast some people get it,3 weeks ago,Divyansh Shukla,UC1r6m4-jemAJJuI2HaaTA3w,1,https://yt3.ggpht.com/ytc/AKedOLSknrRCI1TDkYc5BxNafBSYo-NEGK-MzO1QW5QLlQ=s176-c-k-c0x00ffffff-no-rj,0.0
UgyRhxVHox570TEAgMF4AaABAg.9ZGzWlazd5_9ZLQybzld2V,"LoL
Russia would have been economy in Europe if he didn't mismanaged",1 month ago,Abhishek Gaba,UCfMq7banOKfBdDXqgNSgS5g,2,https://yt3.ggpht.com/fD6ScDwm_SZjwiYgL5utn5muTs-PHnvOwMMPCXoJ8Sqmn-9kSr5j5M7pVGmTj8dI6vwM4SC4Huk=s176-c-k-c0x00ffffff-no-rj,0.0
UgyRhxVHox570TEAgMF4AaABAg.9ZGzWlazd5_9ZxsAg0FgOV,I think yes,3 weeks ago,Divyansh Shukla,UC1r6m4-jemAJJuI2HaaTA3w,0,https://yt3.ggpht.com/ytc/AKedOLSknrRCI1TDkYc5BxNafBSYo-NEGK-MzO1QW5QLlQ=s176-c-k-c0x00ffffff-no-rj,0.0
Ugx4jLshUkVEt6MVDwB4AaABAg.9ZGz19fMZDG9ZIwZh15DKt,Great bro,1 month ago,Prabu S,UCoazRQQ07EPJMjMi7tk_12g,1,https://yt3.ggpht.com/hnRFes4ep1OfhBGOXyFSpo2PqaEG1TpHC_ixxesH5k3Aqki8YBCeM8TJOAo_kJPmdeuLtdadMA=s176-c-k-c0x00ffffff-no-rj,0.0
UgwK0_adRDbK0QVkZq54AaABAg.9ZGyseKIWIN9ZHAUnD0H6a,DRS,1 month ago,Jeevan Rajagopal,UCpNLARKp8fCZe0sWc33UdLw,0,https://yt3.ggpht.com/FcvfsvLrPE0RJrJpnMsOP9tP_cASmXMG-CxcEDSh-J1mhBfnZtGlEuWbLQIPHIN5YVSwUvJa0k0=s176-c-k-c0x00ffffff-no-rj,0.0
UgwK0_adRDbK0QVkZq54AaABAg.9ZGyseKIWIN9ZHGb8_vwIh, @Jeevan Rajagopal  Drag Reduction System,1 month ago,The WebheadGT.,UCFK1CacmnlhPT2Qa6NPVP8A,0,https://yt3.ggpht.com/ytc/AKedOLQvo8EOZMeiaa5qsedpAIuya2AhjzNiJfFWzyMGrg=s176-c-k-c0x00ffffff-no-rj,0.0
UgwK0_adRDbK0QVkZq54AaABAg.9ZGyseKIWIN9ZIN9rtDFBH,copy maar diya. agar ye dhruv rathee ke saare videos copy kar le to bjp bhakt to video hi dekhna chhod denge! 😂,1 month ago,Prabhakar Thakur,UCEuaG-8MygRr0y3mBit-drA,2,https://yt3.ggpht.com/ytc/AKedOLRb1Z5R_uTRqXWw5zqPRBiMDjYjisTDERxb7XwfVw=s176-c-k-c0x00ffffff-no-rj,0.0
UgwK0_adRDbK0QVkZq54AaABAg.9ZGyseKIWIN9ZINZzVkvG5, @Prabhakar Thakur  Ye intellectuals ka channel hai. Yaha BJP bhakt kaise kya?,1 month ago,The WebheadGT.,UCFK1CacmnlhPT2Qa6NPVP8A,1,https://yt3.ggpht.com/ytc/AKedOLQvo8EOZMeiaa5qsedpAIuya2AhjzNiJfFWzyMGrg=s176-c-k-c0x00ffffff-no-rj,0.0
UgwK0_adRDbK0QVkZq54AaABAg.9ZGyseKIWIN9ZIOxDmMsac, @The WebheadGT.  arey bhai hote h kuch log jo apni apni party ko leke senti hote hain. nahi bardasht hota unse.,1 month ago,Prabhakar Thakur,UCEuaG-8MygRr0y3mBit-drA,0,https://yt3.ggpht.com/ytc/AKedOLRb1Z5R_uTRqXWw5zqPRBiMDjYjisTDERxb7XwfVw=s176-c-k-c0x00ffffff-no-rj,0.0
UgwK0_adRDbK0QVkZq54AaABAg.9ZGyseKIWIN9ZIl6BbmUEt, @Prabhakar Thakur  Umm this is an apolitical channel. Here both the sides are considered equally delusional.,1 month ago,Sanyukta,UC5rif8TQMPVy9aZsZMtPNpg,0,https://yt3.ggpht.com/ytc/AKedOLS-WTP_xlMPwkN-M8JJxYMaFnRZU1Hp_iXJ19dDeg=s176-c-k-c0x00ffffff-no-rj,0.0
Ugyl5f_zVl7ECJK_Sat4AaABAg.9ZGxqA2ysXU9_ukgQkbUdT,"Appreciate your comment ☝️whasap the number above for more tips and guidance on profitable investment....
You can join our VIP offers",16 minutes ago,Akshat s十①⑤⑦⑤④⑧⑨④⑥②③,UCVs3Ip0WcDIB9ACyVQmSZUA,0,https://yt3.ggpht.com/XX6l36agaNPRREuldJVL-7QSDAHTYDtSK37cQP8NfcnpM155dyUsBYzXjWOU0hHNryN1Vs_c=s176-c-k-c0x00ffffff-no-rj,0.0
