cid,text,time,author,channel,votes,photo,heart
UgwddTT7EBQVrezgfWF4AaABAg,"►Check out this exclusive offer by Vested ($10 credited to every funded account who signs up using this link) : 
https://app.vested.co.in/signup?state=referral_code:AKVES100
_____________________________________________________
►I teach about US Stocks on my course, you can check it out here:
https://wisdomhatch.com/",3 months ago,Akshat Shrivastava,UCqW8jxh4tH1Z1sWPbkGWL4g,8,https://yt3.ggpht.com/VI0OvMwpPQPFGoHAQOHsvtEcFWg-_YzFBhoeohr2CRz1T21Ja4unTGte1Gz6TnDUgVX9wcOG=s176-c-k-c0x00ffffff-no-rj,0.0
UgznjOSRQxgm3Degh1Z4AaABAg,I bet no one has made more from investment than me since last year.😃,2 months ago,Cooper Smith,UCI-UdH76T4-71C9xJKHyVvA,61,https://yt3.ggpht.com/ytc/AKedOLRjIDLqlZYyFA1YZpSLnUDHOhqhJ8lMzn5Iky21=s176-c-k-c0x00ffffff-no-rj,0.0
UgxV_HVcvNFG8-OhNMV4AaABAg,"Hey Akshat I am never able to understand if investing in an ETF is better or stocks in US markets. Since ETFs have almost all major stocks and ETFs pay up dividends as well. It will be great if you can break it down. Thank you for all the content, helps a ton.",2 months ago,Murtaza_Fit,UCNYJyjL8byV6L98X-7z_rdg,1,https://yt3.ggpht.com/hiZD_gI_5HZYf8mVE9yk-g6xbe1CzfiOCvAplMIGGGo-wLS76y_VlI2eCIpeZp3L3t-suSi06zY=s176-c-k-c0x00ffffff-no-rj,0.0
UgwDqZENMU_9LRalPRl4AaABAg,You had said and supported the vie of Ray Dalion  that he has reduced investment in tech stocks.,2 months ago,Ramesh Vedak,UC8AlkiDPCKgvJ5nXPUKtdbQ,0,https://yt3.ggpht.com/ytc/AKedOLRhI2ISspnJvuRgoOo0fCWivEUnEt5_w-mF=s176-c-k-c0x00ffffff-no-rj,0.0
Ugya0Nibo-sMmTK6TuZ4AaABAg,"So, is reliance on its way to become Amazon of India?",2 months ago (edited),Rahul Mehra,UC2Q81O9bXfX92hp8SfczJ8Q,0,https://yt3.ggpht.com/ytc/AKedOLRmE0WU53QVRMMhVVtBfv21MA4YKvKgFDdBfMZdvQ=s176-c-k-c0x00ffffff-no-rj,0.0
Ugy56HtOR7BJ9-vAdvp4AaABAg,Not relevant as Apple's worth is after 45years being in market and GDP of India is one year . So Apple maybe need another 4500000000000000000000Years to come close to India 😬🤣,2 months ago,rduhoon007,UCWWjLKGld7hy5Y8XGHGELIA,0,https://yt3.ggpht.com/ytc/AKedOLRshNhJHzFtFgN9VPdE_k5GecTvpxzKSObc7A=s176-c-k-c0x00ffffff-no-rj,0.0
UgyR4LlRnFYQedcjPyd4AaABAg,Please make a video on how retail investors can invest in startups in small amounts,2 months ago,Kush,UCKfJ9Cp5jr_hYyirM2gETrQ,1,https://yt3.ggpht.com/v1atzkNpVNcuDnKSiHP_o-3zxW3ntLau6T6A_UooMAPuA-03Qg-T6VAviNkrt11Rz8qqQnSWfg=s176-c-k-c0x00ffffff-no-rj,0.0
Ugy4kdzmKGjrvloUFVV4AaABAg,Cheap labour is a key point for tech companies like tcs to move them forward and make them irreplacable to big tech companies in usa.. Otherwise they would not be abLe to compete in price!!,3 months ago,Rahul Shaw,UCAnyD6boQaDWQ4yzzks_n4A,1,https://yt3.ggpht.com/ytc/AKedOLTuLUpeYY0dUqjA77KxoIcZ95dM8iES0ExD0RX1XA=s176-c-k-c0x00ffffff-no-rj,0.0
Ugzu2wuYxbDRxUP3m0V4AaABAg,"Hi
Pl prepare a video in Indian monopoly stocks",3 months ago,Prasad Macherla,UCU_Yu0gxki8V-pTisXGqGyA,0,https://yt3.ggpht.com/ytc/AKedOLSRvGcgfC9zTXG3BxByEuVUA7BI5g9eZFFpL13GfHPSi0BM4TNV3A7fM8BKLerj=s176-c-k-c0x00ffffff-no-rj,0.0
UgwSf1keMXATFreu7md4AaABAg,"https://youtu.be/qgFaOB-pNMU
Hey Akshat, in the above video of yours, you told no- FAANG stocks. But here you are talking about Amazon, a FAANG stock. I am confused.",3 months ago,ANEES AHMED,UCcRzyNAuNnMTA4OJvSXoOpA,0,https://yt3.ggpht.com/ytc/AKedOLScmCDuyQRw2Li6nkScbZedAKvM7VRt6KLDYCDKmg=s176-c-k-c0x00ffffff-no-rj,0.0
UgyE1eY62jIUSNxxWdF4AaABAg,"How do you invest in Indian stocks being in US, isit legal?",3 months ago,MyOwnChannel,UCy_G7oAIOlljhrAjxIdiF9Q,1,https://yt3.ggpht.com/ytc/AKedOLTOUEv6EJfoGW9lUOB-WOwmHGc4PTmcP5z1oQ=s176-c-k-c0x00ffffff-no-rj,0.0
UgwLe_NaT2HzRxuHhRN4AaABAg,Isn't reliance a probable tech giant in india,3 months ago,Ryan Dileep,UCbqkQ9kdvGgtBnNK9_5HqHg,0,https://yt3.ggpht.com/ytc/AKedOLRTiCQ0D8LOmWILPvLqljLhbjdVDEJFFK3hzg=s176-c-k-c0x00ffffff-no-rj,0.0
UgzDYfSrveGtypCgJBt4AaABAg,"Reading about people grabbing multi-figures monthly as income in investments even in this crazy days in the market,any pointers on how to make substantial progress in earnings?would be appreciated....",3 months ago,David Fred,UC3im4og61aSZeGlqpR16aFw,32,https://yt3.ggpht.com/oA6mSYHicW9E4AAZKaQ5YmRC_LRXyS9cc5Q2HqisZH8CzeQAf8NpTr5TAlJQYu9tqMkG0nrPrFY=s176-c-k-c0x00ffffff-no-rj,0.0
UgzAG3jAi_mraZy8eRp4AaABAg,Well I have a view that the market cap of apple is 3 trillion dollars which took years to be built but India's GDP which is Goods produced by a country in A SINGLE YEAR SO here is the difference 🎉,3 months ago,The Curious Guy,UC7y-2nJ-_YFiwt_VoMwzBCQ,2,https://yt3.ggpht.com/ytc/AKedOLQVRlHI_zYy3E0mfeBC9L5EFWFqrpJ4qTp50QN9aA=s176-c-k-c0x00ffffff-no-rj,0.0
UgxAz36xoHRVR_JGv394AaABAg,"Hii,is it possible for NRI’s to use this platform vested?",3 months ago,Prajith Ponnappan,UCNjTybOrE_xdBRfdN25NsLA,1,https://yt3.ggpht.com/ytc/AKedOLR8v7pcs04f_G3c5iLNck2Vq9OrIHFF2_mvhfgI=s176-c-k-c0x00ffffff-no-rj,0.0
UgzSqjm_oAeqGNWDQ5l4AaABAg,"Thanks Akshat. For tbose who cannot or do t want do direct US investing, please suggest good etf or MF route to invest in US tech.",3 months ago,Prasanth Pathiyil,UCM15I0gY8dZ3oqs9MAO3RhQ,2,https://yt3.ggpht.com/ytc/AKedOLQxhCI34JrQHNyBMmkHHWEYu890iwNlvasb6g=s176-c-k-c0x00ffffff-no-rj,0.0
Ugwkh_DydahCCmhfXzd4AaABAg,"Hey Akshat, completely satisfied with your analysis that big tech companies will remain big for substantial period of time because they have access to wide range of resources and can use them efficiently........Thus on the other side they kept on acquiring emerging companies and literally wipe out their competition......so conclusively we can bet on monopolies and can get sense of being  big giant",3 months ago,PRANSHUL SAXENA,UCimasC3luilXLHY6_pMgf6Q,0,https://yt3.ggpht.com/ytc/AKedOLSq06UOq8ooL8Dz3hFKbG4QZaxYrlO2IxN14mnvBw=s176-c-k-c0x00ffffff-no-rj,0.0
UgxEylSa7LlC6AlWyOF4AaABAg,Hey Akshat! Can you do a video on spinning mills/fabric industry. All stocks in this sector have given massive bull run specially the stocks like PASARI & DIGJAMLTD. Do you recommend investing in these stocks.,3 months ago,Suhail Bhat,UCjYefyAWl2QtEFPJ8krK9ZQ,0,https://yt3.ggpht.com/ytc/AKedOLQkIZNNNoaE5ID5CITX4nTulE61HNi7D9EWSU5r2g=s176-c-k-c0x00ffffff-no-rj,0.0
Ugzxata6Xwzi-1FDVw54AaABAg,THE GDP OF INDIA IS OF ONE YEAR WHILE THE APPLE'S MARKET CAP IS WHAT IT HAS BUILT OVER SO MANY DECADES,3 months ago,Aryan,UC-mSq-N1SINLl11BKjuseHQ,0,https://yt3.ggpht.com/ytc/AKedOLR8ULoPxwEPROdt_EOf2xykRbIXoa0tpGmbi0EHEw=s176-c-k-c0x00ffffff-no-rj,0.0
Ugxb0ErnhS99156Zd1p4AaABAg,"No, 3.1 trillion dollars India’s GDP",3 months ago,Aswini Sau,UC0O2fSBpkYS0RQHaMn48Aww,0,https://yt3.ggpht.com/ytc/AKedOLRImOx96YzLU_XRkoE4-pt_yN6PEZC3o9I0pUecxQ=s176-c-k-c0x00ffffff-no-rj,0.0
UgwddTT7EBQVrezgfWF4AaABAg.9WzNV4h7VGh9WzNe-zqsTX,Sir would you like to add my music in your videos ?,3 months ago,iSHAN BeatZ ♬,UCHTglPJz71JyjHbQJObGw8A,1,https://yt3.ggpht.com/hHn1YpSWBAzvWdU-hSU6d0qebDwXfZqbDYqA19XBMDU8dHNgfOroOtBG2FTZ8WpUaxNMx6bo8WU=s176-c-k-c0x00ffffff-no-rj,0.0
UgwddTT7EBQVrezgfWF4AaABAg.9WzNV4h7VGh9WzP7ru41HI,I have signed up using link provided in your video and funded the account. However $10 has not been credited.,3 months ago,hirok59,UCqRkME_t2kgiqdTldbi3fcA,1,https://yt3.ggpht.com/ytc/AKedOLRzs2-79i44b-hLNGE2mkALgBsGhUdp_NPSiQ=s176-c-k-c0x00ffffff-no-rj,0.0
UgwddTT7EBQVrezgfWF4AaABAg.9WzNV4h7VGh9WzU4S7keCR,Some time i think you are richer than mr Ambani,3 months ago,Tushar pillai,UCNBuuX5ura7Wox0r1yofYIg,0,https://yt3.ggpht.com/oWLRNaO_B47u2xsh2PdTK66hMYDA3QUY40E4yv5jphGz7sHWAxeJfKws0IQXfGOqfw7w8OCX=s176-c-k-c0x00ffffff-no-rj,0.0
UgwddTT7EBQVrezgfWF4AaABAg.9WzNV4h7VGh9WzW-qA5DhC,Amazing video akshat.. Do shoot  a series on startup valuation & investment,3 months ago,Ashutosh Nandi,UC6awt9ZeIEA0oCbK3GsD38g,1,https://yt3.ggpht.com/ytc/AKedOLSAZVdOO66ExbpJClTYstBOEpm_tRLvYa_frA=s176-c-k-c0x00ffffff-no-rj,0.0
UgwddTT7EBQVrezgfWF4AaABAg.9WzNV4h7VGh9WzkBVB7vXS,Okay,3 months ago,Ravi,UCu2AYwjoD-nLMi5XFRF1oMA,0,https://yt3.ggpht.com/mg5IBS5RcPPrbCouRX0PwONXHEJUaY6ZAfoYMtRGQrWpxHm3FyQ5-mm_tcbwRKMv1P79GaJT9Yg=s176-c-k-c0x00ffffff-no-rj,0.0
UgwddTT7EBQVrezgfWF4AaABAg.9WzNV4h7VGh9WzwNpFWAbT,"Hey Akshat, would love to see a video on ""How to invest in web 3.0 companies in India""",3 months ago,Nevin Zacharias,UCoCu0I03zPV0k6lVjIjouhw,3,https://yt3.ggpht.com/ytc/AKedOLTQSk4Ch9Pyq3IO02Yoe3GkW-7GWG6cJnadUdaAnlk=s176-c-k-c0x00ffffff-no-rj,0.0
UgwddTT7EBQVrezgfWF4AaABAg.9WzNV4h7VGh9X1GkvBjJOA,"Akshat, pl make a video on how can a retail investors invest in start ups",3 months ago,Anoop Sisodiya,UCZk-1alSb3lTWsvU8Lol54g,0,https://yt3.ggpht.com/ytc/AKedOLRV813g-BbjfK9c47qMNZIlv1L9BAP4NxoxvA=s176-c-k-c0x00ffffff-no-rj,0.0
UgwddTT7EBQVrezgfWF4AaABAg.9WzNV4h7VGh9XDaPoxj3OV,Apple's 3 trillion dollars is its entire business valuation and might come down if they stop innovating... India's 2.7 trillion dollars is our production in a single year... It will only rise with time... Comparison isn't fair....,3 months ago,Tejaswi R,UCCf2O3OBIpllVqxW2gC7L6w,0,https://yt3.ggpht.com/ytc/AKedOLQTYmh9jXcTMOD5IK5DJdVgW2jKvo82SjxmNksRpA=s176-c-k-c0x00ffffff-no-rj,0.0
UgznjOSRQxgm3Degh1Z4AaABAg.9XovZebeqsO9XovqIufZ0a,I’m considering retiring from work soon 😂,2 months ago,Sofia Estrada,UCS4iQqZD2HYeslctaGFyugw,0,https://yt3.ggpht.com/2ePFqmx2QxzLAoUU_w-Vouh8Iwsq1fM2AE9jQ-bv4yiyWB0AR1DKBGUWv7JL7KXxuhn9LeMdpw=s176-c-k-c0x00ffffff-no-rj,0.0
UgznjOSRQxgm3Degh1Z4AaABAg.9XovZebeqsO9XovvuHA2zm,My boss is not gonna see me soon😂😂,2 months ago,Sofia Estrada,UCS4iQqZD2HYeslctaGFyugw,0,https://yt3.ggpht.com/2ePFqmx2QxzLAoUU_w-Vouh8Iwsq1fM2AE9jQ-bv4yiyWB0AR1DKBGUWv7JL7KXxuhn9LeMdpw=s176-c-k-c0x00ffffff-no-rj,0.0
UgznjOSRQxgm3Degh1Z4AaABAg.9XovZebeqsO9XowB7o1iTD, @Sofia Estrada  lol 😂 why are you considering retiring from work soon?,2 months ago,Matt Weston,UC8AwQ8FZUZqbep940gAISGw,0,https://yt3.ggpht.com/zp4Ht54M7JMzl4rM5YBjx7BivyMvP2KyC_vnhtIZjRw9yWdDavZQynnrXRjRgHXFAixcS-c=s176-c-k-c0x00ffffff-no-rj,0.0
UgznjOSRQxgm3Degh1Z4AaABAg.9XovZebeqsO9XowPJPGt64," @Sofia Estrada  That's lovely, i wanted to trade crypto but got let down by the fall of it.",2 months ago,Matt Weston,UC8AwQ8FZUZqbep940gAISGw,0,https://yt3.ggpht.com/zp4Ht54M7JMzl4rM5YBjx7BivyMvP2KyC_vnhtIZjRw9yWdDavZQynnrXRjRgHXFAixcS-c=s176-c-k-c0x00ffffff-no-rj,0.0
UgznjOSRQxgm3Degh1Z4AaABAg.9XovZebeqsO9XowVQxPEEI, @Matt Weston  I totally comply with you one needs a coach who's is a true analyst. Actually Ivanova is the someone i adhere to and with a great sense of humor.,2 months ago,Sofia Estrada,UCS4iQqZD2HYeslctaGFyugw,0,https://yt3.ggpht.com/2ePFqmx2QxzLAoUU_w-Vouh8Iwsq1fM2AE9jQ-bv4yiyWB0AR1DKBGUWv7JL7KXxuhn9LeMdpw=s176-c-k-c0x00ffffff-no-rj,0.0
UgznjOSRQxgm3Degh1Z4AaABAg.9XovZebeqsO9XowaNti92B, @Sofia Estrada  Please how can I reach out to her. I really want to invest,2 months ago,Matt Weston,UC8AwQ8FZUZqbep940gAISGw,0,https://yt3.ggpht.com/zp4Ht54M7JMzl4rM5YBjx7BivyMvP2KyC_vnhtIZjRw9yWdDavZQynnrXRjRgHXFAixcS-c=s176-c-k-c0x00ffffff-no-rj,0.0
UgznjOSRQxgm3Degh1Z4AaABAg.9XovZebeqsO9XowvPNnQEx,Whatapp ☝🏻,2 months ago,Sofia Estrada,UCS4iQqZD2HYeslctaGFyugw,0,https://yt3.ggpht.com/2ePFqmx2QxzLAoUU_w-Vouh8Iwsq1fM2AE9jQ-bv4yiyWB0AR1DKBGUWv7JL7KXxuhn9LeMdpw=s176-c-k-c0x00ffffff-no-rj,0.0
UgznjOSRQxgm3Degh1Z4AaABAg.9XovZebeqsO9Xox2lTA7Mw," @Sofia Estrada  Thanks, I’ll reach out to her .",2 months ago,Matt Weston,UC8AwQ8FZUZqbep940gAISGw,0,https://yt3.ggpht.com/zp4Ht54M7JMzl4rM5YBjx7BivyMvP2KyC_vnhtIZjRw9yWdDavZQynnrXRjRgHXFAixcS-c=s176-c-k-c0x00ffffff-no-rj,0.0
UgxV_HVcvNFG8-OhNMV4AaABAg.9XOVEbRoI7x9XkpDxJFwfO,"Thanks for your comment, make sure to put for information and advise,I have a new investment plan",2 months ago,♜ 𝐏𝐢𝐧𝐧𝐞𝐝 by Kanal Finans,UCRaeSyMSDHfVW3IlqJNrHzg,0,https://yt3.ggpht.com/ZBqY1oFHAIXtUbXcm9lqSwIlxAm_JnXfWtyyJcqtPO12h0-YwMo0jSUsO1tRzjR8-gryJAdX2g=s176-c-k-c0x00ffffff-no-rj,0.0
UgwDqZENMU_9LRalPRl4AaABAg.9XL7khvRtqf9XkpFD-B7Nx,"Thanks for your comment, make sure to put for information and advise,I have a new investment plan",2 months ago,♜ 𝐏𝐢𝐧𝐧𝐞𝐝 by Kanal Finans,UCRaeSyMSDHfVW3IlqJNrHzg,0,https://yt3.ggpht.com/ZBqY1oFHAIXtUbXcm9lqSwIlxAm_JnXfWtyyJcqtPO12h0-YwMo0jSUsO1tRzjR8-gryJAdX2g=s176-c-k-c0x00ffffff-no-rj,0.0
Ugya0Nibo-sMmTK6TuZ4AaABAg.9XItNuw1ILJ9XkpGIT1LRt,"Thanks for your comment, make sure to put for information and advise,I have a new investment plan",2 months ago,♜ 𝐏𝐢𝐧𝐧𝐞𝐝 by Kanal Finans,UCRaeSyMSDHfVW3IlqJNrHzg,0,https://yt3.ggpht.com/ZBqY1oFHAIXtUbXcm9lqSwIlxAm_JnXfWtyyJcqtPO12h0-YwMo0jSUsO1tRzjR8-gryJAdX2g=s176-c-k-c0x00ffffff-no-rj,0.0
Ugy56HtOR7BJ9-vAdvp4AaABAg.9XIVBMN34Jl9XkpHLiqn8s,"Thanks for your comment, make sure to put for information and advise,I have a new investment plan",2 months ago,♜ 𝐏𝐢𝐧𝐧𝐞𝐝 by Kanal Finans,UCRaeSyMSDHfVW3IlqJNrHzg,0,https://yt3.ggpht.com/ZBqY1oFHAIXtUbXcm9lqSwIlxAm_JnXfWtyyJcqtPO12h0-YwMo0jSUsO1tRzjR8-gryJAdX2g=s176-c-k-c0x00ffffff-no-rj,0.0
UgyR4LlRnFYQedcjPyd4AaABAg.9XIL0oty0IV9_kGpPMyw6w,"Feedback Appreciated
Wanting more info and insight?
Do well to contact the number above.  I have the best linvestment plan for you...",4 days ago,WhatsApp 十⓽⓵⓼⓼⓻⓶⓽⓶⓹⓺⓻⓷,UCohubyvbRG_cpyLyv09Huaw,0,https://yt3.ggpht.com/hQV0_b97oFuYdJW-ttMXYfkm_DQ8GH4C-Bqos4dlKIf3sCpeM9g3Wg1XpRDXKxu9a_Jdx9IDSg=s176-c-k-c0x00ffffff-no-rj,0.0
UgzDYfSrveGtypCgJBt4AaABAg.9X6-Qv4FGlQ9X6-U1hGC9B,You have to have an idea on what you wanna invest in carefully before going in.,3 months ago,Alan PM_c,UCd5Xp1V2tz63OtQOQU7Rk_Q,0,https://yt3.ggpht.com/Tmk3Hwt6vsg4jWerVgWXxIBauzmzizaveFgZgG-8DUrC9z4aPpHGhVi0nMKHQZifh8yG8o2P=s176-c-k-c0x00ffffff-no-rj,0.0
UgzDYfSrveGtypCgJBt4AaABAg.9X6-Qv4FGlQ9X6-YDEsc69,"Kindly reach her thru Tele gram page with 
the name
👇",3 months ago,Faye Hervig,UCYXX0rf1nzy4kw5n9aH-S3g,0,https://yt3.ggpht.com/q11kHSRC3_riVLqJE9oQ0Y3mdkWRppBYd10YNsRBVBhQC5uQ73Ih-8kFscF2E8fA5YqBralDXQ=s176-c-k-c0x00ffffff-no-rj,0.0
UgzDYfSrveGtypCgJBt4AaABAg.9X6-Qv4FGlQ9X6-aGzT5T8,"the increase in my portfolio fantastic, I'm glad I followed Elizabeth Rhode's advice and made that trading move., All thanks to her.",3 months ago,Aron Micheal,UC0Uvgue7PntgWoKI_JD5XAA,0,https://yt3.ggpht.com/Vt1aXHpsTBXuEn3Ykdew_vPeNkWKcJViSB7B1O7RKJBwuFV8RiOEJ6hRp3xbpt-W5PW1xcQojQ=s176-c-k-c0x00ffffff-no-rj,0.0
UgzDYfSrveGtypCgJBt4AaABAg.9X6-Qv4FGlQ9X6-d6giNJb,"This lady right here,I tradr with her she’s inventive and the P.O.T are no jokes, I won’t look awestricken u made mention of her,",3 months ago,Nick Davis,UCOwHDFcEizaFrlBcgW4NwCg,0,https://yt3.ggpht.com/cUZ9qqGjYSe1O1Lvrogq1c98VCumqBMCfTRvnABMDjfVvzK5r5OKJhuFUDXzjRP27Y8WD7KmAg=s176-c-k-c0x00ffffff-no-rj,0.0
UgzDYfSrveGtypCgJBt4AaABAg.9X6-Qv4FGlQ9X6-kx27dRd,"Elizabeth Rhodes really knows her way around trading, its evident from her deep knowledge of how the market works, reading signals to perfection, i feel very safe trading with her.",3 months ago,Ariana Walter,UCU0neqUXPh1jRZBOk-IRf0Q,0,https://yt3.ggpht.com/LXZrrxNWYdAXQuHkpU04C8MpifqOm1qMxMfo2wGLinSfmZJA6A1aO7e2f1WH67l6N1Cja0m_Cg=s176-c-k-c0x00ffffff-no-rj,0.0
UgzDYfSrveGtypCgJBt4AaABAg.9X6-Qv4FGlQ9X6-nkWpPoB,Access to good information is what we investors needs to progress financially and generally in life. here's a good one and I am grateful.,3 months ago,Frank Harvey,UCmAttTtNZEr1DmbyTjvDYwA,0,https://yt3.ggpht.com/YHwl2zdG9zRaenjldrpZkJwf9pZ-K1Hr2bMCRcUqBL-Xq9TJV1n19CEuZo1gG2YG-wz6eVklQw=s176-c-k-c0x00ffffff-no-rj,0.0
UgzDYfSrveGtypCgJBt4AaABAg.9X6-Qv4FGlQ9X6-rAFkBbs,Bitcoin is the safest crypto for investors right now. Couldn’t agree more about tradng with Elizabeth Rhodes she is the best 👌,3 months ago,Zoey Byron,UCASOX9iC3wXteJNitFvxh5w,0,https://yt3.ggpht.com/hz31YA7AATO6l8_bWf5fw72oR_JNOANCqtl-TkBVVf_ueIDFOEv8-dRj_8CXFLGnmYzB7hEt3g=s176-c-k-c0x00ffffff-no-rj,0.0
Ugy4TdUtal5-gtplS6h4AaABAg,LLA shorts made me know about this apple's marketcap & india's GDP,3 months ago,Aryan,UC-mSq-N1SINLl11BKjuseHQ,0,https://yt3.ggpht.com/ytc/AKedOLR8ULoPxwEPROdt_EOf2xykRbIXoa0tpGmbi0EHEw=s176-c-k-c0x00ffffff-no-rj,0.0
UgyyHL0qBd2s6UQJljF4AaABAg,"Comparing Apple's Market Cap with India's GDP , I hope we are considering the PPP (Purchase Power Parity) aspect into it as well.   With INR 12 Lakhs per annum , a person staying in Bhubaneswar is way more richer than the one staying in Mumbai.",3 months ago,Sandeep Janyavula,UCWom2UAW6aZqG5cVCT6qVww,1,https://yt3.ggpht.com/ytc/AKedOLS8uxMPM_E_Xr8dEx-y7WS3Gh3E54D2I8Tnug=s176-c-k-c0x00ffffff-no-rj,0.0
UgxUf8NfZLmWRbrqHix4AaABAg,"Sir, you said u have invested in jp power, bt in tickertape not even single +ve point is present, how do you figure out that its nxt best multibagger ??",3 months ago,manoz .n,UCNTFAjQdYVeeSLHVx76_U_Q,0,https://yt3.ggpht.com/ytc/AKedOLQByrRzrLWZLwcgI7rSa06sQzr4EHg1D5H5U911HA=s176-c-k-c0x00ffffff-no-rj,0.0
UgwKc9PKwaMwhxfS35t4AaABAg,"Can Amazon cross Apple in terms of  market Cap  in near future? After listening to your video, i feel it will cross. What others think?",3 months ago,Adinarayana Gudla,UCRl_H35pjgTkvA6I16OeN1Q,1,https://yt3.ggpht.com/ytc/AKedOLRdT6c10eWXdi6YbfMn3iiZZKi5tzKVSYn4CimEzQ=s176-c-k-c0x00ffffff-no-rj,0.0
Ugw2vjzsZrr2JHUmb254AaABAg,How can retail investors invest in startups sir could you make a video on that please,3 months ago,heet surana,UCaJJVILOKIAfUD-6vGISkTQ,2,https://yt3.ggpht.com/ytc/AKedOLSAwETpwg-_ivcCYVlzkhMq8C1lI6Ljv_Xujjft6Q=s176-c-k-c0x00ffffff-no-rj,0.0
UgzRyc-TkAYAE6SNbQd4AaABAg,Kpit 😀,3 months ago,Crypto Guy,UC11ivB3uUdv0m-jetPR-iwg,0,https://yt3.ggpht.com/m2Bp6GDpTUQ55WlSiR-KecwluUJITlLp-bX1ZZkG1dMmZp7_Pti5mrDp3WZChRdwKod-RtT5-w=s176-c-k-c0x00ffffff-no-rj,0.0
Ugy3keU0VdEudI1Hm3B4AaABAg,"NOTHINGS IMPOSSIBLE.
FB, AMAZON, APPLE WILL BE BEATEN BY OUR INDIANS ONLY... 😊HOW TO INVEST IN US STOCKS PLZ TELL",3 months ago,nitin naik,UCi9fdJQlSpMrdtuYGMzEHfg,0,https://yt3.ggpht.com/ytc/AKedOLSDwXGCUdWhRRlUuPtGZcZQ4bSDytvA9JEgdw=s176-c-k-c0x00ffffff-no-rj,0.0
UgyNyy7aVEU7sNrsZrN4AaABAg,"Hi sir I have invested in JP Power at Rs: 4.75 now the share price is at 9.80. It is having still potential to grow or shall I exit, please suggest.",3 months ago,KYV's - all in one,UC22z-5Vc5ojl5iy5cz3omZQ,1,https://yt3.ggpht.com/ytc/AKedOLTw4EHH34nyyRzzE50yh71Ei27WeeCHqBH9VGb5fg=s176-c-k-c0x00ffffff-no-rj,0.0
UgwMeLNmlvacFRhY6gB4AaABAg,Sir if we want invest in USA stocks .in which broker is best services in India give  details,3 months ago,koduru chidambararao,UCoZj9hHguEDCGus5h_OkgtQ,1,https://yt3.ggpht.com/ytc/AKedOLQCncaModIj8OtB6GxcWcmyXuQl31-ti-9JFw=s176-c-k-c0x00ffffff-no-rj,0.0
UgzUJ-GnAEgdcZYbG9p4AaABAg,How to invest in us stocks??,3 months ago,Vishnuraj,UCh8L40gR_XCysNpvTnuHlFg,2,https://yt3.ggpht.com/ytc/AKedOLTlYkp3Vl-7U398GMWrgJ-G5mxok1DqmSKYIw1djw=s176-c-k-c0x00ffffff-no-rj,0.0
UgxiUrdynIYrwwWWE754AaABAg,"Hey Akshat,
From my point of view, comparing a company's marketcap with GDP may not be the right one, but still I feel this is a worrisome sign. As you said in the video, Feds or Senate will not be able to break such companies rather than questioning or summoning them. Also, investing in the US stocks will provide us currency appreciation as well. We have seen INR falling against US for a large amount of time and its less likely that it would change. So, betting on US stocks not only gives us monopolies, but more returns (when calculated the returns on INR) and diversification as well. As mentioned regarding the monopolies traits, I completely adhere with you. Most of the top companies are thriving hard for Ecosystem play, Expansion and dominance. It would be better for us to learn if you could make some case studies on monopolies of different sectors.
Thank you!!!",3 months ago,Bala Nithya Nirmal,UChq7QsVMiOlrU3lMP5QhKYg,0,https://yt3.ggpht.com/ytc/AKedOLSHKSYgM45nM5tzqtVqh14MJhUHeJ9BiO1l7KZA=s176-c-k-c0x00ffffff-no-rj,0.0
UgywgpQ_zDMDokuV0AJ4AaABAg,"Seriously you are comparing a market cap of company to a company's GDP lol
It took many years for apple to become a 3 trillion but 2.7 GDP of India for one year.
I have a little faith on you now 😂",3 months ago,Dhruv G,UCgGYdlgdYD2R0uSsSQVjg1A,1,https://yt3.ggpht.com/ytc/AKedOLRVoKTR_PYVPuKhnxpPwZWx7PtjvXdTNe6AvQ=s176-c-k-c0x00ffffff-no-rj,0.0
UgwaMTl6XaekVuzUral4AaABAg,"No matter what, India IT's are the best for foreign tech companies as the labour cost will stay low in the future as well, so that contract stays intact.",3 months ago,vinodkmr,UCH3Ieg4JrsOiPT7rLwh1Tpg,0,https://yt3.ggpht.com/ytc/AKedOLRQrSfbFkqo-6RdMru0Hkc4jyKyr5ciCEuwHw=s176-c-k-c0x00ffffff-no-rj,0.0
UgxpufAIguwDQdB9m5V4AaABAg,"Pls look at Saurabh Mukhreja's views on TCS. It is a sort of Monopoly.
Give your views on it.",3 months ago,Vineet Agarwal,UCjmt3Xj3ApEmDWi_68OHiGQ,1,https://yt3.ggpht.com/ytc/AKedOLRTHTtUrSYC0TDZvnFwbPL3JVzM1Q0mSsl0iiDENg=s176-c-k-c0x00ffffff-no-rj,0.0
UgyQWZDAGKxGjaDpYEF4AaABAg,How can I invest amazon from india,3 months ago,GEORGE JUDE C.V,UCaCs96bIXmHCi3YJHqPButQ,1,https://yt3.ggpht.com/ytc/AKedOLRL9dI7GMJFHo1VO2wRvWGLGPkKzQ5dvxhnIA=s176-c-k-c0x00ffffff-no-rj,0.0
UgwwM_8U3e9g2VgPw4N4AaABAg,"Your source of reading like website,books, paper..etc",3 months ago,Kiran Kumar,UC1y3Mbawask61sOcwF6_1yg,0,https://yt3.ggpht.com/ytc/AKedOLQ0yUOI8AqU63B_ehizRl58-NnXDXKU1xsBEw=s176-c-k-c0x00ffffff-no-rj,0.0
UgyxjwrBLv2ScHRS7Yh4AaABAg,They are not like Chem or Mech industry bends environment laws . IT mono giants due to their brain .,3 months ago,Ramesh S,UChepQGizB4QhAuS7W04Hi4w,0,https://yt3.ggpht.com/ytc/AKedOLRjHSaupz5fj6UoJZUlsfsrC3U8ffFhWm6n-ANEAQ=s176-c-k-c0x00ffffff-no-rj,0.0
UgzevWQOnqsK_Hz2QpR4AaABAg,"Hi Sir , what do we do to invest in such companies as what you told about in this video",3 months ago,MrThomsontm,UCNx2ytE3pdH_cV07_CMai8Q,1,https://yt3.ggpht.com/ytc/AKedOLTzqPKK9yoAg1K336enmj7W8IRV1ZRDuWunbw=s176-c-k-c0x00ffffff-no-rj,0.0
UgzkdcYegw8uu6VIED54AaABAg,Hi Akshat can you please make a video for ABSL AMC,3 months ago,Tanmay Budukh,UCrh1MLfUAH35Bmo-IesUj6g,0,https://yt3.ggpht.com/ytc/AKedOLTy9MbOECiuJozoj4fTCFL8Yf7AbR8QyrsBj-W8vg=s176-c-k-c0x00ffffff-no-rj,0.0
UgwK6ZVep7xLAkBb47V4AaABAg,"Hi Akshat Sir,getting so much knowledge from your work,will be a help if you put some light on 12am club with a short video/clip.",3 months ago,Prasanta Chattaraj,UCfAHoD0S6lllxJfNgBKsRzA,0,https://yt3.ggpht.com/ytc/AKedOLRG9vM4O5EEGkr5r5nfiZ5qwTT_7LSU3FDbww=s176-c-k-c0x00ffffff-no-rj,0.0
UgxUf8NfZLmWRbrqHix4AaABAg.9X2aPg_0L9r9_kH-IJWAdU,"Feedback Appreciated
Wanting more info and insight?
Do well to contact the number above..",4 days ago,WhatsApp 十⓽⓵⓼⓼⓻⓶⓽⓶⓹⓺⓻⓷,UCohubyvbRG_cpyLyv09Huaw,0,https://yt3.ggpht.com/hQV0_b97oFuYdJW-ttMXYfkm_DQ8GH4C-Bqos4dlKIf3sCpeM9g3Wg1XpRDXKxu9a_Jdx9IDSg=s176-c-k-c0x00ffffff-no-rj,0.0
UgyF-GFBrhe5Rawa6-94AaABAg,"Hi Akshat, can you please tell bout Bitcoin Loophole. Heard about this in an article. is it for real or you feel it is a scam? I follow your tutorial for investing. Hence want to ABT this",3 months ago,Meghaa Ahuja,UCSZuCaSuSjtM3nrH9Gzj26g,0,https://yt3.ggpht.com/ytc/AKedOLSiELbJB_WcoCV_rKW-1DZi8Rv-3ZvHGanuJb5Wcg=s176-c-k-c0x00ffffff-no-rj,0.0
UgwOS9JInxLcLIcBUIt4AaABAg,Could you help understand the value of debt free company and it’s goodwill over 50 yrs?,3 months ago,Bit VG,UC4tM6E3iDM5cjwDxVF6fc-g,0,https://yt3.ggpht.com/ytc/AKedOLS8XU3Tm81ksjWMCO0KZt1CxN8fZbfP8ZZwjA=s176-c-k-c0x00ffffff-no-rj,0.0
UgwTCwXk0ker8osPNS14AaABAg,"No , There is nothing to worry about Akshat, because the valuation of APPLE is based on whole 75 years of its carrier but in case of India's GDP it is define by the total amount of export done by a county , hence there is no reason for worrying . it is just a friendly comparison .",3 months ago,INDI - AN - IMATOR,UCD11QAiRHERHl5hDr5Mp_3w,0,https://yt3.ggpht.com/ytc/AKedOLSrqCMUmOf2R05R69Nzp9G5ZEEcDkAr2oCZIA=s176-c-k-c0x00ffffff-no-rj,0.0
UgwbODzmsAAdO_u0KBR4AaABAg,Hi bro. Shall we exit from Paytm now?,3 months ago,Sree,UCzCQcE45343UTBGFripROiw,1,https://yt3.ggpht.com/YQHeoMWsAChwbfvnTs-chdCOwMjZnIA4XrqA5Le5qyxAqqqJn4zyq6SJ8OCKXGRTm43Of0s-=s176-c-k-c0x00ffffff-no-rj,0.0
Ugw8_LoosU2gqyWXzHN4AaABAg,"TCS and Infosys failed to gain in consulting were Accenture is leading. I am not talking about IT service, but about consulting.",3 months ago,MSN,UC1Q2BL_EYA5T3ZPTZwkFG9A,0,https://yt3.ggpht.com/ytc/AKedOLSejaEkPguCSROEk4eGYMqZKn_GTIaXI6787g=s176-c-k-c0x00ffffff-no-rj,0.0
UgxQL3u7PyDoNc69ij94AaABAg,15:34 That's JioMart guy👀😂,3 months ago,Smit__K_,UCXyqV9td2pmoMKk_-nRPZYg,0,https://yt3.ggpht.com/ytc/AKedOLQs3E-14cyUrwm4WSKwpbZd-4zxgMvPFa4cbDWhKaY=s176-c-k-c0x00ffffff-no-rj,0.0
UgxTwN4aCj2FJ1XSqt54AaABAg,Pls also mention about taxation for retail investors on investing n startups which are not listed,3 months ago,sandhya godavarthy,UCL-hBRzHdYGCLCdxWC6P8PA,1,https://yt3.ggpht.com/ytc/AKedOLRFn-uBiUUvwcrIh9XLefMrskS2-QZM2lgVkJPhKeD-yUPACdcBWX2a_2nEomqa=s176-c-k-c0x00ffffff-no-rj,0.0
UgzW3_MWM9eXDlQIT814AaABAg,which sectors/ stocks will be performing good during inflation??,3 months ago,daanish feraze,UCx0n6PCl5Ly_D8md8Mc7e9w,0,https://yt3.ggpht.com/ytc/AKedOLT9UUBG8M9kIJsCT6viZJ8Gwu62Jl-LXVcX-sxO=s176-c-k-c0x00ffffff-no-rj,0.0
UgwCFLgs_qe4Z1yHK-d4AaABAg,Do video on poonawala fincorp,3 months ago,S P,UCMQdcWmmt2QXKzJn4p5r_mg,1,https://yt3.ggpht.com/ytc/AKedOLSexAqOR4iZj-SO4ZxiHxEs3pddkIlTujMKO1a8pA=s176-c-k-c0x00ffffff-no-rj,0.0
UgzUJlgiIgOHyn8aK1l4AaABAg,Do you use VESTED Direct Account? or attached an bank account?,3 months ago (edited),Ashish Patil,UCMge4cuVZgvGavoClj2_DcA,1,https://yt3.ggpht.com/ytc/AKedOLQiUk895EWcdKGKXA_6kuoEoLNT1lC02PtBSC4QzAk=s176-c-k-c0x00ffffff-no-rj,0.0
