cid,text,time,author,channel,votes,photo,heart
UgyFea_GV4Nw1hsbrJ14AaABAg,"►For personalized classes on stock market, please check [Last few seats left for March Batch]:
https://wisdomhatch.com/",1 month ago,Akshat Shrivastava,UCqW8jxh4tH1Z1sWPbkGWL4g,2,https://yt3.ggpht.com/VI0OvMwpPQPFGoHAQOHsvtEcFWg-_YzFBhoeohr2CRz1T21Ja4unTGte1Gz6TnDUgVX9wcOG=s176-c-k-c0x00ffffff-no-rj,0.0
Ugz62em_3-tn_ksMsE94AaABAg,Akshat ....Please stop the Buy on DIP videos...Though You are right on Your perspective.Market is fuckin has its own Perspective.,1 month ago,XMan,UCx0aUmFaw5eXSb8Yn4LKHIw,0,https://yt3.ggpht.com/-EEkQTWCo0D9Exjw3VqVuPAnkYJMFw5fpUP75Sh_fXYhL0OscjPL18TocjxeMIVq7-ReRMtnqw=s176-c-k-c0x00ffffff-no-rj,0.0
UgzdiFuW3G4D2jrDM254AaABAg,"Hi Akshat , can you please talk about NSE IFSC US stocks topic?",1 month ago,vinoth kannan,UCzT_cymcDEjCi5FyHEj36JQ,0,https://yt3.ggpht.com/ytc/AKedOLRIED9IJ2o8NO0ECHWokeWmsDN00_eG-75Z86bixQ=s176-c-k-c0x00ffffff-no-rj,0.0
UgxRkGJt-7UyTtvq8rJ4AaABAg,"i will forever be indebted to you, you've changed my whole life and i continue to preach about your name for the world to hear you've saved me from a finacial debt with just little investment, thanks so much Mrs Natalia Watson.",1 month ago, carlos Zach,UCbwV_2sLwx6lo3mEgxmnE9Q,15,https://yt3.ggpht.com/GqmrpDpsF_gC_VR99sYkB5qDd3JcTC3xD82e6gFIXnAHpE9nQ_4pFHOQOxrb57m4S24reB2QXQ=s176-c-k-c0x00ffffff-no-rj,0.0
UgztP8yvMSosSYXGoMx4AaABAg,Sir hindi me video banao na..,1 month ago,Satish Kannan,UCErSfWX-D12UO_JsdZCCZiw,0,https://yt3.ggpht.com/ytc/AKedOLS8XV1pWlQqRGo8wJj5iH_-1Mi4JzGC3l-dBSmbcQ=s176-c-k-c0x00ffffff-no-rj,0.0
UgxgOzme8HlZFhSGI5t4AaABAg,"Hi Akshat, I appreciate your efforts to create videos for everyone from beginners to experts in stock market. However, videos which are ""so obvious"" like these spoils the mood and flow of your whole YouTube channel for people who have atleast this much common sense. I urge you to split your channel into 2 parts (one for beginners and one for advanced level folks) so that neither of them feels cheated of their time watching such videos.",1 month ago,siddhant guralwar,UCTLC3iHQKssz_koPAg8m53g,0,https://yt3.ggpht.com/ytc/AKedOLRxoEBPe6zPg4wI7MKgCvqNq-4ROdOTjFum-w3aY78=s176-c-k-c0x00ffffff-no-rj,0.0
UgzbCurjfrtwivPLvAJ4AaABAg,Hello sir. You do put up videos on Live Investing. Please also let us know whenever you sell the stocks and why. Thanks.,1 month ago,VISHWANATH SHETTAR,UCTqZwJYcixJMWHYLzp5UjGg,0,https://yt3.ggpht.com/ytc/AKedOLRyWv4d5BPa0fHBpbQ7zR5_z2Rg41dxTG21rTKehWv7wolI4v8Km1onHMKuNfxP=s176-c-k-c0x00ffffff-no-rj,0.0
UgxgF47z5j5EMlvMZ854AaABAg,such misleading content,1 month ago,HLX S94,UC7HifjaRtpvSPccNCGmpzaw,1,https://yt3.ggpht.com/ytc/AKedOLSZgXoMhDTuOhVKrPlChPXt0GRQGaC1ZIA6Jm48=s176-c-k-c0x00ffffff-no-rj,0.0
UgzArVvZBEQR_PnKa7J4AaABAg,Akshat ur videos are having lower volume compared to other YouTube videos. This is true for most of the videos. Can u pls fix this sound issue. Thanks,1 month ago (edited),Arpan Shome,UCFhhwMs5h2AfAUQ81I4Ravg,1,https://yt3.ggpht.com/ytc/AKedOLR5BgJH5RVwSgXhOHwPEul2rMr5fozQ1fN-SA=s176-c-k-c0x00ffffff-no-rj,0.0
UgytGlPOi-vUd6hP8RF4AaABAg,Volume is too low,1 month ago,Ritesh Singh,UCTLBM3ke8LDUigyOwL6wYLQ,0,https://yt3.ggpht.com/ytc/AKedOLQjmJ6g-SH4oytptboEx44J8AcEiO5O67JtPUreBw=s176-c-k-c0x00ffffff-no-rj,0.0
UgzybAhFMr5PkHpc4XJ4AaABAg,"anyone here who believes in
buy high sell low?",1 month ago,Viraj Shah,UCvAPYenbGmTba3p7vh8b11Q,1,https://yt3.ggpht.com/ytc/AKedOLQ8_5zLsxl6JFtDRlK6HPNTwNRuduLRFDMLjg=s176-c-k-c0x00ffffff-no-rj,0.0
UgxhI99xP-1T6Dq225Z4AaABAg,"But guys this has to assured by Putin alone, am not seeing any indications of war being stopped.  That guy Comedian has no brain he wants to fight a big war without weapon,  he might ne thinking that it's a cinema shoot.  Totally the current situation is unpredictable,  it may worsen even more.",1 month ago,Manju N H,UC9LwWd1J-UOM18c-quS5z_g,0,https://yt3.ggpht.com/ytc/AKedOLTqFfJCXsjlMZRpecHAO0gNHWJKk-pfGp9OPuOD=s176-c-k-c0x00ffffff-no-rj,0.0
UgxwjoLhmDZK4MW7CLB4AaABAg,"If it were only that easy.

How can anyone predict what is the actual low and when is it exactly on the high??
No matter how much of current affairs you are upto date, its not an easy job.",1 month ago,A M,UCV6Mi2J8TJGGcD5LWstiwbA,0,https://yt3.ggpht.com/ytc/AKedOLQeDkr7Dj0in_N_-3WUMVuXcUHvCvuJ0vlgDR6j=s176-c-k-c0x00ffffff-no-rj,0.0
UgyKoJiLNY5banCS_494AaABAg,Very soft volume 😭,1 month ago,Samit Chakraborty,UCgSUPj_dqZ3FYjxJP8KmJGQ,0,https://yt3.ggpht.com/ytc/AKedOLRG5Cr0lri2quXc9tk-w9tyXDcP5Yzm04oEcw=s176-c-k-c0x00ffffff-no-rj,0.0
UgwEd8yJNInvpp9YCRh4AaABAg,Can u give some idea if any housewife has to start investing in share market..how she should start   ?,1 month ago,Gurmeet Chadha,UCHMmG4qNkiXRtEGKCQgtRHQ,0,https://yt3.ggpht.com/ytc/AKedOLRDHrT2oIPVr8vn_KuiUWrJCPPPcV8RR_cv9w=s176-c-k-c0x00ffffff-no-rj,0.0
UgyGDa3YkefFolw6YL54AaABAg,What if the war does escalate and it falls much lower like it did dyeing COVID,1 month ago,SuperKnight1010,UCfdDlNjT9N4CWxRXR5Gm6RA,0,https://yt3.ggpht.com/ytc/AKedOLT5Gvl4IN_NoRokBa5Pq7tXWaXiihNbGeOp=s176-c-k-c0x00ffffff-no-rj,0.0
Ugycg9EC_nsPVWDf2wF4AaABAg,"The lesson to be learnt by #India from #RussiaUkraineWar is that, if at all we are going to have a conflict with western countries, then we need to be ready to face their multinational companies like Alphabet Inc, Meta, Mastercard, Boeing, etc. too, in addition to their army...you were Questioning why we need a youtube alike a setup for india !!",1 month ago,Madhu R,UC2eQ5lEGLKj5D8b3376alIw,0,https://yt3.ggpht.com/ytc/AKedOLR96zuSr2LYqM-EqUDPzmMImvLI1NjBw4e29a85iaQ=s176-c-k-c0x00ffffff-no-rj,0.0
Ugz007T1tsZo-6YhZVp4AaABAg,Voice is too low. Please consider adding subtitles,1 month ago,Dragon Knight,UCha9S_wZ-whKOvtr_nJKNqA,0,https://yt3.ggpht.com/ytc/AKedOLR3G3N9fZZF3a-HTI5p--c05I2guTozl8daCtEs=s176-c-k-c0x00ffffff-no-rj,0.0
UgxnRHtMNJ9k0Ie_UWN4AaABAg,"Great advice for retail investors 🙏 provided they invest in sectors that would either benefit 
or not be adversely impacted from the war in Ukraine 🙏",1 month ago,Juicy banana,UCaSA85LTikN_G0iC9cHoBSg,0,https://yt3.ggpht.com/ytc/AKedOLR0BnBlL9DuNS0oWWRWNXzXl8IYSWlikb_ViQ=s176-c-k-c0x00ffffff-no-rj,0.0
Ugy0puF73UDIqlhU3L54AaABAg,Buy low & average low & average low & average low last Mai maal khtm 😛,1 month ago,RAJPOOT BOI,UCM-4H9AWIJGa_7G4u1EIZpw,1,https://yt3.ggpht.com/zYLsa3BAUGzZvwSKZMPJyT6HFATARJT_l3OQUWxuOGMOnuTpzAWbWz-ZkJy-_D9uuUBWzlt7EzU=s176-c-k-c0x00ffffff-no-rj,0.0
Ugz62em_3-tn_ksMsE94AaABAg.9ZGX0AdARDn9ZGiKTHVA4I,"👆🏼👆🏼👆🏼Thanks friend  for your comment...
 For more information, advice and consultation on  investment matters , reach out to the What'sap line above okay... 😊😊😊",1 month ago,Akshat S +➊(➒⓿➍)➒➊➐-➐➒➊➑,UCZlE4Y_6xxMiO8IU2N9tr6A,0,https://yt3.ggpht.com/zRF3sZwDNGkWNXDIZw5JM_yXGFg7iH5imrxI9YWyMZ8v_VBbFSkJ2Q6Ra39U2TNq0_qzis_8Qg=s176-c-k-c0x00ffffff-no-rj,0.0
UgxRkGJt-7UyTtvq8rJ4AaABAg.9ZFF9TnHiJU9ZFFL2eWN5z,"Wow, amazing to see others who trade with Mrs Natalia Watson, I'm currently on my 5th trade with her and my portfolio has grown tremendously",1 month ago,NELSON MOORERE,UCFlRID-gJNFTPlHPRIfqXnw,0,https://yt3.ggpht.com/BBX8ILHy15tZC0oLCN_7zmD2W7KKviNXUSZsaizNjEetTcxGyP-uGXRf_W6M7stBOL2yF6M8=s176-c-k-c0x00ffffff-no-rj,0.0
UgxRkGJt-7UyTtvq8rJ4AaABAg.9ZFF9TnHiJU9ZFFQUVVa3M,"I invest with Mrs Natalia too, she charges a 20% commission on profit made after every trading session which is fair compared to the effort she put in to make huge profits",1 month ago,Emily Stewart .J,UC3X5a9D_jpdUpVRvPPezCJQ,0,https://yt3.ggpht.com/f4DYV5hrXzR7IvbIEVdyPTKNnHn6WhduZmuAoJwMQc07HIikyIsMBLCleTUsSwDRQ30wB89FNVw=s176-c-k-c0x00ffffff-no-rj,0.0
UgxRkGJt-7UyTtvq8rJ4AaABAg.9ZFF9TnHiJU9ZFFhJXSRBw,"This is not the first time I am hearing of Mrs Natalia Watson and her exploits in the trading world but I have no idea how to reach her.

 I'm new at this, how can i reach your broker",1 month ago,Leron semendo,UCprwgMcr7uqM62RNcsRmomA,0,https://yt3.ggpht.com/S0i133Xq_7_9T9NR3A2zx9r3iBCdEOGpo1nyvcoBZBidjmHhpVfRqVfySRhZpQ6iMfB6KwTn=s176-c-k-c0x00ffffff-no-rj,0.0
UgxRkGJt-7UyTtvq8rJ4AaABAg.9ZFF9TnHiJU9ZFFzehEp6N,As a first time investor I started trading with her with just a thousand bucks. my portfolio is worth much more than that now within just weeks of trading with her.,1 month ago,Richard Docherty,UCpBq33N3sVX1o_zb5KfAyPA,0,https://yt3.ggpht.com/SjFkvqi66HaydG1Ko7caDHOTmrurBKXeRhsh02m77Aivfc69GNdhrEGHDXyqQuAljLZHPA_m=s176-c-k-c0x00ffffff-no-rj,0.0
UgxRkGJt-7UyTtvq8rJ4AaABAg.9ZFF9TnHiJU9ZFGHKUrowK," @Leron semendo  :yt:  You can communicate with her on telegam with the user name below

investwithNATALIA💯",1 month ago,Emily Stewart .J,UC3X5a9D_jpdUpVRvPPezCJQ,0,https://yt3.ggpht.com/f4DYV5hrXzR7IvbIEVdyPTKNnHn6WhduZmuAoJwMQc07HIikyIsMBLCleTUsSwDRQ30wB89FNVw=s176-c-k-c0x00ffffff-no-rj,0.0
UgxRkGJt-7UyTtvq8rJ4AaABAg.9ZFF9TnHiJU9ZFGLhcQB4-,"I have traded with a lot of individuals but I have  never come across anyone as good as Mrs Natalia Watson, just by applying her strategies I now trade independently. she is the best I'd advise any novice in investing to trade with her.",1 month ago,stanly better,UCUuPsvop2VBHhajzOGcdwEg,0,https://yt3.ggpht.com/ytc/AKedOLQDppLUFMHMN2SGVCN5MS8OizcTfep4EFiOjo57=s176-c-k-c0x00ffffff-no-rj,0.0
UgxRkGJt-7UyTtvq8rJ4AaABAg.9ZFF9TnHiJU9ZFGYnCD5xM," @Emily Stewart .J   Got it, thanks!Very nice!Very interesting!",1 month ago,Leron semendo,UCprwgMcr7uqM62RNcsRmomA,0,https://yt3.ggpht.com/S0i133Xq_7_9T9NR3A2zx9r3iBCdEOGpo1nyvcoBZBidjmHhpVfRqVfySRhZpQ6iMfB6KwTn=s176-c-k-c0x00ffffff-no-rj,0.0
UgxRkGJt-7UyTtvq8rJ4AaABAg.9ZFF9TnHiJU9ZG2K3m7AFD,Bhai tum log kaun ho yaar.,1 month ago,Saurrabh Singh Kushwaha,UCZwNCU8hcWJ8ZfmPduTLbbA,0,https://yt3.ggpht.com/ytc/AKedOLRIHXrr8mqH_0uhl3vmc4MLBDXXkAPgBHmJG8HXbw=s176-c-k-c0x00ffffff-no-rj,0.0
UgxRkGJt-7UyTtvq8rJ4AaABAg.9ZFF9TnHiJU9ZGCgAFqudY, @Saurrabh Singh Kushwaha   contact her for more information,1 month ago,stanly better,UCUuPsvop2VBHhajzOGcdwEg,0,https://yt3.ggpht.com/ytc/AKedOLQDppLUFMHMN2SGVCN5MS8OizcTfep4EFiOjo57=s176-c-k-c0x00ffffff-no-rj,0.0
UgztP8yvMSosSYXGoMx4AaABAg.9ZF6YpK9C1K9ZFijiz6BiI,⬆️⬆️Thank you for your comment.... Contact the What'sap line above for more information and advise on profitable investments..,1 month ago,Akshat. S ±➊➋➊➌➏➌➋➑➏➍➊,UC-gFlQ_MJ7zfpI-8KOGIb6w,0,https://yt3.ggpht.com/Uqj0IRccS8qEqaqAOajIH13LG3rEcTmapr3am1lq25fGU65CnsxNrWLyqCCVbXLMhh20Et_16w=s176-c-k-c0x00ffffff-no-rj,0.0
UgxgOzme8HlZFhSGI5t4AaABAg.9ZEzlJ2du4-9ZFibzq5r0G,⬆️⬆️Thank you for your comment.... Contact the What'sap line above for more information and advise on profitable investments.,1 month ago,Akshat. S ±➊➋➊➌➏➌➋➑➏➍➊,UC-gFlQ_MJ7zfpI-8KOGIb6w,0,https://yt3.ggpht.com/Uqj0IRccS8qEqaqAOajIH13LG3rEcTmapr3am1lq25fGU65CnsxNrWLyqCCVbXLMhh20Et_16w=s176-c-k-c0x00ffffff-no-rj,0.0
UgzybAhFMr5PkHpc4XJ4AaABAg.9ZEdsmnMXVH9ZS39Ri7idd,"Thanks~~~~~<for watching and don’t forget to hit the like button and if you want <<advice…and insight….~~<~wh𝕒𝕥𝚜𝚊𝚙𝚙 below! ! ~<~~
✞𝟏𝟐𝟔𝟕𝟔𝟒𝟕𝟕𝟎𝟑𝟐••☀︎︎☀︎︎",1 month ago,Akshat.S ±①②⑥⑦⑥④⑦⑦⓪③②,UCuUHG83SEdtjE3EM7Q9RxXQ,0,https://yt3.ggpht.com/K_rCcYYvtgDE97vj5yCcn9KXZ9g0iYfWGIwS5N1eMQ1LJMg5fC63UYtW70ekrMn5ZuPD3LFZ=s176-c-k-c0x00ffffff-no-rj,0.0
UgxhI99xP-1T6Dq225Z4AaABAg.9ZEcJIP8KHG9ZS3BjdhJ8u,"Thanks~~~~~<for watching and don’t forget to hit the like button and if you want <<advice…and insight….~~<~wh𝕒𝕥𝚜𝚊𝚙𝚙 below! ! ~<~~
✞𝟏𝟐𝟔𝟕𝟔𝟒𝟕𝟕𝟎𝟑𝟐••☀︎︎☀︎︎",1 month ago,Akshat.S ±①②⑥⑦⑥④⑦⑦⓪③②,UCuUHG83SEdtjE3EM7Q9RxXQ,0,https://yt3.ggpht.com/K_rCcYYvtgDE97vj5yCcn9KXZ9g0iYfWGIwS5N1eMQ1LJMg5fC63UYtW70ekrMn5ZuPD3LFZ=s176-c-k-c0x00ffffff-no-rj,0.0
Ugy0puF73UDIqlhU3L54AaABAg.9ZESELwWVZN9ZETsepUHBA,Then wait for an year 🙏,1 month ago,Juicy banana,UCaSA85LTikN_G0iC9cHoBSg,0,https://yt3.ggpht.com/ytc/AKedOLR0BnBlL9DuNS0oWWRWNXzXl8IYSWlikb_ViQ=s176-c-k-c0x00ffffff-no-rj,0.0
Ugy0puF73UDIqlhU3L54AaABAg.9ZESELwWVZN9ZEjb-tQ7r6,"Bro gaadi, mobile bech do",1 month ago,Fradie D'Souza,UC6q2mRDPBzNZ3KZBg5zOXog,1,https://yt3.ggpht.com/ytc/AKedOLTU6nVnOhoGU3UHDs_pjMzXtfMlOLWFqpt14w=s176-c-k-c0x00ffffff-no-rj,0.0
Ugy0puF73UDIqlhU3L54AaABAg.9ZESELwWVZN9_P8-jap_SL,"ᖴeedback appreciated.
Wanting more info and insight? 
WatsApp the number above, 
endeavour to reach out.",12 days ago,S.M.C. +①⑨④⓪②⑨⓪②④②⑥,UCFFdCL0cX4Ed7QgNYzjqUlA,0,https://yt3.ggpht.com/NyJIjPkvvoAV2yyZdsJERR_io5Ohzr9_t_DqTGhNIqLww88lLm_RPObbF9wpdDGVDNFgBSQc=s176-c-k-c0x00ffffff-no-rj,0.0
UgzUBb9ZauJpZBNfCIp4AaABAg,Now buy low sell still low is going in market,1 month ago,nag 65,UCgMDBtGOXOVPQwefdMjxl3Q,0,https://yt3.ggpht.com/ytc/AKedOLR8edbVLSENeWZdzCHpf9H3ltu5V0E6KWl65w=s176-c-k-c0x00ffffff-no-rj,0.0
UgyGe-mc_YFfLawqEWZ4AaABAg,Your voice is too low in shorts,1 month ago,Vimal,UCqezHuFiteBUeWFTVmg_gFA,0,https://yt3.ggpht.com/ytc/AKedOLR7SbAI_O4oSFUOdTahYEF7YAuRffeoJV2KZPtlxw=s176-c-k-c0x00ffffff-no-rj,0.0
UgzLlssJGjfVtuNrA9p4AaABAg,The volume of video is low and the ad shows which is normal thats why i am complaining volume of video is low,1 month ago (edited),Jay Matang,UCXveCQeN1mz8PiAWAoO2BeA,0,https://yt3.ggpht.com/UQAyV3OJgnAhnwgylpsUHPVA0d3xejV0yAPcdrvcmrzTUEZmmebsnk3fw2cEka0sz10awb6I=s176-c-k-c0x00ffffff-no-rj,0.0
UgyfxBv3arEvJ2y1PNx4AaABAg,but prob is what is low ?,1 month ago,mahesh V,UCi8-Ytah2HvxND2s-a_WL5A,1,https://yt3.ggpht.com/ytc/AKedOLSppJ7C6wohhqpX2Iod3yoT_qcC7XI3LtGolQy-Cw=s176-c-k-c0x00ffffff-no-rj,0.0
Ugwn_H68dbzgD6vnjVV4AaABAg,Which stocks your going to add to your portfolio this week sir......,1 month ago,ALE AJAY KUMAR,UCLBSTSVxWDiudEn9sisqXdw,0,https://yt3.ggpht.com/ytc/AKedOLTU6UfTGHnkOxnn2CZdmVWglP-uJW9NlVL-wVV33A=s176-c-k-c0x00ffffff-no-rj,0.0
UgwTq7HIheCEaEGWB6t4AaABAg,"Ur shots video, volumes are not audiable",1 month ago,Sayantan Chatterjee,UCz5yjsS2XduKqppIlzyNQsQ,1,https://yt3.ggpht.com/ytc/AKedOLTBPPzPINz193-6ERQqsOlCXqVEYSwSDi0AC3fV6PM=s176-c-k-c0x00ffffff-no-rj,0.0
Ugznql4C17RmdrkdMYl4AaABAg,"In a few years to come I'm sure people will be kicking themselves after Being aware of the opportunity they missed not investing in Crypto currency trading. My advice to investors right now, Just seek professional help from a good financial adviser to avoid loosing money.  I'd suggest you get assisted by a market advisor like BLAINE PHILLIPS JR",1 month ago,Alex Benjamin,UCp8B6A0U2mRZoxTh5UfgM0w,2,https://yt3.ggpht.com/ytc/AKedOLR58rEVPtF7j_HCxgp1OPHyzLcBnOLVcCZbiZgw=s176-c-k-c0x00ffffff-no-rj,0.0
UgwMCvqeU52svmyZzzN4AaABAg,I firmly believe you have loss of alteast 10-15 lakhs,1 month ago,hitesh kakkar,UCK0esZHyB9vwXXiBl0_y2eA,3,https://yt3.ggpht.com/ytc/AKedOLQaIxr0-KI1FQWowmskpOn6ZBBWYIi1b4DrfQ=s176-c-k-c0x00ffffff-no-rj,0.0
Ugz-ZytUkeyy9FX2THp4AaABAg,Sir your voice is too low if facing this issue since last 3 to 4 videos of you even my volume in my mobile is full please fix these asap,1 month ago,Md Raheem,UCURoFrp37EGXSX82snjUK_w,0,https://yt3.ggpht.com/ytc/AKedOLTyXWeo8s30df1wA4BDfSjQZH3Ohh1HTaywRg=s176-c-k-c0x00ffffff-no-rj,0.0
UgzW8cV9m-kPBQy3rCN4AaABAg,please avoid this aspect ratio..,1 month ago,thomas ponnan,UCPTIbL1jX3kYoFz8MPVGP3A,0,https://yt3.ggpht.com/ytc/AKedOLSCqfpYludbUqu5Q8ts6JePs4V2cJ3ZMRkzMYPpTw=s176-c-k-c0x00ffffff-no-rj,0.0
UgxcFrHsfamFM-xlTa54AaABAg,Thanks,1 month ago,Kamlesh Mistry,UCI9oCwjXC3XXN3Iqz8RksgQ,0,https://yt3.ggpht.com/ytc/AKedOLSi_l884-0aomNoK-Ie-V-rxIpxXih2wePiBw=s176-c-k-c0x00ffffff-no-rj,0.0
UgwL_7IhwEGS6_bCiAB4AaABAg,"The mike is jeopardizing the content from last few videos. If you are not paying attention to the comment section, then this mistake will cost you.",1 month ago,Subhra,UC75TbqB1a1z-FpRxhXuNGEQ,2,https://yt3.ggpht.com/ytc/AKedOLTdl7jKSNFE1t8Pz9cXL_0rmisIIjjigUruFXkV0g=s176-c-k-c0x00ffffff-no-rj,0.0
UgwaSyx-IO_qR4lbD_d4AaABAg,I will regret this opportunity,1 month ago,MOHSIN S,UCexVetTlze31xHjsru2Gx6g,1,https://yt3.ggpht.com/ytc/AKedOLS2qkfoByL8-7G7U82XgsTCUf9Qu2sbTwlrG-fVvQ=s176-c-k-c0x00ffffff-no-rj,0.0
UgyEX6CwFkGj_3Qi9dN4AaABAg,"Hey Akshat, seems like you mic needs some work...it is l coming out lower than other older videos of yours..",1 month ago,Sagar Madhok,UCQitXOt92TJvL7uhJJgat6Q,28,https://yt3.ggpht.com/ytc/AKedOLTynf8QEtEHMBfbqgOV-5rtifURDhyKYlZixJiqTg=s176-c-k-c0x00ffffff-no-rj,0.0
UgwmQZpC2nnBRDgP1414AaABAg,wait was the volume less for only me or others as well?,1 month ago,Gaurav Kulkarni,UCFvFGMZScmaMG4aj7w5Cxqg,21,https://yt3.ggpht.com/ytc/AKedOLSIV_ufz6xAH0ayY3BhtLfrjbcZUeYmizisSg=s176-c-k-c0x00ffffff-no-rj,0.0
UgxfqZbq5KrPnhFVO094AaABAg,Sir plz make 20 min video on this strategy it is super practical,1 month ago,Sanket Jain,UC8mkZWplrTgYUT1ViYM0Zww,25,https://yt3.ggpht.com/ytc/AKedOLQCWAddI_r32Zj7IfDOf925lCpuk7XoMjM-gg=s176-c-k-c0x00ffffff-no-rj,0.0
UgzUBb9ZauJpZBNfCIp4AaABAg.9ZERaWHQ0K_9_P89sFCte2,"ᖴeedback appreciated.
Wanting more info and insight? 
WatsApp the number above, 
Endeavour to reach out.",12 days ago,S.M.C. +①⑨④⓪②⑨⓪②④②⑥,UCFFdCL0cX4Ed7QgNYzjqUlA,0,https://yt3.ggpht.com/NyJIjPkvvoAV2yyZdsJERR_io5Ohzr9_t_DqTGhNIqLww88lLm_RPObbF9wpdDGVDNFgBSQc=s176-c-k-c0x00ffffff-no-rj,0.0
Ugwn_H68dbzgD6vnjVV4AaABAg.9ZEOW8lMovH9_2bPYR77RB,"ᖴeedback appreciated.
Wanting more info and insight? 
WatsApp the number above, 
Endeavour to reach out.",3 weeks ago,Akshat S. +①⑨④⓪②⑨⓪②④②⑥,UCuSkJdq8FysZunRhjQJ_KFg,0,https://yt3.ggpht.com/0_peNVc7oWg4j8RvdcE03J7Hr1VTOab8DiT9avZru-L6B5MKFYNcMm-6oD2eqMeJDfY89POQ4Q=s176-c-k-c0x00ffffff-no-rj,0.0
Ugznql4C17RmdrkdMYl4AaABAg.9ZEL4rezaJZ9ZELSqeyGnz,"I totally agree with you, Forex trading is the most profitable venture I ever invested in, I reached my goal of $500k yearly trade earnings, setting realistic goals is an essential part of trading",1 month ago,Sandra Barbs,UCFQag6xzcoDqXUY1S5nEupA,1,https://yt3.ggpht.com/ytc/AKedOLSVlY-5inMN3mCTZU7VwRaPIQ8I-jjsDF-1fCS5=s176-c-k-c0x00ffffff-no-rj,0.0
Ugznql4C17RmdrkdMYl4AaABAg.9ZEL4rezaJZ9ZEOBeVams0,"I totally agree with you, Forex trading is the most profitable venture I ever invested in, I reached my goal of $500k yearly trade earnings, setting realistic goals is an essential part of trading",1 month ago,Jane Foster,UCQgJoMsHcEqU1yPyzm0CKpg,1,https://yt3.ggpht.com/-zToUiTxzgN9zSMlD_-c4XDy9Fa1h9rhVU7Q72xvLTEJT6HR9bQmTqjexSSgg72OZepMFNDo=s176-c-k-c0x00ffffff-no-rj,0.0
Ugznql4C17RmdrkdMYl4AaABAg.9ZEL4rezaJZ9ZEOGN1H3rl,please how do i get to reach him?,1 month ago,Trevon Jackson,UC4EGqAeTicc6dzni_-QzLpQ,1,https://yt3.ggpht.com/ytc/AKedOLRMvIZby1Y_Yo7NAvfYQv0nwCJYKl5Ftmy0bGg2bg=s176-c-k-c0x00ffffff-no-rj,0.0
Ugznql4C17RmdrkdMYl4AaABAg.9ZEL4rezaJZ9ZEOIfHQoQ-," @Trevon Jackson  Look him up on the web, you can reach him through his personal site",1 month ago,Alex Benjamin,UCp8B6A0U2mRZoxTh5UfgM0w,1,https://yt3.ggpht.com/ytc/AKedOLR58rEVPtF7j_HCxgp1OPHyzLcBnOLVcCZbiZgw=s176-c-k-c0x00ffffff-no-rj,0.0
UgwMCvqeU52svmyZzzN4AaABAg.9ZEKNzwBbnA9_2bDCfyTwi,"ᖴeedback appreciated.
Wanting more info and insight? 
WatsApp the number above, 
Endeavour to reach out.",3 weeks ago,Akshat S. +①⑨④⓪②⑨⓪②④②⑥,UCuSkJdq8FysZunRhjQJ_KFg,0,https://yt3.ggpht.com/0_peNVc7oWg4j8RvdcE03J7Hr1VTOab8DiT9avZru-L6B5MKFYNcMm-6oD2eqMeJDfY89POQ4Q=s176-c-k-c0x00ffffff-no-rj,0.0
Ugz-ZytUkeyy9FX2THp4AaABAg.9ZEKGjm1yDc9ZETQM7TOe5,i thought there is some issue with my laptop speaker,1 month ago,ajay sai,UCctDZnGYsBT5V2GbF-CNWEA,0,https://yt3.ggpht.com/ytc/AKedOLSPmA2ljV73JSde1XxsbOHxOGoxKi5bd4_nD9pdHw=s176-c-k-c0x00ffffff-no-rj,0.0
UgxcFrHsfamFM-xlTa54AaABAg.9ZEI_0Rew7-9_2bG8PQceg,"ᖴeedback appreciated.
Wanting more info and insight? 
WatsApp the number above, 
Endeavour to reach out.",3 weeks ago,Akshat S. +①⑨④⓪②⑨⓪②④②⑥,UCuSkJdq8FysZunRhjQJ_KFg,0,https://yt3.ggpht.com/0_peNVc7oWg4j8RvdcE03J7Hr1VTOab8DiT9avZru-L6B5MKFYNcMm-6oD2eqMeJDfY89POQ4Q=s176-c-k-c0x00ffffff-no-rj,0.0
UgwL_7IhwEGS6_bCiAB4AaABAg.9ZEIXJvUqsk9ZSp8jIVJ8Q,"Absolutely, content creation should be complete, no undone",1 month ago,Ankur Bhowmik,UCpsds4SY5wmNdf7DAEZ_UaQ,0,https://yt3.ggpht.com/ytc/AKedOLRKwuiY_cmdWwolEuzUVddSpICIVzxPaFUEc_P36_Q=s176-c-k-c0x00ffffff-no-rj,0.0
UgyEX6CwFkGj_3Qi9dN4AaABAg.9ZEGDbjy9a29ZEgk1YSpkL,"very true , initially i thought my laptop had some issue 😃",1 month ago,sachin navle,UCd2cp7VZNKIRQ_Rx5M3oFvg,0,https://yt3.ggpht.com/ytc/AKedOLTHTcBIsAuqYDBc00HBRfZqBlprXob6KNuwoAg_qiw=s176-c-k-c0x00ffffff-no-rj,0.0
UgyEX6CwFkGj_3Qi9dN4AaABAg.9ZEGDbjy9a29ZSp1ju012b,True,1 month ago,Ankur Bhowmik,UCpsds4SY5wmNdf7DAEZ_UaQ,0,https://yt3.ggpht.com/ytc/AKedOLRKwuiY_cmdWwolEuzUVddSpICIVzxPaFUEc_P36_Q=s176-c-k-c0x00ffffff-no-rj,0.0
UgwmQZpC2nnBRDgP1414AaABAg.9ZEGD2hlUHO9ZEHkOXkdgM,"⬆️⬆️Thanks for your comment…
Contact the What’sapp line above for more information and consultation on investment, also participate in the ongoing new investment plan…",1 month ago,Akshat S.➕➊➌➊➌➋➊➌➑➑➍➎,UCzn6wnG-Ghgopzz6Bh3ALiQ,0,https://yt3.ggpht.com/AY2roKNl2OdiqEy5yjYTwO-1Ap0A7cnXvBveHWP5H-OFPXK-gx7JZB1qtbWdUXf6lh_6MLopvw=s176-c-k-c0x00ffffff-no-rj,0.0
UgwmQZpC2nnBRDgP1414AaABAg.9ZEGD2hlUHO9ZENMVxGHgF,Yes too low,1 month ago,ً,UCSy-vk4A-yII6y66iOf-4Cg,1,https://yt3.ggpht.com/4APNFI-g_-QS4io4eM7gt8CKCYxLPRWVH4GEJj77p6IDFk_7XV3tE0nFZcLBrXQU5QWRA041=s176-c-k-c0x00ffffff-no-rj,0.0
UgxfqZbq5KrPnhFVO094AaABAg.9ZEFrh3XLY-9ZEHjF_2dXL,"⬆️⬆️Thanks for your comment…
Contact the What’sapp line above for more information and consultation on investment, also participate in the ongoing new investment plan…",1 month ago,Akshat S.➕➊➌➊➌➋➊➌➑➑➍➎,UCzn6wnG-Ghgopzz6Bh3ALiQ,0,https://yt3.ggpht.com/AY2roKNl2OdiqEy5yjYTwO-1Ap0A7cnXvBveHWP5H-OFPXK-gx7JZB1qtbWdUXf6lh_6MLopvw=s176-c-k-c0x00ffffff-no-rj,0.0
UgxfqZbq5KrPnhFVO094AaABAg.9ZEFrh3XLY-9ZEOMJTb46N,"It is not to predict 💯 on buy low and sell high, the only way is the invest money in good company...",1 month ago,Madhan Kumar,UCn_yhvZZeIjBgCv9BL1d9WQ,0,https://yt3.ggpht.com/ytc/AKedOLRG49qFd-3NVrwU9ddbFddK9C4677UYDM6Nl96M-9Cv5JbmJvIM4mIxgittx3B9=s176-c-k-c0x00ffffff-no-rj,0.0
