cid,text,time,author,channel,votes,photo,heart
UgzJXiQeIbJEWekmpOx4AaABAg,"►Download the Cambly app to start practicing 1-on-1 with a native English speaking tutor. 
https://www.cambly.com/en/student/subscribe?promoCode=akshatspecial
►Use Code “akshatspecial"" to get 25% off for any 3 month plan
_________________________________
►Check out our new course website:
https://wisdomhatch.com/
_____________________________________________________
►I teach about Stock market and cryptocurrencies on my course, you can check it out here: https://docs.google.com/forms/d/11xglZTe8SwGD0vh3A77Gopc-mtRR-pom-zH7fpp44qM/viewform?edit_requested=true",4 months ago,Akshat Shrivastava,UCqW8jxh4tH1Z1sWPbkGWL4g,12,https://yt3.ggpht.com/VI0OvMwpPQPFGoHAQOHsvtEcFWg-_YzFBhoeohr2CRz1T21Ja4unTGte1Gz6TnDUgVX9wcOG=s176-c-k-c0x00ffffff-no-rj,0.0
UgzZgHvrHnoSBXE9GUF4AaABAg,"Hello sir, I've been working for Indian Railways as a Junior engineer(Mechanical) since 5 years.

The nature of my job is maintenance of trains and labour management including distribution of work.

How relevant this experience of mine will be of I decide to go for MBA?",11 days ago,Parag Mehare,UC7KaqpA34nhhfhLZPM8i0hQ,0,https://yt3.ggpht.com/ytc/AKedOLQK4fwVuRDZ_-URfoLcXTcwAYw6lUbrzDNRwNrj=s176-c-k-c0x00ffffff-no-rj,0.0
UgwQP-d5OUNqbYy-8np4AaABAg,"Dynamic,brilliant.I love to learn new things. This has healed me.thanks",2 months ago,geeta singh,UCqTF-9XZMTSuKXHQ6dzGKnQ,1,https://yt3.ggpht.com/ytc/AKedOLRvCiZmg_k9ytwyRgftkxBNS1wb4c04-D8haA=s176-c-k-c0x00ffffff-no-rj,0.0
UgxPCc4l1V2eyVV4j0l4AaABAg,"Dear Akshat , I started my investment journey from 2012 approx , made mistakes & paid heavy cost for that , had seen many other person videos on YouTube regarding investing, but the way you have explained investment in stock market is awesome and I must admit  any layman can make good investment practice watching your video. What I really like is the clarity of your statement and logical reason behind every point. Keep up the great work. Big follower of you.",2 months ago,latturaj,UCwmAkTtZ7WcvQVE4TMsddoA,2,https://yt3.ggpht.com/ytc/AKedOLRJ0ZrJgZeeMV9lLmEeD15yJSGRdXw9nLsZfA=s176-c-k-c0x00ffffff-no-rj,0.0
UgxynWE9sgsr3swihJx4AaABAg,Thank you Akshat for a Very informative video thank you,2 months ago,Siva Nuli,UCsvvQF20tX1GLgoX9l4j_mQ,1,https://yt3.ggpht.com/ytc/AKedOLRQrxsrdcZz9q2NwArjgmK0cplSPd3a_mKuoQ=s176-c-k-c0x00ffffff-no-rj,0.0
UgxEfzSOU0uoG8vMfRN4AaABAg,"I just found your content very informative which can be practically implemented for self growth. I join ur YouTube channel few weeks back and now after watching numerous videos of urs, I felt that u opens up new horizons to my life by adding value. Now I daily wait for content and watch during my night shift ...I wish u all d best for giving such insight and vision to the youth. Love and blessings for Zayn..",2 months ago,h s,UCmQ5A73FwgGIwCxo9uA5G9w,2,https://yt3.ggpht.com/ytc/AKedOLQckJd9wMnWtwvPEn0mTY3VvKcAcnjLJNhl7g=s176-c-k-c0x00ffffff-no-rj,0.0
Ugz-B4nvPvYMIpRayY54AaABAg,"Glad you showcased what MBA actually means. It is more than just a 15-20L degree, it's all about how you want to mold it to your favor.",2 months ago (edited),Shreyas Bhasin,UC7Qv3qzMcO0iIySfeQoXSKQ,2,https://yt3.ggpht.com/ytc/AKedOLTjzIEFDN9wQJL9bKQSDECqP9U15Bef6RaxauK2EA=s176-c-k-c0x00ffffff-no-rj,0.0
Ugx4WkUrhqBz0ok1Ej94AaABAg,its not absolutely free if I spend a minute to see the advertisements 😂,2 months ago,Rahul Arora,UCFJZGhl-L9I44Jnq90uEOwg,0,https://yt3.ggpht.com/ytc/AKedOLSjZbTrGF6XXccVEa8Jb00P6pNr4JeZ4oMAh6V_DCM=s176-c-k-c0x00ffffff-no-rj,0.0
UgxQ_VoLl9PqaDS6oOl4AaABAg,"No need to make video of 20-30 mins, if you could concise it within 5-6 mins",2 months ago,Ashis Raj,UCip935SnMHnJZh-T5HSNl5A,1,https://yt3.ggpht.com/ytc/AKedOLTvyPg8k4FvRoDNwsOss2Qm3PWdAbvkQT0eSnLpEVA=s176-c-k-c0x00ffffff-no-rj,0.0
UgxPS0EWmOeEaohNKiJ4AaABAg,Absolutely loved this video in your entire channel. Thank you very much,2 months ago,Thiruppathi Karuppiah,UCjrZoGzyQ1Ao4VsqWlaLqbg,2,https://yt3.ggpht.com/ytc/AKedOLQUoGx56GAJhZb4-Yri2_ie1OZqUeRps2DpC9ujnw=s176-c-k-c0x00ffffff-no-rj,0.0
UgwRihPmFVpZKNs1gAZ4AaABAg,really great video worth watching after long time,2 months ago,challa nagendra,UCE9eEKF5fNfHgUwFqQotHpA,1,https://yt3.ggpht.com/ytc/AKedOLSmWSnEeN0AFdZ9DyD7M9S6c5Yqc0I-r27ikWPzLA=s176-c-k-c0x00ffffff-no-rj,0.0
Ugwo9pqN3SpC78wskTp4AaABAg,"Hi, Akshat your all video contents are very informative & yr presentation skill is superbb.... I thanks my 23 yr old son, who introduced me to your YouTube videos....daily at age of 49 I m learning new things from your videos.....Thnxs...",2 months ago,N. S. Joshi,UCZfoUU8i7s46pPft_tIdB4Q,2,https://yt3.ggpht.com/ytc/AKedOLT7j7_fT94KZQCmk0FrsyU6n2HhNeiLry6ezg=s176-c-k-c0x00ffffff-no-rj,0.0
UgxmFsCDauBKZh4LwcB4AaABAg,Really enlightning. Thanks for sharing knowledge.,2 months ago,Akash Rajpal,UCoIe0AkzXbW7aX1ySnj810g,2,https://yt3.ggpht.com/ytc/AKedOLRg28jXG8gHL4IwEg8mjTaAbj1s0dlVBmGowsnVQVUWXUPO4SkIxujnbzlr94ga=s176-c-k-c0x00ffffff-no-rj,0.0
UgyhvH8oyD-N3ZcT29Z4AaABAg,"Great video with Facts, No motivational Bs. As a consultant what could you sujest to Apply 80 20 principle in writing",2 months ago (edited),Nerd Bro,UCRfNK--oz5qoOw1Ol55ADgw,1,https://yt3.ggpht.com/ytc/AKedOLSS_0o5QnYKHWQdSyuYeb8sE9IjYSsCjrlVww=s176-c-k-c0x00ffffff-no-rj,0.0
UgypDLLIHyZ048P4WIJ4AaABAg,You are Gem ❤,2 months ago,chayan patni,UCaAeBECMIXKM1pSnwuGfaHw,2,https://yt3.ggpht.com/ytc/AKedOLTu_o1Qx5PBa0DvJ1DsF9RvvasHbvZ9mw2N=s176-c-k-c0x00ffffff-no-rj,0.0
Ugw16U8wC1t5gtdOl_p4AaABAg,Sir I want to share the snswer of question in jpg format so where can I send it.,2 months ago,FUN and LEARN,UCtkH_GXvTMxoXpHmPNiIuXw,0,https://yt3.ggpht.com/Rt7wUGeNpLZEktXBHrJ1UPk6pUbHOzWHEnzlYL6CyWAmRhE48qZulFlNILFdAqqN_gB7jaNis5M=s176-c-k-c0x00ffffff-no-rj,0.0
UgyAGMILuM-0TivQMzF4AaABAg,Thanks for all the efforts you put in to empower the society in different ways,2 months ago,Voice with Varun,UC2hRGFRjP6JMz0wbklt0dCg,2,https://yt3.ggpht.com/AjVGkrf2wuErT09mX5FmTu3_Cz2fOPdz0ve74FXtYvxgsod_riOrvpSL-4_treZIEQKyW2-y5A=s176-c-k-c0x00ffffff-no-rj,0.0
UgwJhJ7Sxjh_IJFcdqp4AaABAg,Pls start lelts training session videos sir,2 months ago,Organization and Minimalism,UCdqxbdftJ9YvsOcxEJ_pcxw,1,https://yt3.ggpht.com/ytc/AKedOLTJJFCLoPkpmdQVARMeVeGCh2-DQlKCymSMRg=s176-c-k-c0x00ffffff-no-rj,0.0
UgwlqO9WGje9e4TH6GJ4AaABAg,Awesome video. Thanks for sharing 😊,2 months ago,Latha Nair,UCEhnzD3k2mD--cG34d-Q49g,1,https://yt3.ggpht.com/ytc/AKedOLRChuD24bwg0XVCR04-nT18w6tyzyZ0z0K2cQ=s176-c-k-c0x00ffffff-no-rj,0.0
Ugzc3W1qTvgdXgvZrIZ4AaABAg,"Hi
My name is also Akshat 
I am 16 
Geting financial knowledge from you 
Inspite of financial freedom definitely
Thank you",2 months ago,A J,UCopT5ede060GxHKA4jJ-E0A,2,https://yt3.ggpht.com/ytc/AKedOLRsislg9lSGqqZlKhS6g85MhFd1Qwd2xN4dY2Q2IA=s176-c-k-c0x00ffffff-no-rj,0.0
UgzJXiQeIbJEWekmpOx4AaABAg.9UycuvIVUl49UyeeoxyqpF,1st reply,4 months ago,Rutuj Palkhedkar,UCnOO6mBy91_3iBoqzAsZYkg,0,https://yt3.ggpht.com/ytc/AKedOLSL0I7VHP0mJgE9gogVSvPexamqHXKXSMcU8Bj_=s176-c-k-c0x00ffffff-no-rj,0.0
UgzJXiQeIbJEWekmpOx4AaABAg.9UycuvIVUl49V1ON8mrKMJ,"Too much lengthy videos yaar
All the time you do this
Make short videos within 10min",4 months ago,Sunny,UCs87mtGtazptmvv6kbrpn2Q,1,https://yt3.ggpht.com/ytc/AKedOLQ8UtsCNwlIRQhlor3WS47-rNMm0wLSQk0DiH4rXg=s176-c-k-c0x00ffffff-no-rj,0.0
UgzJXiQeIbJEWekmpOx4AaABAg.9UycuvIVUl49V4gvolFivt, @Sunny  10 minutes is too much lengthy yaar. How about instagram reels?,4 months ago,Sagar Jain,UCg6yUmjjNct_nk6WjpPDIcg,1,https://yt3.ggpht.com/ytc/AKedOLToLA89jsCEK54EdmxByOqZGSNpTiNmSK3nBMZaTA=s176-c-k-c0x00ffffff-no-rj,0.0
UgzJXiQeIbJEWekmpOx4AaABAg.9UycuvIVUl49V6WCuiUVWi, @Sagar Jain  reels are for you and not me,4 months ago,Sunny,UCs87mtGtazptmvv6kbrpn2Q,0,https://yt3.ggpht.com/ytc/AKedOLQ8UtsCNwlIRQhlor3WS47-rNMm0wLSQk0DiH4rXg=s176-c-k-c0x00ffffff-no-rj,0.0
UgzJXiQeIbJEWekmpOx4AaABAg.9UycuvIVUl49VEVxwRj5WR,Actually I want to know where we can get all the previous year questions,4 months ago,INCREASING LEVEL,UCOWYdoIIsuTW79hvE3XsjzA,1,https://yt3.ggpht.com/ytc/AKedOLRqR9EoTvuGorGK73tfIXN_8H3FXYBUPgPxYUSDmcYngjtAeev_XQm6v6WXyVTP=s176-c-k-c0x00ffffff-no-rj,0.0
UgzJXiQeIbJEWekmpOx4AaABAg.9UycuvIVUl49Zrvo4xFA8R,Insead people are earning money through ads wow,3 weeks ago,loveisnotalwayseasy,UCa4zUv1gDs4V3q5HDCtqOoQ,0,https://yt3.ggpht.com/ytc/AKedOLSuyFcvtPCoU-8HOgN0W34ATRjU4iKgRzJRng=s176-c-k-c0x00ffffff-no-rj,0.0
UgzJXiQeIbJEWekmpOx4AaABAg.9UycuvIVUl49_X8d5KwVjY,¹,9 days ago,Minesh Shrivastav,UC_gnzp5sJo96x8SQvCMdPUw,0,https://yt3.ggpht.com/ytc/AKedOLQsm0GkLi6o8CyeDWxMBooB5jP4ckzvY8ctQg=s176-c-k-c0x00ffffff-no-rj,0.0
UgzZgHvrHnoSBXE9GUF4AaABAg.9_TA1yX0xjR9_UwemxHO8X,"⬆️⬆️⬆️ thanks for the comment..
Contact the What'sap line above for more information,  and new investment ✉️....",10 days ago,Leo Richy,UC87XW1uV6uAdyLzlADP6s3A,0,https://yt3.ggpht.com/qWAcYULq75BzntG6ziybvL0qKaSMMlXVuWEbaT31e5_IRVE0oWX481ljZ0UR7kY9er-jCwaqCw=s176-c-k-c0x00ffffff-no-rj,0.0
UgwQP-d5OUNqbYy-8np4AaABAg.9YWDsu7ocH99_UwgHw7cYc,"⬆️⬆️⬆️ thanks for the comment..
Contact the What'sap line above for more information,  and new investment ✉️....",10 days ago,Leo Richy,UC87XW1uV6uAdyLzlADP6s3A,0,https://yt3.ggpht.com/qWAcYULq75BzntG6ziybvL0qKaSMMlXVuWEbaT31e5_IRVE0oWX481ljZ0UR7kY9er-jCwaqCw=s176-c-k-c0x00ffffff-no-rj,0.0
UgxPCc4l1V2eyVV4j0l4AaABAg.9YQ7SatFI9p9_UwiEw8apw,"⬆️⬆️⬆️ thanks for the comment..
Contact the What'sap line above for more information,  and new investment ✉️....",10 days ago,Leo Richy,UC87XW1uV6uAdyLzlADP6s3A,0,https://yt3.ggpht.com/qWAcYULq75BzntG6ziybvL0qKaSMMlXVuWEbaT31e5_IRVE0oWX481ljZ0UR7kY9er-jCwaqCw=s176-c-k-c0x00ffffff-no-rj,0.0
UgxynWE9sgsr3swihJx4AaABAg.9YOIjXeJuLD9_UwkH9UoaC,"⬆️⬆️⬆️ thanks for the comment..
Contact the What'sap line above for more information,  and new investment ✉️....",10 days ago,Leo Richy,UC87XW1uV6uAdyLzlADP6s3A,0,https://yt3.ggpht.com/qWAcYULq75BzntG6ziybvL0qKaSMMlXVuWEbaT31e5_IRVE0oWX481ljZ0UR7kY9er-jCwaqCw=s176-c-k-c0x00ffffff-no-rj,0.0
Ugz-B4nvPvYMIpRayY54AaABAg.9YJ1ukwQ3Uf9_UwmDWohYt,"⬆️⬆️⬆️ thanks for the comment..
Contact the What'sap line above for more information,  and new investment ✉️....",10 days ago,Leo Richy,UC87XW1uV6uAdyLzlADP6s3A,0,https://yt3.ggpht.com/qWAcYULq75BzntG6ziybvL0qKaSMMlXVuWEbaT31e5_IRVE0oWX481ljZ0UR7kY9er-jCwaqCw=s176-c-k-c0x00ffffff-no-rj,0.0
Ugx4WkUrhqBz0ok1Ej94AaABAg.9YBRdoXgTO_9_UxeeHnob8,"⬆️⬆️⬆️ thanks for the comment..
Contact the What'sap line above for more information,  and new investment ✉️....",10 days ago,What'sapp+⑨①⑧⑧⓪①⓪⑦②⓪⑤⑦,UCCtJndZkHSmsm-fo-08ajBw,0,https://yt3.ggpht.com/x0ZLvjTkOnGIT8t47agCB3L_JzenzyzdGjfzKJ8CEKijYotizLwSX9-TSuz_53UyLnqPRF7j=s176-c-k-c0x00ffffff-no-rj,0.0
UgypDLLIHyZ048P4WIJ4AaABAg.9XsBC4cXolH9_UxhA7788c,"⬆️⬆️⬆️ thanks for the comment..
Contact the What'sap line above for more information,  and new investment ✉️....",10 days ago,What'sapp+⑨①⑧⑧⓪①⓪⑦②⓪⑤⑦,UCCtJndZkHSmsm-fo-08ajBw,0,https://yt3.ggpht.com/x0ZLvjTkOnGIT8t47agCB3L_JzenzyzdGjfzKJ8CEKijYotizLwSX9-TSuz_53UyLnqPRF7j=s176-c-k-c0x00ffffff-no-rj,0.0
Ugw16U8wC1t5gtdOl_p4AaABAg.9XrLbKKOJ6z9_UxhuJTrxk,"⬆️⬆️⬆️ thanks for the comment..
Contact the What'sap line above for more information,  and new investment ✉️....",10 days ago,What'sapp+⑨①⑧⑧⓪①⓪⑦②⓪⑤⑦,UCCtJndZkHSmsm-fo-08ajBw,0,https://yt3.ggpht.com/x0ZLvjTkOnGIT8t47agCB3L_JzenzyzdGjfzKJ8CEKijYotizLwSX9-TSuz_53UyLnqPRF7j=s176-c-k-c0x00ffffff-no-rj,0.0
UgyAGMILuM-0TivQMzF4AaABAg.9XlcYAHQdDv9_UxjcLX5FK,"⬆️⬆️⬆️ thanks for the comment..
Contact the What'sap line above for more information,  and new investment ✉️....",10 days ago,What'sapp+⑨①⑧⑧⓪①⓪⑦②⓪⑤⑦,UCCtJndZkHSmsm-fo-08ajBw,0,https://yt3.ggpht.com/x0ZLvjTkOnGIT8t47agCB3L_JzenzyzdGjfzKJ8CEKijYotizLwSX9-TSuz_53UyLnqPRF7j=s176-c-k-c0x00ffffff-no-rj,0.0
UgwlqO9WGje9e4TH6GJ4AaABAg.9XeU2KPxNGB9_UxkaZg-gt,"⬆️⬆️⬆️ thanks for the comment..
Contact the What'sap line above for more information,  and new investment ✉️....",10 days ago,What'sapp+⑨①⑧⑧⓪①⓪⑦②⓪⑤⑦,UCCtJndZkHSmsm-fo-08ajBw,0,https://yt3.ggpht.com/x0ZLvjTkOnGIT8t47agCB3L_JzenzyzdGjfzKJ8CEKijYotizLwSX9-TSuz_53UyLnqPRF7j=s176-c-k-c0x00ffffff-no-rj,0.0
Ugzc3W1qTvgdXgvZrIZ4AaABAg.9XcwKHd6gge9_UxljoHkhd,"⬆️⬆️⬆️ thanks for the comment..
Contact the What'sap line above for more information,  and new investment ✉️....",10 days ago,What'sapp+⑨①⑧⑧⓪①⓪⑦②⓪⑤⑦,UCCtJndZkHSmsm-fo-08ajBw,0,https://yt3.ggpht.com/x0ZLvjTkOnGIT8t47agCB3L_JzenzyzdGjfzKJ8CEKijYotizLwSX9-TSuz_53UyLnqPRF7j=s176-c-k-c0x00ffffff-no-rj,0.0
Ugz2DIdCCN65rw530RF4AaABAg,This is the channel where I exercise my 80-20 thinking for investing purposes :). Thank you Akshat for your valuable times,2 months ago,rohit thakur,UCr2B3Mqv2oUcJh76eA8Q8jQ,2,https://yt3.ggpht.com/ytc/AKedOLRX8MKETuYLRxSnBJy9IdYwOOUxA5XPBc8myqTREQ=s176-c-k-c0x00ffffff-no-rj,0.0
UgyL0-luYlC-ktErCst4AaABAg,Akshat is literally the elder IIT waley bhaiya we all wanted to guide us. ❤️,2 months ago,Ankita Saxena,UCfmTFpEZNRaXDA8FVjvpPmw,6,https://yt3.ggpht.com/ytc/AKedOLSNas6L7s1Zz_ffRxNXZoVZVGOYzHVU6IW1LWQAAQ=s176-c-k-c0x00ffffff-no-rj,0.0
UgyrSV4jg7aL2YQumwh4AaABAg,Superb Information..,2 months ago,Ankitesh Gupta,UCfSra3VtyEy_Xv9aZkROisw,0,https://yt3.ggpht.com/ytc/AKedOLRj7TcnatBKB8R5yJ9gxOztr634CDb91x3NItjPVg=s176-c-k-c0x00ffffff-no-rj,0.0
Ugwib87an-nvWGP7rw54AaABAg,Can I get ur free course link sir,2 months ago,Mohan Patel,UCfYR5fUGUWA2CtBA3oF0m2w,0,https://yt3.ggpht.com/ytc/AKedOLRVbaw2HvcS6GGErzt2902X6Eg-vFylmDI2bF4l2Q=s176-c-k-c0x00ffffff-no-rj,0.0
UgyreIsSBp4vhd3zkYl4AaABAg,Your videos add so much value in the lives of people specially aspiring leaders of tomorrow belonging to any strata. Kudos.,2 months ago,Piyush Raj Mishra,UCdEvirgHYwg22OUgBTEeHrQ,0,https://yt3.ggpht.com/ytc/AKedOLTEbiiFMB-roJ_KpAbJS1aZUFRMLpbrsDAAorXG-w=s176-c-k-c0x00ffffff-no-rj,0.0
UgyHsCm6pphqnZMQvWF4AaABAg,"Mera harvard ma admission ho chuka hai kl hi joining letter aaya Khushi bhi hai gum bhi Khushi isiliye qnki harvard ma hogya gum isiliye qnki paise bhot dena pdega or Ghar walo se saal bhar door rhna pdega pr abhi mujhe ye video recommendations ma dikhi to mene fataak se vo joining letter phaada or vo paise jo havard ma Dene wala tha uski party kri aaj or krte rhunga pura saal qnki ab to Paisa Bach gya na havard wala mba to mene iss video ma kr hi Lia 
Thank you so much mere paise bachane ke lia🙌🙌",2 months ago,Tanuj Pandey,UCV2VALt7YtV-SgU2CPoSC2w,0,https://yt3.ggpht.com/ytc/AKedOLRaT4vaxm5EMU8atIjz76YYmuzPPQVHNFgqn9GhdQ=s176-c-k-c0x00ffffff-no-rj,0.0
UgxI78GrMOWc8vNO1np4AaABAg,Too much knowledgeable,2 months ago,Misbah Fatima Jahagirdar,UCTQG7kvf9R-GupJ1-8AFd2w,1,https://yt3.ggpht.com/ytc/AKedOLRNvGOGwtM3ShGRvvI1DbCdurXjHsRgJodNYw=s176-c-k-c0x00ffffff-no-rj,0.0
Ugx-09KYYJLygMe3KYF4AaABAg,Love youuu sir,2 months ago,Mouryan Pahwa,UCWJ5ZHDsUbQLd5P-RZLYb7g,1,https://yt3.ggpht.com/ytc/AKedOLQBd5kx_ZxP2Uhp594UK02Q4I-ETujklzJj_4tRyA=s176-c-k-c0x00ffffff-no-rj,0.0
Ugx7m5sj1rPKUzWMJ714AaABAg,"Thumbnail: Harvard mba in 20min
Le me, after completing my 18years of education to be mba graduate, Bachpan se sirf chutiya Kata ja raha tha, MBA 20min  Mein Ho Jaati Hai😅",2 months ago,prince bansod,UCVVmg9o1mnGnfdkGAbTF6zQ,0,https://yt3.ggpht.com/ytc/AKedOLRBsrFXOjMmneZaZKZiDaXwcCUg9dxTYCjejULD=s176-c-k-c0x00ffffff-no-rj,0.0
UgwYS5E06eJBNbGaVVZ4AaABAg,Read lost and not list,3 months ago,Lbv Prasad,UC-4BKFGuisQ3e7HKb6OyIdg,1,https://yt3.ggpht.com/ytc/AKedOLSVwvOcIOQwB6XHBw7FFvThAVoIN608txQ-0A=s176-c-k-c0x00ffffff-no-rj,0.0
Ugw-Tm6jh72GKLEgXb54AaABAg,"Excellent sir. All your videos are TOP OF THE SHELF.
I'm a student of Warren buffet, Benjamin graham and Philip fisher (common stocks and uncommon profits book)
Merely by following their value investing advice(finding stocks below their intrinsic value) I hit at 9 stocks and list just Rs 220 in just one stock.
Thank you for your videos",3 months ago,Lbv Prasad,UC-4BKFGuisQ3e7HKb6OyIdg,2,https://yt3.ggpht.com/ytc/AKedOLSVwvOcIOQwB6XHBw7FFvThAVoIN608txQ-0A=s176-c-k-c0x00ffffff-no-rj,0.0
UgwCclKudyIWV665WSR4AaABAg,Wonderful speech and tips,3 months ago,Uma Pk,UCBW2IEJVHyNCBJnXL3OLQZw,0,https://yt3.ggpht.com/ytc/AKedOLRyfuk0HFudq7tLkyb7v29Mg2d1ip2IPQ5uG0ja=s176-c-k-c0x00ffffff-no-rj,0.0
UgyXzPur8rnQzLFyLyN4AaABAg,To be a writer we can get best sellers of that fields observe its writing style and work on its weak points in my book,3 months ago,Serial Express,UCbbKeSnsB-B6aWV6yfHuWRg,0,https://yt3.ggpht.com/ytc/AKedOLQAMVMfPMlmOkp0cp7cuexG7p0575NwVOvF4g=s176-c-k-c0x00ffffff-no-rj,0.0
UgxfvDc-v7s9C5205CZ4AaABAg,What a valuable video!! Thanks Akshat!,3 months ago,Brinda,UCCwgs8MqQ0fAwZEQ345ZtHQ,1,https://yt3.ggpht.com/ytc/AKedOLQvKqAwn7yw0qrDPBSn2OA8zSOj4y3n9wfB6Y94=s176-c-k-c0x00ffffff-no-rj,0.0
UgxVUxXkHsHiyEjSV6V4AaABAg,"This is first video of mine watched yours...randomly i came across this & its worth of each sec and min of watching ...every bit is completely catchup ...
U gained one more subscriber",3 months ago,GARIMA MISHRA,UCyZW1Hx5bUGfDhFcA5qSiyA,1,https://yt3.ggpht.com/ytc/AKedOLQWOe48NAhAk56LHUt5zv7zBGRJmkb8k8sOcOxO=s176-c-k-c0x00ffffff-no-rj,0.0
Ugwx2m_vOTgl8Fv706F4AaABAg,"Plz make video on GMAT, is it good for 34 years guy? Plz must reply",3 months ago,mohd imran,UCvuAvRhAaxhEtynQ0o0hgWA,1,https://yt3.ggpht.com/ytc/AKedOLTDrXBIANktOCIowLRXXgn-JPJSmd4aTpQ6cw=s176-c-k-c0x00ffffff-no-rj,0.0
Ugzbs3TnORF9npEElrR4AaABAg,You are simply a magical and super efficient..Lot to get inspired.,3 months ago,Pralay Naik,UCWigcvr4VDzlSGVwTEJzGXg,1,https://yt3.ggpht.com/ytc/AKedOLSq8ZztfiWxqus8n2ZxYMmeybCxmnKMKXOadg=s176-c-k-c0x00ffffff-no-rj,0.0
UgxJMK84wCLWk319Vyl4AaABAg,"Crisp, clear and Concise..effective and informative video. Thanks Mr. Akshat, pls continue this service.",3 months ago,Nitin Aggarwal,UCazMeS2X1Tkj4cGa7d1f-Fw,2,https://yt3.ggpht.com/ytc/AKedOLQ8IHSffe4pJaO7xwb2jtsZNteA2PZyPqbl4Q=s176-c-k-c0x00ffffff-no-rj,0.0
UgxouCwLoRVKiJOBUZF4AaABAg,After watching your videos I started working on building my networking skills and grow my network.,3 months ago,ajay kumar,UCbeggSZERl4fibQVkC4rFFQ,1,https://yt3.ggpht.com/ytc/AKedOLS3r18_9kd4FCVcyXyczLZIp0xw7uJ405wVrtexGA=s176-c-k-c0x00ffffff-no-rj,0.0
UgwaCLU-VxMwbzMOVCV4AaABAg,yes corrrect,3 months ago,Ram Sree,UCjZEW7UQiB-EMu2tqMdhthQ,0,https://yt3.ggpht.com/ytc/AKedOLQRZwZrCHCPkNhftU_NttrwQBLs2yAGZRrorCFJpYA=s176-c-k-c0x00ffffff-no-rj,0.0
UgyrSV4jg7aL2YQumwh4AaABAg.9XYb4jG_Lz59_Uxmey644T,"⬆️⬆️⬆️ thanks for the comment..
Contact the What'sap line above for more information,  and new investment ✉️....",10 days ago,What'sapp+⑨①⑧⑧⓪①⓪⑦②⓪⑤⑦,UCCtJndZkHSmsm-fo-08ajBw,0,https://yt3.ggpht.com/x0ZLvjTkOnGIT8t47agCB3L_JzenzyzdGjfzKJ8CEKijYotizLwSX9-TSuz_53UyLnqPRF7j=s176-c-k-c0x00ffffff-no-rj,0.0
Ugwib87an-nvWGP7rw54AaABAg.9XXwQQ7C-oK9_UxrPyIwT6,"⬆️⬆️⬆️ thanks for the comment..
Contact the What'sap line above for more information,  and new investment ✉️....",10 days ago,What'sapp+⑨①⑧⑧⓪①⓪⑦②⓪⑤⑦,UCCtJndZkHSmsm-fo-08ajBw,1,https://yt3.ggpht.com/x0ZLvjTkOnGIT8t47agCB3L_JzenzyzdGjfzKJ8CEKijYotizLwSX9-TSuz_53UyLnqPRF7j=s176-c-k-c0x00ffffff-no-rj,0.0
UgyreIsSBp4vhd3zkYl4AaABAg.9XQt0ZmWCd-9_UxsSLqiWk,"⬆️⬆️⬆️ thanks for the comment..
Contact the What'sap line above for more information,  and new investment ✉️....",10 days ago,What'sapp+⑨①⑧⑧⓪①⓪⑦②⓪⑤⑦,UCCtJndZkHSmsm-fo-08ajBw,0,https://yt3.ggpht.com/x0ZLvjTkOnGIT8t47agCB3L_JzenzyzdGjfzKJ8CEKijYotizLwSX9-TSuz_53UyLnqPRF7j=s176-c-k-c0x00ffffff-no-rj,0.0
UgxI78GrMOWc8vNO1np4AaABAg.9XLF3Yl1xIw9_Uxttcgwyl,"⬆️⬆️⬆️ thanks for the comment..
Contact the What'sap line above for more information,  and new investment ✉️....",10 days ago,What'sapp+⑨①⑧⑧⓪①⓪⑦②⓪⑤⑦,UCCtJndZkHSmsm-fo-08ajBw,0,https://yt3.ggpht.com/x0ZLvjTkOnGIT8t47agCB3L_JzenzyzdGjfzKJ8CEKijYotizLwSX9-TSuz_53UyLnqPRF7j=s176-c-k-c0x00ffffff-no-rj,0.0
Ugx7m5sj1rPKUzWMJ714AaABAg.9XJC5mglR9k9_Uxubi7evH,"⬆️⬆️⬆️ thanks for the comment..
Contact the What'sap line above for more information,  and new investment ✉️....",10 days ago,What'sapp+⑨①⑧⑧⓪①⓪⑦②⓪⑤⑦,UCCtJndZkHSmsm-fo-08ajBw,0,https://yt3.ggpht.com/x0ZLvjTkOnGIT8t47agCB3L_JzenzyzdGjfzKJ8CEKijYotizLwSX9-TSuz_53UyLnqPRF7j=s176-c-k-c0x00ffffff-no-rj,0.0
UgyXzPur8rnQzLFyLyN4AaABAg.9X8SrFDs_FH9_UxwjC2VDw,"⬆️⬆️⬆️ thanks for the comment..
Contact the What'sap line above for more information,  and new investment ✉️....",10 days ago,What'sapp+⑨①⑧⑧⓪①⓪⑦②⓪⑤⑦,UCCtJndZkHSmsm-fo-08ajBw,0,https://yt3.ggpht.com/x0ZLvjTkOnGIT8t47agCB3L_JzenzyzdGjfzKJ8CEKijYotizLwSX9-TSuz_53UyLnqPRF7j=s176-c-k-c0x00ffffff-no-rj,0.0
UgxVUxXkHsHiyEjSV6V4AaABAg.9X2Hb6MUMbh9_UxyT1LJUk,"⬆️⬆️⬆️ thanks for the comment..
Contact the What'sap line above for more information,  and new investment ✉️....",10 days ago,What'sapp+⑨①⑧⑧⓪①⓪⑦②⓪⑤⑦,UCCtJndZkHSmsm-fo-08ajBw,0,https://yt3.ggpht.com/x0ZLvjTkOnGIT8t47agCB3L_JzenzyzdGjfzKJ8CEKijYotizLwSX9-TSuz_53UyLnqPRF7j=s176-c-k-c0x00ffffff-no-rj,0.0
Ugx248CBDEea_KXE_TB4AaABAg,Wow 👍👍,3 months ago,1550 Garv Ahuja,UCHAWBd0JjG23Inzgt3jHaNg,0,https://yt3.ggpht.com/ytc/AKedOLTVzplFtJ1N668RqGM444LZLqAwkBADnDaW2y9CvA=s176-c-k-c0x00ffffff-no-rj,0.0
UgzmVS3HLp3W3SUAaO54AaABAg,"80/20 rule of becoming a writer:- 
rather spending time reading every book and learning spend reading top best seller of your niche and others then go for becoming a writer.",3 months ago,Sachit Jhurani,UC90coZXnwJYuopAcgD2UfOQ,0,https://yt3.ggpht.com/ytc/AKedOLRjJeip51STCKQoNwRegrsyTJFsODRWVLrG6XcB=s176-c-k-c0x00ffffff-no-rj,0.0
UgxVWMpp4u6rPDmW4r94AaABAg,"Hi Akshat, 

I have been watching your videos quite a few days and I am super impressed with your way of presentation and clarity you bring in at all your topics. I am not the one who comment frequently but you made me comment and that’s shows your success. Actually speaking most of the tips and your strategies in your investment and here in effective communication are similar to my thoughts… I am so proud of you! Please keep the momentum going up",3 months ago,Tamil Vanchi,UCYSCMdBrmH4enno9XxlwP5w,4,https://yt3.ggpht.com/ytc/AKedOLSg9WPjvKIbc2CeUn6qRU8GSQMpE0c_1GjKPrwfbQ=s176-c-k-c0x00ffffff-no-rj,0.0
Ugw0JdcLMDL4hZwaAl14AaABAg,"Thanks for the video! The skills were greatly summarized!
Since I'm aspiring to be a writer in the future, I plan to use the 80-20 rule as follows:
1. 80% time in ideation and research
2. 20% time in creating content",3 months ago,Shreyansh Vats,UChJyvZgNM-unQoUtkO1Lo4Q,2,https://yt3.ggpht.com/SX-QsFbKPJjo2lW0jOGqeaImIzq5AyRwH-4KHwox-OiDTXLVSnDZtfzsvV8YqE2UGQ5zdU03rw=s176-c-k-c0x00ffffff-no-rj,0.0
UgzqLmGUAkoRU1Roazt4AaABAg,"Hey Akshat,
Your promo code is invalid on Cambly.",3 months ago,Abhishek Saini,UCrbjE-J4OYC3AW9lkjYIKUw,1,https://yt3.ggpht.com/ytc/AKedOLQmH_hlWpU7xyvsA5m0-Owx4kiHPxF4nIAoZBPrctw=s176-c-k-c0x00ffffff-no-rj,0.0
Ugw99fCSZhIN1iTNi4t4AaABAg,Really great video will definitely come out of 12 next to next year with all these skill and focus on learning new skills thank you sir 😄 loved your content,3 months ago (edited),Habit Disrupter,UCQoHA3PCkc_bii1h7HIMkpQ,2,https://yt3.ggpht.com/7ir-lLlpkpJJcdJbXqcxH5Lz4sOE4jKjpERZ9r_y6Tw_QKcUXwLY2qqczhdBYKixZCy85YmPDw=s176-c-k-c0x00ffffff-no-rj,0.0
UgyKX3VrWaQqUdeveXF4AaABAg,"Once you told that home made product sales in linked in ,can you make video on that in detail",3 months ago,giass,UC_Jot7RhWTUfZlv10FlElbA,0,https://yt3.ggpht.com/ytc/AKedOLS0LSoJK8GCbv9RgwinR_2cyBBVWVh-p-luCeCL=s176-c-k-c0x00ffffff-no-rj,0.0
UgzfPIHDqNwThx4T6NZ4AaABAg,We all watch and learn from you. Your work is incredible.,4 months ago,Santhosh Hugar,UC9tSzZtwTui3JZHB8CmGKSA,0,https://yt3.ggpht.com/ytc/AKedOLR98nbsaOh20LEp4TD3xdky0se5-r-g-kgzvpvJJw=s176-c-k-c0x00ffffff-no-rj,0.0
UgzNiqk1Aj4tCtvH5ll4AaABAg,"Hi @Akshat, I forwarded this video in my IIM MBA Cohort watsapp group, really worth watching, kind request to create more vidoes on your learning during your consulting career, it will be a great help fornstudents like us",4 months ago,Asfaq Khan,UCG9TV3-I00BhK56rPkVqTHg,2,https://yt3.ggpht.com/ytc/AKedOLQ_SqJp0fVN8By8lvfKDhlncwnbLlTOcwPwrcKWjg=s176-c-k-c0x00ffffff-no-rj,0.0
Ugx9rb1Jvl854Vkpk-94AaABAg,Awesome information Akshat,4 months ago,Devendra Sharma,UC2MjAaNnzyjXrCN_YBEK9eQ,0,https://yt3.ggpht.com/ytc/AKedOLSCynW6hn--rYu34rdLctiqezL2j1ijTWJZTszy5A=s176-c-k-c0x00ffffff-no-rj,0.0
Ugy4yESde_itKP5dIOJ4AaABAg,Great video. Thanks a lot sir,4 months ago,Shivam Mishra,UCuUmAhTWzf7RrYMQ80vAenw,0,https://yt3.ggpht.com/ytc/AKedOLTwokjjA-u85XRqn0FbGEsqyBWurtAV8rb_kQ=s176-c-k-c0x00ffffff-no-rj,0.0
UgxKowFKHReYIYeEE4h4AaABAg,आपके पीछे भारतीयता के महान प्रबोधक गौतम बुद्घ 🙏 और महाभारत का दृश्य देखकर अत्यंत खुशी हुई♥️♥️,4 months ago,Yash Pratap Singh Sirohiya,UCl0kgLGBIO4nZJumtiYAj8w,1,https://yt3.ggpht.com/ytc/AKedOLT9fhpv5f07V5xg2zQ-IG6hwbJD0FQbvW8SIfgE_w=s176-c-k-c0x00ffffff-no-rj,0.0
UgyGzqELvSyGBRkWkhN4AaABAg,awesome informative video....u r a rockstar,4 months ago,Gaurav Goel,UCX5cL-iytnxWVL3BJr_cCaA,0,https://yt3.ggpht.com/ytc/AKedOLQpH6Z2ntcATnsygDXaYOdl8NdE9HwdJ74e4g=s176-c-k-c0x00ffffff-no-rj,0.0
UgxM177yy2mTJ_VKfNx4AaABAg,"Master accounting and finance skills.
https://www.youtube.com/c/RKVarsity/playlists",4 months ago,RK varsity,UCbKv0sbT9n50PCRM9vpRuKg,0,https://yt3.ggpht.com/lQzPzr4YmmiuZmwLEaYP4WTPCR7ndH4XjpXp2N89HT3nCd-K9CUsVHm709NUXrjj086QRv-Z8g=s176-c-k-c0x00ffffff-no-rj,0.0
