cid,text,time,author,channel,votes,photo,heart
UgzyY36N7h0-8L7Zpad4AaABAg,► You check FinBingo through this link: http://onelink.to/finbingoak,1 month ago,Akshat Shrivastava,UCqW8jxh4tH1Z1sWPbkGWL4g,12,https://yt3.ggpht.com/VI0OvMwpPQPFGoHAQOHsvtEcFWg-_YzFBhoeohr2CRz1T21Ja4unTGte1Gz6TnDUgVX9wcOG=s176-c-k-c0x00ffffff-no-rj,0.0
Ugwui8MaEIHax-foqFB4AaABAg,Super sir im ftom southindia chennai. Im  very impressed if your infirmation.   Im learning sir,1 day ago,ramesh Hariharan,UCzF6fzu9knY3KBv-uzKpiPA,1,https://yt3.ggpht.com/ytc/AKedOLQ1jzv2rUSF8Vd3aA8Zj9yuDzKf1AEApNxvXw=s176-c-k-c0x00ffffff-no-rj,0.0
Ugz2CnrE6E1wgJ98pw94AaABAg,I really feel left aside hearing and seeing several testimonies from people on profits they make from crypto/Forex investments. Can someone please recommend a good expert that can trade on my behalf and generate profits for me🥺🥺🥺,2 days ago,Stephanie Kaka,UCnDGDcqqU-GxP3g0jqxlyjg,64,https://yt3.ggpht.com/ytc/AKedOLSmh2sziwViFHox8gCSJjY36XwPS3vxFWRmrfqy=s176-c-k-c0x00ffffff-no-rj,0.0
Ugy5SBT0KdOs1sw8FoV4AaABAg,"Hi Akshat, thanks for the video, I can agree with you except for the L&T part. Can you please explain more why we should not invest in L&T ?",3 days ago,PRADEEP MATHEW,UCuLNzM1p5sEr9K312-Yk3JQ,1,https://yt3.ggpht.com/ytc/AKedOLQsaH_DBwBgrFMpMY-rnNjlrUmiM6j_gEdGaE-VgA=s176-c-k-c0x00ffffff-no-rj,0.0
Ugx-hkkGjC8i9cMtAud4AaABAg,Yes!! We need a US Stock market portfolio for 1 lakh!,8 days ago,Harsh Kothari,UCEFidhLpWLutvBb2R9SLDpQ,1,https://yt3.ggpht.com/ytc/AKedOLSn5Rj0nlSA14lytv08U2qiZ7n8gjFUCDBj2TXE=s176-c-k-c0x00ffffff-no-rj,0.0
Ugz0RYBYyC3Wy1oGiMJ4AaABAg,Very good learning video.Thank you,9 days ago,kshanatosh das,UCdPQ2xjjQeqyKYZfg1S-I5w,1,https://yt3.ggpht.com/ytc/AKedOLT9pnR4PhQQ-2kIpVL7zX5oMXFYTdeONcFN2g=s176-c-k-c0x00ffffff-no-rj,0.0
UgxD9tmNcenlJ6ViBnt4AaABAg,How to invest in US market,10 days ago,Somashekhar Chikkanna,UCAXlhW6CuZvA31mOW0GQ7uA,1,https://yt3.ggpht.com/ytc/AKedOLTxs2fuAmUxeTRYptOdca3JemjitLr5yA75xwoItQ=s176-c-k-c0x00ffffff-no-rj,0.0
UgzbY3oO_SzSWxGM2ep4AaABAg,"Great video, never put all your eggs in a single basket is an old adage which is very relevant to investing 👍👍",11 days ago,ArTaoSen,UCNb6t83H8IozTdAS5y_bWdA,1,https://yt3.ggpht.com/ytc/AKedOLRZx93R8CgccToSr4KWWMQMdXBRVAWe6gEqyQ=s176-c-k-c0x00ffffff-no-rj,0.0
UgxRzVDyYnufPrBhWGx4AaABAg,need to know the best way to invest in US. I am bullish about tech.,12 days ago,Ayushman Sisodiya,UCkgf3J2iUY7sShb8xk215ig,0,https://yt3.ggpht.com/ytc/AKedOLTBWAHUrhL9y9m2lAGoTnm3ld87Kit6-D5iN06GgA=s176-c-k-c0x00ffffff-no-rj,0.0
UgyJyqappaYmQAkPyEl4AaABAg,I don't know why.. Every time opposite of what akshat says works 🤣,12 days ago,R,UCVozowcEOOSBUKektRnJ5HQ,0,https://yt3.ggpht.com/ytc/AKedOLQrCRJUEb2vDP_5SMMGY9wRwCu9mEvDUr46aKuLkxu4UBTWgkW9tXc1By4TT691=s176-c-k-c0x00ffffff-no-rj,0.0
UgwXswkrFl7EnFs9IUx4AaABAg,Excellent,2 weeks ago,rajesh sehra,UCco6Ru9EQtNljIBEWZ8cs3A,1,https://yt3.ggpht.com/ytc/AKedOLS59dTwoJi6qiys69mipDGs8_6uhjAe_w9M0Q=s176-c-k-c0x00ffffff-no-rj,0.0
UgxOztOCuBCy6jsB08t4AaABAg,"LT also gives dividend (both interim and final).
Is it also included in these returns..?",2 weeks ago,Prashant Abbey,UCrQFLemxRqe34YdeGql-5Kw,1,https://yt3.ggpht.com/ytc/AKedOLS6KwSZIbPv9cmP-Br9MtVGQMUmwze4Mlk0lHNnEA=s176-c-k-c0x00ffffff-no-rj,0.0
UgyMDUTtF9VtxVCLhyp4AaABAg,Excellent. As a beginner  learnt  a lot.God bless you .,2 weeks ago,sulekha khanna,UCbsyI5BS0SPDtBNuWoo6z3Q,1,https://yt3.ggpht.com/ytc/AKedOLSx-pqjd4X6JTIiswvu2k6V2E4JTn6ovjlJ8A=s176-c-k-c0x00ffffff-no-rj,0.0
UgwOPoI4cajekbsMg8N4AaABAg,Vvv information,2 weeks ago,umapathy Sokke,UCahTsOYBHdXKM0oIHum5yIg,1,https://yt3.ggpht.com/ytc/AKedOLRrqV_ARmwsTJxZoyX8m-N4v3IHTfjKPpkm6VLkSSYVQct0UqpWMq68pkLdSN0A=s176-c-k-c0x00ffffff-no-rj,0.0
Ugz9Nul4mEGDoLLmcZJ4AaABAg,Worth watching. Thank you .,2 weeks ago,Reji Philip,UCgY99JvtOtmZAEltvSRNrgw,1,https://yt3.ggpht.com/ytc/AKedOLTYHlHg6WvoGlkaUulytMuYvXiFwydUOn3JCr0V=s176-c-k-c0x00ffffff-no-rj,0.0
UgzWz-KaLw-wBbWGShd4AaABAg,Lady gaga 😀,2 weeks ago,Venky A,UCoLBekjIjr9ZO9bmsLDh0Gg,0,https://yt3.ggpht.com/ytc/AKedOLSshaOe3PA2TGnFwfTFx2oCvk5jpIEXw7J99A=s176-c-k-c0x00ffffff-no-rj,0.0
UgyIDWX4UiTywo0MRCt4AaABAg,Like the saying,2 weeks ago,Martha Iyengar,UCfQGDOIHnw1duC30WsbPQog,0,https://yt3.ggpht.com/ytc/AKedOLSzVh2s9rUCJDXG92MlHJBm8raY-kF8s0GUaA=s176-c-k-c0x00ffffff-no-rj,0.0
UgyFeyMEvbRfeObFceh4AaABAg,"Yes Akshat, please do make a detailed video on ""how to invest in US market"".",2 weeks ago,Kapil Singh,UChkMNN75Lq5eWZ3cvacqYTA,2,https://yt3.ggpht.com/ytc/AKedOLSBO1bsAwOzlzdjjSu2SPHAgu9sKDp8Dqy189ff=s176-c-k-c0x00ffffff-no-rj,0.0
UgxyWozZw7svKOf9aSt4AaABAg,I think the horse name is ‘Hans’ that was claimed to perform simple arithmetic operations. There is a good discussion about him from the book ‘How to talk to anyone’ by Leil Lowndes.,2 weeks ago,Bedanta Saha,UCN-FfZh5t775QmJlq_Vk7zw,1,https://yt3.ggpht.com/ytc/AKedOLRg__xoSQenMbN7kyOXVMWLS2njSLT-gPC_2fe2tg=s176-c-k-c0x00ffffff-no-rj,0.0
UgyVAgF-8uPIdAAxbHN4AaABAg,Please tell about investing in US stocks,3 weeks ago,Rajdeep Kaur,UC14WqhWvbXHU1xbu5fuwGQg,1,https://yt3.ggpht.com/ytc/AKedOLRTuHc23f7eB-G9WGSxjQi0MPXEazHkHql71g=s176-c-k-c0x00ffffff-no-rj,0.0
UgzyY36N7h0-8L7Zpad4AaABAg.9ZWaleUjDfy9ZWgyhEPuHt,📩👆mujhe ek sandesh bhejen,1 month ago,♜ Pinned_by WISE ADVICE,UCZnDBXUPhYmfRwY1LB_cHmw,0,https://yt3.ggpht.com/PsMdsDmaNwoy6cuYN_P62dId1xQWzrcwMQisb-iOJ_is5UHAeue5Xje25gEzkGEomOrBurhd9w=s176-c-k-c0x00ffffff-no-rj,0.0
UgzyY36N7h0-8L7Zpad4AaABAg.9ZWaleUjDfy9ZWk7_IB3Q3,"please make video on US MARKET. Also, cover how to find good ETFs in US MARKET. Please akshat consider this.",1 month ago,Tirtha Bodhak,UCyXMBTMZh5P-5sZUsdD4Qrw,3,https://yt3.ggpht.com/ytc/AKedOLQBs411L1WhiWEouTUTe-59QloX3x1JuckvsZg2dw=s176-c-k-c0x00ffffff-no-rj,0.0
UgzyY36N7h0-8L7Zpad4AaABAg.9ZWaleUjDfy9ZWl3xqmWnQ,"Sir please make the video on ICO for crypto , i have been waiting for a long time for that video since you said it in a particular video 🙏. Appreciate the work please keep up the great work",1 month ago,Ajith Sg,UCH42MRxJkHjLl4Swp80sWew,0,https://yt3.ggpht.com/ytc/AKedOLRRWcEBxgF_WebzDUm2H7hD9Pc1ZPIn-UqPUw=s176-c-k-c0x00ffffff-no-rj,0.0
UgzyY36N7h0-8L7Zpad4AaABAg.9ZWaleUjDfy9ZWnu1mIFHH,"hi sir, your videos are super informative as well as very helpful to every retail investors watching it....and i would like to give you a challenge  to open a new trading account now and show us the returns after a year..no hatred..i'm a big fan of you... love your contents..... just curious to know ....",1 month ago,GOKU,UCvagdW1b1EztKwreBp2DjRw,0,https://yt3.ggpht.com/ytc/AKedOLQYydGAmzJL3RlZlPrfxJbtxbvBgrlYE9lDSE3jZQ=s176-c-k-c0x00ffffff-no-rj,0.0
UgzyY36N7h0-8L7Zpad4AaABAg.9ZWaleUjDfy9ZWsilNZz9T,"Yeah , pls make video for how to invest other places also",1 month ago,kranti sanglam,UCIfNJfmtuK0MoGrSwRgVF0Q,0,https://yt3.ggpht.com/ytc/AKedOLStSls0DJ1Fc-kZMb3nswMb-9n1mJoEdCWuT2NV0Q=s176-c-k-c0x00ffffff-no-rj,0.0
UgzyY36N7h0-8L7Zpad4AaABAg.9ZWaleUjDfy9ZXL4YT5HGk,"Sir please make video on long term investing portfolio... where sip's shoud be done in perticular one stock always buying
 or 
every purchase should be in variety of stocks different stock",1 month ago,Harshad,UCOYJUwB0y6gAMsaTojkDjVw,0,https://yt3.ggpht.com/jf6grotU1ZUUXmuQUZRITmULf5ENIIOvovUxiawlMHY5BV_2O48OROrMNQWIkQQiGmXgY_7dXA=s176-c-k-c0x00ffffff-no-rj,0.0
UgzyY36N7h0-8L7Zpad4AaABAg.9ZWaleUjDfy9ZYTaUq0bEH," @Sagar Patel  yes, pls report this account as spam.",1 month ago,Rakesh Kumar,UCYYIuvh0iMl1QiuI1RnCSbQ,0,https://yt3.ggpht.com/ytc/AKedOLQDgxJNCQRgIQ41uf0EzGdUeh3HKNxtW9bdxGohyA=s176-c-k-c0x00ffffff-no-rj,0.0
UgzyY36N7h0-8L7Zpad4AaABAg.9ZWaleUjDfy9Zj8V2lVXpi,Yes looking forward for more videos  on investing in us market,4 weeks ago,Manipuri  in  Ireland,UCpRh6MLz2LECjOiHkm_ZKuw,1,https://yt3.ggpht.com/UzYzaSokujdp8H7TmPdmVFYBO0kcE_0VIXJn9S-qoSVihmD05e-rbHglc2omBsMk9WPrYHBZQQ=s176-c-k-c0x00ffffff-no-rj,0.0
Ugwui8MaEIHax-foqFB4AaABAg.9_ptjVnMxAt9_qOEFozExh,"⬆️ Ensure to contact the What'sap line above for more information and consultation on investment. I have a new investment I am sure you will like to be  part of...
Thanks for your comment 🙂",1 day ago,WhatsApp +⓽⓵⓽⓼⓶⓽⓽⓶⓽⓷⓶⓸,UCRBGuqujQeCG1gxpvoLEvpQ,0,https://yt3.ggpht.com/ITI6H_xhgtHsuLbHq4DPCjbIEY2Z8HB8Hqv70FGMlrytL9iy-qwejrZIWAFVuseFuVLX8XhjyD4=s176-c-k-c0x00ffffff-no-rj,0.0
Ugz2CnrE6E1wgJ98pw94AaABAg.9_nI-Zi47bq9_nJyVYtHHT,The market is profiting if you are using really a good broker or account manager to help out with trades or provide signals.,2 days ago,Benjamin Wayne,UCTbKeDVywhFewCOk__bdytw,0,https://yt3.ggpht.com/ytc/AKedOLQ0GPxl96lEGy76aiy7N6N9eC4w5yHIPWG2Pj5E=s176-c-k-c0x00ffffff-no-rj,0.0
Ugz2CnrE6E1wgJ98pw94AaABAg.9_nI-Zi47bq9_nKYXfkHZb,I'll recommend Expert mrs Rosie to you. She's the best I've seen. She trades my fx account and makes me good profits 📈 weekly.,2 days ago,Blessed David,UCk_yh8_6WDoGjCB1b5gfEKg,0,https://yt3.ggpht.com/U2eSqfDxdH591Mp4nL6aZv3U664wovef2YF_WD224Xt8Fl6qTbxB_vOLr2gkjxNwN7zSq4LQFQ=s176-c-k-c0x00ffffff-no-rj,0.0
Ugz2CnrE6E1wgJ98pw94AaABAg.9_nI-Zi47bq9_nKwT38VXu,"My first investment with her gave me profit of over $4,000 Us dollars and ever since then she has never failed to deliver and I can even say she is the most sincere broker I have known",2 days ago,Godwin David,UCBCxp7eMpREe28vvajr_Igw,0,https://yt3.ggpht.com/ytc/AKedOLTCvUY_q0d3NuHxFXebv7wAKGDwef5L1BsT0uP1=s176-c-k-c0x00ffffff-no-rj,0.0
Ugz2CnrE6E1wgJ98pw94AaABAg.9_nI-Zi47bq9_nLTpGU4b8,"So you guys know her too?...
Wow she made my husband and I have our own house and car. She is awesome 👌",2 days ago,Lisa David,UCesyqrHloQ55vLk9YYjBMdw,0,https://yt3.ggpht.com/Wo_pUvK0bzvwD2A4oe042WfOr66-H2vL6N3Icyn0cTnttS34pheqBgfOt7mNgzEfIJ9K9_f0iI4=s176-c-k-c0x00ffffff-no-rj,0.0
Ugz2CnrE6E1wgJ98pw94AaABAg.9_nI-Zi47bq9_nMDc_6_Ci,"She has been trading for me too, her strategies are wonderful and she made me see binary and forex trade from a different dimension. I keep making profits weekly",2 days ago,McHup Amire,UC6_jE1I1JaNKay5VAWTmiaA,0,https://yt3.ggpht.com/hV6KhSXyFqJ324ZjB92wpSidEJ0UvEDqUyhG1P1lu4p5jCAVor9uaKFDp4Jelb8Cxrz9a9ERng=s176-c-k-c0x00ffffff-no-rj,0.0
Ugz2CnrE6E1wgJ98pw94AaABAg.9_nI-Zi47bq9_nMTxfX9lv,"I'm not here to converse for her but to testify just for what I'm sure of, she's trust worthy and best option ever seen",2 days ago,Aiden Gibbs,UCHsDnbJMHyZhCWQTOTqeWzw,0,https://yt3.ggpht.com/ytc/AKedOLR_m8wYPzxytrjeKlthaSf0HFc8LahdqPU2-mP0=s176-c-k-c0x00ffffff-no-rj,0.0
Ugz2CnrE6E1wgJ98pw94AaABAg.9_nI-Zi47bq9_nRQ6JZhRK,"Please how can I reach her?
I think I should try this woman. 
I have heard so much good news about her",2 days ago,Stephanie Kaka,UCnDGDcqqU-GxP3g0jqxlyjg,0,https://yt3.ggpht.com/ytc/AKedOLSmh2sziwViFHox8gCSJjY36XwPS3vxFWRmrfqy=s176-c-k-c0x00ffffff-no-rj,0.0
Ugz2CnrE6E1wgJ98pw94AaABAg.9_nI-Zi47bq9_nRRN-EJbe,How can I reach her directly?,2 days ago,Stephanie Kaka,UCnDGDcqqU-GxP3g0jqxlyjg,0,https://yt3.ggpht.com/ytc/AKedOLSmh2sziwViFHox8gCSJjY36XwPS3vxFWRmrfqy=s176-c-k-c0x00ffffff-no-rj,0.0
Ugz2CnrE6E1wgJ98pw94AaABAg.9_nI-Zi47bq9_nSok4XvEb,+,2 days ago,Godwin David,UCBCxp7eMpREe28vvajr_Igw,0,https://yt3.ggpht.com/ytc/AKedOLTCvUY_q0d3NuHxFXebv7wAKGDwef5L1BsT0uP1=s176-c-k-c0x00ffffff-no-rj,0.0
Ugz2CnrE6E1wgJ98pw94AaABAg.9_nI-Zi47bq9_nSpDyh_FG,1,2 days ago,Godwin David,UCBCxp7eMpREe28vvajr_Igw,0,https://yt3.ggpht.com/ytc/AKedOLTCvUY_q0d3NuHxFXebv7wAKGDwef5L1BsT0uP1=s176-c-k-c0x00ffffff-no-rj,0.0
Ugz2CnrE6E1wgJ98pw94AaABAg.9_nI-Zi47bq9_nSplLgB1r,(404),2 days ago,Godwin David,UCBCxp7eMpREe28vvajr_Igw,0,https://yt3.ggpht.com/ytc/AKedOLTCvUY_q0d3NuHxFXebv7wAKGDwef5L1BsT0uP1=s176-c-k-c0x00ffffff-no-rj,0.0
Ugz2CnrE6E1wgJ98pw94AaABAg.9_nI-Zi47bq9_nSqRsv4Z5,465,2 days ago,Godwin David,UCBCxp7eMpREe28vvajr_Igw,0,https://yt3.ggpht.com/ytc/AKedOLTCvUY_q0d3NuHxFXebv7wAKGDwef5L1BsT0uP1=s176-c-k-c0x00ffffff-no-rj,0.0
Ugz2CnrE6E1wgJ98pw94AaABAg.9_nI-Zi47bq9_nSqwGC2KR,2589,2 days ago,Godwin David,UCBCxp7eMpREe28vvajr_Igw,0,https://yt3.ggpht.com/ytc/AKedOLTCvUY_q0d3NuHxFXebv7wAKGDwef5L1BsT0uP1=s176-c-k-c0x00ffffff-no-rj,0.0
Ugz2CnrE6E1wgJ98pw94AaABAg.9_nI-Zi47bq9_nStAiuFQL,That's her watsap number above. Tell her I referred you.,2 days ago,Godwin David,UCBCxp7eMpREe28vvajr_Igw,0,https://yt3.ggpht.com/ytc/AKedOLTCvUY_q0d3NuHxFXebv7wAKGDwef5L1BsT0uP1=s176-c-k-c0x00ffffff-no-rj,0.0
Ugz2CnrE6E1wgJ98pw94AaABAg.9_nI-Zi47bq9_nTULkF-v4,Ago I was skeptical about trading bitcoin until I was introduced to mrs Rosie and I must say I was impressed by her understanding and politeness,2 days ago,Mark Benjamin,UCRw0s-VR5wg2ipsfY38QJ4g,0,https://yt3.ggpht.com/1N4XSn_5io5vQJ9Tg7mJv7tEkodeJLAlKVcw2Dn77boph5w8lIsyFdR0awC1kYFBNhYZCUL4Q2M=s176-c-k-c0x00ffffff-no-rj,0.0
Ugz2CnrE6E1wgJ98pw94AaABAg.9_nI-Zi47bq9_oRxErfkcE,I was recommended to her by people's testimonies. Writing her has been the best decision I have made,2 days ago,Carl Douglas,UCMif3EPko5XqbkpJjpimVxg,0,https://yt3.ggpht.com/LTMNcqEEq6DrytIxbujj67A7MVfAYOa8-U32rarUWA3mN3k8ExEmI6sQS3GwfGXuOsXkJ_TA=s176-c-k-c0x00ffffff-no-rj,0.0
Ugz2CnrE6E1wgJ98pw94AaABAg.9_nI-Zi47bq9_oSOr494RX,"She has been trading for me too, her strategies are wonderful and she made me see binary and forex trade from a different dimension. I keep making profits weekly",2 days ago,Grace Jonah,UCUSDPXzUjxlElkSiUAqEYew,0,https://yt3.ggpht.com/ytc/AKedOLQAP_KnS_J7rYRuogavEd5G9oBOPyirAi8gh_v4=s176-c-k-c0x00ffffff-no-rj,0.0
Ugy5SBT0KdOs1sw8FoV4AaABAg.9_kxz10wHHi9_lb9Y49rLg,"⬆️ Ensure to contact the What'sap line above for more information and consultation on investment. I have a new investment I am sure you will like to be  part of...
Thanks for your comment 🙂",3 days ago,WhatsApp +⓽⓵⓽⓼⓶⓽⓽⓶⓽⓷⓶⓸,UCRBGuqujQeCG1gxpvoLEvpQ,0,https://yt3.ggpht.com/ITI6H_xhgtHsuLbHq4DPCjbIEY2Z8HB8Hqv70FGMlrytL9iy-qwejrZIWAFVuseFuVLX8XhjyD4=s176-c-k-c0x00ffffff-no-rj,0.0
Ugx-hkkGjC8i9cMtAud4AaABAg.9__nb2OvMoP9_aDhcFbXx0,"Ensure to contact the What'sap line above for more information and consultation on investment. I have a new investment I am sure you will like to be  part of...
Thanks for your comment 🙂",7 days ago,WhatsApp +⓽⓵⓽⓼⓶⓽⓽⓶⓽⓷⓶⓸,UCRBGuqujQeCG1gxpvoLEvpQ,0,https://yt3.ggpht.com/ITI6H_xhgtHsuLbHq4DPCjbIEY2Z8HB8Hqv70FGMlrytL9iy-qwejrZIWAFVuseFuVLX8XhjyD4=s176-c-k-c0x00ffffff-no-rj,0.0
Ugz0RYBYyC3Wy1oGiMJ4AaABAg.9_XMZX86bqS9_XR3WI3YMH,"⬆️⬆️⬆️ thanks for comment,
Contact the What'sap line above  for more information, advise and consultation...",9 days ago,💻Pinnedby Akshat Shrivastava,UCEXcIyqG-i9l1-isQ7cp_iQ,0,https://yt3.ggpht.com/YpFjrX_OB1AoebK5_rexTVCIWjCffaxO-bEjSTM4Fy-XgWtdDoox8Dout9eX_QMBFNQHpw2cqRk=s176-c-k-c0x00ffffff-no-rj,0.0
UgxD9tmNcenlJ6ViBnt4AaABAg.9_UgRRbkf8U9_Vc6G9PxtG,Appreciate your comments☝🏻 whasapp the number above for more tips and guidance on Crypto investment strategies...,10 days ago,Akshat S+①⑧⑥⑦②⑨②⑧③③⑥,UCG1w7uFoMq36C6AcbR2wdsQ,0,https://yt3.ggpht.com/eF83kdCix6JygMiuiT71JC7UgL7d4wcQLpq3MA0qdhJfS_8fyEf69wPoK8glblVZF-nxLm-M=s176-c-k-c0x00ffffff-no-rj,0.0
UgxD9tmNcenlJ6ViBnt4AaABAg.9_UgRRbkf8U9_fa3xqZSpC,"What'sapp✙919781763752

       More profitable updates on trading and Investing📊
  What'sapp✙919781763752

More updates on crypto, XRP, NFT's,BTC📊🚀 🇮🇳🇧🇩🇵🇰🌎",5 days ago,💻Pinnedby Akshat Shrivastava,UC4SIPdlPRZtgfs0Ng4RvVpA,0,https://yt3.ggpht.com/tSXYxDDrjVFYmeWVAU_IDNz0V1O8LpP0VGOOKcN55_Hj4_A79i3wgPCvF1HYUvahMhlkII9q=s176-c-k-c0x00ffffff-no-rj,0.0
UgzbY3oO_SzSWxGM2ep4AaABAg.9_Rj8c3CeCR9_RrLdJO7tK,"Thanks for the feedback,,
contact the What'sap line above for more information and advice on investment, also participate in the ongoing new investment plan.",11 days ago,WhatsApp +⓽⓵⓽⓼⓶⓽⓽⓶⓽⓷⓶⓸,UCRBGuqujQeCG1gxpvoLEvpQ,0,https://yt3.ggpht.com/ITI6H_xhgtHsuLbHq4DPCjbIEY2Z8HB8Hqv70FGMlrytL9iy-qwejrZIWAFVuseFuVLX8XhjyD4=s176-c-k-c0x00ffffff-no-rj,0.0
UgxRzVDyYnufPrBhWGx4AaABAg.9_PoNDLaW4v9_PyE9yRzq6,"⬆️⬆️⬆️ thanks for comment,
Contact the What'sap line above  for more information, advise and consultation",12 days ago,💻Pinnedby Akshat Shrivastava,UCthYZAaGpb5VsiE8bpjJm-g,0,https://yt3.ggpht.com/CDQ4PAaH5aQJg_0f-kj8BxpN8FxDomFQX-yFJrKfVqNUgwxENy5k9sNaM5gQroYI83MXi3jW3A=s176-c-k-c0x00ffffff-no-rj,0.0
UgxRzVDyYnufPrBhWGx4AaABAg.9_PoNDLaW4v9_fa59oaNLK,"What'sapp✙919781763752

       More profitable updates on trading and Investing📊
  What'sapp✙919781763752

More updates on crypto, XRP, NFT's,BTC📊🚀 🇮🇳🇧🇩🇵🇰🌎",5 days ago,💻Pinnedby Akshat Shrivastava,UC4SIPdlPRZtgfs0Ng4RvVpA,0,https://yt3.ggpht.com/tSXYxDDrjVFYmeWVAU_IDNz0V1O8LpP0VGOOKcN55_Hj4_A79i3wgPCvF1HYUvahMhlkII9q=s176-c-k-c0x00ffffff-no-rj,0.0
UgyJyqappaYmQAkPyEl4AaABAg.9_P1Sg0MPKT9_PyGCGoXEb,"⬆️⬆️⬆️ thanks for comment,
Contact the What'sap line above  for more information, advise and consultation",12 days ago,💻Pinnedby Akshat Shrivastava,UCthYZAaGpb5VsiE8bpjJm-g,0,https://yt3.ggpht.com/CDQ4PAaH5aQJg_0f-kj8BxpN8FxDomFQX-yFJrKfVqNUgwxENy5k9sNaM5gQroYI83MXi3jW3A=s176-c-k-c0x00ffffff-no-rj,0.0
UgyJyqappaYmQAkPyEl4AaABAg.9_P1Sg0MPKT9_fa77lnr37,"What'sapp✙919781763752

       More profitable updates on trading and Investing📊
  What'sapp✙919781763752

More updates on crypto, XRP, NFT's,BTC📊🚀 🇮🇳🇧🇩🇵🇰🌎",5 days ago,💻Pinnedby Akshat Shrivastava,UC4SIPdlPRZtgfs0Ng4RvVpA,0,https://yt3.ggpht.com/tSXYxDDrjVFYmeWVAU_IDNz0V1O8LpP0VGOOKcN55_Hj4_A79i3wgPCvF1HYUvahMhlkII9q=s176-c-k-c0x00ffffff-no-rj,0.0
UgwXswkrFl7EnFs9IUx4AaABAg.9_Jy8sO9Emd9_LSITYL-Jl,"Glad you love the content,
contact the What'sap line above for more information and advice on investment, also participate in the ongoing new investment plan.",2 weeks ago,WhatsApp +⓽⓵⓽⓼⓶⓽⓽⓶⓽⓷⓶⓸,UCRBGuqujQeCG1gxpvoLEvpQ,0,https://yt3.ggpht.com/ITI6H_xhgtHsuLbHq4DPCjbIEY2Z8HB8Hqv70FGMlrytL9iy-qwejrZIWAFVuseFuVLX8XhjyD4=s176-c-k-c0x00ffffff-no-rj,0.0
UgxOztOCuBCy6jsB08t4AaABAg.9_JQ3Y-Ggtk9_J_4IqM4cN,"Ensure to contact the What'sap line above for more information and consultation on investment. I have a new investment I am sure you will like to be  part of.
Thanks for your comment 🙂",2 weeks ago,WhatsApp +⓽⓵⓽⓼⓶⓽⓽⓶⓽⓷⓶⓸,UCRBGuqujQeCG1gxpvoLEvpQ,0,https://yt3.ggpht.com/ITI6H_xhgtHsuLbHq4DPCjbIEY2Z8HB8Hqv70FGMlrytL9iy-qwejrZIWAFVuseFuVLX8XhjyD4=s176-c-k-c0x00ffffff-no-rj,0.0
UgyMDUTtF9VtxVCLhyp4AaABAg.9_Ew13g1d8j9_FErJ1favw,Appreciate your comments☝🏻 whasapp the number above for more tips and guidance on Crypto investment strategies...,2 weeks ago,Akshat S+①⑧⑥⑦②⑨②⑧③③⑥,UCiYkl3QgnT8UwIGxaveFPwA,0,https://yt3.ggpht.com/sjR1b8r95SyUQwba1l9F9eEYT75a2WGfNDuZC3a3obgRVeRWUJ_UFEF6GZ2f6KKAQJdro6CAvQ=s176-c-k-c0x00ffffff-no-rj,0.0
UgyMDUTtF9VtxVCLhyp4AaABAg.9_Ew13g1d8j9_fa8NaHTmj,"What'sapp✙919781763752

       More profitable updates on trading and Investing📊
  What'sapp✙919781763752

More updates on crypto, XRP, NFT's,BTC📊🚀 🇮🇳🇧🇩🇵🇰🌎",5 days ago,💻Pinnedby Akshat Shrivastava,UC4SIPdlPRZtgfs0Ng4RvVpA,0,https://yt3.ggpht.com/tSXYxDDrjVFYmeWVAU_IDNz0V1O8LpP0VGOOKcN55_Hj4_A79i3wgPCvF1HYUvahMhlkII9q=s176-c-k-c0x00ffffff-no-rj,0.0
UgwOPoI4cajekbsMg8N4AaABAg.9_BQfpahf3_9_BWeBMyRhw,"Thanks for your comment 👆👆
Endeavour to contact the What'sap line above for more profitable investment plans.",2 weeks ago,WhatsApp +⓽⓵⓽⓼⓶⓽⓽⓶⓽⓷⓶⓸,UCRBGuqujQeCG1gxpvoLEvpQ,0,https://yt3.ggpht.com/ITI6H_xhgtHsuLbHq4DPCjbIEY2Z8HB8Hqv70FGMlrytL9iy-qwejrZIWAFVuseFuVLX8XhjyD4=s176-c-k-c0x00ffffff-no-rj,0.0
Ugz9Nul4mEGDoLLmcZJ4AaABAg.9_B84g_iyeP9_BX5pa2ddv,"Thanks for the feedback,
contact the What'sap line above for more information and advice on investment, also participate in the ongoing new investment plan.",2 weeks ago,WhatsApp +⓽⓵⓽⓼⓶⓽⓽⓶⓽⓷⓶⓸,UCRBGuqujQeCG1gxpvoLEvpQ,0,https://yt3.ggpht.com/ITI6H_xhgtHsuLbHq4DPCjbIEY2Z8HB8Hqv70FGMlrytL9iy-qwejrZIWAFVuseFuVLX8XhjyD4=s176-c-k-c0x00ffffff-no-rj,0.0
UgyFeyMEvbRfeObFceh4AaABAg.9_7b1HMWN-K9_7h9lDQSo8,"⬆️ Ensure to contact the What'sap line above for more information and consultation on investment. I have a new investment I am sure you will like to be  part of...
Thanks for your comment 🙂",2 weeks ago,WhatsApp +⑨①⑨⑧②⑨⑨②⑨③②④,UC4dX8CZ5E3OgGLavS3HiNtA,0,https://yt3.ggpht.com/lN3x_Uhu2vEmZunrUkBxpN7bhf2jTzt3NjmJjkvbQWSKFKqisj047IQ6xRnn9R82C2_YJl9NlQ=s176-c-k-c0x00ffffff-no-rj,0.0
UgxyWozZw7svKOf9aSt4AaABAg.9_5FkSDl_PK9_5GHx7anpT,"Thanks for your comment 👆👆
Endeavour to contact the What'sap line above for more profitable investment plans.",2 weeks ago,WhatsApp +⓽⓵⓽⓼⓶⓽⓽⓶⓽⓷⓶⓸,UCRBGuqujQeCG1gxpvoLEvpQ,0,https://yt3.ggpht.com/ITI6H_xhgtHsuLbHq4DPCjbIEY2Z8HB8Hqv70FGMlrytL9iy-qwejrZIWAFVuseFuVLX8XhjyD4=s176-c-k-c0x00ffffff-no-rj,0.0
UgyVAgF-8uPIdAAxbHN4AaABAg.9_2EcOYJ9T29_XRAlL8AJ2,"⬆️⬆️⬆️ thanks for comment,
Contact the What'sap line above  for more information, advise and consultation..",9 days ago,💻Pinnedby Akshat Shrivastava,UCEXcIyqG-i9l1-isQ7cp_iQ,0,https://yt3.ggpht.com/YpFjrX_OB1AoebK5_rexTVCIWjCffaxO-bEjSTM4Fy-XgWtdDoox8Dout9eX_QMBFNQHpw2cqRk=s176-c-k-c0x00ffffff-no-rj,0.0
UgwzfmpbRTLil4iilxN4AaABAg,Can you speak about ease my trip. I feel it's inflated and friends say promoters have undervalued their stocks. Can we choose this for medium term?,3 weeks ago,thirumuruga yuvaraj,UCZta2kT8glsD-CS07di9IqA,1,https://yt3.ggpht.com/ytc/AKedOLT6WW7EuRIaTkpp_JYxURVrFSNlFigERynPsNBF=s176-c-k-c0x00ffffff-no-rj,0.0
UgxiSt9vlS37xQuRA2V4AaABAg,akshat do you start any management lessons for business analuysis or fundamental analysis of stocks. Please let us know. You have abundant knowledge. good to know lot of things.,3 weeks ago,Naruto fan,UCDrDYF__kDqSlb3ihhFK5Ag,1,https://yt3.ggpht.com/BXLa1fnpjK9rcPmZyjNFlq6Iu7RLcxVkPEmh7oYAg8AHjLot-cbgz8XliIJLoE1UEFTQRlq83A=s176-c-k-c0x00ffffff-no-rj,0.0
UgxJf3GTU8T7zuw8e494AaABAg,wonderful video. Keep it up.,3 weeks ago,Naruto fan,UCDrDYF__kDqSlb3ihhFK5Ag,1,https://yt3.ggpht.com/BXLa1fnpjK9rcPmZyjNFlq6Iu7RLcxVkPEmh7oYAg8AHjLot-cbgz8XliIJLoE1UEFTQRlq83A=s176-c-k-c0x00ffffff-no-rj,0.0
Ugxs6gaYYKHQwvPHsL94AaABAg,Very well  explained about stock market and principles of identifying good stocks. Thank you Very much.,3 weeks ago,Kokkili Ramanayya,UCEL2ScW7nc4slvO0tbYoKNw,1,https://yt3.ggpht.com/ytc/AKedOLQOYiIHVC_liBo1yWbNzPfGm5FS-gp3fwZwJg=s176-c-k-c0x00ffffff-no-rj,0.0
UgybNlod8RmwXOClojJ4AaABAg,"Sir,What you think about the new age unicorns and from that perspective what is your guess about small cap growth stocks in 10 year horizon.",3 weeks ago,rudra das,UCy-ZoqEXe0TvTjpZMosGWUg,1,https://yt3.ggpht.com/ytc/AKedOLRsxD9tDHWrWeeXj-AdzeMGjN5TEmhY1WO4xg=s176-c-k-c0x00ffffff-no-rj,0.0
UgwEb9Ks5fiIJ9D37CJ4AaABAg,Gmm prudler company ke bare mai bataye.,3 weeks ago,Kajal Patel,UCiYSZqcJxqOI6-1lZTko7uw,0,https://yt3.ggpht.com/ytc/AKedOLRhNnhYS8brmw_xIFwjCxlKlMYOQpTa4P660g=s176-c-k-c0x00ffffff-no-rj,0.0
UgwS4XCfrK0EWKLoWcV4AaABAg,"The stock market is in excellent form; I just retired and, with less time on my hands, plunged into the market; it's been quite a voyage, hehe. I want to invest actively in the market, mostly in Bitcoin. I have put aside $120,000 and would welcome any advice on how to maximize my profits.",3 weeks ago,Leif Rasmus,UCy8sPxen1HYA_VytDubDOxw,134,https://yt3.ggpht.com/yiN6fzETpjpqBNN1axyNMmto2slWNklq_uvPBxSzjBGbAPyanOkaAMQ3fDyQeWDNEsPG0vCO=s176-c-k-c0x00ffffff-no-rj,0.0
Ugw4Ry_T2aguxq16X594AaABAg,Gaga means: excessively and foolishly enthusiastic,3 weeks ago,Tom Mathews,UCobJ4ZlopnGMpLIuVTfk89w,1,https://yt3.ggpht.com/ytc/AKedOLTrJkKa9yQcrt7BFObPz-icajpdu9kxesSSHXQj0AM=s176-c-k-c0x00ffffff-no-rj,0.0
UgxjRp2Xv93xYjy-1RN4AaABAg,"Sure, Please make the same type of videos on the US stock market.
There are not that many YouTubers who analyze stocks like you in the US stock market.",3 weeks ago,Tirth Jayswal,UCAesOXIk9b7QBxD6WyjBwiw,1,https://yt3.ggpht.com/ytc/AKedOLRXf3hRNg2Gpdkey4P5ILk43N5RYP-M381N4bdc458=s176-c-k-c0x00ffffff-no-rj,0.0
Ugx1A9XYfdFqMxWD6iF4AaABAg,"Every episode is very informative, keeps us glued on every word & sentence you speak at the same time the best part is you add a pitch of is humorous which makes it Super interesting to understand and brings in some Freshness vibes...",3 weeks ago,Narendra Sharma,UCRU75UK8KSe_0qP4PGf-X7g,0,https://yt3.ggpht.com/ytc/AKedOLSnA92EYGQcznDIyTvK12vsjdqSpIcNdXjAuHsdx20=s176-c-k-c0x00ffffff-no-rj,0.0
UgxZCZxXhVq6Mhny17F4AaABAg,Us market interested to invest not sure where to start,3 weeks ago,Honey Shah,UChh0UmXVibuIDo9-bPvvemw,1,https://yt3.ggpht.com/ytc/AKedOLSwAtHbb06VX4MrbJ3spkWNUGlqpAhhMiD--Q=s176-c-k-c0x00ffffff-no-rj,0.0
UgyNjHqNm83VFA5qjPx4AaABAg,Make a stock market course from basic to advance,4 weeks ago,Gaurav Rauthan,UCBqJ_f_O3Wr1ULFDehDj_5g,1,https://yt3.ggpht.com/ytc/AKedOLRbxJrJ6H_ggmUQgz-jVeQCCoPPnklEc9sv0Giu5Q=s176-c-k-c0x00ffffff-no-rj,0.0
UgyNgMzCQyvGDON9uoF4AaABAg,Waiting for video of I lac investment in US stock and Crypto porfolio,4 weeks ago,Amit Pakhare,UC9YCkdY8NT5eVgfEIVLkRsQ,2,https://yt3.ggpht.com/ytc/AKedOLT009bhY1-SrWaC5ONndzhr3LqhuBXGNJNJHIe-VQ=s176-c-k-c0x00ffffff-no-rj,0.0
UgxNIoTTGH-8ozaEo5N4AaABAg,"You can always time the market by keeping a track on your favourite stocks with its historical data & buying them in crash & corrections which is for sure once in a while every 6 months or so. 

I invest basis this for short term & take away profits. 

I am very watchful on my favourite stocks & historical data.",4 weeks ago (edited),raV,UCG7ZvKy7yCyGAtRQeV1EQRQ,0,https://yt3.ggpht.com/ytc/AKedOLSbL0WUoitsyqL3Qr3XueoliqDasxfYVJeHdNNoyw=s176-c-k-c0x00ffffff-no-rj,0.0
