cid,text,time,author,channel,votes,photo,heart
UgxxiJ4phcPIg2ehVjZ4AaABAg,"►For personalized classes on Stock Market and Cryptocurrencies, check out: https://wisdomhatch.com/
____________________________________
►Check my podcast here:
https://open.spotify.com/show/2TCEknmn1VexWXAHLYdcvL
____________________________________
►Get 50% kickback on your trading fees while trading in Cryptos, check out Vauld: 
https://mobile.vauld.me/Mr0X/Akshat
_____________________________________________________
Check out my smallcases (through MOBILE APP only):
►Akshat's GREAT Indian Monopolies - 
https://link.smallcase.com/qE6Zswafmjb
►Multibagger SmallCase - 
https://link.smallcase.com/ssZNTI8uajb
►Akshat's Consumer Durable - 
https://link.smallcase.com/iqfkxptLVib",2 months ago,Akshat Shrivastava,UCqW8jxh4tH1Z1sWPbkGWL4g,23,https://yt3.ggpht.com/VI0OvMwpPQPFGoHAQOHsvtEcFWg-_YzFBhoeohr2CRz1T21Ja4unTGte1Gz6TnDUgVX9wcOG=s176-c-k-c0x00ffffff-no-rj,0.0
UgzaXuae529_JNhgDiZ4AaABAg,"Superb conversation, thank you Akshat",2 days ago,Niral Visaria,UC_C9VG3a-jprKM6UFWlpR9w,1,https://yt3.ggpht.com/ytc/AKedOLQ_pQ91520XCcCmYwbK02971i-66Bv-e-SBeTGfDlZBtaTp9UuC6XHx-mTgxjoa=s176-c-k-c0x00ffffff-no-rj,0.0
Ugyq_b61eYaNJze3W7J4AaABAg,"Awesome, no two words :-)",6 days ago,a236z,UCVddALMkKMhIXppbmM6qytQ,1,https://yt3.ggpht.com/ytc/AKedOLQ5pmTyce6IW1nnGlPMs6M5BptoR5PP5hq5shcxig=s176-c-k-c0x00ffffff-no-rj,0.0
Ugyrv7LtuB0EbC1ekDt4AaABAg,Amazing mam,13 days ago,Dimple Pandita,UCglvqevNeNLsZOiMFr-4ppQ,1,https://yt3.ggpht.com/ytc/AKedOLTqBVlrHkiFA0A9Q6P3fNPnG5ktzB-TNVdTzd0HvSrcdNOljqa4ESkVawfuFHi2=s176-c-k-c0x00ffffff-no-rj,0.0
UgztvCWvpMBrH-Cy8It4AaABAg,Great Akshat great Video and thanks for inviting Saurabh Mukherjee and Salil Desai. I am also one of the follower of Saurabh Mukherjee.,3 weeks ago,Mahesh Dhakate,UCgVKLKhYUOxxCeQSd3YsBgg,0,https://yt3.ggpht.com/ytc/AKedOLT4cbwr6PWExGdTeXauCvNpgEdzQlSqPC4rS0cFXlo=s176-c-k-c0x00ffffff-no-rj,0.0
UgzzR5F9pwUHt2PH5kZ4AaABAg,"The video made me to recollect my CFA books..
Sadly, the stock market is not working like this now a days..",3 weeks ago (edited),Satish,UCs5EPRcFPnXSCK7oqVda8ug,1,https://yt3.ggpht.com/wel6932TIkngleF6tARdeXLi5roCohLEF4ZZ81m170_NBEJyee9ZmTN01OorvFt9Kvj11itI=s176-c-k-c0x00ffffff-no-rj,0.0
Ugz80EryF7LqspwUgRh4AaABAg,P. S - don't be intimated by my username.,1 month ago,youtube police,UCryIfiCMVwD_pnEMkLOh5cQ,1,https://yt3.ggpht.com/M2yGvYOA6BpoZGuG553wU0VyQIBDxmQmWGH1Mmf-femCn_vTQrBgXMN0EeHvCHszDRNlKZUM=s176-c-k-c0x00ffffff-no-rj,0.0
UgwTEgJCH8v3IQT5orV4AaABAg,"And I am watching in Switzerland, love and respect from Switzerland 🇨🇭",1 month ago,Unseen facts,UCo13TVu1iZvECzY5rq8OWcw,1,https://yt3.ggpht.com/sF2S5wya2SB63rljcJSz-9kU_ZS5n-BuhbH5T_XWYxN02mTCVeByKS2rWKRnwzwKC6M3dFSqgg=s176-c-k-c0x00ffffff-no-rj,0.0
Ugwi8jntnhmO4VpAssl4AaABAg,"Wonderful discussion listening to wonderful experts so much to know.,,Thanks Akshat",1 month ago,Asha Mehta,UC8iiJXthBJ6ARlhahCsDFNA,3,https://yt3.ggpht.com/ytc/AKedOLRnbkwFh39JVr7U1sF9dhI3eA6NoXEOnQ3k-Q=s176-c-k-c0x00ffffff-no-rj,0.0
UgxV8Yo--0nnKoS-QMl4AaABAg,"Akshat maza aa gaya ,three brriliant experts,so much knowledge from Saurabh,Salil",1 month ago,Asha Mehta,UC8iiJXthBJ6ARlhahCsDFNA,1,https://yt3.ggpht.com/ytc/AKedOLRnbkwFh39JVr7U1sF9dhI3eA6NoXEOnQ3k-Q=s176-c-k-c0x00ffffff-no-rj,0.0
UgzW1nnFxy9Y43xeLKd4AaABAg,"I must say that knowing you is my greatest achievement in life, i receive my profit $10,000 successful, all thanks to Mrs Linda may God keep on blessing you.",1 month ago,Grace Florence,UCx54NdzMAgj8Rca7nnozWIg,21,https://yt3.ggpht.com/K5xjW0maT3NWOLIrsj67VlouBLmalno_3A36qNVbbYwNc8zCwVV-fcZ5muof5F00QxCMNF76CCc=s176-c-k-c0x00ffffff-no-rj,0.0
Ugxxq6d3Yhsk6TZ10dx4AaABAg,"Sir thankyou for your videos, pls i have 2 request for you. 1)pls can you explain what sir explained on p/e ratio 2) basic on how to read annual reports . Thankyou for consideration",1 month ago,prakash vasan,UCVVswA_sxefMp8uOmSkfomA,0,https://yt3.ggpht.com/ytc/AKedOLTUVKkL1Rnj-zsLwRZT2o5lBedCjd_3RlxApXyKng=s176-c-k-c0x00ffffff-no-rj,0.0
UgwjEgn7RCS05AT9LIZ4AaABAg,"Good information sir, thank you. Only request use Numbers in English instead of Hindi. Most of South Indian people they doesn't know Hindi Numbers even though they understand Hindi. Please consider sir",1 month ago,DB Solutions India,UCqmalSWgqiVMXOgnR4zyokA,2,https://yt3.ggpht.com/ytc/AKedOLRcXP5-FBXr0VMXc-SNr0-tdr-SkpvIH6VhjyG5XxPvk8XAG7cpgwXshtxd1h3Q=s176-c-k-c0x00ffffff-no-rj,0.0
Ugy9JLq1d8Cj68a-w5B4AaABAg,Both Akshat and Saurabh are humble people & this is what makes it more special,1 month ago,Varun Sethi,UCJHLV1NYRm1oj4QZ6ItKZqg,2,https://yt3.ggpht.com/ytc/AKedOLR_gDOWZWLI3UV66raNyo9w8R0o8oRC7hzN2jO9ZQ=s176-c-k-c0x00ffffff-no-rj,0.0
Ugwh7qCH4MeMJoCXF1N4AaABAg,"Stay away from ""SOCIAL MEDIA""",1 month ago,Priti Kinikar,UCpJamvWutAosRkfQCSuF5xg,0,https://yt3.ggpht.com/ytc/AKedOLQwDKqxt61qaGow7XhHiBhll3OD1RV_3616Qn1VgE-d1oye5rZ8JAlpgocuLhWI=s176-c-k-c0x00ffffff-no-rj,0.0
UgzGz03gsbr9og_bfNF4AaABAg,very helpful session,1 month ago,Harsh Mishra,UCkYP5imsicOwxY72gjgZzHQ,1,https://yt3.ggpht.com/506hTFGZzdR24gxVSrwb6lBAm7VKie6F1iKIi7aDcBX8PCKWCPuRaNQIaL4qChlwbwXC9TZaGA=s176-c-k-c0x00ffffff-no-rj,1.0
Ugz749lyeILncd7ZHlN4AaABAg,kudos to you Akshat for this wonderful video with Saurabh Sir,1 month ago,Balwant Singh,UCXRD2Y72KB0Zvl736o2HyFQ,0,https://yt3.ggpht.com/ytc/AKedOLSpMrPkBiNrfqgtZ9BYCtJa8oisZWULgxB7jciRZg=s176-c-k-c0x00ffffff-no-rj,0.0
UgzzyzMkbPWZANpnI5Z4AaABAg,"Since loosing my job as an air hostess some months back I decided to try something else, what I have found most profitable so far is Options trading and forex because with these two I make close to $ 20k monthly it's great and I'm still trying out other sources.",1 month ago,Ching Dubay,UCHpAuaErEmHdiDXKR0SZFKw,22,https://yt3.ggpht.com/G5C7xAFXe2ex5NM7xj8NLTN-LnKidZqnUgIYLxBQxxoeGxn5sF-PHv2a5OSj3Q1xNflJCEo9=s176-c-k-c0x00ffffff-no-rj,0.0
UgxMrNF2nzHoujluLBN4AaABAg,great video akshat.,1 month ago,khitab oza,UCiiacp8NW2E4M9zq3O84j6A,2,https://yt3.ggpht.com/ytc/AKedOLSx_Dafh8tHxwjYwswlJZdQInkMruSGb_ctcWLfyw=s176-c-k-c0x00ffffff-no-rj,0.0
UgxA5o4Ixa3CiyWY54l4AaABAg,I am from Gwalior too. Inspiring to know people from tier 2 & 3 cities are changing the perceptions on such landscapes.,1 month ago (edited),Prateek Garg,UCMe_Kh_9t8RRvlxGKADJomg,2,https://yt3.ggpht.com/ytc/AKedOLR8ZE-SijgxKj1dFgVGSQis8wNYC9PAMGK8mg_i=s176-c-k-c0x00ffffff-no-rj,0.0
UgxxiJ4phcPIg2ehVjZ4AaABAg.9Xf9I2bnrBt9Xf9M7qguNp,Big fan sirr 🙏🏻🙏🏻,2 months ago,Anubhav singh,UCDZb3Khn0G_yG9Ljp1mzwaA,2,https://yt3.ggpht.com/NItpHEFTjHVgODP1wQp7YR6p40u8uNiRrrKYnlztdZmM2qOk9XzWsUqESx0fx9DrAoofbkXvDw=s176-c-k-c0x00ffffff-no-rj,0.0
UgxxiJ4phcPIg2ehVjZ4AaABAg.9Xf9I2bnrBt9Xf9hzM4aP9,By the way I am 11th student 🙏🏻,2 months ago,Anubhav singh,UCDZb3Khn0G_yG9Ljp1mzwaA,2,https://yt3.ggpht.com/NItpHEFTjHVgODP1wQp7YR6p40u8uNiRrrKYnlztdZmM2qOk9XzWsUqESx0fx9DrAoofbkXvDw=s176-c-k-c0x00ffffff-no-rj,0.0
UgxxiJ4phcPIg2ehVjZ4AaABAg.9Xf9I2bnrBt9XfBjVmDmJn,Saurabh dont like HUL. Only nestle 😊,2 months ago,G R,UCZOhW9kLaagWvpiwgXwm7JQ,1,https://yt3.ggpht.com/ytc/AKedOLTRyKnDBpMBdxX4RHh3izVG72-S37m5RerY5QPS1kQ=s176-c-k-c0x00ffffff-no-rj,0.0
UgxxiJ4phcPIg2ehVjZ4AaABAg.9Xf9I2bnrBt9XfKQPhDfAL, @G R  TRUEEEE,2 months ago,Sayar Ghosh,UCy24qB5hVXCxp7qC6XjTBtg,0,https://yt3.ggpht.com/ytc/AKedOLSXoTIbG4Gx-ycxmaM1LlUNXHpPQpyAC139ZY3xlg=s176-c-k-c0x00ffffff-no-rj,0.0
UgxxiJ4phcPIg2ehVjZ4AaABAg.9Xf9I2bnrBt9XfLG5t43BH,Akshat please do fundamental analysis of Rising Giants Portfolio by Saurabh and Marcellus.,2 months ago,rdx31,UC1-i8gtaxaevkPQhOkcKkPQ,1,https://yt3.ggpht.com/ytc/AKedOLQrH7KZAId5yCBxO3tYNYNzmraKi02yEsx8ajdy=s176-c-k-c0x00ffffff-no-rj,0.0
UgxxiJ4phcPIg2ehVjZ4AaABAg.9Xf9I2bnrBt9XfO2ILsn5X,"Woaahh!! Cannot believe you got saurabh Mukharjea on your channel, he is my investment Idol ♥️",2 months ago,Harsh Shah,UCDrts5VdPLac8hgoBIYu97w,4,https://yt3.ggpht.com/ytc/AKedOLTS2YsNx0dRXd4VR-K5eoDZAQhk_7SD46_LI9nfEik=s176-c-k-c0x00ffffff-no-rj,0.0
UgxxiJ4phcPIg2ehVjZ4AaABAg.9Xf9I2bnrBt9XfbYYfRWX1,Zzzzzzzz,2 months ago,Nishu Sharma,UCkk-rLxk-vAS0HNH_JulsqQ,0,https://yt3.ggpht.com/ytc/AKedOLQ1SEIJzn17KPIb_L-W24e8kVMAd7lk7_Ix2Q=s176-c-k-c0x00ffffff-no-rj,0.0
UgxxiJ4phcPIg2ehVjZ4AaABAg.9Xf9I2bnrBt9Xg7krpUyfI,0,2 months ago,Rahul Puthalath,UCKzUAyo0Xdfl9MQg5jcX5rA,0,https://yt3.ggpht.com/ytc/AKedOLTRKYt3eZsQmIm6FLuabkPOl0flQ_t2kOBqoGHvDg=s176-c-k-c0x00ffffff-no-rj,0.0
UgxxiJ4phcPIg2ehVjZ4AaABAg.9Xf9I2bnrBt9XgGSiRYBrZ,"Pls pls fix your mike, Akshat. Your audio quality is poor. Listen to your own video and compare your voice with other people talking here. You will see the difference.",2 months ago,Bharath Raj,UCApuON19W2doje6tk33pIdQ,1,https://yt3.ggpht.com/ytc/AKedOLQea88VK7NPeJUGWJN__FUJfoSqbl5nyEg_aJcnbyI=s176-c-k-c0x00ffffff-no-rj,0.0
UgxxiJ4phcPIg2ehVjZ4AaABAg.9Xf9I2bnrBt9XhQ91Fdn3Q,U both look so similar ..a DNA test is must,2 months ago,Akshay Raut,UCj_SuEZ4KlcwS5JWp_QT2eQ,0,https://yt3.ggpht.com/ytc/AKedOLQZ1QOt0XIWvTnM8ZrauSFFK6Vo5bXgTk8LkwFzxe4=s176-c-k-c0x00ffffff-no-rj,0.0
UgxxiJ4phcPIg2ehVjZ4AaABAg.9Xf9I2bnrBt9Xj6ODEgZ1C,Thank you sir,2 months ago,Shiraz Akhtar,UCzZBveF9NyOTTcEKPBYZ4bQ,1,https://yt3.ggpht.com/ytc/AKedOLTC7liL7TgRO4Xbc4pdREtU93n6IbxxUXANJzwi7xPdaMYk700xU5Ee7SmhuhB1=s176-c-k-c0x00ffffff-no-rj,0.0
UgxxiJ4phcPIg2ehVjZ4AaABAg.9Xf9I2bnrBt9XkhtygwJEw,Once again a great video.. ✅,2 months ago,Pankaj Kumar,UCWGha7JKKZbZdhmk5jY6GSQ,1,https://yt3.ggpht.com/ytc/AKedOLTkGZLA64UayLgpExQhi17oQTe_zl5n6V7nUg=s176-c-k-c0x00ffffff-no-rj,0.0
UgxxiJ4phcPIg2ehVjZ4AaABAg.9Xf9I2bnrBt9XmDpb1I2Zt,"Hey Akshat, Marcellus' portfolio is mostly public. Shall we discuss few stocks from it in your videos? :)",2 months ago,Mohak Ailani,UCR9rKFzTxRXxa5l1cwOqvGg,1,https://yt3.ggpht.com/ytc/AKedOLT4Z1I3z5FT_x1gqiz2odrzgYgMWeB3x_FGHzE5Fgs=s176-c-k-c0x00ffffff-no-rj,0.0
UgxxiJ4phcPIg2ehVjZ4AaABAg.9Xf9I2bnrBt9Y5KiRHmydF,0,2 months ago,Satishchandra Shenoy,UCJQKeXzHwu6iS9g40R8aBng,0,https://yt3.ggpht.com/ytc/AKedOLT0Z2UtXg7_UaqKlvDtOLyOm4c8u3hEstfqfQ=s176-c-k-c0x00ffffff-no-rj,0.0
UgzaXuae529_JNhgDiZ4AaABAg.9_nwYYtqXvA9_rg2imRdge,"Feedback appreciated.
For insight and more lnfo ✉️.....",1 day ago,WhatsApp💌⑨①⑧①⑨⑥⑨③②⑦⑦⑨,UCfNlcfJ0n5rhCx0pld6V5IA,0,https://yt3.ggpht.com/RFJmbEwUqiezdOTWr8g3YH-XIeSzZLYGGv9qkuM0i70vsawHGYAfT-Ov0yc__nNwn2qfG4DmOw=s176-c-k-c0x00ffffff-no-rj,0.0
Ugyrv7LtuB0EbC1ekDt4AaABAg.9_MqwoMANKn9_QwM6Y5Zid,Appreciate your comment What'sap the number above for more tips and guidance on crypto investment strategies.,11 days ago,WhatsApp +⓽⓵⓽⓼⓶⓽⓽⓶⓽⓷⓶⓸,UCRBGuqujQeCG1gxpvoLEvpQ,0,https://yt3.ggpht.com/ITI6H_xhgtHsuLbHq4DPCjbIEY2Z8HB8Hqv70FGMlrytL9iy-qwejrZIWAFVuseFuVLX8XhjyD4=s176-c-k-c0x00ffffff-no-rj,0.0
UgztvCWvpMBrH-Cy8It4AaABAg.9_2Gfthlc-a9_99kcqAuKH,Appreciate your comments☝🏻 whasapp the number above for more tips and guidance on Crypto investment strategies.,2 weeks ago,bekifaayati•①⑧⑥⑦②⑨②⑧③③⑥•,UClXz3620IlKdgmJt7XtO1DQ,0,https://yt3.ggpht.com/3U_Gabye0gUXbG4HPJaGkGokgP95dDfGeC_WX8RND6Fl5Ymsd6qziy27l_lpiSU-2fMrcLrdtg=s176-c-k-c0x00ffffff-no-rj,0.0
Ugz80EryF7LqspwUgRh4AaABAg.9ZSFBNTD-Y69_rhEcYjcp8,"Feedback appreciated.
For insight and more lnfo ✉️.....",1 day ago,WhatsApp💌⑨①⑧①⑨⑥⑨③②⑦⑦⑨,UCfNlcfJ0n5rhCx0pld6V5IA,0,https://yt3.ggpht.com/RFJmbEwUqiezdOTWr8g3YH-XIeSzZLYGGv9qkuM0i70vsawHGYAfT-Ov0yc__nNwn2qfG4DmOw=s176-c-k-c0x00ffffff-no-rj,0.0
UgwTEgJCH8v3IQT5orV4AaABAg.9ZSC13MOer89ZjmooqZAhD,"Feedback Appreciated...
Wanting more info and insight?
Do well to contact the number above ✉️..",4 weeks ago,WhatsApp⑨①⑦⑨⑦③⓪④⑧⑦①④,UCyQrfTWylb_gdB6iYJ1qgIg,0,https://yt3.ggpht.com/z-LjfR34NRMdDvh7OschUTiPWk-AJQEI5nCUJZAvMOqYhJNrWKhjgpjfahjTuG1EygPqzZH5hMg=s176-c-k-c0x00ffffff-no-rj,0.0
Ugwi8jntnhmO4VpAssl4AaABAg.9ZLsnhy3gzI9_rhOSn0yQP,"Feedback appreciated.
For insight and more lnfo ✉️.....",1 day ago,WhatsApp💌⑨①⑧①⑨⑥⑨③②⑦⑦⑨,UCfNlcfJ0n5rhCx0pld6V5IA,0,https://yt3.ggpht.com/RFJmbEwUqiezdOTWr8g3YH-XIeSzZLYGGv9qkuM0i70vsawHGYAfT-Ov0yc__nNwn2qfG4DmOw=s176-c-k-c0x00ffffff-no-rj,0.0
UgzW1nnFxy9Y43xeLKd4AaABAg.9ZHJABXHjwz9ZHJBaqEe5k,I withdraw my profit every week thanks so much.,1 month ago,Grace Florence,UCx54NdzMAgj8Rca7nnozWIg,0,https://yt3.ggpht.com/K5xjW0maT3NWOLIrsj67VlouBLmalno_3A36qNVbbYwNc8zCwVV-fcZ5muof5F00QxCMNF76CCc=s176-c-k-c0x00ffffff-no-rj,0.0
UgzW1nnFxy9Y43xeLKd4AaABAg.9ZHJABXHjwz9ZHJFX2yduh,"Wow I'm just shock someone mentioned expert Mrs Linda I thought I'm the only one trading with her, She helped me recover what I lost trying to trade my self.",1 month ago,Jacob Moses,UCGkd98B6PLnsz2OCVox2VNA,0,https://yt3.ggpht.com/VKYmcwU16b8sY2KJVkirTCLcXcEK8Q-nKRL49Pz5tLmLWwu2UdD9v1hEowJ8_OaFBPy_n1dfFvM=s176-c-k-c0x00ffffff-no-rj,0.0
UgzW1nnFxy9Y43xeLKd4AaABAg.9ZHJABXHjwz9ZHJJBeBI8p,"Another great withdrawals today!! £73,500 i appreciate what you've done for me, you're the best and i promise to spread your good work, thanks so much Mrs Linda.",1 month ago,chuly Mariam,UCZe8GWX-N-AhQeND2XnqR7w,0,https://yt3.ggpht.com/-7u3ng1IR4f5bRB2HHINntJCBJZ7rQCwuNuwe4z1-MN6dXKhAGmrrdCIzEmLz8FzdEv_PIDA=s176-c-k-c0x00ffffff-no-rj,0.0
UgzW1nnFxy9Y43xeLKd4AaABAg.9ZHJABXHjwz9ZHJSnLJ2Vk,God bless the day i came across your number on YouTube. You are God sent ma'am always remain thankful to you.,1 month ago,Odunayo Oselayo,UCOBKWPxpJwhDCc5VfFwmLgQ,0,https://yt3.ggpht.com/j1xwQjaXpZSPbKO6Fe5NaYEhzFZbC5NZUz8KD8mbiWy26P71ONOppiaR58e7grlQLbj6InUvMi8=s176-c-k-c0x00ffffff-no-rj,0.0
UgzW1nnFxy9Y43xeLKd4AaABAg.9ZHJABXHjwz9ZHJZcvWdOW,"Who's this professional, everyone is talking about? I always see her post on top comment on every YouTube video I watched.",1 month ago,OBANLA MOHAMMED,UCejBmeE8ekjSXWeuRl5iFOw,0,https://yt3.ggpht.com/ytc/AKedOLQObeIi57IaW6Prg0TIHEYAx6e3uLpmmcpOOZgLYKkHhRm-64mCFn3NAitxbkt4=s176-c-k-c0x00ffffff-no-rj,0.0
UgzW1nnFxy9Y43xeLKd4AaABAg.9ZHJABXHjwz9ZHJ_Zuccz2,I think I'm interested how can I get in touch with Mrs Linda?,1 month ago,OBANLA MOHAMMED,UCejBmeE8ekjSXWeuRl5iFOw,0,https://yt3.ggpht.com/ytc/AKedOLQObeIi57IaW6Prg0TIHEYAx6e3uLpmmcpOOZgLYKkHhRm-64mCFn3NAitxbkt4=s176-c-k-c0x00ffffff-no-rj,0.0
UgzW1nnFxy9Y43xeLKd4AaABAg.9ZHJABXHjwz9ZHJlPWIxER,+13,1 month ago,Veronica Ugwu,UC3TFGoG7b3VDMz-SxGpWQYw,0,https://yt3.ggpht.com/ytc/AKedOLSfZ20TWItE2Jx0G5ATOKliW30qNyLucz83pEIqEPP8Znmn-Hhcf6zvpUb9eftI=s176-c-k-c0x00ffffff-no-rj,0.0
UgzW1nnFxy9Y43xeLKd4AaABAg.9ZHJABXHjwz9ZHJmDVBxXR,237,1 month ago,Veronica Ugwu,UC3TFGoG7b3VDMz-SxGpWQYw,0,https://yt3.ggpht.com/ytc/AKedOLSfZ20TWItE2Jx0G5ATOKliW30qNyLucz83pEIqEPP8Znmn-Hhcf6zvpUb9eftI=s176-c-k-c0x00ffffff-no-rj,0.0
UgzW1nnFxy9Y43xeLKd4AaABAg.9ZHJABXHjwz9ZHJmywqMep,658,1 month ago,Veronica Ugwu,UC3TFGoG7b3VDMz-SxGpWQYw,0,https://yt3.ggpht.com/ytc/AKedOLSfZ20TWItE2Jx0G5ATOKliW30qNyLucz83pEIqEPP8Znmn-Hhcf6zvpUb9eftI=s176-c-k-c0x00ffffff-no-rj,0.0
UgzW1nnFxy9Y43xeLKd4AaABAg.9ZHJABXHjwz9ZHJny-SApS,489,1 month ago,Veronica Ugwu,UC3TFGoG7b3VDMz-SxGpWQYw,0,https://yt3.ggpht.com/ytc/AKedOLSfZ20TWItE2Jx0G5ATOKliW30qNyLucz83pEIqEPP8Znmn-Hhcf6zvpUb9eftI=s176-c-k-c0x00ffffff-no-rj,0.0
UgzW1nnFxy9Y43xeLKd4AaABAg.9ZHJABXHjwz9ZHJowr37IC,Tell her I referred you 👆,1 month ago,Veronica Ugwu,UC3TFGoG7b3VDMz-SxGpWQYw,0,https://yt3.ggpht.com/ytc/AKedOLSfZ20TWItE2Jx0G5ATOKliW30qNyLucz83pEIqEPP8Znmn-Hhcf6zvpUb9eftI=s176-c-k-c0x00ffffff-no-rj,0.0
UgzW1nnFxy9Y43xeLKd4AaABAg.9ZHJABXHjwz9ZHJsxc880t,"Thanks Mrs Linda you've been so wonderful to me and my family, thanks for the cash out.",1 month ago,KWAME WARIBAGHA,UCpGQxj2FVxoL9KWcHHpTsXA,0,https://yt3.ggpht.com/gFwv73zlCjED79NFhCY58vYjxbQHC5WGZmqwyGT8C1RAj33Wgu-fzxoHxqyLXXPm8gdw7Tvx=s176-c-k-c0x00ffffff-no-rj,0.0
UgzW1nnFxy9Y43xeLKd4AaABAg.9ZHJABXHjwz9ZHJwcEdj9F,Thanks for the recommendation,1 month ago,Ojkor Blessing,UCY6VvwwISCpmzSjUc8qsFrA,0,https://yt3.ggpht.com/dYtMECD1y0X4bxxW-lhPD0wrLGAThxAAm4U0d6U0Oi8MKMY1dJc_TJ785Ff1asKETT0DRb29-As=s176-c-k-c0x00ffffff-no-rj,0.0
UgzW1nnFxy9Y43xeLKd4AaABAg.9ZHJABXHjwz9ZHJxQlOAnn,I just contacted her and she attends to me nicely,1 month ago,Ojkor Blessing,UCY6VvwwISCpmzSjUc8qsFrA,0,https://yt3.ggpht.com/dYtMECD1y0X4bxxW-lhPD0wrLGAThxAAm4U0d6U0Oi8MKMY1dJc_TJ785Ff1asKETT0DRb29-As=s176-c-k-c0x00ffffff-no-rj,0.0
UgzW1nnFxy9Y43xeLKd4AaABAg.9ZHJABXHjwz9ZHK-hv0Mil,I'm from Germany I used to take loan from the bank for surviver but after trading with expert Mrs Linda she changed my financial status for real.,1 month ago,Paul Kwasu,UCQoltKrIPtmOJZdWyOfdHTA,0,https://yt3.ggpht.com/291qd2KVBdO4M2awmYrvZo0zvtxOJ7mL_ljaOveo90wHwKZNQ2Y3rc-zz86iVpc1_5Dm20Y2Ug=s176-c-k-c0x00ffffff-no-rj,0.0
UgzW1nnFxy9Y43xeLKd4AaABAg.9ZHJABXHjwz9ZHK0YhSMOW,I remember friends calling me crazy when I started but now I shut up them with my four figure weekly return.,1 month ago,Paul Kwasu,UCQoltKrIPtmOJZdWyOfdHTA,0,https://yt3.ggpht.com/291qd2KVBdO4M2awmYrvZo0zvtxOJ7mL_ljaOveo90wHwKZNQ2Y3rc-zz86iVpc1_5Dm20Y2Ug=s176-c-k-c0x00ffffff-no-rj,0.0
UgzW1nnFxy9Y43xeLKd4AaABAg.9ZHJABXHjwz9ZHK3XDoPXT,"I'm from India Mrs Linda change my financial status for real, I'm now a creditor not debtor anymore",1 month ago,Abdallah Muhammad,UC7t3uUVJnDe_q4f0R8Ows-w,0,https://yt3.ggpht.com/oaoQHI9cuZnaofOafFCCDu8qraG_-3DXWoarBViP_PyK6ELm3Cc7l4S-88m1f-WY5ylGK7EL2w=s176-c-k-c0x00ffffff-no-rj,0.0
UgzW1nnFxy9Y43xeLKd4AaABAg.9ZHJABXHjwz9ZHK4K6QUAr,I'm now a creditor not debtor anymore,1 month ago,Abdallah Muhammad,UC7t3uUVJnDe_q4f0R8Ows-w,0,https://yt3.ggpht.com/oaoQHI9cuZnaofOafFCCDu8qraG_-3DXWoarBViP_PyK6ELm3Cc7l4S-88m1f-WY5ylGK7EL2w=s176-c-k-c0x00ffffff-no-rj,0.0
UgzW1nnFxy9Y43xeLKd4AaABAg.9ZHJABXHjwz9ZHK8gPuPBh,She's the key to crypto.,1 month ago,Leosmart Utobor,UCIqflxSUv31GM8ZluvVtEOA,0,https://yt3.ggpht.com/h6u93zDtxIYmmoDuIKX3G9KuLGNeyZv3ZzCIlzpM2b2fsXs25tOZCmXwpuy4MoqeyriauQSJ5fo=s176-c-k-c0x00ffffff-no-rj,0.0
UgzW1nnFxy9Y43xeLKd4AaABAg.9ZHJABXHjwz9ZHK9UvEseW,She really made name for herself,1 month ago,Leosmart Utobor,UCIqflxSUv31GM8ZluvVtEOA,0,https://yt3.ggpht.com/h6u93zDtxIYmmoDuIKX3G9KuLGNeyZv3ZzCIlzpM2b2fsXs25tOZCmXwpuy4MoqeyriauQSJ5fo=s176-c-k-c0x00ffffff-no-rj,0.0
UgzW1nnFxy9Y43xeLKd4AaABAg.9ZHJABXHjwz9ZHKCWxgH78,"I'm not here to converse for her but to testify just for what I'm sure of, she's trust worthy and best option ever seen.",1 month ago,Timothy Akhuemokhan,UChQPYpMdetqLI0uDzfl_S0g,0,https://yt3.ggpht.com/QB_6Y1tdlvJXoKIy31eGvrXmU3KaG7HBWCYO74jvdv5M2iNszxD694YVl9PS99K9TUd4h_p74g=s176-c-k-c0x00ffffff-no-rj,0.0
UgzW1nnFxy9Y43xeLKd4AaABAg.9ZHJABXHjwz9ZHKDLYPfg3,She has made success easier than we thought,1 month ago,Timothy Akhuemokhan,UChQPYpMdetqLI0uDzfl_S0g,0,https://yt3.ggpht.com/QB_6Y1tdlvJXoKIy31eGvrXmU3KaG7HBWCYO74jvdv5M2iNszxD694YVl9PS99K9TUd4h_p74g=s176-c-k-c0x00ffffff-no-rj,0.0
UgzW1nnFxy9Y43xeLKd4AaABAg.9ZHJABXHjwz9ZHKGzOibya,"I've never heard or seen any of her clients complain of Lost....I think she's perfect, Sometimes i wonder if she used magic power trade.",1 month ago,Ibrahim Gimba,UC0vocjq3KKBInfjDCN_XvcA,0,https://yt3.ggpht.com/ytc/AKedOLRqR9EoTvuGorGK73tfIXN_8H3FXYBUPgPxYUSDmcYngjtAeev_XQm6v6WXyVTP=s176-c-k-c0x00ffffff-no-rj,0.0
UgzW1nnFxy9Y43xeLKd4AaABAg.9ZHJABXHjwz9ZHKK7JiKE-,"A friend that I referred to her just received $7,050 profit after 10 days of investing....I became jealous.. lol",1 month ago,John Victor,UCR3HA36L9ODWFUOHeXgV4gg,0,https://yt3.ggpht.com/iytxU1ragi1g9461UR6fyNqqKSXCyMYwyZ_pKT_rgqbeKJE3LpB52gsAcchDUeG8SXSTMgBR=s176-c-k-c0x00ffffff-no-rj,0.0
UgzW1nnFxy9Y43xeLKd4AaABAg.9ZHJABXHjwz9ZHKNDqsyVh,"Those scammers they promise to make up to $50,000 profit within the space of 7 day's with just $500 to invest and end up not even refunding your capital but she's a woman of integrity, with $500 she will tell you she can only make profit within the range of $4000 to $8,900 and she actually delivers.... She's great",1 month ago,Delia Fekety,UCOMs2uwLT1EpA8Ae9J2GnQw,0,https://yt3.ggpht.com/ytc/AKedOLQ_ukdDJOebaHDqg3citGBfFmC-sXKheVxvzVbwioMGUdmHCv2TT5Ng4cOoXPN1=s176-c-k-c0x00ffffff-no-rj,0.0
UgzW1nnFxy9Y43xeLKd4AaABAg.9ZHJABXHjwz9ZHKQQx1zkM,When I saw testimonies all over the place I thought it was made up stories till i was convinced and gave her a try and honestly i don't regret the move i made because i invested in a big way,1 month ago,cris yung,UCzQNQGBha4xv9olJ3u2d0bg,0,https://yt3.ggpht.com/6ZFP5aFjY-InVFymfTWz1x7wtBT9dMWWu-oq1d0L6PkR4i98fM_gktaQROUmYGP6A00BkDY1Cg=s176-c-k-c0x00ffffff-no-rj,0.0
UgzW1nnFxy9Y43xeLKd4AaABAg.9ZHJABXHjwz9ZHKTbEelfX,"I'm from Brazil, I and two other of my friends tried her immediately we testified her performing wonders, She gave her clients nice attention.",1 month ago,Balinese Smith,UCo4Pl9wJKJS7h6EIGx79Hlg,0,https://yt3.ggpht.com/ytc/AKedOLTRIbCUFQdkbtuZ_WTp7c9Q4Fv8Fn-LIf1U2tfvqdFoU7A_uPcT1IDc8Cq9jOuy=s176-c-k-c0x00ffffff-no-rj,0.0
UgzW1nnFxy9Y43xeLKd4AaABAg.9ZHJABXHjwz9ZHKUhdm_fu,Her trading last week was boom,1 month ago,Balinese Smith,UCo4Pl9wJKJS7h6EIGx79Hlg,0,https://yt3.ggpht.com/ytc/AKedOLTRIbCUFQdkbtuZ_WTp7c9Q4Fv8Fn-LIf1U2tfvqdFoU7A_uPcT1IDc8Cq9jOuy=s176-c-k-c0x00ffffff-no-rj,0.0
UgzW1nnFxy9Y43xeLKd4AaABAg.9ZHJABXHjwz9ZHKXlC9hXT,Most people remain poor only because friends and relatives discouraged and advise them against investing and trading forex while the wise ones kept investing and growing higher financially,1 month ago,HAPPINESS GOLD,UC96PI_a5UymJUiIWEZV8f3w,0,https://yt3.ggpht.com/g9bB6smDC0wNNGu1dk4otOMkCUMw9RUf6hAkIae_po463CIf8TYsSFQXS0BDNvjGZECaRaB_=s176-c-k-c0x00ffffff-no-rj,0.0
UgzW1nnFxy9Y43xeLKd4AaABAg.9ZHJABXHjwz9ZHKYbPL_X5,"She's really the best, I've made a lot",1 month ago,HAPPINESS GOLD,UC96PI_a5UymJUiIWEZV8f3w,0,https://yt3.ggpht.com/g9bB6smDC0wNNGu1dk4otOMkCUMw9RUf6hAkIae_po463CIf8TYsSFQXS0BDNvjGZECaRaB_=s176-c-k-c0x00ffffff-no-rj,0.0
UgzW1nnFxy9Y43xeLKd4AaABAg.9ZHJABXHjwz9ZHKb1-Ld0L,"Mrs Linda has brought me out of the darkness and to a better living through trading options, I encourage newbies to trade with her.",1 month ago,patience Bella,UCNJd1bilIK9CZSHhcKfOgaQ,0,https://yt3.ggpht.com/9zgKAbpIrQYJDhLt-Cx6SqL_P-1aY5b7FmFFBkgQbuR7ffWv-n87lFHa2Dl_fvWLhqUPVkRh=s176-c-k-c0x00ffffff-no-rj,0.0
UgzW1nnFxy9Y43xeLKd4AaABAg.9ZHJABXHjwz9ZHKcFRll-I,Trade with her and remember to share testimonies with others.,1 month ago,patience Bella,UCNJd1bilIK9CZSHhcKfOgaQ,0,https://yt3.ggpht.com/9zgKAbpIrQYJDhLt-Cx6SqL_P-1aY5b7FmFFBkgQbuR7ffWv-n87lFHa2Dl_fvWLhqUPVkRh=s176-c-k-c0x00ffffff-no-rj,0.0
UgzW1nnFxy9Y43xeLKd4AaABAg.9ZHJABXHjwz9ZHKffCom6I,Any one there?,1 month ago,Dorathy Abam,UCEzKZvu61lObxyt79EaK8CA,0,https://yt3.ggpht.com/VE0bzpOBQG4nfIso_FGQVkY4TaKpVVo9RDeuHSPd7rvbJGUydvnXKM4FjoqV4VIDTp8n20NXeVE=s176-c-k-c0x00ffffff-no-rj,0.0
UgzW1nnFxy9Y43xeLKd4AaABAg.9ZHJABXHjwz9ZHKtDo5wC7,+13,1 month ago,orikanjo james,UChBRtaO5umytzAlJSYKWWzw,0,https://yt3.ggpht.com/HH50z-Ix878zaNAtNFU_uegAZBBaPEETW-rCvTOxCVvVKoipTWgYXqNP7Eul0R0pB_PnkkH6UQ=s176-c-k-c0x00ffffff-no-rj,0.0
UgzW1nnFxy9Y43xeLKd4AaABAg.9ZHJABXHjwz9ZHKu38bvgp,237,1 month ago,orikanjo james,UChBRtaO5umytzAlJSYKWWzw,0,https://yt3.ggpht.com/HH50z-Ix878zaNAtNFU_uegAZBBaPEETW-rCvTOxCVvVKoipTWgYXqNP7Eul0R0pB_PnkkH6UQ=s176-c-k-c0x00ffffff-no-rj,0.0
UgzW1nnFxy9Y43xeLKd4AaABAg.9ZHJABXHjwz9ZHKuwZuwYk,658,1 month ago,orikanjo james,UChBRtaO5umytzAlJSYKWWzw,0,https://yt3.ggpht.com/HH50z-Ix878zaNAtNFU_uegAZBBaPEETW-rCvTOxCVvVKoipTWgYXqNP7Eul0R0pB_PnkkH6UQ=s176-c-k-c0x00ffffff-no-rj,0.0
UgzW1nnFxy9Y43xeLKd4AaABAg.9ZHJABXHjwz9ZHKvs2wHFl,489,1 month ago,orikanjo james,UChBRtaO5umytzAlJSYKWWzw,0,https://yt3.ggpht.com/HH50z-Ix878zaNAtNFU_uegAZBBaPEETW-rCvTOxCVvVKoipTWgYXqNP7Eul0R0pB_PnkkH6UQ=s176-c-k-c0x00ffffff-no-rj,0.0
UgzW1nnFxy9Y43xeLKd4AaABAg.9ZHJABXHjwz9ZHKwkYnf8A,Her method surprises me👆,1 month ago,orikanjo james,UChBRtaO5umytzAlJSYKWWzw,0,https://yt3.ggpht.com/HH50z-Ix878zaNAtNFU_uegAZBBaPEETW-rCvTOxCVvVKoipTWgYXqNP7Eul0R0pB_PnkkH6UQ=s176-c-k-c0x00ffffff-no-rj,0.0
Ugxxq6d3Yhsk6TZ10dx4AaABAg.9ZDeDWo0uck9ZDuDCwPZS6, @WhatsApp ㊉①③①⑤⑤②⑥⑤⑥⑦⑧  Big fan sir. Never knew you also catered to personal courses. Surely gonna enroll.,1 month ago,prakash vasan,UCVVswA_sxefMp8uOmSkfomA,0,https://yt3.ggpht.com/ytc/AKedOLTUVKkL1Rnj-zsLwRZT2o5lBedCjd_3RlxApXyKng=s176-c-k-c0x00ffffff-no-rj,0.0
UgwjEgn7RCS05AT9LIZ4AaABAg.9ZDYYVWpX039_rhoYKWThT,"Feedback appreciated.
For insight and more lnfo ✉️.....",1 day ago,WhatsApp💌⑨①⑧①⑨⑥⑨③②⑦⑦⑨,UCfNlcfJ0n5rhCx0pld6V5IA,0,https://yt3.ggpht.com/RFJmbEwUqiezdOTWr8g3YH-XIeSzZLYGGv9qkuM0i70vsawHGYAfT-Ov0yc__nNwn2qfG4DmOw=s176-c-k-c0x00ffffff-no-rj,0.0
Ugy9JLq1d8Cj68a-w5B4AaABAg.9ZDUajwkr2z9_ri00lB-xG,"Feedback appreciated.
For insight and more lnfo ✉️.....",1 day ago,WhatsApp💌⑨①⑧①⑨⑥⑨③②⑦⑦⑨,UCfNlcfJ0n5rhCx0pld6V5IA,0,https://yt3.ggpht.com/RFJmbEwUqiezdOTWr8g3YH-XIeSzZLYGGv9qkuM0i70vsawHGYAfT-Ov0yc__nNwn2qfG4DmOw=s176-c-k-c0x00ffffff-no-rj,0.0
UgzGz03gsbr9og_bfNF4AaABAg.9ZCNzmj9Zuz9ZjmsWeppIR,"Feedback Appreciated...
Wanting more info and insight?
Do well to contact the number above ✉️..",4 weeks ago,WhatsApp⑨①⑦⑨⑦③⓪④⑧⑦①④,UCyQrfTWylb_gdB6iYJ1qgIg,0,https://yt3.ggpht.com/z-LjfR34NRMdDvh7OschUTiPWk-AJQEI5nCUJZAvMOqYhJNrWKhjgpjfahjTuG1EygPqzZH5hMg=s176-c-k-c0x00ffffff-no-rj,0.0
Ugz749lyeILncd7ZHlN4AaABAg.9Z4awhCCMhF9_riCJ-g6Hl,"Feedback appreciated.
For insight and more lnfo ✉️.....",1 day ago,WhatsApp💌⑨①⑧①⑨⑥⑨③②⑦⑦⑨,UCfNlcfJ0n5rhCx0pld6V5IA,0,https://yt3.ggpht.com/RFJmbEwUqiezdOTWr8g3YH-XIeSzZLYGGv9qkuM0i70vsawHGYAfT-Ov0yc__nNwn2qfG4DmOw=s176-c-k-c0x00ffffff-no-rj,0.0
UgzzyzMkbPWZANpnI5Z4AaABAg.9Z2JORmZYxU9Z2JfQvjjwV,How? That's great and a nice income to me because I can live and save off that can you please show me how to,1 month ago,Emmy Oregon,UCvXtmr1gpdFCFp9eTXfZhJg,0,https://yt3.ggpht.com/timadzs_CfMQ0oIioK6-4w3w4kvZ6dJ0H04qrlrklR5DCfN4lCC06mM8ZsyGEowzGepm2Bdmyw=s176-c-k-c0x00ffffff-no-rj,0.0
