cid,text,time,author,channel,votes,photo,heart
UgzhFHnt6jCb2Bq7-e94AaABAg,housing loan interests are low but construction materials cost are very high,3 months ago (edited),Ravishankar Archi,UCimPPFpN6JI3L97kpgz7uSA,1,https://yt3.ggpht.com/ytc/AKedOLRkaps3mduhM5jOnVZtnYfMBCkOO83Z42fjIz1rig=s176-c-k-c0x00ffffff-no-rj,0.0
Ugx_ZYBR9W-S8r1WEwt4AaABAg,when to sell JP power ? - 10 ?,3 months ago,Dinesh W,UCqQqdcpIwcInuO0C46EydVg,0,https://yt3.ggpht.com/ytc/AKedOLSxqh3xNa9nWqyZ7dPQYMkQCy4wBTlOiE4Lpg=s176-c-k-c0x00ffffff-no-rj,0.0
UgyIX_dk4dnSMBxbQOR4AaABAg,how frequently one should watch the bulk/ block deals?,3 months ago,Ekta Sahni,UCNiTHkzrGql6K3USzHhtH5A,0,https://yt3.ggpht.com/ytc/AKedOLR7CPYqdFYxCzzjI0zzYISbBGVZAJGCbAqGAS3v2g=s176-c-k-c0x00ffffff-no-rj,0.0
UgyrTYuxsBUYWOVrbUB4AaABAg,Could you please make a video on your perspective on the tech industry in the US and which companies you are bullish on and why India will not do that great in tech space.,3 months ago,Basu S,UCb6HaR-ZbNqVRbYHSUq5UBA,2,https://yt3.ggpht.com/ytc/AKedOLQGK9AkISOe87W8rH8FH1lFEZW6guDlkB2765k6UA=s176-c-k-c0x00ffffff-no-rj,0.0
Ugy7HTbgv6_1pnLu1wV4AaABAg,"Heey Akshat, Going Great 👍",3 months ago,bipin Pethapara jOlly,UC1dTFu90pDvqWy1YSR8soaQ,0,https://yt3.ggpht.com/ytc/AKedOLQ59qX0PpBMmJYhMXVsYghW7UGLGYTEsWhUewl6aQ=s176-c-k-c0x00ffffff-no-rj,0.0
Ugy_i_7QfGwISXTOWSJ4AaABAg,"Hey Akshat, As always a very informative video and learned a new thing from this video i.e. how to see block/bulk deals going in the market......thanks a lot for teaching me one or the other thing from your daily videos....keep on posting such videos which are adding value to me  day by day",3 months ago,PRANSHUL SAXENA,UCimasC3luilXLHY6_pMgf6Q,1,https://yt3.ggpht.com/ytc/AKedOLSq06UOq8ooL8Dz3hFKbG4QZaxYrlO2IxN14mnvBw=s176-c-k-c0x00ffffff-no-rj,0.0
UgxSR92dqsZ8KyVauH14AaABAg,"Hi Akshat
Could you make a check list, which are the things need to be listen before buying a stock",3 months ago,Hari Krishnan,UCYV6kwUgB6b7ISV4ub7VMpQ,2,https://yt3.ggpht.com/ytc/AKedOLSqdQiMht2iK76uQUlCaKhTXZwomi46CQ59DA=s176-c-k-c0x00ffffff-no-rj,0.0
UgwTHEd7KIviyiE83ud4AaABAg,Need more of these market review series because it really gives good insight to the recent position of the stock market. Looking forward to these videos every week,3 months ago,Fahd Ahmed,UCiu4oddxbF3wzAPV4XLeR2w,1,https://yt3.ggpht.com/ytc/AKedOLQC740p9pTd1cAWLidSgCrMmVAiuwqWtvHKOT2x7A=s176-c-k-c0x00ffffff-no-rj,0.0
UgwlU2SNsnYif02awFV4AaABAg,"Hi Akshat, Appreciate put a serial No to your videos to be able to refer & recall",3 months ago,madhup100,UCZAt0OUgHlonDT2ADD5RJVQ,1,https://yt3.ggpht.com/ytc/AKedOLSp3Geq7ybFux5jMDFO-gKHgerXLieOONGj=s176-c-k-c0x00ffffff-no-rj,0.0
UgwC4F6PPxhC7JRQPE14AaABAg,Thanks for the series.,3 months ago,Manas Ranjan Patra,UC74xCgOhKd6JjbNEZxMgqtA,1,https://yt3.ggpht.com/ytc/AKedOLRPthKDia0oDBB6F2CBpNa0tcZK-8NURuXeLnG4-Q=s176-c-k-c0x00ffffff-no-rj,0.0
UgyfwHJuXIh0_eO3vw54AaABAg,Your views on tata steel and hero motocorp?,3 months ago,vighnesh subramanian,UCPm0IA-bG9RcMJvZhFsi2lg,0,https://yt3.ggpht.com/ytc/AKedOLQHpFeTmimkNbEJhiqWLMuIyL2zRFqmkSLyTvuIOA=s176-c-k-c0x00ffffff-no-rj,0.0
UgwIbpRhAnsX8rU0A9p4AaABAg,Thank you! Keep on making such videos. Your content is great.,3 months ago,Anita Sharma,UC9gavVTrShMPzKogsQMAkBA,1,https://yt3.ggpht.com/ytc/AKedOLQHgNgI6UvRAJt6fd2FoPbos6pqxrbqbYHfNyKitg=s176-c-k-c0x00ffffff-no-rj,0.0
UgzdsBKhNNRKD4en7Yl4AaABAg,Please continue on Market Series Videos,3 months ago,VIJAY NAGATHAN,UC0GervjRT8_2sJvvg5jtl9w,1,https://yt3.ggpht.com/Jkokdp5QlB6anhixGdn1ivC92p67dXz4Po41z2vqcDztBwB1TZVqg2pdiS0zWv9fDCfEP-srv_4=s176-c-k-c0x00ffffff-no-rj,0.0
UgycQkehjGtJKziW6m54AaABAg,Tell about route mobile,3 months ago,Sandeep Jain,UCThf_liL20_dqPqLZYwK1hQ,0,https://yt3.ggpht.com/ytc/AKedOLRwLIVbNgRnRWZOufMvIJOJXVlN58BYBKUtkP8Ls8I=s176-c-k-c0x00ffffff-no-rj,0.0
Ugx0qXOTqEbCumZ59yB4AaABAg,opinions on Sigachi Industries?,3 months ago,sanket,UCbCe-VQ4x53EshrBol1_3_g,1,https://yt3.ggpht.com/ytc/AKedOLTwU7Q8SWTm93_29gttzK5VfiUDGkZd1kZCsrs9RXQGTD5VxxIHDaDTSJA2Dm5y=s176-c-k-c0x00ffffff-no-rj,0.0
UgyDOQZlDP7gxYCb4rh4AaABAg,"Please anyone suggest me more youtube channels about fundamental analysys (other than pranjal kamra,shashank,rachana ranade,soic)",3 months ago,Rishi Katari,UC25n9Ken8FP0Y7QZOIJjELQ,1,https://yt3.ggpht.com/ytc/AKedOLTFujt4ihM_NvUfBlxaRopVsdbOxwjfWyHm=s176-c-k-c0x00ffffff-no-rj,0.0
UgyU5-mTM7PiJdmPrq94AaABAg,super liked,3 months ago,Sibabrata Bhowmick,UCvkold1eBzvKVVr6rigW7JA,1,https://yt3.ggpht.com/ytc/AKedOLTvcwXpsPuGQWGiGiSfPgHNWoCSb50-1cJMG3GixQ=s176-c-k-c0x00ffffff-no-rj,0.0
Ugxs3cpPN8qPP9WtQfR4AaABAg,Super video.continue the series.,3 months ago,Rishi Katari,UC25n9Ken8FP0Y7QZOIJjELQ,1,https://yt3.ggpht.com/ytc/AKedOLTFujt4ihM_NvUfBlxaRopVsdbOxwjfWyHm=s176-c-k-c0x00ffffff-no-rj,0.0
Ugzj0CYHJUi9P6izoHx4AaABAg,yes we want such videos please. Very helpful. Thank you,3 months ago,arjun adyanthaya,UCUqdYcAqU3rOBmr5BAWDKyw,1,https://yt3.ggpht.com/ytc/AKedOLQsDzIkTKyNoF9IvU980qTcjUkGJxnUzsygamZ1w--pBFbRGyYaRatqYNepTRQT=s176-c-k-c0x00ffffff-no-rj,0.0
UgynXHOdq5sj6mfuEAJ4AaABAg,"Shall i invest in both nifty fifty market cap mutual fund and nifty stocks directy, simultaneously? (Through sip)",3 months ago (edited),Santhana Krishnan,UCV61fmXpZtxA2NvxYhnMMlQ,2,https://yt3.ggpht.com/ytc/AKedOLSJ9VCq3w39SsfkiUylIChxd24u457fB6Cu21qD2w=s176-c-k-c0x00ffffff-no-rj,0.0
UgzhFHnt6jCb2Bq7-e94AaABAg.9WrKOfij-YN9_IUl5VQUgT,"⬆️⬆️⬆️ thanks for the comment..
Contact the What'sap line above for more information, advise and consulations and also participate in the new ongoing investment.....",2 weeks ago,George maxwell,UCibYKdOL4TMo-2qqFf8mjxg,0,https://yt3.ggpht.com/RM7sE3aEDDVUrXJ9Qu12Mb3i8WPjMjQEl596YomUU6SzQ_12-6WBrvrQwinStZY7IvHK8O1rlmY=s176-c-k-c0x00ffffff-no-rj,0.0
Ugx_ZYBR9W-S8r1WEwt4AaABAg.9WrGUhy2Tn-9_IUllveDVJ,"⬆️⬆️⬆️ thanks for the comment..
Contact the What'sap line above for more information, advise and consulations and also participate in the new ongoing investment.....",2 weeks ago,George maxwell,UCibYKdOL4TMo-2qqFf8mjxg,0,https://yt3.ggpht.com/RM7sE3aEDDVUrXJ9Qu12Mb3i8WPjMjQEl596YomUU6SzQ_12-6WBrvrQwinStZY7IvHK8O1rlmY=s176-c-k-c0x00ffffff-no-rj,0.0
UgyIX_dk4dnSMBxbQOR4AaABAg.9WrF1U-tUop9_IUmO-eKKF,"⬆️⬆️⬆️ thanks for the comment..
Contact the What'sap line above for more information, advise and consulations and also participate in the new ongoing investment.....",2 weeks ago,George maxwell,UCibYKdOL4TMo-2qqFf8mjxg,0,https://yt3.ggpht.com/RM7sE3aEDDVUrXJ9Qu12Mb3i8WPjMjQEl596YomUU6SzQ_12-6WBrvrQwinStZY7IvHK8O1rlmY=s176-c-k-c0x00ffffff-no-rj,0.0
Ugy7HTbgv6_1pnLu1wV4AaABAg.9Wr9fwUcOY89_IUn8MvxIg,"⬆️⬆️⬆️ thanks for the comment..
Contact the What'sap line above for more information, advise and consulations and also participate in the new ongoing investment.....",2 weeks ago,George maxwell,UCibYKdOL4TMo-2qqFf8mjxg,0,https://yt3.ggpht.com/RM7sE3aEDDVUrXJ9Qu12Mb3i8WPjMjQEl596YomUU6SzQ_12-6WBrvrQwinStZY7IvHK8O1rlmY=s176-c-k-c0x00ffffff-no-rj,0.0
UgwTHEd7KIviyiE83ud4AaABAg.9Wr4wpZFkSH9_IUo7qC_nR,"⬆️⬆️⬆️ thanks for the comment..
Contact the What'sap line above for more information, advise and consulations and also participate in the new ongoing investment.....",2 weeks ago,George maxwell,UCibYKdOL4TMo-2qqFf8mjxg,0,https://yt3.ggpht.com/RM7sE3aEDDVUrXJ9Qu12Mb3i8WPjMjQEl596YomUU6SzQ_12-6WBrvrQwinStZY7IvHK8O1rlmY=s176-c-k-c0x00ffffff-no-rj,0.0
