cid,text,time,author,channel,votes,photo,heart
UgwzK1yCy3QhukcPqZB4AaABAg,"►Ace your fundamental analysis with Tickertape!:
https://ttape.in/tQ8PHO7jQgb
_____________________________________________________
►Check out our new course website:
https://wisdomhatch.com/
_____________________________________________________
►For personalized classes on stock markets, please check: https://docs.google.com/forms/d/11xglZTe8SwGD0vh3A77Gopc-mtRR-pom-zH7fpp44qM/viewform?edit_requested=true",3 months ago,Akshat Shrivastava,UCqW8jxh4tH1Z1sWPbkGWL4g,20,https://yt3.ggpht.com/VI0OvMwpPQPFGoHAQOHsvtEcFWg-_YzFBhoeohr2CRz1T21Ja4unTGte1Gz6TnDUgVX9wcOG=s176-c-k-c0x00ffffff-no-rj,0.0
UgxEpgGng0bnnuKF5rF4AaABAg,"I never thought BTC trading would be this profitable, although top losses can be taken even with top notch strategies.",2 months ago,Mason Michael,UCT-UiyMtVLG0TXRciEizCHA,40,https://yt3.ggpht.com/ytc/AKedOLTScKW6a77ilIERX70WP7WoNzPi66yb-0QjJVUM=s176-c-k-c0x00ffffff-no-rj,0.0
UgwfdmTmHZFmP5N71wJ4AaABAg,I will like to see more videos of market series,2 months ago,aakash agarwal,UC4xwMR-nhepuUrjzo2IA-zA,3,https://yt3.ggpht.com/ytc/AKedOLS3SIVTJu5TDnYzRJgS6kfANkRabbHlAF5xqw=s176-c-k-c0x00ffffff-no-rj,0.0
UgxOT-yVz0Y7m1jCOGJ4AaABAg,Nice information keep it up Akshath,2 months ago,Arun Ramesh,UCoyBF1GJE9LVhBor2GlazVA,3,https://yt3.ggpht.com/ytc/AKedOLSTkJ44bfsnZh9RkQhNnQG2FkJWTX4RW2x6ffydpA=s176-c-k-c0x00ffffff-no-rj,0.0
Ugw1zBVtMM1NzQ2TvBZ4AaABAg,Thank you so much Akshat! I love to watch these kind of videos! I hope to learn all the  Macro Economics indicators that affect Global Stock Market! Maybe if you have a course on that as well :) :),2 months ago,Shishir Kumar,UCVsN0zviv6YSXzgwGsHaO2Q,1,https://yt3.ggpht.com/ytc/AKedOLQeYSjxHSDO6TCYi3GVNxTd8mgPbCWjZw9brXayRwk=s176-c-k-c0x00ffffff-no-rj,0.0
UgwfhBhmh1d1UG_O2b54AaABAg,"Thank you for JP power recommendation. Made 80% return on it.

Next one going to be AU small finance Bank. And this iam not going to sell till 2025.",3 months ago,varun khanor,UCDgwvw-WtwhU2jjdrwwVuBA,3,https://yt3.ggpht.com/ytc/AKedOLTwELBrsyPP-jlLBeH4gVhiLV4openU5_B4D8Tdrg=s176-c-k-c0x00ffffff-no-rj,0.0
UgxH_2wUhBHjvQTW_1h4AaABAg,#MarketMacros-- If one full  video on how you pick value buying stocks  and understand the macro around it(where to go and read?) then take a decision on buying those/not is of great help. This come under speculative investments I guess.?,3 months ago,nallapaneni ram,UCSdR_sz95y9E1omH2V1uwcQ,0,https://yt3.ggpht.com/ytc/AKedOLQ9B5yeO37e1tRGKsrLWXrX5TKWamrwlVAJNQ=s176-c-k-c0x00ffffff-no-rj,0.0
UgxSza7aMR_rGU9FIxd4AaABAg,Akshat! Lakshmi nft is sold out,3 months ago (edited),VBL,UClhi26DT4wYTQW9jQJqa5Wg,1,https://yt3.ggpht.com/ytc/AKedOLRQNNjP6Q42x9VsAE6KwZhXGS2TgQvmkHjxjEOt9g=s176-c-k-c0x00ffffff-no-rj,0.0
UgxIoBt0wJzIpygw2ph4AaABAg,"A comment to try to mess with the algorithm. 😉
Please upload",3 months ago,Maverick,UC4352DsKD4iVM6O8c-HsMsQ,1,https://yt3.ggpht.com/ksOZG3YJWpyuLbTHk9gKcue-KFvyUr4HzOZlBwKLQv1INhzwAcRPHezN1zN9_jt-HrplDcoS=s176-c-k-c0x00ffffff-no-rj,0.0
Ugzy5Eu5EfKZLgyemgF4AaABAg,Spandana spoorthi analysis,3 months ago,Kaam ki Baat,UCy3Qoki7PwYmBAwE28QZTgw,0,https://yt3.ggpht.com/ytc/AKedOLS8RBmzFOZl-erin4yy7UFJKSIFIQ1lioepXQ=s176-c-k-c0x00ffffff-no-rj,0.0
UgyE7d9WggrUg8Cj9Vh4AaABAg,Thanks Akshat. Pls make detail video on India bulls,3 months ago,pavan p,UCrnHRXvpSNj6JVWySSexbNQ,1,https://yt3.ggpht.com/ytc/AKedOLTDD9YRxWp-cPc4vNwpl5jx9WUgJNhIMjcGlA=s176-c-k-c0x00ffffff-no-rj,0.0
UgwYUldpzNeRk8w7pBh4AaABAg,Jp power was bought at ₹3. Can’t believe on myself that I found this and recommended it to my friends. Great profit 💯💯🔝🔝,3 months ago,Sanyam Arora,UC0WZ5c-DWmjbzXZBNqtdkxg,0,https://yt3.ggpht.com/ytc/AKedOLRDdBA5J4yCXt5o79gAzKsmYAciHqE-k8AthAc5Sg=s176-c-k-c0x00ffffff-no-rj,0.0
UgzrMl09PnzA22Gxt7F4AaABAg,"Do make more videos in the Market series, indeed insightful",3 months ago,Rushabh Jain,UCR6sBgDbJK5fuDFGnQ3pMmw,1,https://yt3.ggpht.com/ytc/AKedOLQ8gBaKJvOZxxRV2MnKO-0LYmccdH-5TFNyWtRSAg=s176-c-k-c0x00ffffff-no-rj,0.0
UgzVCQLpsWhq4_WMLiB4AaABAg,"véry iñfórmàtívé,Dó màké théßé vídíéóß",3 months ago,amitabh pande,UCglX1cLOCQ1AV73YqF1g9xg,0,https://yt3.ggpht.com/ytc/AKedOLQDZ1NCWHgMQ2_9IAayio7SVO7WCkglj09_WQ=s176-c-k-c0x00ffffff-no-rj,0.0
UgzgJ1vWcROwoBKl_D54AaABAg,"Hi Akshat, This is good one. Every Monday night if you can it would be great. In between JP power is it good if I continue to hold at these price levels?",3 months ago,Arun Ramakrishnan,UCkf24Uo3LPYRkyI95g1gcXQ,1,https://yt3.ggpht.com/ytc/AKedOLTdP6LCkIdPdGzBXg6RJTV5hA1ItuBwdgjsYg=s176-c-k-c0x00ffffff-no-rj,0.0
UgxnjjWUBfMtLb4qQfh4AaABAg,Very interesting  video. Saw it today. Pl continue with this series.,3 months ago,virender slathia,UCAx3_1jaDnrx39nzDsi44vg,1,https://yt3.ggpht.com/ytc/AKedOLRQqDRGP2ZMOkqQNqTD4h0FMmm8TAqnRCDlAeFJhhCPIe4YNk7efqUFdq5yiZoN=s176-c-k-c0x00ffffff-no-rj,0.0
Ugz_1GAeupNTfZs3gDl4AaABAg,https://youtu.be/LtXIz8Xeg-Q,3 months ago,mohanraj ice,UCGZMotY24L5GiC8oxQFzsBw,0,https://yt3.ggpht.com/ytc/AKedOLQ6bIA-8erhg8nDmMa071e4pKxpVartB9Z-cA=s176-c-k-c0x00ffffff-no-rj,0.0
UgwJN5v_OXMT2V5EtqN4AaABAg,"Very interesting session, thank you for this video. Pls continue.
Please make a separate Video on India Bulls Housing Finance",3 months ago,Kishan Kalburgi,UC3Mb6HyrA2k6Eec_frclPhw,0,https://yt3.ggpht.com/ytc/AKedOLSMTXIWTYOz7UN12qxCDrZylXqAqMwd-mw8U9N-=s176-c-k-c0x00ffffff-no-rj,0.0
UgzrRFf8LCD8lNBipk54AaABAg,"Hi Akshat, I have completed my B.Tech from a teir-3 college and having salary of 9lacs, I want your views on investing 5lacs in online MBA programs by Upgrad and continue earning along with that Or leave my job start preparing for CAT and invest 25 lacs to get into tier - 1 MBA colleges in India, according to what would be correct ROI strategy and would request to put your views on FRM. 
🙏🙏🙏🙏🙏🙏🙏🙏🙏🙏",3 months ago,Love Kumar,UCfiG1zmu8X4w2NzIlyv2lCg,1,https://yt3.ggpht.com/ytc/AKedOLR2Gph62zjA3l6SO_T4HTDI1usJdu-PgdKDHA=s176-c-k-c0x00ffffff-no-rj,0.0
UgxdSe8BnwDOi9c0Rht4AaABAg,super MASTER...,3 months ago,Update Maga,UCRCpLXyeYH_x-Kxr1R5_2JA,0,https://yt3.ggpht.com/ytc/AKedOLS4tSEjswxI7Qj4dCsPQq5-IG2penEA__SYZhO-=s176-c-k-c0x00ffffff-no-rj,0.0
UgwzK1yCy3QhukcPqZB4AaABAg.9WoOrOb0LcU9WoRTr4wgcL,"Thanku for this video, can HDFC Ltd. Stock will also see momentum as it's into housing finance.. It has corrected massively.. plz let us know ur view on this stock as well",3 months ago,Salim Baig,UCK3CJwwzBJSgWZmIJB7wn1w,0,https://yt3.ggpht.com/ytc/AKedOLQnUKOIr248BFoBxTPTc5jxXyfx5tovnimKqYIPpqk=s176-c-k-c0x00ffffff-no-rj,0.0
UgwzK1yCy3QhukcPqZB4AaABAg.9WoOrOb0LcU9WoYoeqBkWj,Sir please may video on Iol chemical s ..is it good tym to accumulate this stock,3 months ago,Nishant Baikerikar,UCrTxt0nnt5csTgL5MjlntZg,1,https://yt3.ggpht.com/ytc/AKedOLQucJTZJO7QYL4SjF3q99wnUW0JYotwrN3ZM6-A9tQ=s176-c-k-c0x00ffffff-no-rj,0.0
UgwzK1yCy3QhukcPqZB4AaABAg.9WoOrOb0LcU9WobjG-R4ml,Please give your views of BCG share,3 months ago,siddharth gautam,UCwA_yOCPl9hiC3zhRs3hvvQ,0,https://yt3.ggpht.com/ytc/AKedOLQAHa51LFnHNQeVjGIKIkAUI0TqgMamtRIGYybT=s176-c-k-c0x00ffffff-no-rj,0.0
UgwzK1yCy3QhukcPqZB4AaABAg.9WoOrOb0LcU9WoftTTJwr0,Would be much interested and welcome to hear about your regular review on Indian stock market...,3 months ago,Arjun Balachandran K,UCWKF1AwbWAju7IUrRtQxj_A,0,https://yt3.ggpht.com/ytc/AKedOLSZIx_osUcZ7Av3bdVI42NkbIZVpjudfZsM30yr=s176-c-k-c0x00ffffff-no-rj,0.0
UgwzK1yCy3QhukcPqZB4AaABAg.9WoOrOb0LcU9WomYYGx8No,"Absolutely 100% these are the kind of series of videos we would like to get, & sbi jokes too !!",3 months ago,Ashutosh Nandi,UC6awt9ZeIEA0oCbK3GsD38g,0,https://yt3.ggpht.com/ytc/AKedOLSAZVdOO66ExbpJClTYstBOEpm_tRLvYa_frA=s176-c-k-c0x00ffffff-no-rj,0.0
UgwzK1yCy3QhukcPqZB4AaABAg.9WoOrOb0LcU9Wp18D6xzXg,Want u do analysis of snapchat company,3 months ago,Manav Garg,UC4nKOgywkC6-d-nVXwxbHgw,0,https://yt3.ggpht.com/ytc/AKedOLRJejgmKIgk24y4Jt5EmpT4NwPlPzKKkKbSuNudPw=s176-c-k-c0x00ffffff-no-rj,0.0
UgwzK1yCy3QhukcPqZB4AaABAg.9WoOrOb0LcU9Wp5HNPC3kW,"Sir, your view on UJJIVAN SFB?",3 months ago,Kuldeep Kumar,UC7DqXhKlQ3Zj9lZJUfQzNWA,0,https://yt3.ggpht.com/ytc/AKedOLQhFByRPYh0zFo1o5YRZcHTfBfZ8bdFoSAzcQ=s176-c-k-c0x00ffffff-no-rj,0.0
UgwzK1yCy3QhukcPqZB4AaABAg.9WoOrOb0LcU9WpG0m22Bi-,"thanks akshat, can u have a look at FCS Software solution",3 months ago,Kuldeep Singh,UCBOAMBBpH3J9PAYccFJx52Q,0,https://yt3.ggpht.com/ytc/AKedOLQf11N7zD1ffvlTJ6eRr6GZlV_aprODPD1i4T4j8A=s176-c-k-c0x00ffffff-no-rj,0.0
UgwzK1yCy3QhukcPqZB4AaABAg.9WoOrOb0LcU9WvshfaQRZC,"Hi Akshat, I have completed my B.Tech from a teir-3 college and having salary of 9lacs, I want your views on investing 5lacs in online MBA programs by Upgrad and continue earning along with that Or leave my job start preparing for CAT and invest 25 lacs to get into tier - 1 MBA colleges in India, according to what would be correct ROI strategy and would request to put your views on FRM. 
🙏🙏🙏🙏🙏🙏🙏🙏🙏🙏",3 months ago,Love Kumar,UCfiG1zmu8X4w2NzIlyv2lCg,0,https://yt3.ggpht.com/ytc/AKedOLR2Gph62zjA3l6SO_T4HTDI1usJdu-PgdKDHA=s176-c-k-c0x00ffffff-no-rj,0.0
UgxEpgGng0bnnuKF5rF4AaABAg.9XrMIQpj-ox9XrMReKaFMD,I'm well on course to being a millionaire courtesy of my crypto investment.,2 months ago,Matt Weston,UC8AwQ8FZUZqbep940gAISGw,0,https://yt3.ggpht.com/zp4Ht54M7JMzl4rM5YBjx7BivyMvP2KyC_vnhtIZjRw9yWdDavZQynnrXRjRgHXFAixcS-c=s176-c-k-c0x00ffffff-no-rj,0.0
UgxEpgGng0bnnuKF5rF4AaABAg.9XrMIQpj-ox9XrMZhmn8I0,My boss is not gonna see me soon. Thinking of retiring soon 😆,2 months ago,Matt Weston,UC8AwQ8FZUZqbep940gAISGw,0,https://yt3.ggpht.com/zp4Ht54M7JMzl4rM5YBjx7BivyMvP2KyC_vnhtIZjRw9yWdDavZQynnrXRjRgHXFAixcS-c=s176-c-k-c0x00ffffff-no-rj,0.0
UgxEpgGng0bnnuKF5rF4AaABAg.9XrMIQpj-ox9XrMhIAsVvu,"Oh! lucky you,  have you really earned that much that you are planning to quit your job?",2 months ago,Sofia Estrada,UCS4iQqZD2HYeslctaGFyugw,0,https://yt3.ggpht.com/2ePFqmx2QxzLAoUU_w-Vouh8Iwsq1fM2AE9jQ-bv4yiyWB0AR1DKBGUWv7JL7KXxuhn9LeMdpw=s176-c-k-c0x00ffffff-no-rj,0.0
UgxEpgGng0bnnuKF5rF4AaABAg.9XrMIQpj-ox9XrMnji9ANv,"The crypto market has plenty of opportunities to earn a decent payouts, with the right skills and proper understanding of how the market works.",2 months ago,Robert Anthony,UCUuWN1cDtr9TK_9iU8VEcfg,0,https://yt3.ggpht.com/ytc/AKedOLQnDoIq_rbJQQzd2meCmbfb_fAskbywukkyP5su=s176-c-k-c0x00ffffff-no-rj,0.0
UgxEpgGng0bnnuKF5rF4AaABAg.9XrMIQpj-ox9XrMvnAL5j6, @Sofia Estrada  I really don't want someone to boss around again.,2 months ago,Matt Weston,UC8AwQ8FZUZqbep940gAISGw,0,https://yt3.ggpht.com/zp4Ht54M7JMzl4rM5YBjx7BivyMvP2KyC_vnhtIZjRw9yWdDavZQynnrXRjRgHXFAixcS-c=s176-c-k-c0x00ffffff-no-rj,0.0
UgxEpgGng0bnnuKF5rF4AaABAg.9XrMIQpj-ox9XrN5IEmxBc,"Hey y'all I would need some guide about this bitcoin investment, wanted to give it a try but the fluctuations of the prices keep confusing me.",2 months ago,Sofia Estrada,UCS4iQqZD2HYeslctaGFyugw,0,https://yt3.ggpht.com/2ePFqmx2QxzLAoUU_w-Vouh8Iwsq1fM2AE9jQ-bv4yiyWB0AR1DKBGUWv7JL7KXxuhn9LeMdpw=s176-c-k-c0x00ffffff-no-rj,0.0
UgxEpgGng0bnnuKF5rF4AaABAg.9XrMIQpj-ox9XrNKXCC-O9,That's her watapp ☝️,2 months ago,Matt Weston,UC8AwQ8FZUZqbep940gAISGw,0,https://yt3.ggpht.com/zp4Ht54M7JMzl4rM5YBjx7BivyMvP2KyC_vnhtIZjRw9yWdDavZQynnrXRjRgHXFAixcS-c=s176-c-k-c0x00ffffff-no-rj,0.0
UgxEpgGng0bnnuKF5rF4AaABAg.9XrMIQpj-ox9XrNVSa9VqR,The best decision I ever made in life was investing in crypto market.,2 months ago,Robert Anthony,UCUuWN1cDtr9TK_9iU8VEcfg,0,https://yt3.ggpht.com/ytc/AKedOLQnDoIq_rbJQQzd2meCmbfb_fAskbywukkyP5su=s176-c-k-c0x00ffffff-no-rj,0.0
UgxEpgGng0bnnuKF5rF4AaABAg.9XrMIQpj-ox9XrNciNfDp5," @Matt Weston  Thanks for the recommendation, looking forward to earning from my first investment with her.",2 months ago,Sofia Estrada,UCS4iQqZD2HYeslctaGFyugw,0,https://yt3.ggpht.com/2ePFqmx2QxzLAoUU_w-Vouh8Iwsq1fM2AE9jQ-bv4yiyWB0AR1DKBGUWv7JL7KXxuhn9LeMdpw=s176-c-k-c0x00ffffff-no-rj,0.0
UgwfdmTmHZFmP5N71wJ4AaABAg.9Xl7ueRQRJp9_kYbqOglk_,"Feedback appreciated.
For insight and more lnfo ✉️.""""""",3 days ago,WhatsApp💌⑨①⑧①⑨⑥⑨③②⑦⑦⑨,UCfNlcfJ0n5rhCx0pld6V5IA,0,https://yt3.ggpht.com/RFJmbEwUqiezdOTWr8g3YH-XIeSzZLYGGv9qkuM0i70vsawHGYAfT-Ov0yc__nNwn2qfG4DmOw=s176-c-k-c0x00ffffff-no-rj,0.0
UgxOT-yVz0Y7m1jCOGJ4AaABAg.9XXb6TVrE5i9_kYhSV2YaZ,"Feedback appreciated.
For insight and more lnfo ✉️.""""""",3 days ago,WhatsApp💌⑨①⑧①⑨⑥⑨③②⑦⑦⑨,UCfNlcfJ0n5rhCx0pld6V5IA,0,https://yt3.ggpht.com/RFJmbEwUqiezdOTWr8g3YH-XIeSzZLYGGv9qkuM0i70vsawHGYAfT-Ov0yc__nNwn2qfG4DmOw=s176-c-k-c0x00ffffff-no-rj,0.0
Ugw1zBVtMM1NzQ2TvBZ4AaABAg.9XUQbrnww_D9_kYm4FO2mo,"Feedback appreciated.
For insight and more lnfo ✉️.""""""",3 days ago,WhatsApp💌⑨①⑧①⑨⑥⑨③②⑦⑦⑨,UCfNlcfJ0n5rhCx0pld6V5IA,0,https://yt3.ggpht.com/RFJmbEwUqiezdOTWr8g3YH-XIeSzZLYGGv9qkuM0i70vsawHGYAfT-Ov0yc__nNwn2qfG4DmOw=s176-c-k-c0x00ffffff-no-rj,0.0
UgwfhBhmh1d1UG_O2b54AaABAg.9XGMw4rlG7v9_kZ3vW9rCH,"Feedback appreciated.
For insight and more lnfo ✉️.""""""",3 days ago,WhatsApp💌⑨①⑧①⑨⑥⑨③②⑦⑦⑨,UCfNlcfJ0n5rhCx0pld6V5IA,1,https://yt3.ggpht.com/RFJmbEwUqiezdOTWr8g3YH-XIeSzZLYGGv9qkuM0i70vsawHGYAfT-Ov0yc__nNwn2qfG4DmOw=s176-c-k-c0x00ffffff-no-rj,0.0
UgxH_2wUhBHjvQTW_1h4AaABAg.9XFnUlVTRYT9_IUXP643-0,"⬆️⬆️⬆️ thanks for the comment..
Contact the What'sap line above for more information, advise and consulations and also participate in the new ongoing investment....",2 weeks ago,George maxwell,UCibYKdOL4TMo-2qqFf8mjxg,0,https://yt3.ggpht.com/RM7sE3aEDDVUrXJ9Qu12Mb3i8WPjMjQEl596YomUU6SzQ_12-6WBrvrQwinStZY7IvHK8O1rlmY=s176-c-k-c0x00ffffff-no-rj,0.0
UgxSza7aMR_rGU9FIxd4AaABAg.9X9zQ8N0eKS9_IUYJDnooz,"⬆️⬆️⬆️ thanks for the comment..
Contact the What'sap line above for more information, advise and consulations and also participate in the new ongoing investment....",2 weeks ago,George maxwell,UCibYKdOL4TMo-2qqFf8mjxg,0,https://yt3.ggpht.com/RM7sE3aEDDVUrXJ9Qu12Mb3i8WPjMjQEl596YomUU6SzQ_12-6WBrvrQwinStZY7IvHK8O1rlmY=s176-c-k-c0x00ffffff-no-rj,0.0
UgxIoBt0wJzIpygw2ph4AaABAg.9X90jsO-Fxx9_IUYz7jsUF,"⬆️⬆️⬆️ thanks for the comment..
Contact the What'sap line above for more information, advise and consulations and also participate in the new ongoing investment....",2 weeks ago,George maxwell,UCibYKdOL4TMo-2qqFf8mjxg,0,https://yt3.ggpht.com/RM7sE3aEDDVUrXJ9Qu12Mb3i8WPjMjQEl596YomUU6SzQ_12-6WBrvrQwinStZY7IvHK8O1rlmY=s176-c-k-c0x00ffffff-no-rj,0.0
Ugzy5Eu5EfKZLgyemgF4AaABAg.9X5LgBaP0Sb9YeFWkSULqR, @WhatsApp㊉①⑥⑤①⑨⑨⑧⑨⑦⑥②  Spandana spoorthi business analysis and future bet,1 month ago,Kaam ki Baat,UCy3Qoki7PwYmBAwE28QZTgw,0,https://yt3.ggpht.com/ytc/AKedOLS8RBmzFOZl-erin4yy7UFJKSIFIQ1lioepXQ=s176-c-k-c0x00ffffff-no-rj,0.0
UgwYUldpzNeRk8w7pBh4AaABAg.9X3B4UOqbcJ9_IU_HdIHzQ,"⬆️⬆️⬆️ thanks for the comment..
Contact the What'sap line above for more information, advise and consulations and also participate in the new ongoing investment....",2 weeks ago,George maxwell,UCibYKdOL4TMo-2qqFf8mjxg,0,https://yt3.ggpht.com/RM7sE3aEDDVUrXJ9Qu12Mb3i8WPjMjQEl596YomUU6SzQ_12-6WBrvrQwinStZY7IvHK8O1rlmY=s176-c-k-c0x00ffffff-no-rj,0.0
UgxnjjWUBfMtLb4qQfh4AaABAg.9WzG9cb1Z8S9_IUb_1Xze6,"⬆️⬆️⬆️ thanks for the comment..
Contact the What'sap line above for more information, advise and consulations and also participate in the new ongoing investment....",2 weeks ago,George maxwell,UCibYKdOL4TMo-2qqFf8mjxg,0,https://yt3.ggpht.com/RM7sE3aEDDVUrXJ9Qu12Mb3i8WPjMjQEl596YomUU6SzQ_12-6WBrvrQwinStZY7IvHK8O1rlmY=s176-c-k-c0x00ffffff-no-rj,0.0
UgzrRFf8LCD8lNBipk54AaABAg.9WvsgW8f-269_IUcar_o9x,"⬆️⬆️⬆️ thanks for the comment..
Contact the What'sap line above for more information, advise and consulations and also participate in the new ongoing investment....",2 weeks ago,George maxwell,UCibYKdOL4TMo-2qqFf8mjxg,0,https://yt3.ggpht.com/RM7sE3aEDDVUrXJ9Qu12Mb3i8WPjMjQEl596YomUU6SzQ_12-6WBrvrQwinStZY7IvHK8O1rlmY=s176-c-k-c0x00ffffff-no-rj,0.0
UgwmjEeeXmix7d_yuER4AaABAg,"Great, Akshat. Continue your good work. You are educating us in the right way.",3 months ago,Y R Prasad,UCTYuxrF3iYeeY6LtQMtuJUA,1,https://yt3.ggpht.com/ytc/AKedOLSaiMYpZEZe9GoDamyo4gEXFgfQGajOHwsG4g=s176-c-k-c0x00ffffff-no-rj,0.0
UgxZyJ2hxxBwNA1svp54AaABAg,"Thanks for your wonderful videos and asking our queries and recommendations for uploading new videos😍🎥
 Bro do upload series of videos on the topic of Essential habits for Long term wealth generation ,  Strategies and tricks to create long term wealth through Indian and US stocks, cryptos, passive income sources❤ Brief the topic FIRE ( Financial Independence Retire Early) and explain the method to acheive Financial Freedom within Age 30 🥰😘🎁  
Bro pls do reply or answer in any of your upcoming videos ❤✨😍",3 months ago,kodeeswaran 7,UCq_NTRsS7H1T8QZqAgj1how,1,https://yt3.ggpht.com/ytc/AKedOLT4uMI0c7cww-KvKspceBFkfN75ky9wz0RIkA=s176-c-k-c0x00ffffff-no-rj,0.0
Ugymz_nxfUyFNjfDW1p4AaABAg,"Hi @Akshat : What are your thoughts on Orient Green power. This stock has gone way to up.
It would be great if you could pen down your thoughts",3 months ago,Vishal Patil,UCvmZh0ItNNrZGmx58sXpxIA,1,https://yt3.ggpht.com/ytc/AKedOLS1UsgbD5ygI2FKBulFCZURtRSXlhL433Lytw=s176-c-k-c0x00ffffff-no-rj,0.0
Ugx8VqaKTBCrmM6PzYV4AaABAg,Pls continue this market macros. It's so informative,3 months ago,nathan a u,UCywzSAC_RewZ5T3Fhr8J9fw,0,https://yt3.ggpht.com/ytc/AKedOLQyJqsrmPi1NWqsRQyVjpmdUR35_T-jKfyLMo_UlHyzA1I8VE_jpRVqMB0wptFF=s176-c-k-c0x00ffffff-no-rj,0.0
Ugw4tuaMDZEd_tYXS6V4AaABAg,"Hi Akshat..from where I can get the total list of stocks that you invested...Also if possible segregate by duration wise like long term(10+year),medium term(5+yers) and short term(less then 1 year)",3 months ago,Bramha Nanda Padhy,UCG4YZqePaiYGW5mgmgcousQ,1,https://yt3.ggpht.com/ytc/AKedOLQIU-i5JjZHe0PPvMaYRcijSMnywS2tUfdNPKn4AQ=s176-c-k-c0x00ffffff-no-rj,0.0
UgwcSsOM9tO-qR_vgNB4AaABAg,Requesting you to make a Video on KPIT,3 months ago,DINESH R,UCfaorjnIjXOupq_z_Des3Bw,0,https://yt3.ggpht.com/ytc/AKedOLTycupnh3DiPkZwb9ou-NOWqJXvfAb2T5VUDPscpg=s176-c-k-c0x00ffffff-no-rj,0.0
Ugx0vqiIoGjXAQbzlCZ4AaABAg,"Hello sir, it's a wonderful to get quality inputs from you always... And this series is best plz keep on doing it... Can you please make more elaborate videos on India bulls and go fashion... Thank you so much",3 months ago,Vivek Vichare,UCPLTXG8J2H9RhPnyjJ5Yx9A,3,https://yt3.ggpht.com/ytc/AKedOLSdJ4tyt8HwGwOHrrvvWvkUEq_950rxSPO81A=s176-c-k-c0x00ffffff-no-rj,0.0
UgwzYDWEptSzJmPBUrx4AaABAg,what do you expect from jppower stocks at what time are you thinking to sell the stocks of jppower or what you you expect from such stocks?,3 months ago,Sharan Talwar,UCZmevSbXldFAPS3AjPgRjLw,1,https://yt3.ggpht.com/ytc/AKedOLSGRSdzv0tUMS8lW9FPWYDXSKrhbzFuznSgRQ=s176-c-k-c0x00ffffff-no-rj,0.0
UgyN3Z5io_Cx5hGAaFh4AaABAg,"Thank you so much for so much information that you put out sir.
🙏",3 months ago,new tick-tock,UC0LS-y0qoj7y8ymDe1zPN1g,0,https://yt3.ggpht.com/ytc/AKedOLSZDlCEdPoM6TdUGLZHqb6wP_bmq3CnXY3Rkw=s176-c-k-c0x00ffffff-no-rj,0.0
UgwuTKBcQIyq4LBsbFx4AaABAg,"yes this one is good series , plz continue we would love to learn a lot from it",3 months ago,Prajwal Kawtikwar,UCMMTtQ9b7nc_V6G1NC4nuWA,1,https://yt3.ggpht.com/ytc/AKedOLSBBPmjrhpgdi0-W9RxQv3G6d4HnKRdEqznNIcIq0oARtuQJqlPf3r_hi0lnHsv=s176-c-k-c0x00ffffff-no-rj,0.0
Ugw1V4PW7ytyurWHTft4AaABAg,"Hey akshat so many seperate video promises on varied specific stocks & concepts !!
Chalu kro bhaiya series subject wise 🙏",3 months ago,Smith Bhandari,UCXGWLZEM0RLQ-g1nBDqo7dg,1,https://yt3.ggpht.com/ytc/AKedOLQNUn3IYxz0ACNBTJWDrzpsQKJ37_gaHdNxLED3Mw=s176-c-k-c0x00ffffff-no-rj,0.0
UgxPExHkTp98Tqp07kZ4AaABAg,Kindly make a video on Sugar Industries across India which produces Ethanol as a byproduct,3 months ago,Vinayak Rajannavar,UC01dqAkekpyYuPnaMhMd0_Q,1,https://yt3.ggpht.com/ytc/AKedOLQ0E3NvmemFaNv6CtqH6c52WSGpEVOBX4zS3ikkCA=s176-c-k-c0x00ffffff-no-rj,0.0
UgySLvau6uX98Z7RCqB4AaABAg,"Hi Akshat, Could you please give your views about the downfall in policybazar by almost 45%? From your videos I know you are very bullish on the insurance sector. I had also seen your detailed video. It has been doing the right things and have even got a broker license through which they will make themselves omnipresent. Why is it still falling?",3 months ago,Prateek Mangal,UCShSAWMP0ZB4DuKO9F9nvdg,1,https://yt3.ggpht.com/ytc/AKedOLQ8ltBMpfgeNTNv7_PCHig4EEPqVLyHgWrHoA=s176-c-k-c0x00ffffff-no-rj,0.0
Ugw_OkrgCzC-GSRHeYR4AaABAg,Super thankful for this series... as always great work..,3 months ago,Avishek Banerjee,UCfmEsNW0swKlnL7ZKuo7LsQ,1,https://yt3.ggpht.com/ytc/AKedOLQVNYB5ibsHVPIRfrq6_w7WaKE85KMDZ6FTWvUpaw=s176-c-k-c0x00ffffff-no-rj,0.0
Ugxy7H7aeSYDHvyUjKt4AaABAg,"When I watched your videos, it give me more perspective about stock market learning..Thanks Akshay..",3 months ago,Favas V,UCIWbpuHOFN8eX5qOb6veIIQ,2,https://yt3.ggpht.com/ytc/AKedOLTPM_jNc51P11yp4UudkyMFw1Z2-6R8JAo62G6S=s176-c-k-c0x00ffffff-no-rj,0.0
UgxJHAIjThVPTE0InLB4AaABAg,I have completed 15 years in the IT industry and considering the current demands and the way Infosys and TCS align themselves with the latest tech demand is phenomenal. Top IT services companies will grow rapidly ~ 20% + CAGR for this decade.  FAANG stocks are also a stock fashion statement these days.,3 months ago,Nishant Kashyap,UCqfwg8SIYKbEGpt3QsXNpCA,7,https://yt3.ggpht.com/ytc/AKedOLRLd0hL9WzuerSgMNRqcN4YdSKag4vkrG6Bz-gN3Q=s176-c-k-c0x00ffffff-no-rj,0.0
UgwTuS5DK_KYYZOcIeF4AaABAg,@akshat - Now I'm the super marketer of your channel 😂. Hope you are getting many subscribers and likes,3 months ago,TRENDS ONLY,UChoaun1s3czujqzOAiR9DFw,0,https://yt3.ggpht.com/ytc/AKedOLQ4r1a2sGJEdMnIHSo7relq-uNVUC_DQ2DU8y3nzGHYF8Aj0ldk5IWI60owJDuk=s176-c-k-c0x00ffffff-no-rj,1.0
Ugy9U95BVBnRWkXrJ5R4AaABAg,Fantastic analysis Akshat sir..,3 months ago,RAYALA JOHN BABU,UC_b-syYCJzk4HYMVjbE_xiA,1,https://yt3.ggpht.com/ytc/AKedOLQceN-L1o_bzTg44mZsd30M-l2gxSNpR0EXgyxN3w=s176-c-k-c0x00ffffff-no-rj,0.0
UgyqF3xYscggKcHmqF54AaABAg,Please make video on Indiabulls Hsg Fin.,3 months ago,Ramesh Vedak,UC8AlkiDPCKgvJ5nXPUKtdbQ,1,https://yt3.ggpht.com/ytc/AKedOLRhI2ISspnJvuRgoOo0fCWivEUnEt5_w-mF=s176-c-k-c0x00ffffff-no-rj,0.0
UgziSqOXpN2Qr4EiS_l4AaABAg,"Thanks Akshat. This is a good series to start with though from Monday to Wednesday, Market have changed a lot. Better if this video is released earlier, if feasible.

Series is good but i guess as time evolves this will become more interesting. Not saying this is not good but at your standards space for this video to improve in terms of its content.

Summarizing what i got from call:
preparedness",3 months ago,Manish Chadha,UCtmqcQlSOV2qIgvj4LSplrQ,1,https://yt3.ggpht.com/ytc/AKedOLSdUZK5QfbonIjVMnsXJcliYWpoC995BUR-oA=s176-c-k-c0x00ffffff-no-rj,0.0
UgxZyJ2hxxBwNA1svp54AaABAg.9Wtus3bMfZn9_DOwH6EpMl,"Thanks for your comments,what'sap me with the number showing up there for your investment plans ..",2 weeks ago,WhatsApp十⓽⓵⓼⓼⓻⓶⓽⓶⓹⓺⓻⓷,UCJw3kQVWhEN5zW5MGyquE4A,0,https://yt3.ggpht.com/XcDUDosfnvSyzMHh36WrmWds3EqdYKkc8sow3G9g3bBHtat843XYq8bXDp0hBUMi1M4KT-sejL0=s176-c-k-c0x00ffffff-no-rj,0.0
UgwuTKBcQIyq4LBsbFx4AaABAg.9WrxbYxrlIQ9_IUesP4RVp,"⬆️⬆️⬆️ thanks for the comment..
Contact the What'sap line above for more information, advise and consulations and also participate in the new ongoing investment.....",2 weeks ago,George maxwell,UCibYKdOL4TMo-2qqFf8mjxg,0,https://yt3.ggpht.com/RM7sE3aEDDVUrXJ9Qu12Mb3i8WPjMjQEl596YomUU6SzQ_12-6WBrvrQwinStZY7IvHK8O1rlmY=s176-c-k-c0x00ffffff-no-rj,0.0
Ugw1V4PW7ytyurWHTft4AaABAg.9WrxZHMcEuC9_IUfYEXt2c,"⬆️⬆️⬆️ thanks for the comment..
Contact the What'sap line above for more information, advise and consulations and also participate in the new ongoing investment.....",2 weeks ago,George maxwell,UCibYKdOL4TMo-2qqFf8mjxg,0,https://yt3.ggpht.com/RM7sE3aEDDVUrXJ9Qu12Mb3i8WPjMjQEl596YomUU6SzQ_12-6WBrvrQwinStZY7IvHK8O1rlmY=s176-c-k-c0x00ffffff-no-rj,0.0
Ugw_OkrgCzC-GSRHeYR4AaABAg.9WrgUImu6eG9_IUiE4KJpk,"⬆️⬆️⬆️ thanks for the comment..
Contact the What'sap line above for more information, advise and consulations and also participate in the new ongoing investment.....",2 weeks ago,George maxwell,UCibYKdOL4TMo-2qqFf8mjxg,0,https://yt3.ggpht.com/RM7sE3aEDDVUrXJ9Qu12Mb3i8WPjMjQEl596YomUU6SzQ_12-6WBrvrQwinStZY7IvHK8O1rlmY=s176-c-k-c0x00ffffff-no-rj,0.0
UgxJHAIjThVPTE0InLB4AaABAg.9WrYnshIk3D9_IUizBCQxP,"⬆️⬆️⬆️ thanks for the comment..
Contact the What'sap line above for more information, advise and consulations and also participate in the new ongoing investment.....",2 weeks ago,George maxwell,UCibYKdOL4TMo-2qqFf8mjxg,0,https://yt3.ggpht.com/RM7sE3aEDDVUrXJ9Qu12Mb3i8WPjMjQEl596YomUU6SzQ_12-6WBrvrQwinStZY7IvHK8O1rlmY=s176-c-k-c0x00ffffff-no-rj,0.0
UgwTuS5DK_KYYZOcIeF4AaABAg.9WrSIMiVBwe9_IUjhwqieC,"⬆️⬆️⬆️ thanks for the comment..
Contact the What'sap line above for more information, advise and consulations and also participate in the new ongoing investment.....",2 weeks ago,George maxwell,UCibYKdOL4TMo-2qqFf8mjxg,1,https://yt3.ggpht.com/RM7sE3aEDDVUrXJ9Qu12Mb3i8WPjMjQEl596YomUU6SzQ_12-6WBrvrQwinStZY7IvHK8O1rlmY=s176-c-k-c0x00ffffff-no-rj,0.0
UgziSqOXpN2Qr4EiS_l4AaABAg.9WrLScC99d-9_IUkUgoNVn,"⬆️⬆️⬆️ thanks for the comment..
Contact the What'sap line above for more information, advise and consulations and also participate in the new ongoing investment.....",2 weeks ago,George maxwell,UCibYKdOL4TMo-2qqFf8mjxg,0,https://yt3.ggpht.com/RM7sE3aEDDVUrXJ9Qu12Mb3i8WPjMjQEl596YomUU6SzQ_12-6WBrvrQwinStZY7IvHK8O1rlmY=s176-c-k-c0x00ffffff-no-rj,0.0
