cid,text,time,author,channel,votes,photo,heart
UgxXNze3EYAqcfQatYx4AaABAg,"Value buying / generating alpha from PE expansion is a very short lived process and needs skill in terms of timing entrry and exit as well.

All that is not required when you are buying companies that grow fast. Even buying them at high PE, the E of P/E increases at such good pace or the consistency and guarantee of future stable cash flow is so strong that the PE keeps on falling and price increases to reflect the previous high PE.
Examples of such companies are Nestle.",4 months ago,Shahryar,UC4lvxczCZ_K7Ga-XDNK_hOA,0,https://yt3.ggpht.com/ytc/AKedOLRq6e3wv_6uh2O8t76AsHj5q4MnZGij_My92mpOBsE=s176-c-k-c0x00ffffff-no-rj,0.0
Ugx2-MYQKubu71u_v_R4AaABAg,Hindustan foods has high debt as per my comfort level and has low margin. Sub 3% net margins.,4 months ago,Shahryar,UC4lvxczCZ_K7Ga-XDNK_hOA,0,https://yt3.ggpht.com/ytc/AKedOLRq6e3wv_6uh2O8t76AsHj5q4MnZGij_My92mpOBsE=s176-c-k-c0x00ffffff-no-rj,0.0
Ugxydn2Y7SCV-5r2gBh4AaABAg,"hai sir, one of the great analysis. but in case of HDFC amc when aditya birla sun life amc came for IPO i heard that many new players are entering in mutual fund business and they are tecky and may introduce  smart schemes like ETF where expense ratio are un comparable as you see in one of the HDFC scheme above 2% but in one of the other amc etf it is around i remember 0.3-0.5% only. is this the reason for the stock prise fall.",4 months ago,yenduri srinivas,UCA2upaEJRvasp9FooKMVHCg,1,https://yt3.ggpht.com/ytc/AKedOLTruRpl2hHBlDLlunp-upCgKLmEZc3Lr2P5q1f3jg=s176-c-k-c0x00ffffff-no-rj,0.0
UgxaMTTTSQoJdPWvWel4AaABAg,Please tell me about divis lab.,4 months ago,hosakote vijayalakshmi,UCtPIfOu2yQBOzqEUjQejIOQ,0,https://yt3.ggpht.com/ytc/AKedOLSkvtT1heufEd1sb9l4DPKn_pVvSep-KkcYhp13=s176-c-k-c0x00ffffff-no-rj,0.0
UgyoLjqsaawNsZllXl54AaABAg,Great going,4 months ago,Demon Blunt,UCdPOG8LT0bzAjVdIciQKf1A,0,https://yt3.ggpht.com/ytc/AKedOLQtCo31Qq9fWDqWyQ751PpJWHXbE7CKp4i9pw=s176-c-k-c0x00ffffff-no-rj,0.0
Ugypl7xdwEDhf-Ve2SR4AaABAg,very educative,4 months ago,Nanda kumar Gupta,UCvRht5mn-R8PACknA8CtC5w,0,https://yt3.ggpht.com/ytc/AKedOLSEzyFMWnhYPOWWUj9tR-4WdCiaa0vZD2vs2A=s176-c-k-c0x00ffffff-no-rj,0.0
UgynvUParoQ0ojS1X8x4AaABAg,"Akshat, Please make a video on how we can invest in International stocks. Please try to cover different markets, like US, Hingkong, etc. if possible",4 months ago,rahul jhunjhunwala,UCivUmP3Zwl9sTrK7B5LqRCQ,0,https://yt3.ggpht.com/ytc/AKedOLTtxTdDT1S2cccDOHNFOpTq5sj0I0UbeWDY2yZaHR8=s176-c-k-c0x00ffffff-no-rj,0.0
UgwECDvd4n977ITw79R4AaABAg,you go sell your house and invest in these stock --- best line,4 months ago,Krishna Agarwal,UCeCgnzMHYWUrjDww6LFsyJA,1,https://yt3.ggpht.com/ytc/AKedOLS3Gv8gwR3NiWwnbdL0ijiRTKWpisL9RnB7ep8=s176-c-k-c0x00ffffff-no-rj,0.0
UgwNAZulw-kLlO4DgcZ4AaABAg,Bought Hindustan foods @540 and holding tight. 😉😉,4 months ago,Karthik Kannan,UCqf0MjGrEuQQo7jrl8cEHqg,0,https://yt3.ggpht.com/ytc/AKedOLTKwoWyBikiSJML_TGXE3n7BiMx3jK1r_33ZA=s176-c-k-c0x00ffffff-no-rj,0.0
UgwFidrYhODb-rKbF4x4AaABAg.9VkojD7VV0y9_USe14nKj2,"Thanks for the feedback,
contact the What'sap line above for more information and advice on investment, also participate in the ongoing new investment plan.",10 days ago,Whatsap+①⑦②④③①⑤⑤⑤⓪⑦📩,UCoXac_jASoTVwmmzR3pYsEA,0,https://yt3.ggpht.com/uz11b1QmczGqSlUUkysHpV8j1IAgdLKC0m5HV4p2C5eDF-ymjmC5dWz_11K7YX0YavxNf-4n=s176-c-k-c0x00ffffff-no-rj,0.0
UgwJjdbV3NYffA8iWyN4AaABAg.9VkQy7NjZYL9_USkVsmasa,"Ensure to contact the What'sap line above for more information and consultation on investment. I have a new investment I am sure you will like to be  part of..
Thanks for your comment.",10 days ago,Whatsap+①⑦②④③①⑤⑤⑤⓪⑦📩,UCoXac_jASoTVwmmzR3pYsEA,0,https://yt3.ggpht.com/uz11b1QmczGqSlUUkysHpV8j1IAgdLKC0m5HV4p2C5eDF-ymjmC5dWz_11K7YX0YavxNf-4n=s176-c-k-c0x00ffffff-no-rj,0.0
UgyDHY5GhUSrZsO2TDx4AaABAg.9VjxbZhROgR9_OzRhIyicj,"Ensure to contact the What'sap line above for more information and consultation on investment. I have a new investment I am sure you will like to be  part of...
Thanks for your comment 🙂",12 days ago,Whatsap+①⑦②④③①⑤⑤⑤⓪⑦📩,UCoXac_jASoTVwmmzR3pYsEA,0,https://yt3.ggpht.com/uz11b1QmczGqSlUUkysHpV8j1IAgdLKC0m5HV4p2C5eDF-ymjmC5dWz_11K7YX0YavxNf-4n=s176-c-k-c0x00ffffff-no-rj,0.0
Ugxydn2Y7SCV-5r2gBh4AaABAg.9Vjt3_2i4gr9_OziIkD8pk,"⬆️ Ensure to contact the What'sap line above for more information and consultation on investment. I have a new investment I am sure you will like to be  part of...
Thanks for your comment",12 days ago,Whatsap+①⑦②④③①⑤⑤⑤⓪⑦📩,UCoXac_jASoTVwmmzR3pYsEA,0,https://yt3.ggpht.com/uz11b1QmczGqSlUUkysHpV8j1IAgdLKC0m5HV4p2C5eDF-ymjmC5dWz_11K7YX0YavxNf-4n=s176-c-k-c0x00ffffff-no-rj,0.0
UgwYqiTDPa36Vp1cDrB4AaABAg,HINDUSTAN FOOD PE IS SO HIGH,4 months ago,Ashish Behera,UCwHfAY5sQpFPt1IyDBtJ4IA,1,https://yt3.ggpht.com/ytc/AKedOLQ3p7wCU3TkrdnciUpJZcBbzK_sCOkrL2SHsQdv=s176-c-k-c0x00ffffff-no-rj,0.0
UgzVMk7m2PVSe4JBEop4AaABAg,After you recommended ppl went and bought hathway. Reliance will kill hathway brand as its not strong.,4 months ago,Souvik Maji,UC4KAVcm5tfWkES6uKGE8O-w,2,https://yt3.ggpht.com/ytc/AKedOLRaf8aFmbjHW4f2hNjSDZXy_KiKzWuq_i7BtqiT4w=s176-c-k-c0x00ffffff-no-rj,0.0
Ugzfi_3mdv3zqbH_nUp4AaABAg,Power auto consumable tourism related industry are good for next 10 years,4 months ago,Btube,UCq25gpN1Zs8Qbla0gIld_OQ,0,https://yt3.ggpht.com/ytc/AKedOLSavW9czMjGmx52mioDqYAkS4d0b858l9brRGczwA=s176-c-k-c0x00ffffff-no-rj,0.0
UgwzJn95ttppATb--PV4AaABAg,I don't think Asian paints and HUL will fall anymore. Already corrected. Bullish engulf in HUL.,4 months ago,Anand,UCXjNOT_TrE1opNLnvz0QzmA,2,https://yt3.ggpht.com/ytc/AKedOLQGabmEy76Xz-Fmq--utN8dvBM7sEdjsxsZkpkaQic=s176-c-k-c0x00ffffff-no-rj,0.0
UgyTIVvppxB5AtRbhbh4AaABAg,@Akash: what about CAMS?,4 months ago,Dark,UCu8ni9lZ_i_JgiLAIKZLqbg,0,https://yt3.ggpht.com/ytc/AKedOLSN56TopSCDxT4UyPMH2yzwnEyAiiEL8RxCHw=s176-c-k-c0x00ffffff-no-rj,0.0
