cid,text,time,author,channel,votes,photo,heart
Ugzer3At5WMW49f4FAx4AaABAg,"You're a lifesaver!!!! 
Thank you ever sooo much",1 year ago,Daniela Da Silva,UCgWcBqnCdurijc_65gHhgKg,1,https://yt3.ggpht.com/ytc/AKedOLQSguzc7SxiPHhF3FbjJkPVMgUOO41_Ghyr1jbBqg=s176-c-k-c0x00ffffff-no-rj,1.0
Ugzdafe4zd5d_YtkWdJ4AaABAg,kindly provide practices set,12 days ago,Lokesh Verma,UCzQNY4oqy5k2ms1VDa8oSVA,1,https://yt3.ggpht.com/ytc/AKedOLTbHPUBGsRUYQ0c2nJilq2XYJFEzXL0LuR_o6OqWw=s176-c-k-c0x00ffffff-no-rj,1.0
UgxMFjd9STFrwixKY9l4AaABAg,Hi! Thanks for the video),2 months ago,Ромашкевич Константин,UC6Dkc8QQa6BFHmn0FFMC_OA,1,https://yt3.ggpht.com/ytc/AKedOLQl3vX_EK0WHt1ThGeRPKJfdhxccOyo3cHcEPQtZQ=s176-c-k-c0x00ffffff-no-rj,1.0
UgyowVlqeIOe2mkVDW94AaABAg,you are awesome thank you for saving my time :),3 months ago,R G,UCTER4fWLC3FTL86_1vOCjJg,1,https://yt3.ggpht.com/ytc/AKedOLRnB2RKKTxl5nPPo8fzkTdRVB7i_N1z-SYf2moB0g=s176-c-k-c0x00ffffff-no-rj,1.0
Ugz7EpgKPuVac-fFbdd4AaABAg,Thank you ever so much :),3 months ago,Code Craft,UCxnIL1wwdHlWeZ762PUX9GQ,1,https://yt3.ggpht.com/L8aWMZVpJeR4ihN5sYi1-VKcR3RQCkExsSsgh3pSjO3HYzv0v_X7dHmVEzytU3gJDluJXf2eKA=s176-c-k-c0x00ffffff-no-rj,1.0
Ugwl6S0LpMB28OGP3Yh4AaABAg,"Thanks a lot for such a detailed explanation, its very useful. Thanks once again.",3 months ago,Neha Tiwari,UCLZ4WFztnA05oXv99RZNUDw,1,https://yt3.ggpht.com/ytc/AKedOLR_jKZPjnEtCMYZsBDdB00d6hRhikMr5t6Ta0F32xhbq-G5rFKq_ZTFdIFM5sTk=s176-c-k-c0x00ffffff-no-rj,1.0
UgxQVw5-CbacwlUISd14AaABAg,"Thank you Thoufiq for this tutorial  👍 🙌 15:18 Can you explain how to change Owner database for  default ""postgres"" please ? 🙏",3 months ago (edited),Chenda Thp,UCY2RL_z_b_vBj3AmGnGF_Ng,1,https://yt3.ggpht.com/ytc/AKedOLRNuOM8lOIk2b24pD-N9APvbrvnjG-u06nmOjOP=s176-c-k-c0x00ffffff-no-rj,1.0
Ugxq87mrqHJqJ6MKHi54AaABAg,Thanks much! It is really helpful for me (beginner in PostgreSQL).,4 months ago,Thet Yee Win,UCEFk1LBo-8jNFqlp_GIQXOQ,1,https://yt3.ggpht.com/ytc/AKedOLStKxlAXXwXO6TH1-p3PxOIyE8mTODfMEbpran3=s176-c-k-c0x00ffffff-no-rj,1.0
UgxVwVOfGB9kVqZnm4d4AaABAg,very helpfull.,4 months ago,kanakapalli anurag,UCVJjxCdi50NVwYpzBOkYEJg,1,https://yt3.ggpht.com/ytc/AKedOLS8njvNdt-xGETeQWG9_-yZ4bR2-lQnpJuK9Nt7cGM=s176-c-k-c0x00ffffff-no-rj,1.0
UgzoH2S8CHVdYm9nLKd4AaABAg,"Thank yyyyoooouuu!!!! So helpful..
i used the first method but when i login to pg admin it show me this error: connection to server at ""localhost"" (::1), port 5432 failed: FATAL: password authentication failed for user ""postgres""
why? How to solve it?",6 months ago,لمى,UCg7bOGufx6ljVHnkYURQe-Q,1,https://yt3.ggpht.com/ytc/AKedOLSDw17GqrLSUlQyNzUVW6jnNIv_LpG4gwc47V6O=s176-c-k-c0x00ffffff-no-rj,1.0
UgyDdjlHOZRAdaQ1T9B4AaABAg,I needed this so much! thank you !!,6 months ago,jpg,UCg9UV6VH93SHG5aaevaA9fQ,1,https://yt3.ggpht.com/SfrbQ4_TWHXc3IOtloQgNhsrAkEsVKgWCbrtjj3bT1jUBryRXBGK8aU_Vsrw6rtwxogfZoQUWQ=s176-c-k-c0x00ffffff-no-rj,1.0
Ugzgvl4orbJlWNis7EF4AaABAg,"I am on Apple Silicon M1 and I get the following error.
A non-fatal error occur whilst creating menu shortcuts.
problem running post-install step. installation may not complete correctly the database cluster. 

I tried installing different versions of Postgre but getting the same error.
Can you help ?",6 months ago,Apurv Adarsh,UCRIIOBy7AVcAXzB7YYV2yYw,1,https://yt3.ggpht.com/ytc/AKedOLRW25DlBFG6ga_KrZQyKJPFJSh_lwSWmee69j25MBw=s176-c-k-c0x00ffffff-no-rj,1.0
UgxUULvxO36x5RR1dVx4AaABAg,please make a video about how to use psql using terminal command line tools,6 months ago,igothisoncamera,UC8rKuAQITfZjH8L0ssV90bA,1,https://yt3.ggpht.com/ytc/AKedOLRiM2juitCaHp8eqhEQxvElKZ4Ss4u3di8ee6eG=s176-c-k-c0x00ffffff-no-rj,1.0
UgzosVQk2gr6ryK6MsF4AaABAg,Your video was really helpful. Thanks!,6 months ago,Mootje,UCA4NAo7MuCtAvU3UBYElw9A,1,https://yt3.ggpht.com/ytc/AKedOLR-E5Nd6FZ3tb0daIh2IdSfN0jNF13ZE7YumG0b=s176-c-k-c0x00ffffff-no-rj,1.0
Ugy0lIZkxFpnaP5h8IF4AaABAg,"I just installed PostgreSQL but it says ""A non-fatal error occur whilst creating menu shortcuts."".  What should I do?",6 months ago,Phichaya Boice,UCrhTEqvzwUuAWMyOS76ZwhA,0,https://yt3.ggpht.com/ytc/AKedOLTQhcUSE5dDDnTsTYydKOKkhF-mqfuZ8fJrQQviNg=s176-c-k-c0x00ffffff-no-rj,0.0
UgyHMzoMd0SaOpZLOBx4AaABAg,"God bless, you saved me",1 year ago,Bunny R,UCmu1FBx3AUYxcU3nm7TdG3A,1,https://yt3.ggpht.com/ytc/AKedOLRR4mWqT86NwrrWmc3IKQSTlSyW4UV8x_DkYQ=s176-c-k-c0x00ffffff-no-rj,1.0
UgyS-0i8p1aWWYnbThx4AaABAg,"Fantastic guide, thank you!",1 year ago,Amy Hart,UCHWSb-rDUMV09tlhma4VZKw,1,https://yt3.ggpht.com/ytc/AKedOLRpfF5wFuCuzved_Fah8ZFtVY04j3CDfibm-Q=s176-c-k-c0x00ffffff-no-rj,1.0
Ugy05JrJzhXxwxmTx_l4AaABAg,"Hi , Thank u for the video .. i have one question ... how to re-attach panel actually in my system i was trying fetch sql query and accidentally panel got detach but there is no option to attclach it back to editor. When i try to run its showing “stay or leave on the page” . Not able to execute my query. Please answer this ASAP.",1 year ago,komal kaur,UClZyU9hJouT2waWucoX8rZA,1,https://yt3.ggpht.com/ytc/AKedOLTQ2SRqJi5_LObn35wXUH2T6SALIToTPwCj=s176-c-k-c0x00ffffff-no-rj,1.0
Ugw0YYy0Wvb91VhTUmF4AaABAg,Well done. Thanks for the video <3,1 year ago,Kai Clone,UCXyxPa4lZ_r0mkuskNh7HZA,1,https://yt3.ggpht.com/ytc/AKedOLRWbhBA5qhayVQKvvslFkt7REasDrCbwbbjOGqMRg=s176-c-k-c0x00ffffff-no-rj,1.0
UgxrqKYgJ3SUvXw3FhN4AaABAg,Thank you Thoufiq Mohammed,1 year ago,🪓 Patrick Bateman,UCSo-aWIKdgf11eRx7R_WzRg,1,https://yt3.ggpht.com/gWzT-4AjK2l_nFZfDilwXhymGPpKsA75KjKWyjpjAwPXl5toeJ8gI6tpfHaXWwpekdzdcTHtbw=s176-c-k-c0x00ffffff-no-rj,1.0
Ugzer3At5WMW49f4FAx4AaABAg.9LAwNhL_B959LAx8OnS-ga,"Thank you so much for your kind words..
So glad it helped🙂",1 year ago,techTFQ,UCnz-ZXXER4jOvuED5trXfEA,1,https://yt3.ggpht.com/68QpkOCRQespfOQ5yZwhCrM6Ab0kipqOU16JwAAhDm9f8I0CfPzMW-qpzdYJmn0TQ-UBd862=s176-c-k-c0x00ffffff-no-rj,0.0
Ugzdafe4zd5d_YtkWdJ4AaABAg.9_LXU5MsKKW9_LiWXnGVf-,What practice set,12 days ago,techTFQ,UCnz-ZXXER4jOvuED5trXfEA,0,https://yt3.ggpht.com/68QpkOCRQespfOQ5yZwhCrM6Ab0kipqOU16JwAAhDm9f8I0CfPzMW-qpzdYJmn0TQ-UBd862=s176-c-k-c0x00ffffff-no-rj,0.0
UgxMFjd9STFrwixKY9l4AaABAg.9YJL34d0whM9YJWXo0UFm6,Your welcome 🙏🏼,2 months ago,techTFQ,UCnz-ZXXER4jOvuED5trXfEA,0,https://yt3.ggpht.com/68QpkOCRQespfOQ5yZwhCrM6Ab0kipqOU16JwAAhDm9f8I0CfPzMW-qpzdYJmn0TQ-UBd862=s176-c-k-c0x00ffffff-no-rj,0.0
UgyowVlqeIOe2mkVDW94AaABAg.9X97eWaXlXm9X9yrF79jEJ,Your welcome 🙏🏼 i am glad this helped,3 months ago,techTFQ,UCnz-ZXXER4jOvuED5trXfEA,0,https://yt3.ggpht.com/68QpkOCRQespfOQ5yZwhCrM6Ab0kipqOU16JwAAhDm9f8I0CfPzMW-qpzdYJmn0TQ-UBd862=s176-c-k-c0x00ffffff-no-rj,0.0
Ugz7EpgKPuVac-fFbdd4AaABAg.9WhhOJpLafy9WiHeMVos_k,Your welcome 🙏🏼,3 months ago,techTFQ,UCnz-ZXXER4jOvuED5trXfEA,0,https://yt3.ggpht.com/68QpkOCRQespfOQ5yZwhCrM6Ab0kipqOU16JwAAhDm9f8I0CfPzMW-qpzdYJmn0TQ-UBd862=s176-c-k-c0x00ffffff-no-rj,0.0
Ugwl6S0LpMB28OGP3Yh4AaABAg.9WGz3EWrrCM9WHLa8CqQzu,Your welcome Neha :),3 months ago,techTFQ,UCnz-ZXXER4jOvuED5trXfEA,0,https://yt3.ggpht.com/68QpkOCRQespfOQ5yZwhCrM6Ab0kipqOU16JwAAhDm9f8I0CfPzMW-qpzdYJmn0TQ-UBd862=s176-c-k-c0x00ffffff-no-rj,0.0
UgxQVw5-CbacwlUISd14AaABAg.9W08Ir3gvPf9W0A_NrgzVk,FIND IT 😅 : I created the postgres Superuser : CREATE USER postgres SUPERUSER; then : CREATE DATABASE postgres WITH OWNER postgres; With command \du you can see all users. I quit my terminal and come back with : psql -U postgres VOILA 🥳,3 months ago,Chenda Thp,UCY2RL_z_b_vBj3AmGnGF_Ng,1,https://yt3.ggpht.com/ytc/AKedOLRNuOM8lOIk2b24pD-N9APvbrvnjG-u06nmOjOP=s176-c-k-c0x00ffffff-no-rj,1.0
UgxQVw5-CbacwlUISd14AaABAg.9W08Ir3gvPf9W0jR2p83Lm,"Awesome chenda 👌
Glad you found the solution",3 months ago,techTFQ,UCnz-ZXXER4jOvuED5trXfEA,1,https://yt3.ggpht.com/68QpkOCRQespfOQ5yZwhCrM6Ab0kipqOU16JwAAhDm9f8I0CfPzMW-qpzdYJmn0TQ-UBd862=s176-c-k-c0x00ffffff-no-rj,0.0
Ugxq87mrqHJqJ6MKHi54AaABAg.9VwMTIa45x_9VwNlKa6jNT,"Your welcome Yee Win ,
Glad this helped",4 months ago,techTFQ,UCnz-ZXXER4jOvuED5trXfEA,0,https://yt3.ggpht.com/68QpkOCRQespfOQ5yZwhCrM6Ab0kipqOU16JwAAhDm9f8I0CfPzMW-qpzdYJmn0TQ-UBd862=s176-c-k-c0x00ffffff-no-rj,0.0
UgxVwVOfGB9kVqZnm4d4AaABAg.9VIcLIMlkXx9VJEH60NiJ4,Thank you Anurag 🙏🏼,4 months ago,techTFQ,UCnz-ZXXER4jOvuED5trXfEA,0,https://yt3.ggpht.com/68QpkOCRQespfOQ5yZwhCrM6Ab0kipqOU16JwAAhDm9f8I0CfPzMW-qpzdYJmn0TQ-UBd862=s176-c-k-c0x00ffffff-no-rj,0.0
UgzoH2S8CHVdYm9nLKd4AaABAg.9TTTy5dyqAu9TTUelfIiVi,"Your welcome 🙏🏼 

I think the error is due to incorrect password.. password should be the same which you entered during installation..",6 months ago,techTFQ,UCnz-ZXXER4jOvuED5trXfEA,0,https://yt3.ggpht.com/68QpkOCRQespfOQ5yZwhCrM6Ab0kipqOU16JwAAhDm9f8I0CfPzMW-qpzdYJmn0TQ-UBd862=s176-c-k-c0x00ffffff-no-rj,0.0
UgzoH2S8CHVdYm9nLKd4AaABAg.9TTTy5dyqAu9TUZw88-fBU, @techTFQ   am sure it correct and i try to reset new password but it still this error appears. can you help me? :(,6 months ago,لمى,UCg7bOGufx6ljVHnkYURQe-Q,1,https://yt3.ggpht.com/ytc/AKedOLSDw17GqrLSUlQyNzUVW6jnNIv_LpG4gwc47V6O=s176-c-k-c0x00ffffff-no-rj,1.0
UgzoH2S8CHVdYm9nLKd4AaABAg.9TTTy5dyqAu9TVOQ-C_doa,"Hi,
I think you installed using the EDB method but I’ve seen some issue in it faced by some other people as well so can you uninstall this and then try to re-install  using the Postgres.app method .. I think this will work",6 months ago (edited),techTFQ,UCnz-ZXXER4jOvuED5trXfEA,0,https://yt3.ggpht.com/68QpkOCRQespfOQ5yZwhCrM6Ab0kipqOU16JwAAhDm9f8I0CfPzMW-qpzdYJmn0TQ-UBd862=s176-c-k-c0x00ffffff-no-rj,0.0
UgzoH2S8CHVdYm9nLKd4AaABAg.9TTTy5dyqAu9Tkf9bT-M4Q," @techTFQ  thank you a looooooot 
my mistake  was ther chick box i didnt check it when they want me enter the password :)",5 months ago,لمى,UCg7bOGufx6ljVHnkYURQe-Q,1,https://yt3.ggpht.com/ytc/AKedOLSDw17GqrLSUlQyNzUVW6jnNIv_LpG4gwc47V6O=s176-c-k-c0x00ffffff-no-rj,1.0
UgzoH2S8CHVdYm9nLKd4AaABAg.9TTTy5dyqAu9Tkl6R8WLbm,Ok 👍 glad it finally worked 😊,5 months ago,techTFQ,UCnz-ZXXER4jOvuED5trXfEA,0,https://yt3.ggpht.com/68QpkOCRQespfOQ5yZwhCrM6Ab0kipqOU16JwAAhDm9f8I0CfPzMW-qpzdYJmn0TQ-UBd862=s176-c-k-c0x00ffffff-no-rj,0.0
UgyDdjlHOZRAdaQ1T9B4AaABAg.9TKug0WmCby9TL1k7cyQXh,"Your welcome 🙏🏼 
Glad this helped ..",6 months ago,techTFQ,UCnz-ZXXER4jOvuED5trXfEA,0,https://yt3.ggpht.com/68QpkOCRQespfOQ5yZwhCrM6Ab0kipqOU16JwAAhDm9f8I0CfPzMW-qpzdYJmn0TQ-UBd862=s176-c-k-c0x00ffffff-no-rj,0.0
Ugzgvl4orbJlWNis7EF4AaABAg.9Ss35vhvZS09Ss3e6SxWO1,"Hi,
Which type of installation have you chosen?
Is it the interactive installer by EDB or Postgres.app or Homebrew?

I think EDB might give some issues sometime for some version and generally the Postgres.app sure work fine.

Can you try Postgres.app",6 months ago,techTFQ,UCnz-ZXXER4jOvuED5trXfEA,0,https://yt3.ggpht.com/68QpkOCRQespfOQ5yZwhCrM6Ab0kipqOU16JwAAhDm9f8I0CfPzMW-qpzdYJmn0TQ-UBd862=s176-c-k-c0x00ffffff-no-rj,0.0
Ugzgvl4orbJlWNis7EF4AaABAg.9Ss35vhvZS09Ss8WY6ILyM," @techTFQ  I tried EDB first, it failed. Then I tried postgres.app, it succeded. But after installing pgadmin 4, the server doesn't show up",6 months ago,Apurv Adarsh,UCRIIOBy7AVcAXzB7YYV2yYw,1,https://yt3.ggpht.com/ytc/AKedOLRW25DlBFG6ga_KrZQyKJPFJSh_lwSWmee69j25MBw=s176-c-k-c0x00ffffff-no-rj,1.0
Ugzgvl4orbJlWNis7EF4AaABAg.9Ss35vhvZS09SsBFaPaSCX,Have you initialized the server as mentioned in the website?,6 months ago,techTFQ,UCnz-ZXXER4jOvuED5trXfEA,0,https://yt3.ggpht.com/68QpkOCRQespfOQ5yZwhCrM6Ab0kipqOU16JwAAhDm9f8I0CfPzMW-qpzdYJmn0TQ-UBd862=s176-c-k-c0x00ffffff-no-rj,0.0
Ugzgvl4orbJlWNis7EF4AaABAg.9Ss35vhvZS09SsDQLuFnX6," @techTFQ  yes, as you showed on the video. Server was initialized correctly. I can see 3 server names including postgres",6 months ago,Apurv Adarsh,UCRIIOBy7AVcAXzB7YYV2yYw,1,https://yt3.ggpht.com/ytc/AKedOLRW25DlBFG6ga_KrZQyKJPFJSh_lwSWmee69j25MBw=s176-c-k-c0x00ffffff-no-rj,1.0
Ugzgvl4orbJlWNis7EF4AaABAg.9Ss35vhvZS09SsDuXiSST5,"Ok, I had faced something like this long back and I remember I just uninstalled Postgres and PgAdmin and then re installed it again and it worked fine..
Can you try that",6 months ago,techTFQ,UCnz-ZXXER4jOvuED5trXfEA,0,https://yt3.ggpht.com/68QpkOCRQespfOQ5yZwhCrM6Ab0kipqOU16JwAAhDm9f8I0CfPzMW-qpzdYJmn0TQ-UBd862=s176-c-k-c0x00ffffff-no-rj,0.0
UgxUULvxO36x5RR1dVx4AaABAg.9SbEuV_m1YD9Sba25lJHQL,"Hi, haven’t planned this for now but will surely consider making a video abt it in near future",6 months ago,techTFQ,UCnz-ZXXER4jOvuED5trXfEA,1,https://yt3.ggpht.com/68QpkOCRQespfOQ5yZwhCrM6Ab0kipqOU16JwAAhDm9f8I0CfPzMW-qpzdYJmn0TQ-UBd862=s176-c-k-c0x00ffffff-no-rj,0.0
UgzosVQk2gr6ryK6MsF4AaABAg.9SaZ93RYOe29SaiK1rjtnE,"Thank you 🙏🏼 
So glad it helped you 🙂",6 months ago,techTFQ,UCnz-ZXXER4jOvuED5trXfEA,1,https://yt3.ggpht.com/68QpkOCRQespfOQ5yZwhCrM6Ab0kipqOU16JwAAhDm9f8I0CfPzMW-qpzdYJmn0TQ-UBd862=s176-c-k-c0x00ffffff-no-rj,0.0
Ugy0lIZkxFpnaP5h8IF4AaABAg.9SKfDfX4p3q9SKhZmr1uCs,"And it says ""Problem running post-install step. Installation may not complete correctly. Failed to start the database server."".",6 months ago,Phichaya Boice,UCrhTEqvzwUuAWMyOS76ZwhA,0,https://yt3.ggpht.com/ytc/AKedOLTQhcUSE5dDDnTsTYydKOKkhF-mqfuZ8fJrQQviNg=s176-c-k-c0x00ffffff-no-rj,0.0
UgyHMzoMd0SaOpZLOBx4AaABAg.9LBDAxz9xlr9LBDNUK4eT0,"Thank you for the feedback...
So glad it helped 🙂...",1 year ago,techTFQ,UCnz-ZXXER4jOvuED5trXfEA,0,https://yt3.ggpht.com/68QpkOCRQespfOQ5yZwhCrM6Ab0kipqOU16JwAAhDm9f8I0CfPzMW-qpzdYJmn0TQ-UBd862=s176-c-k-c0x00ffffff-no-rj,0.0
UgyS-0i8p1aWWYnbThx4AaABAg.9Jv9pk1b09u9Jva2HpRnGx,"Thank you for the feedback ☺️
Much appreciated",1 year ago,techTFQ,UCnz-ZXXER4jOvuED5trXfEA,0,https://yt3.ggpht.com/68QpkOCRQespfOQ5yZwhCrM6Ab0kipqOU16JwAAhDm9f8I0CfPzMW-qpzdYJmn0TQ-UBd862=s176-c-k-c0x00ffffff-no-rj,0.0
Ugy05JrJzhXxwxmTx_l4AaABAg.9JIfFTtanaJ9JIfv6B6NQN,"Hi.. your welcome..

I believe you want your pg admin layout to be as it was in the beginning right?
If so go to File —> Reset Layout

This should do it..

Also after the reset you can click File —> Lock layout —> prevent Docking to avoid such issues in future..",1 year ago,techTFQ,UCnz-ZXXER4jOvuED5trXfEA,1,https://yt3.ggpht.com/68QpkOCRQespfOQ5yZwhCrM6Ab0kipqOU16JwAAhDm9f8I0CfPzMW-qpzdYJmn0TQ-UBd862=s176-c-k-c0x00ffffff-no-rj,0.0
Ugy05JrJzhXxwxmTx_l4AaABAg.9JIfFTtanaJ9JKWWVOpFgC, @techTFQ  Thank you very much.,1 year ago,komal kaur,UClZyU9hJouT2waWucoX8rZA,1,https://yt3.ggpht.com/ytc/AKedOLTQ2SRqJi5_LObn35wXUH2T6SALIToTPwCj=s176-c-k-c0x00ffffff-no-rj,1.0
Ugw0YYy0Wvb91VhTUmF4AaABAg.9IkK6T5YYRb9Il0_TR53VV,Your welcome ☺️.. hope it helped ..,1 year ago,techTFQ,UCnz-ZXXER4jOvuED5trXfEA,0,https://yt3.ggpht.com/68QpkOCRQespfOQ5yZwhCrM6Ab0kipqOU16JwAAhDm9f8I0CfPzMW-qpzdYJmn0TQ-UBd862=s176-c-k-c0x00ffffff-no-rj,0.0
UgxrqKYgJ3SUvXw3FhN4AaABAg.9IkGAieabGO9Il0WIwizI7,Your welcome Dileep 🙂😃.. I hope it was helpful..,1 year ago (edited),techTFQ,UCnz-ZXXER4jOvuED5trXfEA,1,https://yt3.ggpht.com/68QpkOCRQespfOQ5yZwhCrM6Ab0kipqOU16JwAAhDm9f8I0CfPzMW-qpzdYJmn0TQ-UBd862=s176-c-k-c0x00ffffff-no-rj,0.0
Ugw2zQmIZv4bM58QAh94AaABAg,i had the same mistake with the (13.1 version),1 year ago,Andrea Solis Garcia,UCWSV0MwPShF4h5KPk4gGNtw,1,https://yt3.ggpht.com/ytc/AKedOLShz5KWCOGSR4dMvZ8BVY_tIVXcdqum1F8u7qe9LA=s176-c-k-c0x00ffffff-no-rj,1.0
UgwarreL7sNBCxzwnxR4AaABAg,"Followed the process to uninstall but can still see the user: PostgreSQL at the login. So it's not a complete uninstallation. I deleted it by going to Mac Settings>users. Not sure if this is enough.
Please make a video to access PostgreSQL from Python. Thank you!",1 year ago,Sleeping Phoenix,UCfFphnxRsrFWJGV9EK-2bdw,1,https://yt3.ggpht.com/ytc/AKedOLRYeDHy4QsZANh5UkRTFNR5vKBxWs9orY1jIg=s176-c-k-c0x00ffffff-no-rj,1.0
Ugy75AyhrdJ547rYOwl4AaABAg,"Nice video, enjoyed it. Please keep them coming.  I forgot my PostgreSQL user password, please share if you know the best way to reset it. Thank you!",1 year ago,Sleeping Phoenix,UCfFphnxRsrFWJGV9EK-2bdw,1,https://yt3.ggpht.com/ytc/AKedOLRYeDHy4QsZANh5UkRTFNR5vKBxWs9orY1jIg=s176-c-k-c0x00ffffff-no-rj,0.0
UgxiEVphWLWTo2_pUXl4AaABAg,This video just gave me real peace since my mac kept failing to open PostgreSQL after upgrading to Big Sur. I finally open it and it works fine.,1 year ago,Hanna Choi,UCnq5qDdYRS5GGMc_GSQ4b0w,2,https://yt3.ggpht.com/ytc/AKedOLQWanGog1zA6OmSsrMoOzjJBMgCtm3sosIxbQ=s176-c-k-c0x00ffffff-no-rj,1.0
UgxOllaGtiVVJZnkGL14AaABAg,"Thanks to you I could easily download PostgreSQL from DB that i have to work on. My problem is that i need the 13.1v instead of the 12.5v which it doesn't work on the Big Sur. Installed etc but doesn't open. Any help with that? 
Thanks a lot again in advance",1 year ago,Panagiotis Tsirogiannis,UCQB88o2d0s2SbbStZc0kBfw,1,https://yt3.ggpht.com/ytc/AKedOLTdP5E84RotRWOJz0o5JV6UyhQWKs4hMs6PCg=s176-c-k-c0x00ffffff-no-rj,1.0
UgyyrFREdmQXJNyLimR4AaABAg,Helpful,1 year ago,Smitha Smith,UCILojF0ZU59fOkT1YCn1hDQ,1,https://yt3.ggpht.com/ytc/AKedOLR6b58ZmHdQvG3gLBQrfc6khe5dEAzMp5R03A=s176-c-k-c0x00ffffff-no-rj,1.0
UgxEcgkTbFk56u8kLS14AaABAg,Nice,1 year ago,Shabana Shabana,UCz3IdFsiG3OM33DNfMvKbxQ,1,https://yt3.ggpht.com/ytc/AKedOLSBV_DN8B_6YRp4u72YC9b0qFtLhZNFaVlbHA=s176-c-k-c0x00ffffff-no-rj,1.0
Ugwt3eCWCxmaxCb9kOh4AaABAg,Cool . Informative,1 year ago,Melissa L,UCm_UKnmbKZ0L5IZmP4UVfxQ,1,https://yt3.ggpht.com/ytc/AKedOLRdwBG1oPvrLdnDr31aEJnba6mevkmKAuqrzA=s176-c-k-c0x00ffffff-no-rj,1.0
UgxoKNaOx6jN08F-R8Z4AaABAg,"Being a naive, yet very easy to understand. You make a great tutor. Keep up your good work.",1 year ago,Fathima Farahna,UCmMR20vhhydELL3JFxZ6MoQ,9,https://yt3.ggpht.com/ytc/AKedOLTsP0crbsq7j0CfAPty-RPMZVW7t34FCVgcSt6RIw=s176-c-k-c0x00ffffff-no-rj,1.0
UgxjagU75mIoz5jRj_t4AaABAg,Very informative and helpful. Would love to see more such videos. 👌🏻,1 year ago,Rafiya Shahana,UC3Y-D25Up0n0Kc4AT6Q63Ug,1,https://yt3.ggpht.com/ytc/AKedOLSkbDJipH3xw-W3Ki7IqpXQqkaEQTxvtrgVZdMuIw=s176-c-k-c0x00ffffff-no-rj,1.0
UgxiSTFPPOALab_iYTl4AaABAg,Nicely explained 👌👌 perfect,1 year ago,Sheeba Parveen,UCLG0THTDn61-uOe8uz3luCg,1,https://yt3.ggpht.com/ytc/AKedOLS_bbDwk2UdEkLpnVA8niKltV1MsVbZ24fICYS3bA=s176-c-k-c0x00ffffff-no-rj,1.0
Ugxjojbzy4ps5W3Q2k54AaABAg,Never used PostgreSQL DB. But really loved the video & enjoyed learning something new👍🏻 Kuddos👏🏻 Keep up the good work brother🙌🏻,1 year ago,Mohammed Shahil,UCWu0-yMNxR1UyjHDKkXcgMA,1,https://yt3.ggpht.com/ytc/AKedOLTj9o1Oeo0yG7m4Txg3aoh7qvUmtfyXcHIHKl4giA=s176-c-k-c0x00ffffff-no-rj,1.0
Ugw2zQmIZv4bM58QAh94AaABAg.9IaHqtuWhpI9IdUduYMza7,"Are you also using Mac OS Big Sur?
I imagined the issue to be due to Mac OS Big Sur and not with Postrges..",1 year ago,techTFQ,UCnz-ZXXER4jOvuED5trXfEA,0,https://yt3.ggpht.com/68QpkOCRQespfOQ5yZwhCrM6Ab0kipqOU16JwAAhDm9f8I0CfPzMW-qpzdYJmn0TQ-UBd862=s176-c-k-c0x00ffffff-no-rj,0.0
UgwarreL7sNBCxzwnxR4AaABAg.9HGa1ypzCeA9HGeET8DwQh,"Thank you for the feedback..
Yes generally any database uninstallation involves some steps to delete files manually.. I believe I covered all of these steps in the video..
You can also refer to the uninstallation instruction given by PostgreSQL (link in description)
Hopefully it should clarify any of you doubts",1 year ago,techTFQ,UCnz-ZXXER4jOvuED5trXfEA,1,https://yt3.ggpht.com/68QpkOCRQespfOQ5yZwhCrM6Ab0kipqOU16JwAAhDm9f8I0CfPzMW-qpzdYJmn0TQ-UBd862=s176-c-k-c0x00ffffff-no-rj,0.0
UgxiEVphWLWTo2_pUXl4AaABAg.9H9k3UXTf2U9H9qEgAI-jh,"Awesome... glad the video helped..
Thanks for your comment..",1 year ago,techTFQ,UCnz-ZXXER4jOvuED5trXfEA,0,https://yt3.ggpht.com/68QpkOCRQespfOQ5yZwhCrM6Ab0kipqOU16JwAAhDm9f8I0CfPzMW-qpzdYJmn0TQ-UBd862=s176-c-k-c0x00ffffff-no-rj,0.0
UgxOllaGtiVVJZnkGL14AaABAg.9Gc8i2O4QB49GcEzlWfaq2,"Thank you ☺️ 
13.1 through EBD does not work...
Try postgres.app method to install version 13.. it will work on Big Sur...",1 year ago,techTFQ,UCnz-ZXXER4jOvuED5trXfEA,1,https://yt3.ggpht.com/68QpkOCRQespfOQ5yZwhCrM6Ab0kipqOU16JwAAhDm9f8I0CfPzMW-qpzdYJmn0TQ-UBd862=s176-c-k-c0x00ffffff-no-rj,0.0
UgxOllaGtiVVJZnkGL14AaABAg.9Gc8i2O4QB49L4BKhdgRKM, @techTFQ  wow.. thank you very much.. i have the same problems..,1 year ago,Lovidya Helmi,UC2-dWl5rkw5Fw6Lx4l8tqmw,1,https://yt3.ggpht.com/ytc/AKedOLSuPi4_LGJXjR5xaX-WP43e3G6bkk9FzJ3quis5=s176-c-k-c0x00ffffff-no-rj,1.0
UgxOllaGtiVVJZnkGL14AaABAg.9Gc8i2O4QB49L6SjP79U4w,"Thank you so much for the feedback..
I am glad this helped you..🙂",1 year ago,techTFQ,UCnz-ZXXER4jOvuED5trXfEA,0,https://yt3.ggpht.com/68QpkOCRQespfOQ5yZwhCrM6Ab0kipqOU16JwAAhDm9f8I0CfPzMW-qpzdYJmn0TQ-UBd862=s176-c-k-c0x00ffffff-no-rj,0.0
UgyyrFREdmQXJNyLimR4AaABAg.9G8oYwNWElR9G8oxwg3qQG,Thank you 😊,1 year ago,techTFQ,UCnz-ZXXER4jOvuED5trXfEA,1,https://yt3.ggpht.com/68QpkOCRQespfOQ5yZwhCrM6Ab0kipqOU16JwAAhDm9f8I0CfPzMW-qpzdYJmn0TQ-UBd862=s176-c-k-c0x00ffffff-no-rj,0.0
UgxEcgkTbFk56u8kLS14AaABAg.9G8gomt8CDH9G8ou-9jF6o,Thank you 😊,1 year ago,techTFQ,UCnz-ZXXER4jOvuED5trXfEA,0,https://yt3.ggpht.com/68QpkOCRQespfOQ5yZwhCrM6Ab0kipqOU16JwAAhDm9f8I0CfPzMW-qpzdYJmn0TQ-UBd862=s176-c-k-c0x00ffffff-no-rj,0.0
Ugwt3eCWCxmaxCb9kOh4AaABAg.9G7NS3osHmQ9G7OFta51NS,Thank you 😊,1 year ago,techTFQ,UCnz-ZXXER4jOvuED5trXfEA,1,https://yt3.ggpht.com/68QpkOCRQespfOQ5yZwhCrM6Ab0kipqOU16JwAAhDm9f8I0CfPzMW-qpzdYJmn0TQ-UBd862=s176-c-k-c0x00ffffff-no-rj,0.0
UgxoKNaOx6jN08F-R8Z4AaABAg.9G7MkA3pTsd9G7O8XXM-Jj,Thank you ☺️,1 year ago (edited),techTFQ,UCnz-ZXXER4jOvuED5trXfEA,1,https://yt3.ggpht.com/68QpkOCRQespfOQ5yZwhCrM6Ab0kipqOU16JwAAhDm9f8I0CfPzMW-qpzdYJmn0TQ-UBd862=s176-c-k-c0x00ffffff-no-rj,0.0
UgxjagU75mIoz5jRj_t4AaABAg.9G6tdThKawu9G6vVS2ZfPh,Thank you Rafiya... 😀,1 year ago,techTFQ,UCnz-ZXXER4jOvuED5trXfEA,0,https://yt3.ggpht.com/68QpkOCRQespfOQ5yZwhCrM6Ab0kipqOU16JwAAhDm9f8I0CfPzMW-qpzdYJmn0TQ-UBd862=s176-c-k-c0x00ffffff-no-rj,0.0
UgxiSTFPPOALab_iYTl4AaABAg.9G6SoyMms4l9G6Zzq4KoQw,Thank you Sheeba 😀,1 year ago,techTFQ,UCnz-ZXXER4jOvuED5trXfEA,0,https://yt3.ggpht.com/68QpkOCRQespfOQ5yZwhCrM6Ab0kipqOU16JwAAhDm9f8I0CfPzMW-qpzdYJmn0TQ-UBd862=s176-c-k-c0x00ffffff-no-rj,0.0
Ugxjojbzy4ps5W3Q2k54AaABAg.9G6NxDzZLdV9G6OJq0nVWr,"Thank you Shahil..
It’s one of the most widely used RDBMS today and is gaining more popularity everyday so no harm in learning this 😀
Thank you for liking it..",1 year ago,techTFQ,UCnz-ZXXER4jOvuED5trXfEA,1,https://yt3.ggpht.com/68QpkOCRQespfOQ5yZwhCrM6Ab0kipqOU16JwAAhDm9f8I0CfPzMW-qpzdYJmn0TQ-UBd862=s176-c-k-c0x00ffffff-no-rj,0.0
